	id	state	COUNTY	GEO_TTL	relevant_naics	NAICS2012_TTL	NAICS_Sector	estab	emp	payann
473700	32	32	999	Nevada -- Statewide	211111	Crude petroleum and natural gas extraction	21	1.0	0.0	0.0
473701	32	32	999	Nevada -- Statewide	213111	Drilling oil and gas wells	21	1.4	0.0	184.4
473702	32	32	999	Nevada -- Statewide	213112	Support activities for oil and gas operations	21	2.2	0.0	0.0
473703	32	32	999	Nevada -- Statewide	213114	Support activities for metal mining	21	7.0	1017.6	102017.4
473704	32	32	999	Nevada -- Statewide	213115	Support activities for nonmetallic minerals (except fuels) mining	21	1.0	0.0	0.0
473705	32	32	999	Nevada -- Statewide	221115	Wind electric power generation	22	1.0	0.0	0.0
473706	32	32	999	Nevada -- Statewide	236210	Industrial building construction	23	1.0	0.0	0.0
473707	32	32	999	Nevada -- Statewide	236220	Commercial and institutional building construction	23	1.0	0.0	0.0
473708	32	32	999	Nevada -- Statewide	237130	Power and communication line and related structures construction	23	2.2	0.0	0.0
473709	32	32	999	Nevada -- Statewide	237310	Highway, street, and bridge construction	23	1.0	0.0	0.0
473710	32	32	999	Nevada -- Statewide	238210	Electrical contractors and other wiring installation contractors	23	2.0	0.0	0.0
473711	32	32	999	Nevada -- Statewide	238220	Plumbing, heating, and air-conditioning contractors	23	1.8	0.0	25.6
473712	32	32	999	Nevada -- Statewide	423210	Furniture merchant wholesalers	42	1.0	0.0	0.0
473713	32	32	999	Nevada -- Statewide	423220	Home furnishing merchant wholesalers	42	1.2	0.0	0.0
473714	32	32	999	Nevada -- Statewide	423310	Lumber, plywood, millwork, and wood panel merchant wholesalers	42	1.0	0.0	0.0
473715	32	32	999	Nevada -- Statewide	423410	Photographic equipment and supplies merchant wholesalers	42	1.2	0.0	0.0
473716	32	32	999	Nevada -- Statewide	423420	Office equipment merchant wholesalers	42	1.0	0.0	0.0
473717	32	32	999	Nevada -- Statewide	423430	Computer and computer peripheral equipment and software merchant wholesalers	42	7.2	35.2	4654.0
473718	32	32	999	Nevada -- Statewide	423440	Other commercial equipment merchant wholesalers	42	1.5	0.0	0.0
473719	32	32	999	Nevada -- Statewide	423450	Medical, dental, and hospital equipment and supplies merchant wholesalers	42	12.6	51.6	15003.2
473720	32	32	999	Nevada -- Statewide	423460	Ophthalmic goods merchant wholesalers	42	1.0	0.0	0.0
473721	32	32	999	Nevada -- Statewide	423510	Metal service centers and other metal merchant wholesalers	42	1.0	0.0	0.0
473722	32	32	999	Nevada -- Statewide	423610	Electrical apparatus and equipment, wiring supplies, and related equipment merchant wholesalers	42	2.0	0.0	0.0
473723	32	32	999	Nevada -- Statewide	423690	Other electronic parts and equipment merchant wholesalers	42	9.4	32.8	5004.0
473724	32	32	999	Nevada -- Statewide	423720	Plumbing and heating equipment and supplies (hydronics) merchant wholesalers	42	1.0	0.0	0.0
473725	32	32	999	Nevada -- Statewide	423830	Industrial machinery and equipment merchant wholesalers	42	3.2	0.0	359.8
473726	32	32	999	Nevada -- Statewide	423860	Transportation equipment and supplies (except motor vehicle) merchant wholesalers	42	1.0	0.0	0.0
473727	32	32	999	Nevada -- Statewide	423920	Toy and hobby goods and supplies merchant wholesalers	42	1.0	0.0	0.0
473728	32	32	999	Nevada -- Statewide	423930	Recyclable material merchant wholesalers	42	1.0	0.0	0.0
473729	32	32	999	Nevada -- Statewide	424120	Stationery and office supplies merchant wholesalers	42	1.0	0.0	0.0
473730	32	32	999	Nevada -- Statewide	424130	Industrial and personal service paper merchant wholesalers	42	1.0	0.0	0.0
473731	32	32	999	Nevada -- Statewide	424210	Drugs and druggists' sundries merchant wholesalers	42	10.4	117.6	15319.8
473732	32	32	999	Nevada -- Statewide	424310	Piece goods, notions, and other dry goods merchant wholesalers	42	1.0	0.0	0.0
473733	32	32	999	Nevada -- Statewide	424320	Men's and boys' clothing and furnishings merchant wholesalers	42	1.0	0.0	0.0
473734	32	32	999	Nevada -- Statewide	424450	Confectionery merchant wholesalers	42	1.5	0.0	0.0
473735	32	32	999	Nevada -- Statewide	424470	Meat and meat product merchant wholesalers	42	1.0	0.0	0.0
473736	32	32	999	Nevada -- Statewide	424490	Other grocery and related products merchant wholesalers	42	5.4	38.0	1267.0
473737	32	32	999	Nevada -- Statewide	424690	Other chemical and allied products merchant wholesalers	42	3.2	0.0	0.0
473738	32	32	999	Nevada -- Statewide	424720	Petroleum and petroleum products merchant wholesalers (except bulk stations and terminals) 	42	1.6666666666666667	0.0	0.0
473739	32	32	999	Nevada -- Statewide	424820	Wine and distilled alcoholic beverage merchant wholesalers	42	2.4	0.8	104.6
473740	32	32	999	Nevada -- Statewide	424990	Other miscellaneous nondurable goods merchant wholesalers	42	1.0	0.0	0.0
473741	32	32	999	Nevada -- Statewide	425120	Wholesale trade agents and brokers	42	3.4	0.0	0.0
473742	32	32	999	Nevada -- Statewide	443142	Electronics stores	44	1.0	0.0	0.0
473743	32	32	999	Nevada -- Statewide	446110	Pharmacies and drug stores	44	1.0	0.0	0.0
473744	32	32	999	Nevada -- Statewide	454113	Mail-order houses	45	3.0	0.0	0.0
473745	32	32	999	Nevada -- Statewide	485410	School and employee bus transportation	48	1.0	0.0	0.0
473746	32	32	999	Nevada -- Statewide	488190	Other support activities for air transportation	48	1.0	0.0	0.0
473747	32	32	999	Nevada -- Statewide	488510	Freight transportation arrangement	48	1.0	0.0	0.0
473748	32	32	999	Nevada -- Statewide	511130	Book publishers	51	1.0	0.0	0.0
473749	32	32	999	Nevada -- Statewide	511140	Directory and mailing list publishers	51	1.0	0.0	0.0
473750	32	32	999	Nevada -- Statewide	511199	All other publishers	51	1.0	0.0	0.0
473751	32	32	999	Nevada -- Statewide	511210	Software publishers	51	7.6	100.2	14452.6
473752	32	32	999	Nevada -- Statewide	512110	Motion picture and video production	51	1.0	0.0	0.0
473753	32	32	999	Nevada -- Statewide	515120	Television broadcasting	51	1.0	0.0	0.0
473754	32	32	999	Nevada -- Statewide	517110	Wired telecommunications carriers	51	6.6	19.2	1153.0
473755	32	32	999	Nevada -- Statewide	517210	Wireless telecommunications carriers (except satellite)	51	4.0	11.0	1089.6
473756	32	32	999	Nevada -- Statewide	517919	All other telecommunications	51	1.6	1.0	71.4
473757	32	32	999	Nevada -- Statewide	518210	Data processing, hosting, and related services	51	4.2	2.2	409.4
473758	32	32	999	Nevada -- Statewide	519130	Internet publishing and broadcasting and web search portals	51	1.25	0.0	0.0
473759	32	32	999	Nevada -- Statewide	522110	Commercial banking	52	6.8	60.6	11135.8
473760	32	32	999	Nevada -- Statewide	522120	Savings institutions	52	1.0	0.0	0.0
473761	32	32	999	Nevada -- Statewide	522210	Credit card issuing	52	1.6	0.0	0.0
473762	32	32	999	Nevada -- Statewide	522220	Sales financing	52	3.0	0.0	0.0
473763	32	32	999	Nevada -- Statewide	522291	Consumer lending	52	1.0	0.0	0.0
473764	32	32	999	Nevada -- Statewide	522292	Real estate credit	52	4.2	3.8	635.8
473765	32	32	999	Nevada -- Statewide	522320	Financial transactions processing, reserve, and clearinghouse activities	52	3.8	6.0	1261.8
473766	32	32	999	Nevada -- Statewide	522390	Other activities related to credit intermediation	52	1.4	0.0	0.0
473767	32	32	999	Nevada -- Statewide	523110	Investment banking and securities dealing	52	1.0	0.0	0.0
473768	32	32	999	Nevada -- Statewide	523120	Securities brokerage	52	5.6	0.0	0.0
473769	32	32	999	Nevada -- Statewide	523920	Portfolio management	52	1.0	0.0	0.0
473770	32	32	999	Nevada -- Statewide	523930	Investment advice	52	2.2	0.0	0.0
473771	32	32	999	Nevada -- Statewide	523991	Trust, fiduciary, and custody activities	52	1.0	0.0	0.0
473772	32	32	999	Nevada -- Statewide	524113	Direct life insurance carriers	52	16.8	227.4	24575.8
473773	32	32	999	Nevada -- Statewide	524114	Direct health and medical insurance carriers	52	20.8	151.8	14781.8
473774	32	32	999	Nevada -- Statewide	524126	Direct property and casualty insurance carriers	52	12.2	52.4	5163.4
473775	32	32	999	Nevada -- Statewide	524128	Other direct insurance (except life, health, and medical) carriers	52	1.0	0.0	0.0
473776	32	32	999	Nevada -- Statewide	524130	Reinsurance carriers	52	1.0	0.0	0.0
473777	32	32	999	Nevada -- Statewide	524210	Insurance agencies and brokerages	52	9.8	14.2	1476.6
473778	32	32	999	Nevada -- Statewide	524291	Claims adjusting	52	1.0	0.0	0.0
473779	32	32	999	Nevada -- Statewide	524292	Third party administration of insurance and pension funds	52	3.0	1.5	154.5
473780	32	32	999	Nevada -- Statewide	524298	All other insurance related activities	52	1.0	0.0	0.0
473781	32	32	999	Nevada -- Statewide	531210	Offices of real estate agents and brokers	53	1.0	0.0	0.0
473782	32	32	999	Nevada -- Statewide	531311	Residential property managers	53	2.0	0.0	0.0
473783	32	32	999	Nevada -- Statewide	531312	Nonresidential property managers	53	1.4	0.0	0.0
473784	32	32	999	Nevada -- Statewide	531390	Other activities related to real estate	53	1.0	0.0	0.0
473785	32	32	999	Nevada -- Statewide	532420	Office machinery and equipment rental and leasing	53	1.0	0.0	0.0
473786	32	32	999	Nevada -- Statewide	541213	Tax preparation services	54	2.0	0.0	0.0
473787	32	32	999	Nevada -- Statewide	541214	Payroll services	54	5.2	72.2	3573.8
473788	32	32	999	Nevada -- Statewide	541320	Landscape architectural services	54	1.0	0.0	0.0
473789	32	32	999	Nevada -- Statewide	541330	Engineering services	54	7.6	31.4	4467.6
473790	32	32	999	Nevada -- Statewide	541511	Custom computer programming services	54	9.4	57.0	5325.2
473791	32	32	999	Nevada -- Statewide	541512	Computer systems design services	54	16.0	200.4	22630.8
473792	32	32	999	Nevada -- Statewide	541513	Computer facilities management services	54	2.0	0.0	0.0
473793	32	32	999	Nevada -- Statewide	541519	Other computer related services	54	3.2	8.2	1190.8
473794	32	32	999	Nevada -- Statewide	541611	Administrative management and general management consulting services	54	1.4	0.0	0.0
473795	32	32	999	Nevada -- Statewide	541612	Human resources consulting services	54	1.75	0.0	0.0
473796	32	32	999	Nevada -- Statewide	541613	Marketing consulting services	54	1.0	0.0	0.0
473797	32	32	999	Nevada -- Statewide	541614	Process, physical distribution, and logistics consulting services	54	1.0	0.0	0.0
473798	32	32	999	Nevada -- Statewide	541620	Environmental consulting services	54	3.0	0.0	0.0
473799	32	32	999	Nevada -- Statewide	541690	Other scientific and technical consulting services	54	2.0	0.0	0.0
473800	32	32	999	Nevada -- Statewide	541711	Research and development in biotechnology	54	1.0	0.0	0.0
473801	32	32	999	Nevada -- Statewide	541712	Research and development in the physical, engineering, and life sciences (except biotechnology)	54	4.0	27.0	2890.0
473802	32	32	999	Nevada -- Statewide	541810	Advertising agencies	54	1.0	0.0	0.0
473803	32	32	999	Nevada -- Statewide	541850	Outdoor advertising	54	1.0	0.0	0.0
473804	32	32	999	Nevada -- Statewide	541890	Other services related to advertising	54	1.0	0.0	0.0
473805	32	32	999	Nevada -- Statewide	541921	Photography studios, portrait	54	1.6666666666666667	0.0	0.0
473806	32	32	999	Nevada -- Statewide	551114	Corporate, subsidiary, and regional managing offices	55	4.0	9.4	1223.2
473807	32	32	999	Nevada -- Statewide	561110	Office administrative services	56	1.0	0.0	0.0
473808	32	32	999	Nevada -- Statewide	561210	Facilities support services	56	1.3333333333333333	0.0	0.0
473809	32	32	999	Nevada -- Statewide	561311	Employment placement agencies	56	1.0	0.0	0.0
473810	32	32	999	Nevada -- Statewide	561320	Temporary help services	56	20.0	5023.6	83176.4
473811	32	32	999	Nevada -- Statewide	561330	Professional employer organizations	56	8.4	12666.6	530432.2
473812	32	32	999	Nevada -- Statewide	561410	Document preparation services	56	2.25	31.5	915.0
473813	32	32	999	Nevada -- Statewide	561422	Telemarketing bureaus and other contact centers	56	1.8	0.0	0.0
473814	32	32	999	Nevada -- Statewide	561439	Other business service centers (including copy shops)	56	1.0	0.0	0.0
473815	32	32	999	Nevada -- Statewide	561499	All other business support services	56	1.0	0.0	0.0
473816	32	32	999	Nevada -- Statewide	561510	Travel agencies	56	5.2	0.0	0.0
473817	32	32	999	Nevada -- Statewide	561520	Tour operators	56	1.0	0.0	0.0
473818	32	32	999	Nevada -- Statewide	561611	Investigation services	56	2.0	0.0	0.0
473819	32	32	999	Nevada -- Statewide	561612	Security guards and patrol services	56	1.0	0.0	0.0
473820	32	32	999	Nevada -- Statewide	561621	Security systems services (except locksmiths)	56	1.0	0.0	0.0
473821	32	32	999	Nevada -- Statewide	561720	Janitorial services	56	1.0	0.0	0.0
473822	32	32	999	Nevada -- Statewide	561990	All other support services	56	1.8	0.0	0.0
473823	32	32	999	Nevada -- Statewide	562211	Hazardous waste treatment and disposal	56	1.0	0.0	0.0
473824	32	32	999	Nevada -- Statewide	562219	Other nonhazardous waste treatment and disposal	56	1.0	0.0	0.0
473825	32	32	999	Nevada -- Statewide	611310	Colleges, universities, and professional schools	61	3.0	0.0	0.0
473826	32	32	999	Nevada -- Statewide	611420	Computer training	61	1.0	0.0	0.0
473827	32	32	999	Nevada -- Statewide	611519	Other technical and trade schools	61	1.0	0.0	0.0
473828	32	32	999	Nevada -- Statewide	611691	Exam preparation and tutoring	61	1.0	0.0	0.0
473829	32	32	999	Nevada -- Statewide	611710	Educational support services	61	2.0	0.0	0.0
473830	32	32	999	Nevada -- Statewide	621111	Offices of physicians (except mental health specialists)	62	1.0	0.0	0.0
473831	32	32	999	Nevada -- Statewide	621340	Offices of physical, occupational and speech therapists, and audiologists	62	1.0	0.0	0.0
473832	32	32	999	Nevada -- Statewide	621399	Offices of all other miscellaneous health practitioners	62	1.0	0.0	0.0
473833	32	32	999	Nevada -- Statewide	621420	Outpatient mental health and substance abuse centers	62	2.0	0.0	0.0
473834	32	32	999	Nevada -- Statewide	621498	All other outpatient care centers	62	1.0	0.0	0.0
473835	32	32	999	Nevada -- Statewide	621512	Diagnostic imaging centers	62	1.4	0.0	0.0
473836	32	32	999	Nevada -- Statewide	621610	Home health care services	62	3.0	0.0	0.0
473837	32	32	999	Nevada -- Statewide	621999	All other miscellaneous ambulatory health care services	62	1.0	0.0	0.0
473838	32	32	999	Nevada -- Statewide	624120	Services for the elderly and persons with disabilities	62	1.0	0.0	0.0
473839	32	32	999	Nevada -- Statewide	711211	Sports teams and clubs	71	1.0	0.0	0.0
473840	32	32	999	Nevada -- Statewide	711320	Promoters of performing arts, sports, and similar events without facilities	71	1.0	0.0	0.0
473841	32	32	999	Nevada -- Statewide	811212	Computer and office machine repair and maintenance	81	1.5	0.0	0.0
473842	32	32	999	Nevada -- Statewide	811310	Commercial and industrial machinery and equipment (except automotive and electronic) repair and maintenance	81	1.8	0.0	0.0
473843	32	32	999	Nevada -- Statewide	812199	Other personal care services	81	1.0	0.0	0.0
473844	32	32	999	Nevada -- Statewide	812990	All other personal services	81	1.5	0.0	0.0
473845	32	32	999	Nevada -- Statewide	813212	Voluntary health organizations	81	1.0	0.0	0.0
473846	32	32	999	Nevada -- Statewide	813312	Environment, conservation and wildlife organizations	81	1.0	0.0	0.0
