233	17	999	Statewide	56	Travel arrangement and reservation services	17	5615	1070.8000000000002	7398.8	477109.9999999998
234	17	999	Statewide	56	Waste collection	17	5621	440.45000000000005	6851.000000000003	502061.3999999999
235	17	999	Statewide	56	Waste treatment and disposal	17	5622	129.15	1698.6000000000001	102066.0
236	17	999	Statewide	61	Business schools and computer and management training	17	6114	380.19999999999993	2128.9999999999995	119665.79999999999
237	17	999	Statewide	61	Colleges, universities, and professional schools	17	6113	205.8	78253.00000000001	3970276.0
238	17	999	Statewide	61	Educational support services	17	6117	363.5	4370.799999999999	202568.60000000003
239	17	999	Statewide	61	Elementary and secondary schools	17	6111	923.6	38470.39999999999	1289484.0
240	17	999	Statewide	61	Junior colleges	17	6112	37.39999999999999	1684.6000000000001	57889.6
241	17	999	Statewide	61	Other schools and instruction	17	6116	1967.9500000000007	16853.2	286735.99999999994
242	17	999	Statewide	61	Technical and trade schools	17	6115	371.89999999999986	3892.2000000000003	150944.6
243	17	999	Statewide	62	Child day care services	17	6244	2926.7499999999995	35096.4	747640.6
244	17	999	Statewide	62	Community food and housing, and emergency and other relief services	17	6242	466.1999999999999	7042.399999999998	223094.2000000001
245	17	999	Statewide	62	Continuing care retirement communities and assisted living facilities for the elderly	17	6233	548.2333333333333	31063.53333333334	778390.8
246	17	999	Statewide	62	General medical and surgical hospitals	17	6221	200.19999999999996	170195.4	9927405.0
247	17	999	Statewide	62	Home health care services	17	6216	1271.9333333333332	58143.6	1399999.2000000002
248	17	999	Statewide	62	Individual and family services	17	6241	2371.6000000000004	61606.8	1448247.0
249	17	999	Statewide	62	Medical and diagnostic laboratories	17	6215	454.5333333333332	6567.4	395725.39999999997
250	17	999	Statewide	62	Nursing care facilities (skilled nursing facilities)	17	6231	731.7333333333333	72032.0	2018131.7999999989
251	17	999	Statewide	62	Offices of dentists	17	6212	6046.4000000000015	36458.40000000001	1677450.0000000002
252	17	999	Statewide	62	Offices of other health practitioners	17	6213	6786.099999999997	37336.60000000001	1508741.0
253	17	999	Statewide	62	Offices of physicians	17	6211	8203.899999999998	87640.59999999999	7781631.200000001
254	17	999	Statewide	62	Other ambulatory health care services	17	6219	387.20000000000005	9427.599999999997	398176.8
255	17	999	Statewide	62	Other residential care facilities	17	6239	138.25	2551.4	90317.4
256	17	999	Statewide	62	Outpatient care centers	17	6214	1304.4000000000005	22007.999999999993	1115710.2
257	17	999	Statewide	62	Psychiatric and substance abuse hospitals	17	6222	18.4	2742.8	136364.4
258	17	999	Statewide	62	Residential intellectual and developmental disability, mental health, and substance abuse facilities	17	6232	1409.4666666666665	20456.600000000002	515892.7999999999
259	17	999	Statewide	62	Specialty (except psychiatric and substance abuse) hospitals	17	6223	19.400000000000002	5036.2	285879.4
260	17	999	Statewide	62	Vocational rehabilitation services	17	6243	339.6	8214.2	168081.4
261	17	999	Statewide	71	Agents and managers for artists, athletes, entertainers, and other public figures	17	7114	101.6	288.59999999999997	25784.6
262	17	999	Statewide	71	Amusement parks and arcades	17	7131	126.60000000000002	2738.0000000000005	43181.20000000001
263	17	999	Statewide	71	Gambling industries	17	7132	133.01666666666665	1456.4	84565.8
264	17	999	Statewide	71	Independent artists, writers, and performers	17	7115	613.3999999999997	968.4000000000001	71762.60000000002
265	17	999	Statewide	71	Museums, historical sites, and similar institutions	17	7121	210.13333333333333	5659.399999999999	218295.99999999994
266	17	999	Statewide	71	Other amusement and recreation industries	17	7139	2713.200000000002	48308.00000000003	931470.8000000002
267	17	999	Statewide	71	Performing arts companies	17	7111	376.99999999999994	5913.199999999999	196883.39999999997
268	17	999	Statewide	71	Promoters of performing arts, sports, and similar events	17	7113	271.70000000000005	3227.6	105712.20000000003
269	17	999	Statewide	71	Spectator sports	17	7112	185.1833333333333	2702.5999999999995	607539.8
270	17	999	Statewide	72	Drinking places (alcoholic beverages)	17	7224	2652.5999999999995	19577.6	313083.6000000001
271	17	999	Statewide	72	RV (recreational vehicle) parks and recreational camps	17	7212	137.00000000000003	140.6	6847.000000000002
272	17	999	Statewide	72	Restaurants and other eating places	17	7225	21324.399999999994	382234.40000000014	6231600.399999995
273	17	999	Statewide	72	Rooming and boarding houses	17	7213	114.60000000000001	620.5999999999998	15689.2
274	17	999	Statewide	72	Special food services	17	7223	2000.7833333333335	33010.200000000004	793609.4
275	17	999	Statewide	72	Traveler accommodation	17	7211	1499.266666666667	52682.39999999999	1589513.2
276	17	999	Statewide	81	Automotive repair and maintenance	17	8111	7330.299999999999	38211.8	1351792.8000000003
277	17	999	Statewide	81	Business, professional, labor, political, and similar organizations	17	8139	3246.5999999999995	35986.0	2117271.000000001
278	17	999	Statewide	81	Civic and social organizations	17	8134	1059.1999999999998	9848.6	296050.3999999998
279	17	999	Statewide	81	Commercial and industrial machinery and equipment (except automotive and electronic) repair and maintenance	17	8113	974.2	7521.799999999999	420073.3999999999
280	17	999	Statewide	81	Death care services	17	8122	1053.0	4990.999999999999	217329.9999999999
281	17	999	Statewide	81	Drycleaning and laundry services	17	8123	1496.9500000000005	10157.699999999997	274174.05000000005
282	17	999	Statewide	81	Electronic and precision equipment repair and maintenance	17	8112	561.0333333333333	3803.8000000000015	179880.2
283	17	999	Statewide	81	Grantmaking and giving services	17	8132	743.2000000000002	6048.399999999999	401467.5999999998
284	17	999	Statewide	81	Other personal services	17	8129	1937.95	11659.2	279274.00000000006
285	17	999	Statewide	81	Personal and household goods repair and maintenance	17	8114	855.6500000000002	2335.0	81701.8
286	17	999	Statewide	81	Personal care services	17	8121	4896.8	29606.8	592363.3999999994
287	17	999	Statewide	81	Religious organizations	17	8131	7325.0	68905.20000000001	1485896.0
288	17	999	Statewide	81	Social advocacy organizations	17	8133	581.233333333333	5430.200000000002	225746.80000000002
