18217	25	25	0	Massachusetts	332813	Electroplating, plating, polishing, anodizing, and coloring	33	65.0	1888.0	91122.4
18218	25	25	0	Massachusetts	332911	Industrial valve manufacturing	33	11.0	1066.0	76119.2
18219	25	25	0	Massachusetts	332912	Fluid power valve and hose fitting manufacturing	33	3.4	18.2	902.8
18220	25	25	0	Massachusetts	332913	Plumbing fixture fitting and trim manufacturing	33	7.0	355.6	21659.2
18221	25	25	0	Massachusetts	332919	Other metal valve and pipe fitting manufacturing	33	4.0	62.0	3777.6
18222	25	25	0	Massachusetts	332991	Ball and roller bearing manufacturing	33	2.0	0.0	0.0
18223	25	25	0	Massachusetts	332993	Ammunition (except small arms) manufacturing	33	1.2	0.0	0.0
18224	25	25	0	Massachusetts	332994	Small arms, ordnance, and ordnance accessories manufacturing	33	7.8	1710.2	108379.8
18225	25	25	0	Massachusetts	332996	Fabricated pipe and pipe fitting manufacturing	33	5.2	31.4	2641.2
18226	25	25	0	Massachusetts	332999	All other miscellaneous fabricated metal product manufacturing	33	72.2	1146.6	62230.8
18227	25	25	0	Massachusetts	333111	Farm machinery and equipment manufacturing	33	3.4	0.0	159.6
18228	25	25	0	Massachusetts	333120	Construction machinery manufacturing	33	5.6	36.4	2435.8
18229	25	25	0	Massachusetts	333131	Mining machinery and equipment manufacturing	33	1.0	0.0	0.0
18230	25	25	0	Massachusetts	333132	Oil and gas field machinery and equipment manufacturing	33	1.6666666666666667	0.0	570.0
18231	25	25	0	Massachusetts	333241	Food product machinery manufacturing	33	4.8	19.0	1229.2
18232	25	25	0	Massachusetts	333242	Semiconductor machinery manufacturing	33	13.0	2977.4	318931.0
18233	25	25	0	Massachusetts	333243	Sawmill, woodworking, and paper machinery manufacturing	33	17.8	572.4	39993.8
18234	25	25	0	Massachusetts	333244	Printing machinery and equipment manufacturing	33	7.4	119.2	7659.2
18235	25	25	0	Massachusetts	333249	Other industrial machinery manufacturing	33	49.4	1101.4	79089.0
18236	25	25	0	Massachusetts	333314	Optical instrument and lens manufacturing	33	37.2	1795.6	128035.0
18237	25	25	0	Massachusetts	333316	Photographic and photocopying equipment manufacturing	33	6.4	92.0	6468.0
18238	25	25	0	Massachusetts	333318	Other commercial and service industry machinery manufacturing	33	31.2	892.2	49982.8
18239	25	25	0	Massachusetts	333413	Industrial and commercial fan and blower and air purification equipment manufacturing	33	6.8	151.8	10669.0
18240	25	25	0	Massachusetts	333414	Heating equipment (except warm air furnaces) manufacturing	33	13.4	572.6	28806.8
18241	25	25	0	Massachusetts	333415	Air-conditioning and warm air heating equipment and commercial and industrial refrigeration equipment manufacturing	33	10.8	652.8	49992.6
18242	25	25	0	Massachusetts	333511	Industrial mold manufacturing	33	33.0	742.4	41987.6
18243	25	25	0	Massachusetts	333514	Special die and tool, die set, jig, and fixture manufacturing	33	45.4	456.2	26377.4
18244	25	25	0	Massachusetts	333515	Cutting tool and machine tool accessory manufacturing	33	33.2	614.8	33265.2
18245	25	25	0	Massachusetts	333517	Machine tool manufacturing	33	25.4	343.2	26560.6
18246	25	25	0	Massachusetts	333519	Rolling mill and other metalworking machinery manufacturing	33	11.8	236.0	17049.2
18247	25	25	0	Massachusetts	333611	Turbine and turbine generator set units manufacturing	33	9.0	663.4	47649.4
18248	25	25	0	Massachusetts	333612	Speed changer, industrial high-speed drive, and gear manufacturing	33	3.8	69.2	4905.6
18249	25	25	0	Massachusetts	333613	Mechanical power transmission equipment manufacturing	33	8.6	401.6	38594.2
18250	25	25	0	Massachusetts	333618	Other engine equipment manufacturing	33	2.2	0.0	0.0
18251	25	25	0	Massachusetts	333911	Pump and pumping equipment manufacturing	33	5.0	308.0	18433.4
18252	25	25	0	Massachusetts	333912	Air and gas compressor manufacturing	33	3.4	169.4	10399.2
18253	25	25	0	Massachusetts	333921	Elevator and moving stairway manufacturing	33	4.4	41.8	3083.2
18254	25	25	0	Massachusetts	333922	Conveyor and conveying equipment manufacturing	33	12.6	251.0	15831.6
18255	25	25	0	Massachusetts	333923	Overhead traveling crane, hoist, and monorail system manufacturing	33	7.4	127.0	6202.0
18256	25	25	0	Massachusetts	333924	Industrial truck, trailer, and stacker machinery manufacturing	33	2.0	0.0	0.0
18257	25	25	0	Massachusetts	333991	Power-driven handtool manufacturing	33	4.2	38.0	2265.6
18258	25	25	0	Massachusetts	333992	Welding and soldering equipment manufacturing	33	8.0	80.2	5103.0
18259	25	25	0	Massachusetts	333993	Packaging machinery manufacturing	33	11.2	432.2	30793.2
18260	25	25	0	Massachusetts	333994	Industrial process furnace and oven manufacturing	33	14.4	444.2	24500.4
18261	25	25	0	Massachusetts	333995	Fluid power cylinder and actuator manufacturing	33	1.5	0.0	0.0
18262	25	25	0	Massachusetts	333996	Fluid power pump and motor manufacturing	33	2.2	0.0	0.0
18263	25	25	0	Massachusetts	333997	Scale and balance manufacturing	33	1.6	0.0	0.0
18264	25	25	0	Massachusetts	333999	All other miscellaneous general purpose machinery manufacturing	33	45.8	1718.0	162086.6
18265	25	25	0	Massachusetts	334111	Electronic computer manufacturing	33	20.0	360.2	27979.0
18266	25	25	0	Massachusetts	334112	Computer storage device manufacturing	33	8.8	550.2	39771.4
18267	25	25	0	Massachusetts	334118	Computer terminal and other computer peripheral equipment manufacturing	33	26.0	860.8	64731.0
18268	25	25	0	Massachusetts	334210	Telephone apparatus manufacturing	33	9.2	590.0	78321.0
18269	25	25	0	Massachusetts	334220	Radio and television broadcasting and wireless communications equipment manufacturing	33	40.0	3794.2	407226.4
18270	25	25	0	Massachusetts	334290	Other communications equipment manufacturing	33	13.2	219.0	14767.6
18271	25	25	0	Massachusetts	334310	Audio and video equipment manufacturing	33	15.6	440.4	36959.2
18272	25	25	0	Massachusetts	334412	Bare printed circuit board manufacturing	33	16.2	357.8	20453.6
18273	25	25	0	Massachusetts	334413	Semiconductor and related device manufacturing	33	47.4	4306.8	417377.4
18274	25	25	0	Massachusetts	334416	Capacitor, resistor, coil, transformer, and other inductor manufacturing	33	21.2	603.8	25461.6
18275	25	25	0	Massachusetts	334417	Electronic connector manufacturing	33	11.2	279.2	21231.8
18276	25	25	0	Massachusetts	334418	Printed circuit assembly (electronic assembly) manufacturing	33	30.4	1566.0	133531.0
18277	25	25	0	Massachusetts	334419	Other electronic component manufacturing	33	63.0	3992.0	300837.0
18278	25	25	0	Massachusetts	334510	Electromedical and electrotherapeutic apparatus manufacturing	33	64.8	6313.6	656325.8
18279	25	25	0	Massachusetts	334511	Search, detection, navigation, guidance, aeronautical, and nautical system and instrument manufacturing	33	30.8	2554.6	227936.8
18280	25	25	0	Massachusetts	334512	Automatic environmental control manufacturing for residential, commercial, and appliance use	33	11.6	369.0	27822.2
18281	25	25	0	Massachusetts	334513	Instruments and related products manufacturing for measuring, displaying, and controlling industrial process variables	33	37.0	2252.4	203177.2
18282	25	25	0	Massachusetts	334514	Totalizing fluid meter and counting device manufacturing	33	5.8	54.8	2596.0
18283	25	25	0	Massachusetts	334515	Instrument manufacturing for measuring and testing electricity and electrical systems	33	43.4	1529.2	138446.8
18284	25	25	0	Massachusetts	334516	Analytical laboratory instrument manufacturing	33	55.8	5754.4	571004.2
18285	25	25	0	Massachusetts	334517	Irradiation apparatus manufacturing	33	11.8	1804.2	195437.0
18286	25	25	0	Massachusetts	334519	Other measuring and controlling device manufacturing	33	50.8	2023.0	163811.6
18287	25	25	0	Massachusetts	334613	Blank magnetic and optical recording media manufacturing	33	5.0	151.4	11307.4
18288	25	25	0	Massachusetts	334614	Software and other prerecorded compact disc, tape, and record reproducing	33	16.4	114.2	13553.2
18289	25	25	0	Massachusetts	335110	Electric lamp bulb and part manufacturing	33	1.8	0.0	0.0
18290	25	25	0	Massachusetts	335121	Residential electric lighting fixture manufacturing	33	10.4	221.6	11834.2
18291	25	25	0	Massachusetts	335122	Commercial, industrial, and institutional electric lighting fixture manufacturing	33	14.8	492.6	34462.0
18292	25	25	0	Massachusetts	335129	Other lighting equipment manufacturing	33	7.8	196.4	10447.2
18293	25	25	0	Massachusetts	335210	Small electrical appliance manufacturing	33	8.2	55.8	3768.4
18294	25	25	0	Massachusetts	335228	Other major household appliance manufacturing	33	4.2	214.8	11336.0
18295	25	25	0	Massachusetts	335311	Power, distribution, and specialty transformer manufacturing	33	7.6	104.8	7290.0
18296	25	25	0	Massachusetts	335312	Motor and generator manufacturing	33	9.4	151.2	7865.4
18297	25	25	0	Massachusetts	335313	Switchgear and switchboard apparatus manufacturing	33	5.2	249.6	16286.4
18298	25	25	0	Massachusetts	335314	Relay and industrial control manufacturing	33	27.6	551.0	35991.0
18299	25	25	0	Massachusetts	335911	Storage battery manufacturing	33	5.4	110.8	11505.4
18300	25	25	0	Massachusetts	335912	Primary battery manufacturing	33	7.2	92.8	5185.6
18301	25	25	0	Massachusetts	335921	Fiber optic cable manufacturing	33	8.0	118.0	8378.0
18302	25	25	0	Massachusetts	335929	Other communication and energy wire manufacturing	33	20.6	1301.0	85896.0
18303	25	25	0	Massachusetts	335931	Current-carrying wiring device manufacturing	33	22.2	649.4	62244.4
18304	25	25	0	Massachusetts	335932	Noncurrent-carrying wiring device manufacturing	33	1.0	0.0	0.0
18305	25	25	0	Massachusetts	335991	Carbon and graphite product manufacturing	33	5.8	113.0	8887.0
18306	25	25	0	Massachusetts	335999	All other miscellaneous electrical equipment and component manufacturing	33	36.2	2430.0	206304.4
18307	25	25	0	Massachusetts	336111	Automobile manufacturing	33	1.2	0.0	0.0
18308	25	25	0	Massachusetts	336211	Motor vehicle body manufacturing	33	7.6	185.8	10014.8
18309	25	25	0	Massachusetts	336212	Truck trailer manufacturing	33	3.6	15.6	1079.4
18310	25	25	0	Massachusetts	336214	Travel trailer and camper manufacturing	33	7.0	82.4	3101.8
18311	25	25	0	Massachusetts	336310	Motor vehicle gasoline engine and engine parts manufacturing	33	7.2	44.8	3618.2
18312	25	25	0	Massachusetts	336320	Motor vehicle electrical and electronic equipment manufacturing	33	7.0	8.2	631.6
18313	25	25	0	Massachusetts	336330	Motor vehicle steering and suspension components (except spring) manufacturing	33	1.8	0.0	0.0
18314	25	25	0	Massachusetts	336340	Motor vehicle brake system manufacturing	33	2.2	0.0	342.6
18315	25	25	0	Massachusetts	336350	Motor vehicle transmission and power train parts manufacturing	33	1.2	0.0	0.0
18316	25	25	0	Massachusetts	336360	Motor vehicle seating and interior trim manufacturing	33	2.6	0.0	0.0
18317	25	25	0	Massachusetts	336370	Motor vehicle metal stamping	33	7.0	126.0	5498.6
18318	25	25	0	Massachusetts	336390	Other motor vehicle parts manufacturing	33	13.2	742.2	62503.8
18319	25	25	0	Massachusetts	336411	Aircraft manufacturing	33	1.3333333333333333	0.0	0.0
18320	25	25	0	Massachusetts	336412	Aircraft engine and engine parts manufacturing	33	15.6	2915.0	242472.4
18321	25	25	0	Massachusetts	336413	Other aircraft parts and auxiliary equipment manufacturing	33	5.6	32.6	4883.4
18322	25	25	0	Massachusetts	336414	Guided missile and space vehicle manufacturing	33	1.75	0.0	0.0
18323	25	25	0	Massachusetts	336415	Guided missile and space vehicle propulsion unit and propulsion unit parts manufacturing	33	1.0	0.0	0.0
18324	25	25	0	Massachusetts	336419	Other guided missile and space vehicle parts and auxiliary equipment manufacturing	33	1.8	0.0	0.0
18325	25	25	0	Massachusetts	336510	Railroad rolling stock manufacturing	33	3.0	17.6	1317.4
18326	25	25	0	Massachusetts	336611	Ship building and repairing	33	12.8	333.4	18540.4
18327	25	25	0	Massachusetts	336612	Boat building	33	27.4	162.4	9504.0
18328	25	25	0	Massachusetts	336991	Motorcycle, bicycle, and parts manufacturing	33	10.2	145.2	5865.4
18329	25	25	0	Massachusetts	336992	Military armored vehicle, tank, and tank component manufacturing	33	2.2	0.0	0.0
18330	25	25	0	Massachusetts	336999	All other transportation equipment manufacturing	33	5.8	281.6	18025.4
18331	25	25	0	Massachusetts	337110	Wood kitchen cabinet and countertop manufacturing	33	95.0	641.8	30626.8
18332	25	25	0	Massachusetts	337121	Upholstered household furniture manufacturing	33	17.2	84.4	2994.0
18333	25	25	0	Massachusetts	337122	Nonupholstered wood household furniture manufacturing	33	49.2	394.8	15998.6
18334	25	25	0	Massachusetts	337124	Metal household furniture manufacturing	33	5.2	24.8	1666.6
18335	25	25	0	Massachusetts	337125	Household furniture (except wood and metal) manufacturing	33	3.6	2.0	107.8
18336	25	25	0	Massachusetts	337127	Institutional furniture manufacturing	33	11.6	166.4	9911.0
18337	25	25	0	Massachusetts	337211	Wood office furniture manufacturing	33	5.0	21.2	813.2
18338	25	25	0	Massachusetts	337212	Custom architectural woodwork and millwork manufacturing	33	52.2	686.6	38295.0
18339	25	25	0	Massachusetts	337214	Office furniture (except wood) manufacturing	33	4.6	311.2	11624.4
18340	25	25	0	Massachusetts	337215	Showcase, partition, shelving, and locker manufacturing	33	19.6	350.2	17208.6
18341	25	25	0	Massachusetts	337910	Mattress manufacturing	33	10.0	433.4	18160.0
18342	25	25	0	Massachusetts	337920	Blind and shade manufacturing	33	6.8	48.6	2038.6
18343	25	25	0	Massachusetts	339112	Surgical and medical instrument manufacturing	33	69.6	5309.6	433119.0
18344	25	25	0	Massachusetts	339113	Surgical appliance and supplies manufacturing	33	63.8	1904.2	146074.8
18345	25	25	0	Massachusetts	339114	Dental equipment and supplies manufacturing	33	15.0	377.8	26818.0
18346	25	25	0	Massachusetts	339115	Ophthalmic goods manufacturing	33	13.2	358.8	31656.6
18347	25	25	0	Massachusetts	339116	Dental laboratories	33	123.2	815.4	44681.2
18348	25	25	0	Massachusetts	339910	Jewelry and silverware manufacturing	33	67.8	1172.2	55186.0
18349	25	25	0	Massachusetts	339920	Sporting and athletic goods manufacturing	33	31.4	1005.2	76836.4
18350	25	25	0	Massachusetts	339930	Doll, toy, and game manufacturing	33	16.4	663.0	26961.6
18351	25	25	0	Massachusetts	339940	Office supplies (except paper) manufacturing	33	10.2	497.6	23019.2
18352	25	25	0	Massachusetts	339950	Sign manufacturing	33	125.2	1361.4	72024.0
18353	25	25	0	Massachusetts	339991	Gasket, packing, and sealing device manufacturing	33	12.6	768.4	50205.6
18354	25	25	0	Massachusetts	339992	Musical instrument manufacturing	33	29.0	441.4	23794.8
18355	25	25	0	Massachusetts	339993	Fastener, button, needle, and pin manufacturing	33	4.0	20.6	958.6
18356	25	25	0	Massachusetts	339994	Broom, brush, and mop manufacturing	33	2.8	0.0	0.0
18357	25	25	0	Massachusetts	339995	Burial casket manufacturing	33	4.2	157.8	5745.0
18358	25	25	0	Massachusetts	339999	All other miscellaneous manufacturing	33	115.2	1713.6	97550.0
18359	25	25	0	Massachusetts	423110	Automobile and other motor vehicle merchant wholesalers	42	99.8	1719.6	108297.6
18360	25	25	0	Massachusetts	423120	Motor vehicle supplies and new parts merchant wholesalers	42	263.6	4316.2	191081.6
18361	25	25	0	Massachusetts	423130	Tire and tube merchant wholesalers	42	37.6	418.2	24354.2
18362	25	25	0	Massachusetts	423140	Motor vehicle parts (used) merchant wholesalers	42	38.2	544.6	19263.4
18363	25	25	0	Massachusetts	423210	Furniture merchant wholesalers	42	105.8	1127.0	84626.4
18364	25	25	0	Massachusetts	423220	Home furnishing merchant wholesalers	42	135.4	1958.6	130049.6
18365	25	25	0	Massachusetts	423310	Lumber, plywood, millwork, and wood panel merchant wholesalers	42	130.0	2370.6	142849.0
18366	25	25	0	Massachusetts	423320	Brick, stone, and related construction material merchant wholesalers	42	64.6	577.2	36424.4
18367	25	25	0	Massachusetts	423330	Roofing, siding, and insulation material merchant wholesalers	42	57.6	597.4	40837.2
18368	25	25	0	Massachusetts	423390	Other construction material merchant wholesalers	42	55.2	584.6	37308.6
18369	25	25	0	Massachusetts	423410	Photographic equipment and supplies merchant wholesalers	42	21.6	183.0	18781.8
18370	25	25	0	Massachusetts	423420	Office equipment merchant wholesalers	42	226.6	1612.2	170802.2
18371	25	25	0	Massachusetts	423430	Computer and computer peripheral equipment and software merchant wholesalers	42	272.8	6643.2	848743.2
18372	25	25	0	Massachusetts	423440	Other commercial equipment merchant wholesalers	42	83.6	1158.4	70310.8
18373	25	25	0	Massachusetts	423450	Medical, dental, and hospital equipment and supplies merchant wholesalers	42	221.2	10257.8	1192406.4
18374	25	25	0	Massachusetts	423460	Ophthalmic goods merchant wholesalers	42	21.2	167.4	16035.2
18375	25	25	0	Massachusetts	423490	Other professional equipment and supplies merchant wholesalers	42	98.4	1320.4	103882.4
18376	25	25	0	Massachusetts	423510	Metal service centers and other metal merchant wholesalers	42	159.8	2105.8	129470.0
18377	25	25	0	Massachusetts	423520	Coal and other mineral and ore merchant wholesalers	42	3.2	2.0	348.8
18378	25	25	0	Massachusetts	423610	Electrical apparatus and equipment, wiring supplies, and related equipment merchant wholesalers	42	300.8	4896.0	362306.8
18379	25	25	0	Massachusetts	423620	Household appliances, electric housewares, and consumer electronics merchant wholesalers 	42	52.6	1320.8	144591.2
18380	25	25	0	Massachusetts	423690	Other electronic parts and equipment merchant wholesalers	42	346.6	9570.2	1235921.6
18381	25	25	0	Massachusetts	423710	Hardware merchant wholesalers	42	116.6	1812.4	139159.4
18382	25	25	0	Massachusetts	423720	Plumbing and heating equipment and supplies (hydronics) merchant wholesalers	42	155.4	1724.2	122581.2
18383	25	25	0	Massachusetts	423730	Warm air heating and air-conditioning equipment and supplies merchant wholesalers	42	77.2	858.6	60762.2
18384	25	25	0	Massachusetts	423740	Refrigeration equipment and supplies merchant wholesalers	42	26.2	254.2	15611.8
18385	25	25	0	Massachusetts	423810	Construction and mining (except oil well) machinery and equipment merchant wholesalers	42	60.4	970.4	79312.8
18386	25	25	0	Massachusetts	423820	Farm and garden machinery and equipment merchant wholesalers	42	30.8	306.6	15655.0
18387	25	25	0	Massachusetts	423830	Industrial machinery and equipment merchant wholesalers	42	509.4	6698.0	533868.4
18388	25	25	0	Massachusetts	423840	Industrial supplies merchant wholesalers	42	123.0	1394.8	106848.2
18389	25	25	0	Massachusetts	423850	Service establishment equipment and supplies merchant wholesalers	42	87.8	898.2	55459.0
18390	25	25	0	Massachusetts	423860	Transportation equipment and supplies (except motor vehicle) merchant wholesalers	42	20.8	94.4	6811.8
18391	25	25	0	Massachusetts	423910	Sporting and recreational goods and supplies merchant wholesalers	42	116.2	1128.2	97575.2
18392	25	25	0	Massachusetts	423920	Toy and hobby goods and supplies merchant wholesalers	42	34.6	282.6	21590.4
18393	25	25	0	Massachusetts	423930	Recyclable material merchant wholesalers	42	151.6	1687.6	89534.8
18394	25	25	0	Massachusetts	423940	Jewelry, watch, precious stone, and precious metal merchant wholesalers	42	92.4	567.2	39426.6
18395	25	25	0	Massachusetts	423990	Other miscellaneous durable goods merchant wholesalers	42	171.6	2510.6	176765.0
18396	25	25	0	Massachusetts	424110	Printing and writing paper merchant wholesalers	42	20.4	151.2	12015.8
18397	25	25	0	Massachusetts	424120	Stationery and office supplies merchant wholesalers	42	87.8	2016.8	131792.4
18398	25	25	0	Massachusetts	424130	Industrial and personal service paper merchant wholesalers	42	113.4	2497.0	174843.0
18399	25	25	0	Massachusetts	424210	Drugs and druggists' sundries merchant wholesalers	42	153.8	7991.0	1263012.4
18400	25	25	0	Massachusetts	424310	Piece goods, notions, and other dry goods merchant wholesalers	42	43.2	644.4	39619.0
18401	25	25	0	Massachusetts	424320	Men's and boys' clothing and furnishings merchant wholesalers	42	69.0	1282.4	86895.8
18402	25	25	0	Massachusetts	424330	Women's, children's, and infants' clothing and accessories merchant wholesalers	42	82.0	596.8	32083.8
18403	25	25	0	Massachusetts	424340	Footwear merchant wholesalers	42	46.6	2995.4	346132.2
18404	25	25	0	Massachusetts	424410	General line grocery merchant wholesalers	42	52.6	2246.4	147208.0
18405	25	25	0	Massachusetts	424420	Packaged frozen food merchant wholesalers	42	91.8	2500.0	149471.8
18406	25	25	0	Massachusetts	424430	Dairy product (except dried or canned) merchant wholesalers	42	42.2	1789.2	124026.4
18407	25	25	0	Massachusetts	424440	Poultry and poultry product merchant wholesalers	42	14.0	148.8	10498.4
18408	25	25	0	Massachusetts	424450	Confectionery merchant wholesalers	42	62.0	580.0	27532.6
18409	25	25	0	Massachusetts	424460	Fish and seafood merchant wholesalers	42	133.8	1856.6	103290.6
18410	25	25	0	Massachusetts	424470	Meat and meat product merchant wholesalers	42	54.0	838.4	47924.8
18411	25	25	0	Massachusetts	424480	Fresh fruit and vegetable merchant wholesalers	42	120.0	2150.6	133600.4
18412	25	25	0	Massachusetts	424490	Other grocery and related products merchant wholesalers	42	239.2	6667.8	360689.6
18413	25	25	0	Massachusetts	424510	Grain and field bean merchant wholesalers	42	2.4	0.0	0.0
18414	25	25	0	Massachusetts	424520	Livestock merchant wholesalers	42	2.2	1.6	107.4
18415	25	25	0	Massachusetts	424590	Other farm product raw material merchant wholesalers	42	7.8	39.0	3724.8
18416	25	25	0	Massachusetts	424610	Plastics materials and basic forms and shapes merchant wholesalers	42	78.2	731.6	51286.0
18417	25	25	0	Massachusetts	424690	Other chemical and allied products merchant wholesalers	42	145.4	1541.4	122473.0
18418	25	25	0	Massachusetts	424710	Petroleum bulk stations and terminals 	42	47.4	1235.0	113029.4
18419	25	25	0	Massachusetts	424720	Petroleum and petroleum products merchant wholesalers (except bulk stations and terminals) 	42	39.2	622.4	48795.4
18420	25	25	0	Massachusetts	424810	Beer and ale merchant wholesalers	42	32.6	1972.0	120813.8
18421	25	25	0	Massachusetts	424820	Wine and distilled alcoholic beverage merchant wholesalers	42	74.4	2167.0	179184.4
18422	25	25	0	Massachusetts	424910	Farm supplies merchant wholesalers	42	54.8	445.6	31809.4
18423	25	25	0	Massachusetts	424920	Book, periodical, and newspaper merchant wholesalers	42	62.0	1232.4	62678.2
18424	25	25	0	Massachusetts	424930	Flower, nursery stock, and florists' supplies merchant wholesalers	42	55.4	989.0	46941.8
18425	25	25	0	Massachusetts	424940	Tobacco and tobacco product merchant wholesalers	42	21.0	1285.4	64369.2
18426	25	25	0	Massachusetts	424950	Paint, varnish, and supplies merchant wholesalers	42	43.4	494.2	28321.2
18427	25	25	0	Massachusetts	424990	Other miscellaneous nondurable goods merchant wholesalers	42	165.2	1525.2	84938.4
18428	25	25	0	Massachusetts	425110	Business to business electronic markets	42	11.8	50.4	4015.4
18429	25	25	0	Massachusetts	425120	Wholesale trade agents and brokers	42	1050.8	9839.6	693547.0
18430	25	25	0	Massachusetts	441110	New car dealers	44	458.6	22072.4	1239824.4
18431	25	25	0	Massachusetts	441120	Used car dealers	44	530.8	2335.2	98935.0
18432	25	25	0	Massachusetts	441210	Recreational vehicle dealers	44	28.6	316.4	13954.0
18433	25	25	0	Massachusetts	441222	Boat dealers	44	115.4	762.0	40330.2
18434	25	25	0	Massachusetts	441228	Motorcycle, ATV, and all other motor vehicle dealers	44	81.2	670.6	25477.6
18435	25	25	0	Massachusetts	441310	Automotive parts and accessories stores	44	578.4	5583.8	158819.0
18436	25	25	0	Massachusetts	441320	Tire dealers	44	300.0	2954.0	110563.8
18437	25	25	0	Massachusetts	442110	Furniture stores	44	442.2	3879.8	160761.4
18438	25	25	0	Massachusetts	442210	Floor covering stores	44	221.2	1022.6	47144.0
18439	25	25	0	Massachusetts	442291	Window treatment stores	44	70.0	258.2	8587.8
18440	25	25	0	Massachusetts	442299	All other home furnishings stores	44	395.4	5319.8	105377.4
18441	25	25	0	Massachusetts	443141	Household appliance stores	44	169.0	1312.4	57932.8
18442	25	25	0	Massachusetts	443142	Electronics stores	44	776.2	7548.8	227570.8
18443	25	25	0	Massachusetts	444110	Home centers	44	112.8	5427.2	150603.4
18444	25	25	0	Massachusetts	444120	Paint and wallpaper stores	44	152.6	819.0	32361.8
18445	25	25	0	Massachusetts	444130	Hardware stores	44	307.6	2925.2	81354.2
18446	25	25	0	Massachusetts	444190	Other building material dealers	44	792.8	8110.6	448005.8
18447	25	25	0	Massachusetts	444210	Outdoor power equipment stores	44	79.4	516.4	18372.2
18448	25	25	0	Massachusetts	444220	Nursery, garden center, and farm supply stores	44	248.8	1759.4	70926.2
18449	25	25	0	Massachusetts	445110	Supermarkets and other grocery (except convenience) stores	44	1399.8	85765.0	1820379.6
18450	25	25	0	Massachusetts	445120	Convenience stores	44	1520.0	6075.0	104021.0
18451	25	25	0	Massachusetts	445210	Meat markets	44	109.6	1047.2	26654.0
18452	25	25	0	Massachusetts	445220	Fish and seafood markets	44	111.0	652.4	19141.2
18453	25	25	0	Massachusetts	445230	Fruit and vegetable markets	44	68.0	956.6	26217.6
18454	25	25	0	Massachusetts	445291	Baked goods stores	44	95.2	538.8	10558.2
18455	25	25	0	Massachusetts	445292	Confectionery and nut stores	44	94.0	620.6	8697.8
18456	25	25	0	Massachusetts	445299	All other specialty food stores	44	140.8	854.2	18648.8
18457	25	25	0	Massachusetts	445310	Beer, wine, and liquor stores	44	1381.4	8741.4	209032.0
18458	25	25	0	Massachusetts	446110	Pharmacies and drug stores	44	949.4	20053.8	685669.6
18459	25	25	0	Massachusetts	446120	Cosmetics, beauty supplies, and perfume stores	44	301.4	2666.4	51124.4
18460	25	25	0	Massachusetts	446130	Optical goods stores	44	331.6	1816.4	58835.2
18461	25	25	0	Massachusetts	446191	Food (health) supplement stores	44	166.2	701.8	16608.2
18462	25	25	0	Massachusetts	446199	All other health and personal care stores	44	192.0	1179.2	53277.2
