18743	25	25	0	Massachusetts	611420	Computer training	61	44.6	285.0	16511.8
18744	25	25	0	Massachusetts	611430	Professional and management development training	61	194.0	1678.2	119965.6
18745	25	25	0	Massachusetts	611511	Cosmetology and barber schools	61	36.8	366.6	10497.6
18746	25	25	0	Massachusetts	611512	Flight training	61	15.0	83.0	3952.8
18747	25	25	0	Massachusetts	611513	Apprenticeship training	61	29.0	649.4	27039.8
18748	25	25	0	Massachusetts	611519	Other technical and trade schools	61	115.4	2176.2	83658.0
18749	25	25	0	Massachusetts	611610	Fine arts schools	61	498.4	3807.8	62900.6
18750	25	25	0	Massachusetts	611620	Sports and recreation instruction	61	514.8	3372.0	66444.8
18751	25	25	0	Massachusetts	611630	Language schools	61	60.2	1642.2	61024.0
18752	25	25	0	Massachusetts	611691	Exam preparation and tutoring	61	229.4	4397.6	87424.4
18753	25	25	0	Massachusetts	611692	Automobile driving schools	61	134.2	761.2	15510.4
18754	25	25	0	Massachusetts	611699	All other miscellaneous schools and instruction	61	183.0	1666.6	51970.2
18755	25	25	0	Massachusetts	611710	Educational support services	61	265.0	3629.6	175890.4
18756	25	25	0	Massachusetts	621111	Offices of physicians (except mental health specialists)	62	3371.4	55290.0	5907215.2
18757	25	25	0	Massachusetts	621112	Offices of physicians, mental health specialists	62	254.0	2195.4	104650.4
18758	25	25	0	Massachusetts	621210	Offices of dentists	62	3185.8	23539.8	1252547.4
18759	25	25	0	Massachusetts	621310	Offices of chiropractors	62	720.0	2219.4	73145.0
18760	25	25	0	Massachusetts	621320	Offices of optometrists	62	394.6	1864.2	82669.8
18761	25	25	0	Massachusetts	621330	Offices of mental health practitioners (except physicians)	62	378.4	2965.6	107573.6
18762	25	25	0	Massachusetts	621340	Offices of physical, occupational and speech therapists, and audiologists	62	700.8	8019.8	344785.6
18763	25	25	0	Massachusetts	621391	Offices of podiatrists	62	199.6	807.8	41239.2
18764	25	25	0	Massachusetts	621399	Offices of all other miscellaneous health practitioners	62	272.6	1205.6	47340.0
18765	25	25	0	Massachusetts	621410	Family planning centers	62	48.0	551.8	23708.6
18766	25	25	0	Massachusetts	621420	Outpatient mental health and substance abuse centers	62	300.6	9827.6	342049.0
18767	25	25	0	Massachusetts	621491	HMO medical centers	62	1.25	0.0	0.0
18768	25	25	0	Massachusetts	621492	Kidney dialysis centers	62	172.8	1577.6	85235.8
18769	25	25	0	Massachusetts	621493	Freestanding ambulatory surgical and emergency centers	62	80.0	2091.4	152022.2
18770	25	25	0	Massachusetts	621498	All other outpatient care centers	62	203.4	14902.0	1232488.6
18771	25	25	0	Massachusetts	621511	Medical laboratories	62	210.2	5659.4	396780.8
18772	25	25	0	Massachusetts	621512	Diagnostic imaging centers	62	132.6	2176.0	160619.6
18773	25	25	0	Massachusetts	621610	Home health care services	62	590.0	35637.2	1249990.6
18774	25	25	0	Massachusetts	621910	Ambulance services	62	100.2	6709.0	240864.2
18775	25	25	0	Massachusetts	621991	Blood and organ banks	62	10.6	906.0	64888.8
18776	25	25	0	Massachusetts	621999	All other miscellaneous ambulatory health care services	62	72.0	1637.2	111447.2
18777	25	25	0	Massachusetts	622110	General medical and surgical hospitals	62	79.2	161090.6	10241044.6
18778	25	25	0	Massachusetts	622210	Psychiatric and substance abuse hospitals	62	26.0	11052.6	671865.4
18779	25	25	0	Massachusetts	622310	Specialty (except psychiatric and substance abuse) hospitals	62	33.2	17093.4	960279.4
18780	25	25	0	Massachusetts	623110	Nursing care facilities (skilled nursing facilities)	62	480.6	59358.6	1995393.4
18781	25	25	0	Massachusetts	623210	Residential intellectual and developmental disability facilities	62	1395.2	23101.8	645696.2
18782	25	25	0	Massachusetts	623220	Residential mental health and substance abuse facilities	62	392.6	8563.4	259419.2
18783	25	25	0	Massachusetts	623311	Continuing care retirement communities	62	89.0	9184.8	260290.0
18784	25	25	0	Massachusetts	623312	Assisted living facilities for the elderly	62	246.6	9832.4	246272.4
18785	25	25	0	Massachusetts	623990	Other residential care facilities	62	113.0	3288.8	115982.8
18786	25	25	0	Massachusetts	624110	Child and youth services	62	340.6	6405.0	197238.2
18787	25	25	0	Massachusetts	624120	Services for the elderly and persons with disabilities	62	628.6	59455.6	1185063.0
18788	25	25	0	Massachusetts	624190	Other individual and family services	62	694.0	14186.6	433403.0
18789	25	25	0	Massachusetts	624210	Community food services	62	102.2	991.6	31542.6
18790	25	25	0	Massachusetts	624221	Temporary shelters	62	136.4	3332.4	104623.4
18791	25	25	0	Massachusetts	624229	Other community housing services	62	142.8	1782.4	65028.6
18792	25	25	0	Massachusetts	624230	Emergency and other relief services	62	30.0	530.6	21825.0
18793	25	25	0	Massachusetts	624310	Vocational rehabilitation services	62	224.0	9180.2	204582.4
18794	25	25	0	Massachusetts	624410	Child day care services	62	2145.0	28067.4	662837.0
18795	25	25	0	Massachusetts	711110	Theater companies and dinner theaters	71	90.0	1388.6	38356.8
18796	25	25	0	Massachusetts	711120	Dance companies	71	12.0	130.6	5820.0
18797	25	25	0	Massachusetts	711130	Musical groups and artists	71	85.6	1006.6	56806.2
18798	25	25	0	Massachusetts	711190	Other performing arts companies	71	3.6	1.2	116.2
18799	25	25	0	Massachusetts	711211	Sports teams and clubs	71	18.4	1738.0	612403.8
18800	25	25	0	Massachusetts	711212	Racetracks	71	5.6	380.2	15230.8
18801	25	25	0	Massachusetts	711219	Other spectator sports	71	16.0	32.6	1843.2
18802	25	25	0	Massachusetts	711310	Promoters of performing arts, sports, and similar events with facilities	71	92.0	2522.2	83262.4
18803	25	25	0	Massachusetts	711320	Promoters of performing arts, sports, and similar events without facilities	71	88.4	548.0	27011.0
18804	25	25	0	Massachusetts	711410	Agents and managers for artists, athletes, entertainers, and other public figures	71	79.2	242.8	23679.6
18805	25	25	0	Massachusetts	711510	Independent artists, writers, and performers	71	265.0	722.2	67095.6
18806	25	25	0	Massachusetts	712110	Museums	71	167.8	4009.4	146476.0
18807	25	25	0	Massachusetts	712120	Historical sites	71	95.4	781.2	23793.4
18808	25	25	0	Massachusetts	712130	Zoos and botanical gardens	71	18.0	701.6	25732.6
18809	25	25	0	Massachusetts	712190	Nature parks and other similar institutions	71	10.4	17.0	1837.6
18810	25	25	0	Massachusetts	713110	Amusement and theme parks	71	8.2	564.4	22390.2
18811	25	25	0	Massachusetts	713120	Amusement arcades	71	71.2	835.4	12371.4
18812	25	25	0	Massachusetts	713290	Other gambling industries	71	3.0	0.0	72.4
18813	25	25	0	Massachusetts	713910	Golf courses and country clubs	71	314.4	5135.4	251776.2
18814	25	25	0	Massachusetts	713920	Skiing facilities	71	12.2	2122.2	19242.2
18815	25	25	0	Massachusetts	713930	Marinas	71	176.0	1082.2	58401.2
18816	25	25	0	Massachusetts	713940	Fitness and recreational sports centers	71	1094.4	25214.4	369970.4
18817	25	25	0	Massachusetts	713950	Bowling centers	71	83.6	1469.2	24567.8
18818	25	25	0	Massachusetts	713990	All other amusement and recreation industries	71	451.6	2695.6	75667.6
18819	25	25	0	Massachusetts	721110	Hotels (except casino hotels) and motels	72	742.8	28686.2	967485.8
18820	25	25	0	Massachusetts	721191	Bed-and-breakfast inns	72	175.8	596.8	18535.0
18821	25	25	0	Massachusetts	721199	All other traveler accommodation	72	20.6	31.6	1186.6
18822	25	25	0	Massachusetts	721211	RV (recreational vehicle) parks and campgrounds	72	59.2	195.4	9843.8
18823	25	25	0	Massachusetts	721214	Recreational and vacation camps (except campgrounds)	72	62.2	429.2	27448.6
18824	25	25	0	Massachusetts	721310	Rooming and boarding houses	72	42.0	152.6	3790.6
18825	25	25	0	Massachusetts	722310	Food service contractors	72	1113.6	7442.8	457169.8
18826	25	25	0	Massachusetts	722320	Caterers	72	368.2	5618.2	138166.0
18827	25	25	0	Massachusetts	722330	Mobile food services	72	100.0	250.4	6383.0
18828	25	25	0	Massachusetts	722410	Drinking places (alcoholic beverages)	72	816.6	8682.0	146091.4
18829	25	25	0	Massachusetts	722511	Full-service restaurants	72	6218.6	128904.8	2665547.8
18830	25	25	0	Massachusetts	722513	Limited-service restaurants	72	5062.4	58620.6	921579.6
18831	25	25	0	Massachusetts	722514	Cafeterias, grill buffets, and buffets	72	54.0	661.8	10394.2
18832	25	25	0	Massachusetts	722515	Snack and nonalcoholic beverage bars	72	2365.0	32979.2	528501.0
18833	25	25	0	Massachusetts	811111	General automotive repair	81	1968.0	7523.4	291389.0
18834	25	25	0	Massachusetts	811112	Automotive exhaust system repair	81	32.8	121.8	4842.2
18835	25	25	0	Massachusetts	811113	Automotive transmission repair	81	80.4	293.4	11962.4
18836	25	25	0	Massachusetts	811118	Other automotive mechanical and electrical repair and maintenance	81	47.0	216.4	8835.6
18837	25	25	0	Massachusetts	811121	Automotive body, paint, and interior repair and maintenance	81	1013.4	6013.8	271223.6
18838	25	25	0	Massachusetts	811122	Automotive glass replacement shops	81	179.6	934.2	40193.6
18839	25	25	0	Massachusetts	811191	Automotive oil change and lubrication shops	81	149.8	948.2	29438.0
18840	25	25	0	Massachusetts	811192	Car washes	81	395.0	2357.8	59611.4
18841	25	25	0	Massachusetts	811198	All other automotive repair and maintenance	81	58.6	174.4	6592.4
18842	25	25	0	Massachusetts	811211	Consumer electronics repair and maintenance	81	32.8	120.4	4143.2
18843	25	25	0	Massachusetts	811212	Computer and office machine repair and maintenance	81	116.2	887.2	57360.4
18844	25	25	0	Massachusetts	811213	Communication equipment repair and maintenance	81	25.4	165.8	10837.2
18845	25	25	0	Massachusetts	811219	Other electronic and precision equipment repair and maintenance	81	79.2	1320.0	119799.8
18846	25	25	0	Massachusetts	811310	Commercial and industrial machinery and equipment (except automotive and electronic) repair and maintenance	81	275.0	2277.0	143016.2
18847	25	25	0	Massachusetts	811411	Home and garden equipment repair and maintenance	81	27.4	101.6	3167.4
18848	25	25	0	Massachusetts	811412	Appliance repair and maintenance	81	79.8	365.2	14406.8
18849	25	25	0	Massachusetts	811420	Reupholstery and furniture repair	81	91.8	409.6	15939.8
18850	25	25	0	Massachusetts	811430	Footwear and leather goods repair	81	17.4	30.8	962.6
18851	25	25	0	Massachusetts	811490	Other personal and household goods repair and maintenance	81	199.0	750.4	30744.6
18852	25	25	0	Massachusetts	812111	Barber shops	81	87.6	264.0	5693.4
18853	25	25	0	Massachusetts	812112	Beauty salons	81	2499.2	16028.4	366773.8
18854	25	25	0	Massachusetts	812113	Nail salons	81	598.0	2299.2	43293.2
18855	25	25	0	Massachusetts	812191	Diet and weight reducing centers	81	93.6	355.6	12364.6
18856	25	25	0	Massachusetts	812199	Other personal care services	81	480.4	2887.8	56620.4
18857	25	25	0	Massachusetts	812210	Funeral homes and funeral services	81	397.0	2237.8	89863.4
18858	25	25	0	Massachusetts	812220	Cemeteries and crematories	81	120.8	719.8	34058.8
18859	25	25	0	Massachusetts	812310	Coin-operated laundries and drycleaners	81	312.8	1172.8	24203.6
18860	25	25	0	Massachusetts	812320	Drycleaning and laundry services (except coin-operated)	81	647.6	3891.4	83342.4
18861	25	25	0	Massachusetts	812331	Linen supply	81	31.8	1961.6	62179.0
18862	25	25	0	Massachusetts	812332	Industrial launderers	81	16.6	835.8	42093.4
18863	25	25	0	Massachusetts	812910	Pet care (except veterinary) services	81	477.2	2529.4	52633.6
18864	25	25	0	Massachusetts	812921	Photofinishing laboratories (except one-hour)	81	15.8	99.6	4085.6
18865	25	25	0	Massachusetts	812922	One-hour photofinishing	81	7.0	9.8	281.0
18866	25	25	0	Massachusetts	812930	Parking lots and garages	81	453.8	4909.2	104228.2
18867	25	25	0	Massachusetts	812990	All other personal services	81	311.8	1839.0	61617.6
18868	25	25	0	Massachusetts	813110	Religious organizations	81	2881.0	25369.2	618602.4
18869	25	25	0	Massachusetts	813211	Grantmaking foundations	81	332.6	2864.2	235439.0
18870	25	25	0	Massachusetts	813212	Voluntary health organizations	81	136.2	1899.2	107252.8
18871	25	25	0	Massachusetts	813219	Other grantmaking and giving services	81	89.6	621.4	34512.6
18872	25	25	0	Massachusetts	813311	Human rights organizations	81	96.4	832.6	38845.8
18873	25	25	0	Massachusetts	813312	Environment, conservation and wildlife organizations	81	254.4	2575.2	118582.0
18874	25	25	0	Massachusetts	813319	Other social advocacy organizations	81	209.8	2804.2	144625.0
18875	25	25	0	Massachusetts	813410	Civic and social organizations	81	894.4	8803.6	172352.8
18876	25	25	0	Massachusetts	813910	Business associations	81	350.2	1851.4	123073.0
18877	25	25	0	Massachusetts	813920	Professional organizations	81	182.2	1581.6	117854.8
18878	25	25	0	Massachusetts	813930	Labor unions and similar labor organizations	81	449.8	3444.0	106728.6
18879	25	25	0	Massachusetts	813940	Political organizations	81	58.0	217.6	10529.6
18880	25	25	0	Massachusetts	813990	Other similar organizations (except business, professional, labor, and political organizations)	81	327.2	1709.0	58799.2
