	id	state	COUNTY	GEO_TTL	relevant_naics	NAICS2012_TTL	NAICS_Sector	estab	emp	payann
534001	37	37	999	North Carolina -- Statewide	211111	Crude petroleum and natural gas extraction	21	1.0	0.0	0.0
534002	37	37	999	North Carolina -- Statewide	212321	Construction sand and gravel mining	21	1.0	0.0	0.0
534003	37	37	999	North Carolina -- Statewide	213111	Drilling oil and gas wells	21	1.0	0.0	0.0
534004	37	37	999	North Carolina -- Statewide	213112	Support activities for oil and gas operations	21	1.0	0.0	0.0
534005	37	37	999	North Carolina -- Statewide	213114	Support activities for metal mining	21	1.4	0.0	0.0
534006	37	37	999	North Carolina -- Statewide	221115	Wind electric power generation	22	1.3333333333333333	0.0	0.0
534007	37	37	999	North Carolina -- Statewide	221210	Natural gas distribution	22	1.0	0.0	0.0
534008	37	37	999	North Carolina -- Statewide	236210	Industrial building construction	23	1.25	0.0	0.0
534009	37	37	999	North Carolina -- Statewide	236220	Commercial and institutional building construction	23	1.25	0.0	0.0
534010	37	37	999	North Carolina -- Statewide	237110	Water and sewer line and related structures construction	23	1.0	0.0	0.0
534011	37	37	999	North Carolina -- Statewide	237130	Power and communication line and related structures construction	23	2.6	0.0	0.0
534012	37	37	999	North Carolina -- Statewide	237310	Highway, street, and bridge construction	23	1.0	0.0	0.0
534013	37	37	999	North Carolina -- Statewide	238220	Plumbing, heating, and air-conditioning contractors	23	1.0	0.0	0.0
534014	37	37	999	North Carolina -- Statewide	238290	Other building equipment contractors	23	1.4	0.0	0.0
534015	37	37	999	North Carolina -- Statewide	423210	Furniture merchant wholesalers	42	3.2	5.8	884.8
534016	37	37	999	North Carolina -- Statewide	423220	Home furnishing merchant wholesalers	42	1.0	0.0	0.0
534017	37	37	999	North Carolina -- Statewide	423320	Brick, stone, and related construction material merchant wholesalers	42	1.0	0.0	0.0
534018	37	37	999	North Carolina -- Statewide	423330	Roofing, siding, and insulation material merchant wholesalers	42	1.8	0.0	0.0
534019	37	37	999	North Carolina -- Statewide	423390	Other construction material merchant wholesalers	42	2.0	0.0	0.0
534020	37	37	999	North Carolina -- Statewide	423410	Photographic equipment and supplies merchant wholesalers	42	1.0	0.0	0.0
534021	37	37	999	North Carolina -- Statewide	423420	Office equipment merchant wholesalers	42	2.0	0.0	0.0
534022	37	37	999	North Carolina -- Statewide	423430	Computer and computer peripheral equipment and software merchant wholesalers	42	11.4	81.2	17201.6
534023	37	37	999	North Carolina -- Statewide	423440	Other commercial equipment merchant wholesalers	42	2.8	7.2	784.4
534024	37	37	999	North Carolina -- Statewide	423450	Medical, dental, and hospital equipment and supplies merchant wholesalers	42	14.0	472.2	66841.2
534025	37	37	999	North Carolina -- Statewide	423460	Ophthalmic goods merchant wholesalers	42	1.8	0.0	0.0
534026	37	37	999	North Carolina -- Statewide	423490	Other professional equipment and supplies merchant wholesalers	42	1.0	0.0	0.0
534027	37	37	999	North Carolina -- Statewide	423510	Metal service centers and other metal merchant wholesalers	42	1.3333333333333333	0.0	0.0
534028	37	37	999	North Carolina -- Statewide	423610	Electrical apparatus and equipment, wiring supplies, and related equipment merchant wholesalers	42	7.8	55.8	5017.0
534029	37	37	999	North Carolina -- Statewide	423620	Household appliances, electric housewares, and consumer electronics merchant wholesalers 	42	1.0	0.0	0.0
534030	37	37	999	North Carolina -- Statewide	423690	Other electronic parts and equipment merchant wholesalers	42	10.8	169.0	22784.6
534031	37	37	999	North Carolina -- Statewide	423720	Plumbing and heating equipment and supplies (hydronics) merchant wholesalers	42	1.5	0.0	0.0
534032	37	37	999	North Carolina -- Statewide	423810	Construction and mining (except oil well) machinery and equipment merchant wholesalers	42	1.0	0.0	0.0
534033	37	37	999	North Carolina -- Statewide	423830	Industrial machinery and equipment merchant wholesalers	42	6.2	59.8	4178.2
534034	37	37	999	North Carolina -- Statewide	423840	Industrial supplies merchant wholesalers	42	2.0	0.0	0.0
534035	37	37	999	North Carolina -- Statewide	423930	Recyclable material merchant wholesalers	42	1.2	0.0	0.0
534036	37	37	999	North Carolina -- Statewide	423940	Jewelry, watch, precious stone, and precious metal merchant wholesalers	42	1.3333333333333333	0.0	0.0
534037	37	37	999	North Carolina -- Statewide	423990	Other miscellaneous durable goods merchant wholesalers	42	1.6	0.6	38.6
534038	37	37	999	North Carolina -- Statewide	424110	Printing and writing paper merchant wholesalers	42	2.0	0.0	0.0
534039	37	37	999	North Carolina -- Statewide	424120	Stationery and office supplies merchant wholesalers	42	2.0	0.0	0.0
534040	37	37	999	North Carolina -- Statewide	424130	Industrial and personal service paper merchant wholesalers	42	1.0	0.0	0.0
534041	37	37	999	North Carolina -- Statewide	424210	Drugs and druggists' sundries merchant wholesalers	42	15.6	1290.4	291539.2
534042	37	37	999	North Carolina -- Statewide	424310	Piece goods, notions, and other dry goods merchant wholesalers	42	3.4	0.0	0.0
534043	37	37	999	North Carolina -- Statewide	424320	Men's and boys' clothing and furnishings merchant wholesalers	42	1.0	0.0	0.0
534044	37	37	999	North Carolina -- Statewide	424330	Women's, children's, and infants' clothing and accessories merchant wholesalers	42	1.0	0.0	0.0
534045	37	37	999	North Carolina -- Statewide	424410	General line grocery merchant wholesalers	42	2.0	0.0	0.0
534046	37	37	999	North Carolina -- Statewide	424420	Packaged frozen food merchant wholesalers	42	1.0	0.0	0.0
534047	37	37	999	North Carolina -- Statewide	424450	Confectionery merchant wholesalers	42	3.25	0.0	0.0
534048	37	37	999	North Carolina -- Statewide	424470	Meat and meat product merchant wholesalers	42	1.0	0.0	0.0
534049	37	37	999	North Carolina -- Statewide	424490	Other grocery and related products merchant wholesalers	42	8.8	25.6	2991.4
534050	37	37	999	North Carolina -- Statewide	424610	Plastics materials and basic forms and shapes merchant wholesalers	42	4.2	11.0	1279.2
534051	37	37	999	North Carolina -- Statewide	424690	Other chemical and allied products merchant wholesalers	42	10.2	88.0	11527.4
534052	37	37	999	North Carolina -- Statewide	424720	Petroleum and petroleum products merchant wholesalers (except bulk stations and terminals) 	42	7.6	7.6	980.4
534053	37	37	999	North Carolina -- Statewide	424820	Wine and distilled alcoholic beverage merchant wholesalers	42	1.8	0.0	0.0
534054	37	37	999	North Carolina -- Statewide	424910	Farm supplies merchant wholesalers	42	2.0	0.0	0.0
534055	37	37	999	North Carolina -- Statewide	425110	Business to business electronic markets	42	1.4	0.0	266.8
534056	37	37	999	North Carolina -- Statewide	425120	Wholesale trade agents and brokers	42	5.4	203.6	14119.2
534057	37	37	999	North Carolina -- Statewide	446110	Pharmacies and drug stores	44	1.0	0.0	0.0
534058	37	37	999	North Carolina -- Statewide	446120	Cosmetics, beauty supplies, and perfume stores	44	1.0	0.0	0.0
534059	37	37	999	North Carolina -- Statewide	454113	Mail-order houses	45	3.0	0.0	0.0
534060	37	37	999	North Carolina -- Statewide	484121	General freight trucking, long-distance, truckload	48	1.0	0.0	0.0
534061	37	37	999	North Carolina -- Statewide	484230	Specialized freight (except used goods) trucking, long-distance	48	1.0	0.0	0.0
534062	37	37	999	North Carolina -- Statewide	485410	School and employee bus transportation	48	1.0	0.0	0.0
534063	37	37	999	North Carolina -- Statewide	488190	Other support activities for air transportation	48	1.0	0.0	0.0
534064	37	37	999	North Carolina -- Statewide	488510	Freight transportation arrangement	48	1.0	0.0	0.0
534065	37	37	999	North Carolina -- Statewide	493110	General warehousing and storage	49	4.0	0.0	0.0
534066	37	37	999	North Carolina -- Statewide	511130	Book publishers	51	1.0	0.0	0.0
534067	37	37	999	North Carolina -- Statewide	511140	Directory and mailing list publishers	51	1.0	0.0	0.0
534068	37	37	999	North Carolina -- Statewide	511199	All other publishers	51	1.0	0.0	0.0
534069	37	37	999	North Carolina -- Statewide	511210	Software publishers	51	15.0	799.2	115711.2
534070	37	37	999	North Carolina -- Statewide	512110	Motion picture and video production	51	2.8	0.0	0.0
534071	37	37	999	North Carolina -- Statewide	515120	Television broadcasting	51	1.0	0.0	0.0
534072	37	37	999	North Carolina -- Statewide	515210	Cable and other subscription programming	51	2.0	0.0	0.0
534073	37	37	999	North Carolina -- Statewide	517110	Wired telecommunications carriers	51	12.4	78.2	6809.2
534074	37	37	999	North Carolina -- Statewide	517210	Wireless telecommunications carriers (except satellite)	51	2.2	0.0	0.0
534075	37	37	999	North Carolina -- Statewide	517919	All other telecommunications	51	2.4	11.8	989.6
534076	37	37	999	North Carolina -- Statewide	518210	Data processing, hosting, and related services	51	7.8	36.2	4909.4
534077	37	37	999	North Carolina -- Statewide	519130	Internet publishing and broadcasting and web search portals	51	4.0	0.0	0.0
534078	37	37	999	North Carolina -- Statewide	522110	Commercial banking	52	10.0	119.2	12573.0
534079	37	37	999	North Carolina -- Statewide	522120	Savings institutions	52	1.8	0.0	0.0
534080	37	37	999	North Carolina -- Statewide	522210	Credit card issuing	52	2.0	0.0	0.0
534081	37	37	999	North Carolina -- Statewide	522220	Sales financing	52	7.6	7.6	1088.6
534082	37	37	999	North Carolina -- Statewide	522291	Consumer lending	52	2.0	0.0	0.0
534083	37	37	999	North Carolina -- Statewide	522292	Real estate credit	52	11.0	235.6	28085.2
534084	37	37	999	North Carolina -- Statewide	522320	Financial transactions processing, reserve, and clearinghouse activities	52	8.2	28.6	5483.4
534085	37	37	999	North Carolina -- Statewide	522390	Other activities related to credit intermediation	52	2.2	2.6	209.0
534086	37	37	999	North Carolina -- Statewide	523110	Investment banking and securities dealing	52	2.0	0.0	0.0
534087	37	37	999	North Carolina -- Statewide	523120	Securities brokerage	52	12.4	33.4	8985.0
534088	37	37	999	North Carolina -- Statewide	523140	Commodity contracts brokerage	52	1.0	0.0	0.0
534089	37	37	999	North Carolina -- Statewide	523920	Portfolio management	52	5.8	12.4	6662.0
534090	37	37	999	North Carolina -- Statewide	523930	Investment advice	52	4.0	8.4	3351.6
534091	37	37	999	North Carolina -- Statewide	523991	Trust, fiduciary, and custody activities	52	1.0	0.0	0.0
534092	37	37	999	North Carolina -- Statewide	524113	Direct life insurance carriers	52	18.8	267.6	24191.4
534093	37	37	999	North Carolina -- Statewide	524114	Direct health and medical insurance carriers	52	11.0	1325.0	75786.0
534094	37	37	999	North Carolina -- Statewide	524126	Direct property and casualty insurance carriers	52	23.4	1007.4	81394.4
534095	37	37	999	North Carolina -- Statewide	524128	Other direct insurance (except life, health, and medical) carriers	52	1.0	0.0	0.0
534096	37	37	999	North Carolina -- Statewide	524130	Reinsurance carriers	52	2.0	0.0	0.0
534097	37	37	999	North Carolina -- Statewide	524210	Insurance agencies and brokerages	52	17.6	164.4	10588.4
534098	37	37	999	North Carolina -- Statewide	524291	Claims adjusting	52	1.2	0.0	0.0
534099	37	37	999	North Carolina -- Statewide	524292	Third party administration of insurance and pension funds	52	4.0	18.4	1409.2
534100	37	37	999	North Carolina -- Statewide	524298	All other insurance related activities	52	1.6	0.0	0.0
534101	37	37	999	North Carolina -- Statewide	531210	Offices of real estate agents and brokers	53	1.0	0.0	0.0
534102	37	37	999	North Carolina -- Statewide	531311	Residential property managers	53	1.0	0.0	0.0
534103	37	37	999	North Carolina -- Statewide	531312	Nonresidential property managers	53	1.0	0.0	0.0
534104	37	37	999	North Carolina -- Statewide	531390	Other activities related to real estate	53	1.6	0.0	0.0
534105	37	37	999	North Carolina -- Statewide	532412	Construction, mining, and forestry machinery and equipment rental and leasing	53	1.0	0.0	0.0
534106	37	37	999	North Carolina -- Statewide	532420	Office machinery and equipment rental and leasing	53	1.0	0.0	0.0
534107	37	37	999	North Carolina -- Statewide	541211	Offices of certified public accountants	54	1.3333333333333333	0.0	0.0
534108	37	37	999	North Carolina -- Statewide	541213	Tax preparation services	54	1.0	0.0	0.0
534109	37	37	999	North Carolina -- Statewide	541214	Payroll services	54	9.8	725.4	35979.0
534110	37	37	999	North Carolina -- Statewide	541219	Other accounting services	54	1.0	0.0	0.0
534111	37	37	999	North Carolina -- Statewide	541330	Engineering services	54	10.0	258.4	24510.0
534112	37	37	999	North Carolina -- Statewide	541511	Custom computer programming services	54	14.6	1246.0	135444.2
534113	37	37	999	North Carolina -- Statewide	541512	Computer systems design services	54	18.6	515.8	37712.0
534114	37	37	999	North Carolina -- Statewide	541513	Computer facilities management services	54	2.75	167.0	16553.75
534115	37	37	999	North Carolina -- Statewide	541519	Other computer related services	54	3.6	60.8	6066.0
534116	37	37	999	North Carolina -- Statewide	541611	Administrative management and general management consulting services	54	3.75	32.25	3702.0
534117	37	37	999	North Carolina -- Statewide	541612	Human resources consulting services	54	3.4	0.0	0.0
534118	37	37	999	North Carolina -- Statewide	541613	Marketing consulting services	54	1.0	0.0	0.0
534119	37	37	999	North Carolina -- Statewide	541614	Process, physical distribution, and logistics consulting services	54	1.0	0.0	0.0
534120	37	37	999	North Carolina -- Statewide	541620	Environmental consulting services	54	2.0	0.0	0.0
534121	37	37	999	North Carolina -- Statewide	541690	Other scientific and technical consulting services	54	1.6	0.0	0.0
534122	37	37	999	North Carolina -- Statewide	541711	Research and development in biotechnology	54	1.0	0.0	0.0
534123	37	37	999	North Carolina -- Statewide	541712	Research and development in the physical, engineering, and life sciences (except biotechnology)	54	4.4	314.8	33583.6
534124	37	37	999	North Carolina -- Statewide	541810	Advertising agencies	54	1.75	0.0	0.0
534125	37	37	999	North Carolina -- Statewide	541850	Outdoor advertising	54	1.0	0.0	0.0
534126	37	37	999	North Carolina -- Statewide	541870	Advertising material distribution services	54	1.0	0.0	0.0
534127	37	37	999	North Carolina -- Statewide	541890	Other services related to advertising	54	1.0	0.0	0.0
534128	37	37	999	North Carolina -- Statewide	541910	Marketing research and public opinion polling	54	2.0	0.0	0.0
534129	37	37	999	North Carolina -- Statewide	541921	Photography studios, portrait	54	1.6666666666666667	0.0	0.0
534130	37	37	999	North Carolina -- Statewide	551114	Corporate, subsidiary, and regional managing offices	55	13.6	129.2	16766.2
534131	37	37	999	North Carolina -- Statewide	561110	Office administrative services	56	2.0	4.6	708.4
534132	37	37	999	North Carolina -- Statewide	561210	Facilities support services	56	1.6	0.0	0.0
534133	37	37	999	North Carolina -- Statewide	561311	Employment placement agencies	56	1.2	0.0	0.0
534134	37	37	999	North Carolina -- Statewide	561312	Executive search services	56	2.0	0.0	0.0
534135	37	37	999	North Carolina -- Statewide	561320	Temporary help services	56	58.0	16441.2	368441.4
534136	37	37	999	North Carolina -- Statewide	561330	Professional employer organizations	56	7.4	28956.0	1084126.6
534137	37	37	999	North Carolina -- Statewide	561410	Document preparation services	56	2.75	155.0	7756.75
534138	37	37	999	North Carolina -- Statewide	561422	Telemarketing bureaus and other contact centers	56	4.0	366.2	4143.8
534139	37	37	999	North Carolina -- Statewide	561439	Other business service centers (including copy shops)	56	1.0	0.0	0.0
534140	37	37	999	North Carolina -- Statewide	561440	Collection agencies	56	1.0	0.0	0.0
534141	37	37	999	North Carolina -- Statewide	561450	Credit bureaus	56	2.0	0.0	0.0
534142	37	37	999	North Carolina -- Statewide	561499	All other business support services	56	1.8	0.0	0.0
534143	37	37	999	North Carolina -- Statewide	561510	Travel agencies	56	3.8	0.0	0.0
534144	37	37	999	North Carolina -- Statewide	561599	All other travel arrangement and reservation services	56	1.0	0.0	0.0
534145	37	37	999	North Carolina -- Statewide	561611	Investigation services	56	2.0	0.0	0.0
534146	37	37	999	North Carolina -- Statewide	561612	Security guards and patrol services	56	1.8	139.8	4179.6
534147	37	37	999	North Carolina -- Statewide	561621	Security systems services (except locksmiths)	56	3.0	0.0	0.0
534148	37	37	999	North Carolina -- Statewide	561720	Janitorial services	56	2.0	0.0	0.0
534149	37	37	999	North Carolina -- Statewide	561920	Convention and trade show organizers	56	1.0	0.0	0.0
534150	37	37	999	North Carolina -- Statewide	561990	All other support services	56	2.6	46.0	1118.8
534151	37	37	999	North Carolina -- Statewide	562111	Solid waste collection	56	1.0	0.0	0.0
534152	37	37	999	North Carolina -- Statewide	562219	Other nonhazardous waste treatment and disposal	56	1.0	0.0	0.0
534153	37	37	999	North Carolina -- Statewide	611310	Colleges, universities, and professional schools	61	4.0	0.0	0.0
534154	37	37	999	North Carolina -- Statewide	611430	Professional and management development training	61	1.3333333333333333	0.0	0.0
534155	37	37	999	North Carolina -- Statewide	611519	Other technical and trade schools	61	1.0	0.0	0.0
534156	37	37	999	North Carolina -- Statewide	611691	Exam preparation and tutoring	61	1.0	0.0	0.0
534157	37	37	999	North Carolina -- Statewide	611699	All other miscellaneous schools and instruction	61	1.0	0.0	0.0
534158	37	37	999	North Carolina -- Statewide	611710	Educational support services	61	1.3333333333333333	0.0	0.0
534159	37	37	999	North Carolina -- Statewide	621111	Offices of physicians (except mental health specialists)	62	2.5	54.5	755.5
534160	37	37	999	North Carolina -- Statewide	621340	Offices of physical, occupational and speech therapists, and audiologists	62	7.2	575.8	26096.6
534161	37	37	999	North Carolina -- Statewide	621420	Outpatient mental health and substance abuse centers	62	1.0	0.0	0.0
534162	37	37	999	North Carolina -- Statewide	621491	HMO medical centers	62	1.0	0.0	0.0
534163	37	37	999	North Carolina -- Statewide	621512	Diagnostic imaging centers	62	1.0	0.0	0.0
534164	37	37	999	North Carolina -- Statewide	621610	Home health care services	62	2.0	0.0	0.0
534165	37	37	999	North Carolina -- Statewide	621999	All other miscellaneous ambulatory health care services	62	2.8	8.4	1045.0
534166	37	37	999	North Carolina -- Statewide	624310	Vocational rehabilitation services	62	1.0	0.0	0.0
534167	37	37	999	North Carolina -- Statewide	711320	Promoters of performing arts, sports, and similar events without facilities	71	1.0	0.0	0.0
534168	37	37	999	North Carolina -- Statewide	722310	Food service contractors	72	2.0	0.0	0.0
534169	37	37	999	North Carolina -- Statewide	811122	Automotive glass replacement shops	81	1.0	0.0	0.0
534170	37	37	999	North Carolina -- Statewide	811212	Computer and office machine repair and maintenance	81	1.0	0.0	0.0
534171	37	37	999	North Carolina -- Statewide	811219	Other electronic and precision equipment repair and maintenance	81	1.0	0.0	0.0
534172	37	37	999	North Carolina -- Statewide	811310	Commercial and industrial machinery and equipment (except automotive and electronic) repair and maintenance	81	1.6	0.0	0.0
534173	37	37	999	North Carolina -- Statewide	812199	Other personal care services	81	1.0	0.0	0.0
534174	37	37	999	North Carolina -- Statewide	812990	All other personal services	81	1.6	0.0	0.0
534175	37	37	999	North Carolina -- Statewide	813110	Religious organizations	81	1.0	0.0	0.0
534176	37	37	999	North Carolina -- Statewide	813212	Voluntary health organizations	81	1.2	0.0	0.0
534177	37	37	999	North Carolina -- Statewide	813219	Other grantmaking and giving services	81	1.0	0.0	0.0
534178	37	37	999	North Carolina -- Statewide	813312	Environment, conservation and wildlife organizations	81	2.0	0.0	0.0
