252	40	999	Statewide	62	Outpatient care centers	40	6214	505.00000000000006	7031.199999999999	300257.6
253	40	999	Statewide	62	Psychiatric and substance abuse hospitals	40	6222	14.8	1670.0	58793.799999999996
254	40	999	Statewide	62	Residential intellectual and developmental disability, mental health, and substance abuse facilities	40	6232	533.95	4889.2	93959.00000000001
255	40	999	Statewide	62	Specialty (except psychiatric and substance abuse) hospitals	40	6223	29.0	4181.6	241200.4
256	40	999	Statewide	62	Vocational rehabilitation services	40	6243	105.35	2398.3999999999996	40434.6
257	40	999	Statewide	71	Agents and managers for artists, athletes, entertainers, and other public figures	40	7114	14.0	4.800000000000001	215.8
258	40	999	Statewide	71	Amusement parks and arcades	40	7131	31.400000000000002	418.20000000000005	5208.599999999999
259	40	999	Statewide	71	Gambling industries	40	7132	86.39999999999998	2251.6000000000004	65197.399999999994
260	40	999	Statewide	71	Independent artists, writers, and performers	40	7115	91.0	122.0	5927.799999999999
261	40	999	Statewide	71	Museums, historical sites, and similar institutions	40	7121	100.0	861.8	25901.0
262	40	999	Statewide	71	Other amusement and recreation industries	40	7139	623.1833333333333	8236.400000000001	147883.4
263	40	999	Statewide	71	Performing arts companies	40	7111	67.6	503.2	13483.999999999998
264	40	999	Statewide	71	Promoters of performing arts, sports, and similar events	40	7113	65.8	344.0	12928.0
265	40	999	Statewide	71	Spectator sports	40	7112	51.9	61.2	12394.0
266	40	999	Statewide	72	Drinking places (alcoholic beverages)	40	7224	414.45	2848.2	41928.7
267	40	999	Statewide	72	RV (recreational vehicle) parks and recreational camps	40	7212	64.1	101.20000000000002	2600.6
268	40	999	Statewide	72	Restaurants and other eating places	40	7225	5913.000000000001	119210.6	1635699.8000000003
269	40	999	Statewide	72	Rooming and boarding houses	40	7213	46.6	111.40000000000002	1603.6000000000001
270	40	999	Statewide	72	Special food services	40	7223	407.1333333333333	3573.8500000000004	68239.90000000002
271	40	999	Statewide	72	Traveler accommodation	40	7211	846.2999999999998	12893.4	229159.39999999994
272	40	999	Statewide	81	Automotive repair and maintenance	40	8111	1789.2	8616.200000000004	288115.1999999999
273	40	999	Statewide	81	Business, professional, labor, political, and similar organizations	40	8139	544.0	2681.7999999999997	132765.19999999998
274	40	999	Statewide	81	Civic and social organizations	40	8134	260.93333333333334	1301.1999999999998	29346.600000000002
275	40	999	Statewide	81	Commercial and industrial machinery and equipment (except automotive and electronic) repair and maintenance	40	8113	428.2499999999999	2095.2000000000003	113751.59999999999
276	40	999	Statewide	81	Death care services	40	8122	313.7999999999999	1241.8	42090.0
277	40	999	Statewide	81	Drycleaning and laundry services	40	8123	341.4	3232.7999999999997	76461.4
278	40	999	Statewide	81	Electronic and precision equipment repair and maintenance	40	8112	150.3	664.0	29802.4
279	40	999	Statewide	81	Grantmaking and giving services	40	8132	223.39999999999998	977.1999999999999	55004.600000000006
280	40	999	Statewide	81	Other personal services	40	8129	390.9833333333334	2040.6499999999999	41149.15000000001
281	40	999	Statewide	81	Personal and household goods repair and maintenance	40	8114	193.65	388.0	10636.6
282	40	999	Statewide	81	Personal care services	40	8121	874.6500000000002	3978.7999999999997	75363.20000000001
283	40	999	Statewide	81	Religious organizations	40	8131	3364.8	28844.199999999986	497301.39999999985
284	40	999	Statewide	81	Social advocacy organizations	40	8133	130.41666666666666	549.6	21530.449999999997
