796	19	999	Statewide	62	Offices of chiropractors	19	621310	845.0500000000001	1756.8000000000004	59319.59999999998
797	19	999	Statewide	62	Offices of dentists	19	621210	1050.8	7292.799999999998	391390.60000000003
798	19	999	Statewide	62	Offices of mental health practitioners (except physicians)	19	621330	184.13333333333335	614.4	25230.199999999993
799	19	999	Statewide	62	Offices of optometrists	19	621320	308.69999999999993	1157.1999999999998	46584.6
800	19	999	Statewide	62	Offices of physical, occupational and speech therapists, and audiologists	19	621340	289.90000000000003	1882.3999999999999	76643.8
801	19	999	Statewide	62	Offices of physicians (except mental health specialists)	19	621111	1227.7666666666669	18008.900000000005	1668118.6500000001
802	19	999	Statewide	62	Offices of physicians, mental health specialists	19	621112	63.80000000000001	100.0	7472.8
803	19	999	Statewide	62	Offices of podiatrists	19	621391	70.99999999999999	146.0	9411.4
804	19	999	Statewide	62	Other community housing services	19	624229	60.64999999999999	195.79999999999998	7604.2
805	19	999	Statewide	62	Other individual and family services	19	624190	434.99999999999994	4049.0	105993.99999999999
806	19	999	Statewide	62	Other residential care facilities	19	623990	56.699999999999996	260.2	6600.2
807	19	999	Statewide	62	Outpatient mental health and substance abuse centers	19	621420	173.20000000000002	1240.0	47541.99999999999
808	19	999	Statewide	62	Psychiatric and substance abuse hospitals	19	622210	6.8	0.0	0.0
809	19	999	Statewide	62	Residential intellectual and developmental disability facilities	19	623210	522.2666666666667	2766.1999999999994	69866.79999999999
810	19	999	Statewide	62	Residential mental health and substance abuse facilities	19	623220	63.400000000000006	491.40000000000003	14204.199999999999
811	19	999	Statewide	62	Services for the elderly and persons with disabilities	19	624120	296.90000000000015	7311.199999999999	124547.6
812	19	999	Statewide	62	Specialty (except psychiatric and substance abuse) hospitals	19	622310	3.0	0.0	0.0
813	19	999	Statewide	62	Temporary shelters	19	624221	53.4	580.8	15936.000000000002
814	19	999	Statewide	62	Vocational rehabilitation services	19	624310	102.4	1340.2	23366.4
815	19	999	Statewide	71	Agents and managers for artists, athletes, entertainers, and other public figures	19	711410	6.0	0.6	35.0
816	19	999	Statewide	71	All other amusement and recreation industries	19	713990	152.30000000000007	589.2	10366.200000000003
817	19	999	Statewide	71	Amusement and theme parks	19	713110	5.0	0.0	0.0
818	19	999	Statewide	71	Amusement arcades	19	713120	31.53333333333333	82.2	839.6
819	19	999	Statewide	71	Bowling centers	19	713950	129.60000000000002	439.40000000000003	5362.400000000001
820	19	999	Statewide	71	Casinos (except casino hotels)	19	713210	9.933333333333334	0.0	0.0
821	19	999	Statewide	71	Dance companies	19	711120	8.0	0.0	0.0
822	19	999	Statewide	71	Fitness and recreational sports centers	19	713940	362.93333333333334	5997.4	54339.0
823	19	999	Statewide	71	Golf courses and country clubs	19	713910	308.95	1756.4	52594.80000000001
824	19	999	Statewide	71	Historical sites	19	712120	10.0	0.0	0.0
825	19	999	Statewide	71	Independent artists, writers, and performers	19	711510	99.95	86.3	3093.55
826	19	999	Statewide	71	Marinas	19	713930	25.8	4.0	392.4
827	19	999	Statewide	71	Museums	19	712110	104.8	359.4	10197.000000000002
828	19	999	Statewide	71	Musical groups and artists	19	711130	23.8	44.2	1898.2
829	19	999	Statewide	71	Nature parks and other similar institutions	19	712190	5.0	0.0	0.0
830	19	999	Statewide	71	Other gambling industries	19	713290	11.0	38.6	3224.2
831	19	999	Statewide	71	Other performing arts companies	19	711190	3.0	0.0	0.0
832	19	999	Statewide	71	Other spectator sports	19	711219	34.21666666666666	21.066666666666666	807.0666666666667
833	19	999	Statewide	71	Promoters of performing arts, sports, and similar events with facilities	19	711310	66.0	171.60000000000002	4039.2000000000003
834	19	999	Statewide	71	Promoters of performing arts, sports, and similar events without facilities	19	711320	53.599999999999994	13.4	761.6
835	19	999	Statewide	71	Racetracks	19	711212	25.066666666666666	0.0	0.0
836	19	999	Statewide	71	Skiing facilities	19	713920	4.0	0.0	0.0
837	19	999	Statewide	71	Sports teams and clubs	19	711211	22.2	99.6	7112.2
838	19	999	Statewide	71	Theater companies and dinner theaters	19	711110	25.799999999999997	18.0	555.0
839	19	999	Statewide	71	Zoos and botanical gardens	19	712130	7.8	0.0	0.0
840	19	999	Statewide	72	All other traveler accommodation	19	721199	10.0	0.0	0.0
841	19	999	Statewide	72	Bed-and-breakfast inns	19	721191	22.8	3.8	54.6
842	19	999	Statewide	72	Cafeterias, grill buffets, and buffets	19	722514	66.61666666666667	170.59999999999997	3744.9000000000005
843	19	999	Statewide	72	Casino hotels	19	721120	12.6	0.0	0.0
844	19	999	Statewide	72	Caterers	19	722320	91.66666666666667	378.2	5631.0
845	19	999	Statewide	72	Drinking places (alcoholic beverages)	19	722410	933.2499999999998	4735.799999999999	54756.600000000006
846	19	999	Statewide	72	Food service contractors	19	722310	219.70000000000002	984.0000000000001	22106.399999999998
847	19	999	Statewide	72	Full-service restaurants	19	722511	2492.2000000000003	45625.599999999984	627919.8000000002
848	19	999	Statewide	72	Hotels (except casino hotels) and motels	19	721110	679.1999999999997	10935.800000000001	187053.99999999997
849	19	999	Statewide	72	Limited-service restaurants	19	722513	1944.3166666666655	36592.4	432451.7999999999
850	19	999	Statewide	72	Mobile food services	19	722330	43.23333333333333	17.400000000000002	266.8
851	19	999	Statewide	72	RV (recreational vehicle) parks and campgrounds	19	721211	29.750000000000004	8.2	494.6
852	19	999	Statewide	72	Recreational and vacation camps (except campgrounds)	19	721214	29.0	54.4	1637.6
853	19	999	Statewide	72	Rooming and boarding houses	19	721310	55.4	127.39999999999999	2306.7999999999997
854	19	999	Statewide	72	Snack and nonalcoholic beverage bars	19	722515	488.0999999999999	4231.2	52203.399999999994
855	19	999	Statewide	81	All other automotive repair and maintenance	19	811198	31.499999999999996	29.599999999999998	1142.0
856	19	999	Statewide	81	All other personal services	19	812990	71.80000000000001	85.0	2805.6000000000004
857	19	999	Statewide	81	Appliance repair and maintenance	19	811412	34.4	25.6	1211.6000000000001
858	19	999	Statewide	81	Automotive body, paint, and interior repair and maintenance	19	811121	491.2	1747.6000000000004	73967.00000000001
859	19	999	Statewide	81	Automotive exhaust system repair	19	811112	22.4	8.0	420.8
860	19	999	Statewide	81	Automotive glass replacement shops	19	811122	71.4	99.8	4491.6
861	19	999	Statewide	81	Automotive oil change and lubrication shops	19	811191	67.80000000000001	229.0	6294.0
862	19	999	Statewide	81	Automotive transmission repair	19	811113	54.300000000000004	119.80000000000001	5021.200000000001
863	19	999	Statewide	81	Barber shops	19	812111	27.2	29.0	668.1999999999999
864	19	999	Statewide	81	Beauty salons	19	812112	855.3499999999999	3906.600000000001	85510.39999999997
865	19	999	Statewide	81	Business associations	19	813910	334.6000000000001	1061.8	74932.0
866	19	999	Statewide	81	Car washes	19	811192	228.06666666666666	1437.8000000000002	25220.13333333333
867	19	999	Statewide	81	Cemeteries and crematories	19	812220	95.8	128.8	4369.4
868	19	999	Statewide	81	Civic and social organizations	19	813410	363.0	1446.2	26557.2
869	19	999	Statewide	81	Coin-operated laundries and drycleaners	19	812310	58.60000000000001	68.4	1486.2
870	19	999	Statewide	81	Commercial and industrial machinery and equipment (except automotive and electronic) repair and maintenance	19	811310	424.99999999999994	1565.3999999999999	72256.60000000002
871	19	999	Statewide	81	Communication equipment repair and maintenance	19	811213	12.95	0.0	0.0
872	19	999	Statewide	81	Computer and office machine repair and maintenance	19	811212	57.13333333333334	87.39999999999999	3750.6000000000004
873	19	999	Statewide	81	Consumer electronics repair and maintenance	19	811211	12.1	1.0	18.0
874	19	999	Statewide	81	Diet and weight reducing centers	19	812191	24.999999999999996	87.4	1543.9999999999998
875	19	999	Statewide	81	Drycleaning and laundry services (except coin-operated)	19	812320	100.4	356.4	8375.8
876	19	999	Statewide	81	Environment, conservation and wildlife organizations	19	813312	59.74999999999999	109.5	4553.25
877	19	999	Statewide	81	Footwear and leather goods repair	19	811430	9.8	5.6	139.8
878	19	999	Statewide	81	Funeral homes and funeral services	19	812210	353.19999999999993	1003.2000000000004	38455.4
879	19	999	Statewide	81	General automotive repair	19	811111	1080.5500000000002	3554.4000000000005	139834.4
880	19	999	Statewide	81	Grantmaking foundations	19	813211	123.6	299.8	16055.0
881	19	999	Statewide	81	Home and garden equipment repair and maintenance	19	811411	32.83333333333333	2.8	22.6
882	19	999	Statewide	81	Human rights organizations	19	813311	26.46666666666667	312.4	9032.4
883	19	999	Statewide	81	Industrial launderers	19	812332	25.6	215.2	8648.6
884	19	999	Statewide	81	Labor unions and similar labor organizations	19	813930	214.76666666666662	1122.8000000000002	26684.999999999996
885	19	999	Statewide	81	Linen supply	19	812331	4.0	0.0	0.0
886	19	999	Statewide	81	Nail salons	19	812113	70.80000000000001	90.8	2321.4
887	19	999	Statewide	81	One-hour photofinishing	19	812922	4.0	0.0	0.0
888	19	999	Statewide	81	Other automotive mechanical and electrical repair and maintenance	19	811118	34.0	57.0	2536.8
889	19	999	Statewide	81	Other electronic and precision equipment repair and maintenance	19	811219	16.4	7.6	542.8
890	19	999	Statewide	81	Other grantmaking and giving services	19	813219	42.13333333333334	77.2	4928.6
891	19	999	Statewide	81	Other personal and household goods repair and maintenance	19	811490	76.89999999999999	48.4	1782.6000000000001
892	19	999	Statewide	81	Other personal care services	19	812199	171.13333333333333	850.6	12535.599999999999
893	19	999	Statewide	81	Other similar organizations (except business, professional, labor, and political organizations)	19	813990	76.39999999999999	130.20000000000002	5290.599999999999
894	19	999	Statewide	81	Other social advocacy organizations	19	813319	73.96666666666667	100.8	4424.8
895	19	999	Statewide	81	Parking lots and garages	19	812930	42.6	159.4	3615.7999999999997
896	19	999	Statewide	81	Pet care (except veterinary) services	19	812910	169.65000000000006	530.5999999999999	7971.200000000001
897	19	999	Statewide	81	Photofinishing laboratories (except one-hour)	19	812921	7.0	0.0	0.0
898	19	999	Statewide	81	Political organizations	19	813940	33.099999999999994	36.8	3520.4
899	19	999	Statewide	81	Professional organizations	19	813920	66.60000000000001	617.6	43259.799999999996
900	19	999	Statewide	81	Religious organizations	19	813110	2969.599999999998	18391.8	315993.80000000005
901	19	999	Statewide	81	Reupholstery and furniture repair	19	811420	25.0	13.6	543.8000000000001
902	19	999	Statewide	81	Voluntary health organizations	19	813212	41.0	131.6	7637.200000000001
