	id	COUNTY	GEO_TTL	NAICS_Sector	NAICS2012_TTL	state	relevant_naics	estab_agg	emp_agg	payann_agg	emp_api	payann_api	estab_api
0	49	999	Statewide	11	Crop harvesting, primarily by machine	49	115113	4.0	0.0	0.0	0.0	0.0	1.3333333333333333
1	49	999	Statewide	11	Farm labor contractors and crew leaders	49	115115	1.0	0.0	0.0	0.0	0.0	1.0
2	49	999	Statewide	11	Farm management services	49	115116	7.0	0.0	0.0	43.0	3675.6	5.6
3	49	999	Statewide	11	Finfish fishing	49	114111	2.0	0.0	0.0	0.0	0.0	1.2
4	49	999	Statewide	11	Hunting and trapping	49	114210	5.0	0.0	0.0	7.8	361.0	4.4
5	49	999	Statewide	11	Logging	49	113310	9.7	0.0	0.0	31.0	1298.2	7.4
6	49	999	Statewide	11	Other marine fishing	49	114119	1.0	0.0	0.0	0.0	0.0	1.0
7	49	999	Statewide	11	Postharvest crop activities (except cotton ginning)	49	115114	6.0	0.0	0.0	17.0	489.4	5.8
8	49	999	Statewide	11	Shellfish fishing	49	114112	2.0	0.0	0.0	0.0	0.0	2.0
9	49	999	Statewide	11	Soil preparation, planting, and cultivating	49	115112	8.65	0.0	0.0	8.4	330.6	6.2
10	49	999	Statewide	11	Support activities for animal production	49	115210	50.43333333333333	54.60000000000001	2163.4000000000005	112.8	3355.6	46.2
11	49	999	Statewide	11	Support activities for forestry	49	115310	6.4	0.2	26.8	1.4	182.0	4.4
12	49	999	Statewide	21	All other metal ore mining	49	212299	3.2	0.0	0.0	0.0	0.0	2.2
13	49	999	Statewide	21	All other nonmetallic mineral mining	49	212399	8.0	0.0	0.0	153.6	11794.4	7.2
14	49	999	Statewide	21	Anthracite mining	49	212113	1.0	0.0	0.0	0.0	0.0	1.0
15	49	999	Statewide	21	Bituminous coal and lignite surface mining	49	212111	2.4	0.0	0.0	0.0	0.0	2.2
16	49	999	Statewide	21	Bituminous coal underground mining	49	212112	10.4	0.0	0.0	1347.0	102183.6	10.4
17	49	999	Statewide	21	Clay and ceramic and refractory minerals mining	49	212325	2.0	0.0	0.0	0.0	0.0	2.0
18	49	999	Statewide	21	Construction sand and gravel mining	49	212321	31.0	5.800000000000002	233.0	308.8	18225.2	27.8
19	49	999	Statewide	21	Copper ore and nickel ore mining	49	212234	5.8	0.0	0.0	376.4	29870.0	4.6
20	49	999	Statewide	21	Crude petroleum and natural gas extraction	49	211111	55.0	493.2	52307.6	1548.0	170841.6	58.2
21	49	999	Statewide	21	Crushed and broken granite mining and quarrying	49	212313	1.0	0.0	0.0	0.0	0.0	1.0
22	49	999	Statewide	21	Crushed and broken limestone mining and quarrying	49	212312	6.199999999999998	0.0	0.0	49.4	4954.6	5.4
23	49	999	Statewide	21	Dimension stone mining and quarrying	49	212311	6.2	0.0	0.0	7.2	722.2	3.4
24	49	999	Statewide	21	Drilling oil and gas wells	49	213111	46.86666666666667	237.13333333333333	19123.466666666667	549.6	34303.2	48.2
25	49	999	Statewide	21	Gold ore mining	49	212221	9.8	0.0	0.0	11.6	743.0	5.2
26	49	999	Statewide	21	Industrial sand mining	49	212322	2.0	0.0	0.0	0.0	0.0	1.0
27	49	999	Statewide	21	Iron ore mining	49	212210	3.0	0.0	0.0	0.0	0.0	1.4
28	49	999	Statewide	21	Natural gas liquid extraction	49	211112	5.0	0.0	0.0	23.4	1018.4	4.0
29	49	999	Statewide	21	Other chemical and fertilizer mineral mining	49	212393	3.2	0.0	0.0	0.0	0.0	2.2
30	49	999	Statewide	21	Other crushed and broken stone mining and quarrying	49	212319	11.4	12.8	421.0	75.8	4462.4	11.2
31	49	999	Statewide	21	Phosphate rock mining	49	212392	1.0	0.0	0.0	0.0	0.0	1.0
32	49	999	Statewide	21	Potash, soda, and borate mineral mining	49	212391	4.0	0.0	0.0	0.0	0.0	3.2
33	49	999	Statewide	21	Support activities for coal mining	49	213113	5.8	0.0	0.0	31.0	2879.2	4.8
34	49	999	Statewide	21	Support activities for metal mining	49	213114	11.8	0.0	0.0	152.0	20662.0	12.8
35	49	999	Statewide	21	Support activities for nonmetallic minerals (except fuels) mining	49	213115	8.4	0.0	0.0	82.6	3999.4	7.0
36	49	999	Statewide	21	Support activities for oil and gas operations	49	213112	244.65	1941.3	126010.7	2689.2	178606.4	249.6
37	49	999	Statewide	21	Uranium-radium-vanadium ore mining	49	212291	1.0	0.0	0.0	0.0	0.0	1.0
38	49	999	Statewide	22	Electric bulk power transmission and control	49	221121	2.0	0.0	0.0	0.0	0.0	1.2
39	49	999	Statewide	22	Electric power distribution	49	221122	115.8	9.8	1326.8	867.2	84335.2	115.8
40	49	999	Statewide	22	Fossil fuel electric power generation	49	221112	27.4	0.0	0.0	360.4	39610.4	27.4
41	49	999	Statewide	22	Geothermal electric power generation	49	221116	1.6	0.0	0.0	0.0	0.0	1.6
42	49	999	Statewide	22	Hydroelectric power generation	49	221111	6.75	0.0	0.0	13.2	877.2	5.8
43	49	999	Statewide	22	Natural gas distribution	49	221210	3.2	0.0	0.0	0.0	0.0	3.6
44	49	999	Statewide	22	Other electric power generation	49	221118	3.0	0.0	0.0	1.2	21.6	1.6
45	49	999	Statewide	22	Sewage treatment facilities	49	221320	3.0	0.0	0.0	0.0	210.5	2.5
46	49	999	Statewide	22	Solar electric power generation	49	221114	4.5	0.0	0.0	0.0	0.0	2.0
47	49	999	Statewide	22	Steam and air-conditioning supply	49	221330	1.0	0.0	0.0	0.0	0.0	1.0
48	49	999	Statewide	22	Water supply and irrigation systems	49	221310	61.06666666666667	134.0	6405.0	226.0	8656.2	58.0
49	49	999	Statewide	22	Wind electric power generation	49	221115	2.0	0.0	0.0	0.0	0.0	2.0
50	49	999	Statewide	23	All other specialty trade contractors	49	238990	477.14999999999986	2636.600000000001	132536.2	2820.8	139522.4	475.2
51	49	999	Statewide	23	Commercial and institutional building construction	49	236220	426.0500000000001	4724.6	285523.60000000003	4876.8	288220.8	424.6
52	49	999	Statewide	23	Drywall and insulation contractors	49	238310	299.73333333333335	3149.6	113425.0	3282.4	116374.2	296.4
53	49	999	Statewide	23	Electrical contractors and other wiring installation contractors	49	238210	765.9999999999999	9540.999999999998	509677.00000000006	9981.2	534940.8	764.8
54	49	999	Statewide	23	Finish carpentry contractors	49	238350	427.1	1472.1999999999996	50993.59999999999	1568.0	53053.2	423.8
55	49	999	Statewide	23	Flooring contractors	49	238330	216.6	612.4	22539.2	674.2	22819.0	216.2
56	49	999	Statewide	23	Framing contractors	49	238130	235.6	1321.6	43901.6	1409.6	45617.6	233.6
57	49	999	Statewide	23	Glass and glazing contractors	49	238150	54.8	416.00000000000006	18395.0	516.0	21593.8	54.6
58	49	999	Statewide	23	Highway, street, and bridge construction	49	237310	87.8	2001.2	136895.6	2522.4	163257.0	86.4
59	49	999	Statewide	23	Industrial building construction	49	236210	38.73333333333334	974.0	76133.0	1455.6	104882.6	38.2
60	49	999	Statewide	23	Land subdivision	49	237210	103.9	508.2	30504.000000000004	557.2	31309.4	99.6
61	49	999	Statewide	23	Masonry contractors	49	238140	270.06666666666666	2085.8	73880.8	2137.2	74595.8	267.2
62	49	999	Statewide	23	New housing for-sale builders	49	236117	231.65	1126.4	67187.8	1255.2	69496.4	229.6
63	49	999	Statewide	23	New multifamily housing construction (except for-sale builders)	49	236116	52.3	209.4	11305.8	297.4	13626.2	48.6
64	49	999	Statewide	23	New single-family housing construction (except for-sale builders)	49	236115	827.1999999999998	2900.6	109133.6	3006.2	110138.6	827.2
65	49	999	Statewide	23	Oil and gas pipeline and related structures construction	49	237120	35.6	774.6	48314.8	1080.8	60861.6	31.4
66	49	999	Statewide	23	Other building equipment contractors	49	238290	72.60000000000002	991.8	61613.4	1121.2	67063.0	69.4
67	49	999	Statewide	23	Other building finishing contractors	49	238390	95.3	603.8	25460.0	656.0	27011.2	90.4
68	49	999	Statewide	23	Other foundation, structure, and building exterior contractors	49	238190	87.39999999999998	248.2	13278.8	460.0	20364.8	85.0
69	49	999	Statewide	23	Other heavy and civil engineering construction	49	237990	26.85	417.0	27311.8	515.2	31396.0	23.0
70	49	999	Statewide	23	Painting and wall covering contractors	49	238320	438.4	1680.0000000000002	69721.0	2131.2	70894.6	437.6
71	49	999	Statewide	23	Plumbing, heating, and air-conditioning contractors	49	238220	1069.4	8590.199999999999	416110.0	8693.6	417561.2	1069.8
72	49	999	Statewide	23	Poured concrete foundation and structure contractors	49	238110	372.8	2581.2	108781.6	2818.2	116161.0	371.8
73	49	999	Statewide	23	Power and communication line and related structures construction	49	237130	64.0	1222.6	74735.40000000001	1475.0	96782.0	63.8
74	49	999	Statewide	23	Residential remodelers	49	236118	755.25	1959.0	67074.2	2066.0	68129.8	755.0
75	49	999	Statewide	23	Roofing contractors	49	238160	202.6	1794.4	68816.40000000001	1883.6	72222.2	202.0
76	49	999	Statewide	23	Siding contractors	49	238170	120.2	797.8000000000002	27963.8	853.2	28774.2	119.4
77	49	999	Statewide	23	Site preparation contractors	49	238910	457.5	3706.2	174264.19999999995	4033.6	184202.8	457.0
78	49	999	Statewide	23	Structural steel and precast concrete contractors	49	238120	53.40000000000001	1179.2	65106.0	1291.0	67968.8	50.6
79	49	999	Statewide	23	Tile and terrazzo contractors	49	238340	209.6	961.8	34964.6	1023.2	35340.2	204.8
80	49	999	Statewide	23	Water and sewer line and related structures construction	49	237110	122.4	998.7	53561.60000000001	1439.0	76494.2	120.2
81	49	999	Statewide	31	All other leather good and allied product manufacturing	49	316998	16.133333333333333	25.266666666666666	749.4666666666667	63.0	3000.8	13.4
82	49	999	Statewide	31	All other miscellaneous food manufacturing	49	311999	18.3	69.8	2913.4	523.2	19563.0	14.8
83	49	999	Statewide	31	All other miscellaneous textile product mills	49	314999	24.65	54.4	2144.8	112.0	4504.6	23.6
84	49	999	Statewide	31	Animal (except poultry) slaughtering	49	311611	22.0	47.6	1289.2	591.4	21453.6	20.6
85	49	999	Statewide	31	Apparel accessories and other apparel manufacturing	49	315990	11.783333333333333	11.6	130.2	32.6	743.8	9.6
86	49	999	Statewide	31	Bottled water manufacturing	49	312112	7.0	0.0	0.0	0.0	0.0	5.4
87	49	999	Statewide	31	Breakfast cereal manufacturing	49	311230	1.0	0.0	0.0	0.0	0.0	1.0
88	49	999	Statewide	31	Breweries	49	312120	12.533333333333333	188.2	7102.0	212.2	7914.8	8.2
89	49	999	Statewide	31	Broadwoven fabric mills	49	313210	1.2	0.0	0.0	0.0	0.0	1.2
90	49	999	Statewide	31	Cane sugar manufacturing	49	311314	1.0	0.0	0.0	0.0	0.0	1.0
91	49	999	Statewide	31	Cheese manufacturing	49	311513	10.0	0.0	0.0	679.2	34373.6	8.4
92	49	999	Statewide	31	Chocolate and confectionery manufacturing from cacao beans	49	311351	4.4	17.2	311.4	29.4	528.6	3.0
93	49	999	Statewide	31	Coffee and tea manufacturing	49	311920	8.2	0.0	49.4	24.4	1066.2	6.0
94	49	999	Statewide	31	Commercial bakeries	49	311812	31.8	849.1999999999998	36753.0	1056.8	41111.0	30.2
95	49	999	Statewide	31	Confectionery manufacturing from purchased chocolate	49	311352	24.0	205.00000000000003	4215.4	297.2	5479.6	23.4
96	49	999	Statewide	31	Cookie and cracker manufacturing	49	311821	8.399999999999999	14.4	247.0	519.2	18295.6	8.2
97	49	999	Statewide	31	Creamery butter manufacturing	49	311512	2.0	0.0	0.0	0.0	0.0	1.4
98	49	999	Statewide	31	Curtain and linen mills	49	314120	24.4	176.39999999999995	5453.8	217.8	6626.6	24.4
99	49	999	Statewide	31	Cut and sew apparel contractors	49	315210	14.0	22.0	548.2	67.6	1757.0	12.0
100	49	999	Statewide	31	Distilleries	49	312140	9.8	0.0	0.0	28.2	2138.8	4.6
101	49	999	Statewide	31	Dog and cat food manufacturing	49	311111	4.8	0.0	0.0	418.8	23885.6	4.2
102	49	999	Statewide	31	Dried and dehydrated food manufacturing	49	311423	8.0	0.0	0.0	229.2	10163.2	6.0
103	49	999	Statewide	31	Dry pasta, dough, and flour mixes manufacturing from purchased flour	49	311824	1.0	0.0	0.0	0.0	0.0	1.0
104	49	999	Statewide	31	Dry, condensed, and evaporated dairy product manufacturing	49	311514	7.8	0.0	0.0	397.4	17851.6	6.8
105	49	999	Statewide	31	Fabric coating mills	49	313320	8.0	0.0	0.0	0.0	659.0	8.0
106	49	999	Statewide	31	Fiber, yarn, and thread mills	49	313110	2.0	0.0	0.0	0.0	0.0	1.5
107	49	999	Statewide	31	Flavoring syrup and concentrate manufacturing	49	311930	2.0	0.0	0.0	0.0	0.0	1.6
108	49	999	Statewide	31	Flour milling	49	311211	8.0	76.4	4277.0	309.2	17443.0	7.2
109	49	999	Statewide	31	Fluid milk manufacturing	49	311511	4.2	106.2	5445.2	645.6	34830.6	4.2
110	49	999	Statewide	31	Footwear manufacturing	49	316210	1.0	0.0	0.0	0.0	0.0	1.0
111	49	999	Statewide	31	Frozen cakes, pies, and other pastries manufacturing	49	311813	2.8	0.0	0.0	0.0	0.0	2.8
112	49	999	Statewide	31	Frozen fruit, juice, and vegetable manufacturing	49	311411	2.0	0.0	0.0	0.0	0.0	2.0
113	49	999	Statewide	31	Frozen specialty food manufacturing	49	311412	4.4	0.0	0.0	1103.8	45799.8	4.2
114	49	999	Statewide	31	Fruit and vegetable canning	49	311421	9.0	5.2	132.0	67.2	2552.2	8.2
115	49	999	Statewide	31	Ice cream and frozen dessert manufacturing	49	311520	7.6	0.0	0.0	144.8	6274.4	7.2
116	49	999	Statewide	31	Ice manufacturing	49	312113	7.4	21.6	565.8	91.0	3041.4	7.4
117	49	999	Statewide	31	Knit fabric mills	49	313240	2.0	0.0	0.0	0.0	0.0	1.2
118	49	999	Statewide	31	Leather and hide tanning and finishing	49	316110	2.2	0.0	0.0	0.0	0.0	1.4
119	49	999	Statewide	31	Mayonnaise, dressing, and other prepared sauce manufacturing	49	311941	3.0	0.0	0.0	0.0	0.0	1.4
120	49	999	Statewide	31	Meat processed from carcasses	49	311612	15.266666666666667	134.8	6415.0	342.6	13667.2	13.8
121	49	999	Statewide	31	Men's and boys' cut and sew apparel manufacturing	49	315220	3.0	0.0	0.0	0.25	15.25	1.5
122	49	999	Statewide	31	Narrow fabric mills and schiffli machine embroidery	49	313220	1.0	0.0	0.0	0.0	0.0	1.0
123	49	999	Statewide	31	Nonchocolate confectionery manufacturing	49	311340	18.6	417.8	16512.0	526.2	19334.6	18.4
124	49	999	Statewide	31	Other animal food manufacturing	49	311119	17.4	104.6	5239.6	301.4	13927.6	16.8
125	49	999	Statewide	31	Other apparel knitting mills	49	315190	3.0	0.0	0.0	0.0	0.0	1.5
126	49	999	Statewide	31	Other cut and sew apparel manufacturing	49	315280	10.4	26.6	754.8	231.2	5066.8	9.2
127	49	999	Statewide	31	Other snack food manufacturing	49	311919	7.6	20.6	643.4	132.2	6079.0	6.8
128	49	999	Statewide	31	Perishable prepared food manufacturing	49	311991	7.6	161.0	6651.2	162.8	6757.4	5.4
129	49	999	Statewide	31	Poultry processing	49	311615	5.0	0.0	0.0	416.2	17267.4	5.0
130	49	999	Statewide	31	Rendering and meat byproduct processing	49	311613	2.0	0.0	0.0	0.0	0.0	2.0
131	49	999	Statewide	31	Retail bakeries	49	311811	58.38333333333334	565.5999999999998	7618.4	677.2	8925.0	54.8
132	49	999	Statewide	31	Roasted nuts and peanut butter manufacturing	49	311911	1.0	0.0	0.0	0.0	0.0	1.0
133	49	999	Statewide	31	Rope, cordage, twine, tire cord, and tire fabric mills	49	314994	1.2	0.0	0.0	0.0	0.0	1.2
134	49	999	Statewide	31	Seafood product preparation and packaging	49	311710	1.0	0.0	0.0	0.0	0.0	1.0
135	49	999	Statewide	31	Soft drink manufacturing	49	312111	5.9	57.8	2758.6	233.8	11423.0	4.2
136	49	999	Statewide	31	Soybean and other oilseed processing	49	311224	1.0	0.0	0.0	0.0	0.0	1.0
137	49	999	Statewide	31	Specialty canning	49	311422	1.0	0.0	0.0	0.0	0.0	1.0
138	49	999	Statewide	31	Spice and extract manufacturing	49	311942	2.0	0.0	0.0	0.0	0.0	1.0
139	49	999	Statewide	31	Textile and fabric finishing mills	49	313310	9.2	1.4	84.6	69.0	3726.2	8.6
140	49	999	Statewide	31	Textile bag and canvas mills	49	314910	16.2	97.4	4473.0	118.8	5095.4	15.8
141	49	999	Statewide	31	Tobacco manufacturing	49	312230	2.5	0.0	0.0	0.0	56.5	2.5
142	49	999	Statewide	31	Tortilla manufacturing	49	311830	3.2	1.2	16.4	1.2	18.6	2.4
143	49	999	Statewide	31	Wet corn milling	49	311221	1.0	0.0	0.0	0.0	0.0	1.0
144	49	999	Statewide	31	Wineries	49	312130	7.25	0.0	0.0	16.8	747.8	5.6
145	49	999	Statewide	31	Women's handbag and purse manufacturing	49	316992	2.0	0.0	0.0	0.0	0.0	1.0
146	49	999	Statewide	31	Women's, girls', and infants' cut and sew apparel manufacturing	49	315240	10.8	3.8	184.6	16.4	528.4	8.4
147	49	999	Statewide	32	Abrasive product manufacturing	49	327910	4.0	0.0	0.0	0.0	0.0	4.0
148	49	999	Statewide	32	Adhesive manufacturing	49	325520	3.75	0.0	0.0	0.0	0.0	2.6
149	49	999	Statewide	32	All other basic organic chemical manufacturing	49	325199	4.25	0.0	0.0	4.2	130.6	2.6
150	49	999	Statewide	32	All other converted paper product manufacturing	49	322299	5.8	24.4	997.0	31.8	1255.2	4.8
151	49	999	Statewide	32	All other miscellaneous chemical product and preparation manufacturing	49	325998	15.2	111.6	4904.8	487.4	23999.6	12.8
152	49	999	Statewide	32	All other miscellaneous nonmetallic mineral product manufacturing	49	327999	4.333333333333333	0.0	0.0	38.4	1181.0	3.8
153	49	999	Statewide	32	All other miscellaneous wood product manufacturing	49	321999	33.4	172.35	4582.9	266.4	6768.2	30.6
154	49	999	Statewide	32	All other petroleum and coal products manufacturing	49	324199	4.0	0.0	0.0	0.0	0.0	1.8
155	49	999	Statewide	32	All other plastics product manufacturing	49	326199	71.8	2007.2	85847.80000000003	2100.4	89199.6	70.4
156	49	999	Statewide	32	All other rubber product manufacturing	49	326299	4.6	37.4	1765.0	37.8	1776.4	4.6
157	49	999	Statewide	32	Artificial and synthetic fibers and filaments manufacturing	49	325220	2.0	0.0	0.0	0.0	0.0	2.0
158	49	999	Statewide	32	Asphalt paving mixture and block manufacturing	49	324121	11.0	63.0	5305.0	114.2	7881.4	10.4
159	49	999	Statewide	32	Asphalt shingle and coating materials manufacturing	49	324122	3.0	0.0	0.0	0.0	0.0	2.2
160	49	999	Statewide	32	Biological product (except diagnostic) manufacturing	49	325414	2.4	0.0	0.0	0.0	0.0	1.6
161	49	999	Statewide	32	Books printing	49	323117	5.4	0.0	0.0	42.8	1518.4	4.8
162	49	999	Statewide	32	Cement manufacturing	49	327310	6.0	0.0	0.0	0.0	0.0	4.6
163	49	999	Statewide	32	Clay building material and refractories manufacturing	49	327120	9.2	201.8	13094.6	316.0	17608.0	7.6
164	49	999	Statewide	32	Commercial printing (except screen and books)	49	323111	170.20000000000005	3032.0	128493.2	3674.0	152839.6	170.2
165	49	999	Statewide	32	Commercial screen printing	49	323113	61.05	746.0	18784.6	822.6	20345.8	58.2
166	49	999	Statewide	32	Concrete block and brick manufacturing	49	327331	7.199999999999998	0.0	0.0	93.0	4955.6	6.8
167	49	999	Statewide	32	Concrete pipe manufacturing	49	327332	3.0	0.0	0.0	0.0	0.0	2.2
168	49	999	Statewide	32	Corrugated and solid fiber box manufacturing	49	322211	6.6000000000000005	0.0	0.0	582.4	35013.6	6.6
169	49	999	Statewide	32	Custom compounding of purchased resins	49	325991	3.6	0.0	0.0	5.6	145.0	3.6
170	49	999	Statewide	32	Cut stock, resawing lumber, and planing	49	321912	8.4	0.0	0.0	76.6	2431.8	6.6
171	49	999	Statewide	32	Cut stone and stone product manufacturing	49	327991	33.800000000000004	309.8	12273.2	389.2	15636.8	31.6
172	49	999	Statewide	32	Engineered wood member (except truss) manufacturing	49	321213	1.0	0.0	0.0	0.0	0.0	1.0
173	49	999	Statewide	32	Explosives manufacturing	49	325920	2.4	0.0	0.0	11.4	509.8	2.4
174	49	999	Statewide	32	Fertilizer (mixing only) manufacturing	49	325314	4.4	0.0	0.0	95.2	5232.4	4.4
175	49	999	Statewide	32	Folding paperboard box manufacturing	49	322212	4.0	0.0	0.0	150.8	7140.4	4.0
176	49	999	Statewide	32	Glass container manufacturing	49	327213	1.0	0.0	0.0	0.0	0.0	1.0
177	49	999	Statewide	32	Glass product manufacturing made of purchased glass	49	327215	7.0	51.6	1805.4	101.0	3897.8	6.2
178	49	999	Statewide	32	Ground or treated mineral and earth manufacturing	49	327992	2.0	0.0	0.0	0.0	0.0	2.0
179	49	999	Statewide	32	Gypsum product manufacturing	49	327420	3.0	0.0	0.0	17.8	979.8	2.4
180	49	999	Statewide	32	Hardwood veneer and plywood manufacturing	49	321211	1.4	0.0	0.0	0.0	0.0	1.4
181	49	999	Statewide	32	In-vitro diagnostic substance manufacturing	49	325413	2.0	0.0	0.0	0.0	0.0	2.0
182	49	999	Statewide	32	Industrial gas manufacturing	49	325120	4.6	0.0	0.0	0.0	0.0	3.8
183	49	999	Statewide	32	Laminated plastics plate, sheet (except packaging), and shape manufacturing	49	326130	4.6	0.0	0.0	0.0	0.0	3.8
184	49	999	Statewide	32	Lime manufacturing	49	327410	2.0	0.0	0.0	0.0	0.0	1.4
185	49	999	Statewide	32	Manufactured home (mobile home) manufacturing	49	321991	2.2	0.0	0.0	0.0	0.0	2.0
186	49	999	Statewide	32	Medicinal and botanical manufacturing	49	325411	21.6	460.0	22218.0	582.8	28555.6	20.8
187	49	999	Statewide	32	Mineral wool manufacturing	49	327993	5.2	0.0	0.0	30.2	1278.2	4.4
188	49	999	Statewide	32	Nitrogenous fertilizer manufacturing	49	325311	2.8	0.0	0.0	0.0	0.0	2.8
189	49	999	Statewide	32	Other basic inorganic chemical manufacturing	49	325180	4.0	0.0	0.0	193.6	14890.0	3.6
190	49	999	Statewide	32	Other concrete product manufacturing	49	327390	21.2	257.6	10858.6	465.2	18726.2	20.4
191	49	999	Statewide	32	Other millwork (including flooring)	49	321918	32.4	217.8	6968.2	243.0	7510.2	32.0
192	49	999	Statewide	32	Other paperboard container manufacturing	49	322219	3.0	0.0	0.0	0.0	0.0	2.2
193	49	999	Statewide	32	Other pressed and blown glass and glassware manufacturing	49	327212	3.0	0.0	0.0	0.0	0.0	2.8
194	49	999	Statewide	32	Paint and coating manufacturing	49	325510	14.6	95.0	6441.8	183.0	11127.0	13.2
195	49	999	Statewide	32	Paper (except newsprint) mills	49	322121	3.0	0.0	0.0	0.0	0.0	2.4
196	49	999	Statewide	32	Paper bag and coated and treated paper manufacturing	49	322220	8.4	0.0	0.0	567.0	26513.4	5.6
197	49	999	Statewide	32	Pesticide and other agricultural chemical manufacturing	49	325320	2.0	0.0	0.0	0.0	0.0	1.2
198	49	999	Statewide	32	Petrochemical manufacturing	49	325110	1.0	0.0	0.0	0.0	0.0	1.0
199	49	999	Statewide	32	Petroleum lubricating oil and grease manufacturing	49	324191	4.2	4.6	230.4	5.8	262.6	2.6
200	49	999	Statewide	32	Petroleum refineries	49	324110	7.4	306.0	35781.0	1052.0	150931.4	6.6
201	49	999	Statewide	32	Pharmaceutical preparation manufacturing	49	325412	37.8	2443.0	171466.40000000002	3501.0	242037.4	36.6
202	49	999	Statewide	32	Phosphatic fertilizer manufacturing	49	325312	3.0	0.0	0.0	4.6	231.8	2.0
203	49	999	Statewide	32	Photographic film, paper, plate, and chemical manufacturing	49	325992	2.0	0.0	0.0	0.0	0.0	1.5
204	49	999	Statewide	32	Plastics bag and pouch manufacturing	49	326111	7.8	0.0	0.0	888.2	44320.2	6.0
205	49	999	Statewide	32	Plastics bottle manufacturing	49	326160	9.0	52.40000000000001	2558.6	202.6	8482.4	9.0
206	49	999	Statewide	32	Plastics material and resin manufacturing	49	325211	10.8	80.2	3950.0	202.2	8550.4	9.4
207	49	999	Statewide	32	Plastics packaging film and sheet (including laminated) manufacturing	49	326112	6.8	145.4	6303.4	214.8	9281.2	4.8
208	49	999	Statewide	32	Plastics pipe and pipe fitting manufacturing	49	326122	9.8	45.6	1737.0	283.6	12846.0	9.6
209	49	999	Statewide	32	Plastics plumbing fixture manufacturing	49	326191	9.2	0.0	0.0	289.8	12242.4	8.6
210	49	999	Statewide	32	Polish and other sanitation good manufacturing	49	325612	3.0	0.0	0.0	10.6	565.4	3.0
211	49	999	Statewide	32	Polystyrene foam product manufacturing	49	326140	7.0	10.4	903.6	266.4	9426.2	6.8
212	49	999	Statewide	32	Pottery, ceramics, and plumbing fixture manufacturing	49	327110	5.8	0.0	0.0	12.8	464.8	5.8
213	49	999	Statewide	32	Prefabricated wood building manufacturing	49	321992	6.0	0.0	0.0	30.8	1068.6	3.8
214	49	999	Statewide	32	Printing ink manufacturing	49	325910	2.8	22.0	1038.2	22.0	1038.2	2.8
215	49	999	Statewide	32	Pulp mills	49	322110	1.0	0.0	0.0	0.0	0.0	1.0
216	49	999	Statewide	32	Ready-mix concrete manufacturing	49	327320	49.2	570.0	28127.4	797.4	40891.8	47.6
217	49	999	Statewide	32	Reconstituted wood product manufacturing	49	321219	2.0	0.0	0.0	0.0	0.0	1.0
218	49	999	Statewide	32	Rubber and plastics hoses and belting manufacturing	49	326220	3.0	0.0	0.0	0.0	0.0	2.8
219	49	999	Statewide	32	Rubber product manufacturing for mechanical use	49	326291	3.0	0.0	0.0	0.0	0.0	3.0
220	49	999	Statewide	32	Sanitary paper product manufacturing	49	322291	3.0	0.0	0.0	0.0	0.0	2.2
221	49	999	Statewide	32	Sawmills	49	321113	10.4	0.0	0.0	17.8	529.6	8.8
222	49	999	Statewide	32	Soap and other detergent manufacturing	49	325611	11.6	0.0	0.0	261.0	13473.0	10.6
223	49	999	Statewide	32	Stationery product manufacturing	49	322230	6.4	15.2	1372.6	87.8	3373.0	6.4
224	49	999	Statewide	32	Support activities for printing	49	323120	21.200000000000006	169.6	5164.0	236.8	8561.4	20.6
225	49	999	Statewide	32	Surface active agent manufacturing	49	325613	1.0	0.0	0.0	0.0	0.0	1.0
226	49	999	Statewide	32	Synthetic dye and pigment manufacturing	49	325130	1.0	0.0	0.0	0.0	0.0	1.0
227	49	999	Statewide	32	Tire retreading	49	326212	7.4	21.6	1361.2	35.6	2142.0	6.6
228	49	999	Statewide	32	Toilet preparation manufacturing	49	325620	9.65	0.0	0.0	140.4	6696.6	7.2
229	49	999	Statewide	32	Truss manufacturing	49	321214	14.6	351.0	11414.2	462.6	15055.2	14.2
230	49	999	Statewide	32	Unlaminated plastics film and sheet (except packaging) manufacturing	49	326113	6.4	8.2	350.8	36.2	1467.8	5.0
231	49	999	Statewide	32	Unlaminated plastics profile shape manufacturing	49	326121	1.0	0.0	0.0	0.0	0.0	1.0
232	49	999	Statewide	32	Urethane and other foam product (except polystyrene) manufacturing	49	326150	8.8	89.0	3895.8	83.2	5980.4	8.2
233	49	999	Statewide	32	Wood container and pallet manufacturing	49	321920	21.33333333333333	190.6	8230.4	422.8	12782.8	20.8
234	49	999	Statewide	32	Wood preservation	49	321114	2.0	0.0	0.0	0.0	0.0	1.4
235	49	999	Statewide	32	Wood window and door manufacturing	49	321911	28.95	314.0	11181.4	392.4	14045.0	28.6
236	49	999	Statewide	33	Air and gas compressor manufacturing	49	333912	2.0	0.0	0.0	0.0	0.0	1.4
237	49	999	Statewide	33	Air-conditioning and warm air heating equipment and commercial and industrial refrigeration equipment manufacturing	49	333415	2.0	0.0	0.0	0.0	0.0	2.0
238	49	999	Statewide	33	Aircraft engine and engine parts manufacturing	49	336412	3.0	0.0	0.0	0.0	0.0	2.8
239	49	999	Statewide	33	Aircraft manufacturing	49	336411	6.75	0.0	0.0	0.0	0.0	2.6
240	49	999	Statewide	33	All other miscellaneous electrical equipment and component manufacturing	49	335999	6.6	24.6	841.8	117.4	6451.4	6.2
241	49	999	Statewide	33	All other miscellaneous fabricated metal product manufacturing	49	332999	59.73333333333333	767.0	31420.4	1388.8	55369.2	57.0
242	49	999	Statewide	33	All other miscellaneous general purpose machinery manufacturing	49	333999	15.2	168.4	6688.8	221.4	8883.8	14.0
