	id	COUNTY	GEO_TTL	NAICS_Sector	NAICS2012_TTL	state	relevant_naics	estab	emp	payann
0	50	999	Statewide	11	Forest nurseries and gathering of forest products	50	1132	3.0	0.0	0.0
1	50	999	Statewide	11	Logging	50	1133	78.4	119.99999999999999	5585.0
2	50	999	Statewide	11	Support activities for animal production	50	1152	22.0	29.0	1126.2
3	50	999	Statewide	11	Support activities for crop production	50	1151	17.599999999999998	11.4	529.6
4	50	999	Statewide	11	Support activities for forestry	50	1153	20.4	9.6	303.6
5	50	999	Statewide	11	Timber tract operations	50	1131	3.0	0.0	0.0
6	50	999	Statewide	21	Nonmetallic mineral mining and quarrying	50	2123	48.199999999999996	245.0	19178.2
7	50	999	Statewide	22	Electric power generation, transmission and distribution	50	2211	50.66666666666667	438.0	39227.200000000004
8	50	999	Statewide	22	Natural gas distribution	50	2212	1.0	0.0	0.0
9	50	999	Statewide	22	Water, sewage and other systems	50	2213	12.4	1.8	52.4
10	50	999	Statewide	23	Building equipment contractors	50	2382	588.4	3851.6000000000004	189732.00000000003
11	50	999	Statewide	23	Building finishing contractors	50	2383	399.40000000000003	1305.8	53385.600000000006
12	50	999	Statewide	23	Foundation, structure, and building exterior contractors	50	2381	339.2	1365.2	71623.99999999999
13	50	999	Statewide	23	Highway, street, and bridge construction	50	2373	30.4	77.4	7227.200000000001
14	50	999	Statewide	23	Land subdivision	50	2372	7.0	0.0	0.0
15	50	999	Statewide	23	Nonresidential building construction	50	2362	94.8	893.4	54034.0
16	50	999	Statewide	23	Other heavy and civil engineering construction	50	2379	11.799999999999999	0.0	0.0
17	50	999	Statewide	23	Other specialty trade contractors	50	2389	389.0	1595.7999999999997	101075.79999999999
18	50	999	Statewide	23	Residential building construction	50	2361	772.6	2399.0	111568.2
19	50	999	Statewide	23	Utility system construction	50	2371	57.199999999999996	304.6	23374.600000000002
20	50	999	Statewide	31	Animal food manufacturing	50	3111	16.2	116.8	5420.0
21	50	999	Statewide	31	Animal slaughtering and processing	50	3116	16.199999999999996	66.2	2605.2
22	50	999	Statewide	31	Apparel accessories and other apparel manufacturing	50	3159	4.2	0.0	0.0
23	50	999	Statewide	31	Apparel knitting mills	50	3151	1.0	0.0	0.0
24	50	999	Statewide	31	Bakeries and tortilla manufacturing	50	3118	54.8	659.2	23485.6
25	50	999	Statewide	31	Beverage manufacturing	50	3121	43.9	463.0	20572.0
26	50	999	Statewide	31	Cut and sew apparel manufacturing	50	3152	11.5	0.0	0.0
27	50	999	Statewide	31	Dairy product manufacturing	50	3115	28.0	1253.1999999999998	66957.2
28	50	999	Statewide	31	Fabric mills	50	3132	2.0	0.0	0.0
29	50	999	Statewide	31	Fiber, yarn, and thread mills	50	3131	3.4	0.0	0.0
30	50	999	Statewide	31	Footwear manufacturing	50	3162	2.0	0.0	0.0
31	50	999	Statewide	31	Fruit and vegetable preserving and specialty food manufacturing	50	3114	11.233333333333333	0.0	0.0
32	50	999	Statewide	31	Grain and oilseed milling	50	3112	6.1	1.6	23.8
33	50	999	Statewide	31	Leather and hide tanning and finishing	50	3161	2.0	0.0	0.0
34	50	999	Statewide	31	Other food manufacturing	50	3119	36.266666666666666	75.80000000000001	2881.7999999999997
35	50	999	Statewide	31	Other leather and allied product manufacturing	50	3169	6.0	0.0	0.0
36	50	999	Statewide	31	Other textile product mills	50	3149	10.8	3.9	89.05
37	50	999	Statewide	31	Sugar and confectionery product manufacturing	50	3113	23.25	142.2	6060.2
38	50	999	Statewide	31	Textile and fabric finishing and fabric coating mills	50	3133	4.0	0.0	0.0
39	50	999	Statewide	31	Textile furnishings mills	50	3141	5.2	0.0	0.0
40	50	999	Statewide	32	Basic chemical manufacturing	50	3251	4.0	0.0	0.0
41	50	999	Statewide	32	Cement and concrete product manufacturing	50	3273	21.53333333333333	51.6	4175.0
42	50	999	Statewide	32	Clay product and refractory manufacturing	50	3271	13.399999999999999	2.6	81.8
43	50	999	Statewide	32	Converted paper product manufacturing	50	3222	2.0	0.0	0.0
44	50	999	Statewide	32	Glass and glass product manufacturing	50	3272	15.200000000000001	12.4	240.2
45	50	999	Statewide	32	Other chemical product and preparation manufacturing	50	3259	5.2	0.0	0.0
46	50	999	Statewide	32	Other nonmetallic mineral product manufacturing	50	3279	51.6	688.0000000000001	34387.6
47	50	999	Statewide	32	Other wood product manufacturing	50	3219	61.599999999999994	691.4000000000001	25657.2
48	50	999	Statewide	32	Paint, coating, and adhesive manufacturing	50	3255	6.2	0.0	0.0
49	50	999	Statewide	32	Pesticide, fertilizer, and other agricultural chemical manufacturing	50	3253	4.4	0.0	0.0
50	50	999	Statewide	32	Petroleum and coal products manufacturing	50	3241	8.6	0.0	0.0
51	50	999	Statewide	32	Pharmaceutical and medicine manufacturing	50	3254	6.300000000000001	0.0	0.0
52	50	999	Statewide	32	Plastics product manufacturing	50	3261	24.8	738.4	32482.400000000005
53	50	999	Statewide	32	Printing and related support activities	50	3231	61.199999999999996	636.2	30043.6
54	50	999	Statewide	32	Pulp, paper, and paperboard mills	50	3221	4.0	0.0	0.0
55	50	999	Statewide	32	Resin, synthetic rubber, and artificial synthetic fibers and filaments manufacturing	50	3252	3.6	0.0	0.0
56	50	999	Statewide	32	Rubber product manufacturing	50	3262	3.0	0.0	0.0
57	50	999	Statewide	32	Sawmills and wood preservation	50	3211	33.0	133.8	5591.6
58	50	999	Statewide	32	Soap, cleaning compound, and toilet preparation manufacturing	50	3256	12.066666666666666	175.6	7320.6
59	50	999	Statewide	32	Veneer, plywood, and engineered wood product manufacturing	50	3212	9.0	0.0	0.0
60	50	999	Statewide	33	Aerospace product and parts manufacturing	50	3364	3.2	0.0	0.0
61	50	999	Statewide	33	Agriculture, construction, and mining machinery manufacturing	50	3331	2.0	0.0	0.0
62	50	999	Statewide	33	Alumina and aluminum production and processing	50	3313	1.0	0.0	0.0
63	50	999	Statewide	33	Architectural and structural metals manufacturing	50	3323	24.150000000000002	207.6	10383.6
64	50	999	Statewide	33	Audio and video equipment manufacturing	50	3343	1.0	0.0	0.0
65	50	999	Statewide	33	Boiler, tank, and shipping container manufacturing	50	3324	3.0	0.0	0.0
66	50	999	Statewide	33	Coating, engraving, heat treating, and allied activities	50	3328	10.0	0.0	0.0
67	50	999	Statewide	33	Commercial and service industry machinery manufacturing	50	3333	6.0	0.0	0.0
68	50	999	Statewide	33	Communications equipment manufacturing	50	3342	4.0	0.0	0.0
69	50	999	Statewide	33	Computer and peripheral equipment manufacturing	50	3341	2.0	0.0	0.0
70	50	999	Statewide	33	Cutlery and handtool manufacturing	50	3322	4.4	0.0	0.0
71	50	999	Statewide	33	Electric lighting equipment manufacturing	50	3351	8.4	0.0	0.0
72	50	999	Statewide	33	Electrical equipment manufacturing	50	3353	2.5	0.0	0.0
73	50	999	Statewide	33	Engine, turbine, and power transmission equipment manufacturing	50	3336	5.0	0.0	0.0
74	50	999	Statewide	33	Forging and stamping	50	3321	5.0	0.0	0.0
75	50	999	Statewide	33	Hardware manufacturing	50	3325	1.0	0.0	0.0
76	50	999	Statewide	33	Household and institutional furniture and kitchen cabinet manufacturing	50	3371	56.80000000000001	247.80000000000004	11051.4
77	50	999	Statewide	33	Household appliance manufacturing	50	3352	1.0	0.0	0.0
78	50	999	Statewide	33	Industrial machinery manufacturing	50	3332	10.4	0.0	0.0
79	50	999	Statewide	33	Iron and steel mills and ferroalloy manufacturing	50	3311	1.0	0.0	0.0
80	50	999	Statewide	33	Machine shops; turned product; and screw, nut, and bolt manufacturing	50	3327	49.05	404.8	23622.399999999998
81	50	999	Statewide	33	Manufacturing and reproducing magnetic and optical media	50	3346	2.0	0.0	0.0
82	50	999	Statewide	33	Medical equipment and supplies manufacturing	50	3391	27.200000000000003	70.0	3552.4
83	50	999	Statewide	33	Metalworking machinery manufacturing	50	3335	22.4	199.2	13808.800000000001
84	50	999	Statewide	33	Motor vehicle body and trailer manufacturing	50	3362	1.0	0.0	0.0
85	50	999	Statewide	33	Motor vehicle manufacturing	50	3361	2.0	0.0	0.0
86	50	999	Statewide	33	Motor vehicle parts manufacturing	50	3363	4.8	0.0	0.0
87	50	999	Statewide	33	Navigational, measuring, electromedical, and control instruments manufacturing	50	3345	19.2	474.4	37185.2
88	50	999	Statewide	33	Nonferrous metal (except aluminum) production and processing	50	3314	1.0	0.0	0.0
89	50	999	Statewide	33	Office furniture (including fixtures) manufacturing	50	3372	12.8	3.2	113.39999999999999
90	50	999	Statewide	33	Other electrical equipment and component manufacturing	50	3359	12.0	264.6	17645.0
91	50	999	Statewide	33	Other fabricated metal product manufacturing	50	3329	10.6	0.0	0.0
92	50	999	Statewide	33	Other furniture related product manufacturing	50	3379	2.0	0.0	0.0
93	50	999	Statewide	33	Other general purpose machinery manufacturing	50	3339	11.4	0.0	0.0
94	50	999	Statewide	33	Other miscellaneous manufacturing	50	3399	71.2	598.4000000000001	28488.2
95	50	999	Statewide	33	Other transportation equipment manufacturing	50	3369	4.0	0.0	0.0
96	50	999	Statewide	33	Semiconductor and other electronic component manufacturing	50	3344	10.866666666666667	0.0	0.0
97	50	999	Statewide	33	Ship and boat building	50	3366	4.0	0.0	0.0
98	50	999	Statewide	33	Spring and wire product manufacturing	50	3326	2.0	0.0	0.0
99	50	999	Statewide	33	Steel product manufacturing from purchased steel	50	3312	3.0	0.0	0.0
100	50	999	Statewide	33	Ventilation, heating, air-conditioning, and commercial refrigeration equipment manufacturing	50	3334	9.7	0.0	0.0
101	50	999	Statewide	42	Apparel, piece goods, and notions merchant wholesalers	50	4243	27.400000000000002	303.2	13239.199999999999
102	50	999	Statewide	42	Beer, wine, and distilled alcoholic beverage merchant wholesalers	50	4248	14.8	296.6	12483.4
103	50	999	Statewide	42	Chemical and allied products merchant wholesalers	50	4246	19.4	47.2	2859.8
104	50	999	Statewide	42	Drugs and druggists' sundries merchant wholesalers	50	4242	13.8	275.4	14071.6
105	50	999	Statewide	42	Farm product raw material merchant wholesalers	50	4245	7.6	0.0	0.0
106	50	999	Statewide	42	Furniture and home furnishing merchant wholesalers	50	4232	23.73333333333333	101.6	6888.4
107	50	999	Statewide	42	Grocery and related product merchant wholesalers	50	4244	87.19999999999999	2457.4	126327.20000000001
108	50	999	Statewide	42	Hardware, plumbing and heating equipment and supplies merchant wholesalers	50	4237	40.0	198.2	14055.399999999998
109	50	999	Statewide	42	Household appliances and electrical and electronic goods merchant wholesalers	50	4236	52.79999999999999	216.8	17816.399999999998
110	50	999	Statewide	42	Lumber and other construction materials merchant wholesalers	50	4233	48.6	253.8	15710.0
111	50	999	Statewide	42	Machinery, equipment, and supplies merchant wholesalers	50	4238	101.99999999999999	819.0	48805.2
112	50	999	Statewide	42	Metal and mineral (except petroleum) merchant wholesalers	50	4235	12.2	86.6	4767.4
113	50	999	Statewide	42	Miscellaneous durable goods merchant wholesalers	50	4239	74.69999999999999	486.79999999999995	25073.600000000002
114	50	999	Statewide	42	Miscellaneous nondurable goods merchant wholesalers	50	4249	65.6	495.00000000000006	31730.0
115	50	999	Statewide	42	Motor vehicle and motor vehicle parts and supplies merchant wholesalers	50	4231	57.199999999999996	593.8	29073.600000000002
116	50	999	Statewide	42	Paper and paper product merchant wholesalers	50	4241	18.0	15.8	1047.0
117	50	999	Statewide	42	Petroleum and petroleum products merchant wholesalers	50	4247	17.0	65.6	5890.4
118	50	999	Statewide	42	Professional and commercial equipment and supplies merchant wholesalers	50	4234	44.0	234.2	20884.2
119	50	999	Statewide	42	Wholesale electronic markets and agents and brokers	50	4251	71.0	125.00000000000001	10525.399999999998
120	50	999	Statewide	44	Automobile dealers	50	4411	176.2	3378.4	158912.2
121	50	999	Statewide	44	Automotive parts, accessories, and tire stores	50	4413	151.8	1104.0	34994.0
122	50	999	Statewide	44	Beer, wine, and liquor stores	50	4453	124.6	287.2	10816.6
123	50	999	Statewide	44	Building material and supplies dealers	50	4441	240.2	2648.2	93862.6
124	50	999	Statewide	44	Clothing stores	50	4481	217.99999999999997	1897.8000000000002	29014.599999999995
125	50	999	Statewide	44	Electronics and appliance stores	50	4431	109.4	487.00000000000006	16823.399999999998
126	50	999	Statewide	44	Furniture stores	50	4421	59.199999999999996	180.8	6914.799999999999
127	50	999	Statewide	44	Gasoline stations	50	4471	449.2	3592.2000000000003	70766.79999999999
128	50	999	Statewide	44	Grocery stores	50	4451	307.4	9892.999999999998	193661.00000000003
129	50	999	Statewide	44	Health and personal care stores	50	4461	186.6	1724.6	67088.4
130	50	999	Statewide	44	Home furnishings stores	50	4422	92.3	621.8	17866.0
131	50	999	Statewide	44	Jewelry, luggage, and leather goods stores	50	4483	52.60000000000001	233.80000000000004	9155.199999999999
132	50	999	Statewide	44	Lawn and garden equipment and supplies stores	50	4442	81.2	730.6	24357.999999999996
133	50	999	Statewide	44	Other motor vehicle dealers	50	4412	55.4	266.4	12592.600000000002
134	50	999	Statewide	44	Shoe stores	50	4482	49.6	291.40000000000003	7212.4
135	50	999	Statewide	44	Specialty food stores	50	4452	68.60000000000001	206.6	5921.6
136	50	999	Statewide	45	Book stores and news dealers	50	4512	38.6	174.0	3594.4
137	50	999	Statewide	45	Department stores	50	4521	15.4	879.4000000000001	18255.0
138	50	999	Statewide	45	Direct selling establishments	50	4543	162.0	1264.0	58444.4
139	50	999	Statewide	45	Electronic shopping and mail-order houses	50	4541	120.85	793.8	30930.600000000006
140	50	999	Statewide	45	Florists	50	4531	42.0	68.2	1507.1999999999998
141	50	999	Statewide	45	Office supplies, stationery, and gift stores	50	4532	98.3	473.6	10133.199999999997
142	50	999	Statewide	45	Other general merchandise stores	50	4529	101.25	922.2	20436.6
143	50	999	Statewide	45	Other miscellaneous store retailers	50	4539	125.20000000000002	559.3999999999999	15293.8
144	50	999	Statewide	45	Sporting goods, hobby, and musical instrument stores	50	4511	193.8	1654.3999999999999	34096.4
145	50	999	Statewide	45	Used merchandise stores	50	4533	79.60000000000001	435.4	7774.200000000001
146	50	999	Statewide	45	Vending machine operators	50	4542	6.0	0.0	0.0
147	50	999	Statewide	48	Charter bus industry	50	4855	6.6	0.0	0.0
148	50	999	Statewide	48	Freight transportation arrangement	50	4885	20.4	113.19999999999999	6884.2
149	50	999	Statewide	48	General freight trucking	50	4841	119.19999999999999	917.2	50250.2
150	50	999	Statewide	48	Inland water transportation	50	4832	4.0	0.0	0.0
151	50	999	Statewide	48	Interurban and rural bus transportation	50	4852	2.8	0.0	0.0
152	50	999	Statewide	48	Nonscheduled air transportation	50	4812	2.0	0.0	0.0
153	50	999	Statewide	48	Other support activities for transportation	50	4889	3.0	0.0	0.0
154	50	999	Statewide	48	Other transit and ground passenger transportation	50	4859	12.266666666666666	45.6	1524.8
155	50	999	Statewide	48	Pipeline transportation of crude oil	50	4861	1.0	0.0	0.0
156	50	999	Statewide	48	Pipeline transportation of natural gas	50	4862	1.8	0.0	0.0
157	50	999	Statewide	48	Scenic and sightseeing transportation, land	50	4871	3.0	0.0	0.0
158	50	999	Statewide	48	Scenic and sightseeing transportation, other	50	4879	2.0	0.0	0.0
159	50	999	Statewide	48	Scenic and sightseeing transportation, water	50	4872	3.0	0.0	0.0
160	50	999	Statewide	48	Scheduled air transportation	50	4811	7.2	122.4	2839.6
161	50	999	Statewide	48	School and employee bus transportation	50	4854	21.0	32.4	579.6
162	50	999	Statewide	48	Specialized freight trucking	50	4842	175.6	866.7999999999998	39833.399999999994
163	50	999	Statewide	48	Support activities for air transportation	50	4881	13.649999999999999	57.2	7111.2
164	50	999	Statewide	48	Support activities for rail transportation	50	4882	9.6	0.0	0.0
165	50	999	Statewide	48	Support activities for road transportation	50	4884	21.0	15.0	527.0
166	50	999	Statewide	48	Support activities for water transportation	50	4883	2.0	0.0	0.0
167	50	999	Statewide	48	Taxi and limousine service	50	4853	19.8	86.8	1437.6
168	50	999	Statewide	48	Urban transit systems	50	4851	6.116666666666667	0.0	0.0
169	50	999	Statewide	49	Couriers and express delivery services	50	4921	22.2	191.8	9536.400000000001
170	50	999	Statewide	49	Local messengers and local delivery	50	4922	8.6	233.0	4497.4
171	50	999	Statewide	49	Warehousing and storage	50	4931	22.0	200.4	8017.799999999999
172	50	999	Statewide	51	Cable and other subscription programming	50	5152	10.0	0.0	0.0
173	50	999	Statewide	51	Data processing, hosting, and related services	50	5182	33.199999999999996	1009.4000000000001	73564.8
174	50	999	Statewide	51	Motion picture and video industries	50	5121	53.400000000000006	277.8	5457.2
175	50	999	Statewide	51	Newspaper, periodical, book, and directory publishers	50	5111	89.4	801.0	35629.4
176	50	999	Statewide	51	Other information services	50	5191	81.8	335.19999999999993	12535.999999999998
177	50	999	Statewide	51	Other telecommunications	50	5179	9.4	69.8	2090.2
178	50	999	Statewide	51	Radio and television broadcasting	50	5151	38.8	523.2	22948.6
179	50	999	Statewide	51	Satellite telecommunications	50	5174	1.0	0.0	0.0
180	50	999	Statewide	51	Software publishers	50	5112	23.0	677.8	60457.2
181	50	999	Statewide	51	Sound recording industries	50	5122	11.800000000000002	2.6	177.4
182	50	999	Statewide	51	Wired telecommunications carriers	50	5171	111.6	453.2	40432.4
183	50	999	Statewide	51	Wireless telecommunications carriers (except satellite)	50	5172	22.549999999999997	37.8	2304.6000000000004
184	50	999	Statewide	52	Activities related to credit intermediation	50	5223	13.8	36.0	2952.0
185	50	999	Statewide	52	Agencies, brokerages, and other insurance related activities	50	5242	288.6	1480.6	99213.2
186	50	999	Statewide	52	Depository credit intermediation	50	5221	330.59999999999997	4022.8	203458.4
187	50	999	Statewide	52	Insurance carriers	50	5241	70.45	969.1999999999999	83820.4
188	50	999	Statewide	52	Nondepository credit intermediation	50	5222	34.0	67.60000000000001	5453.0
189	50	999	Statewide	52	Other financial investment activities	50	5239	101.4	428.8	54527.4
190	50	999	Statewide	52	Other investment pools and funds	50	5259	2.0	0.0	0.0
191	50	999	Statewide	52	Securities and commodity contracts intermediation and brokerage	50	5231	84.80000000000001	131.79999999999998	39234.0
192	50	999	Statewide	53	Activities related to real estate	50	5313	238.0	833.6	34196.0
193	50	999	Statewide	53	Automotive equipment rental and leasing	50	5321	31.666666666666668	210.0	9224.6
194	50	999	Statewide	53	Commercial and industrial machinery and equipment rental and leasing	50	5324	18.6	98.0	6704.4
195	50	999	Statewide	53	Consumer goods rental	50	5322	65.19999999999999	157.79999999999998	8369.2
196	50	999	Statewide	53	General rental centers	50	5323	10.8	0.0	0.0
197	50	999	Statewide	53	Lessors of nonfinancial intangible assets (except copyrighted works)	50	5331	9.6	56.4	5571.8
198	50	999	Statewide	53	Lessors of real estate	50	5311	186.6	798.9999999999997	33820.600000000006
199	50	999	Statewide	53	Offices of real estate agents and brokers	50	5312	202.8	333.0	16152.6
200	50	999	Statewide	54	Accounting, tax preparation, bookkeeping, and payroll services	50	5412	285.4	1938.2000000000003	88914.79999999999
201	50	999	Statewide	54	Advertising, public relations, and related services	50	5418	78.19999999999999	346.4	18640.2
202	50	999	Statewide	54	Architectural, engineering, and related services	50	5413	369.59999999999997	1973.6	128134.59999999999
203	50	999	Statewide	54	Computer systems design and related services	50	5415	238.39999999999998	2557.2000000000003	206018.19999999995
204	50	999	Statewide	54	Legal services	50	5411	433.6	1810.4	135129.0
205	50	999	Statewide	54	Management, scientific, and technical consulting services	50	5416	341.4	1735.6000000000001	126902.59999999999
206	50	999	Statewide	54	Other professional, scientific, and technical services	50	5419	195.0	1176.8	42633.99999999999
207	50	999	Statewide	54	Scientific research and development services	50	5417	47.849999999999994	252.0	19494.800000000003
208	50	999	Statewide	54	Specialized design services	50	5414	104.0	242.4	11945.799999999997
209	50	999	Statewide	55	Management of companies and enterprises	50	5511	86.6	1196.0	133261.6
210	50	999	Statewide	56	Business support services	50	5614	51.4	281.6	9461.800000000001
211	50	999	Statewide	56	Employment services	50	5613	61.00000000000001	1155.6000000000001	26949.0
212	50	999	Statewide	56	Facilities support services	50	5612	11.55	7.8	261.0
213	50	999	Statewide	56	Investigation and security services	50	5616	36.6	558.2	12146.8
214	50	999	Statewide	56	Office administrative services	50	5611	54.25000000000001	326.19999999999993	19217.399999999998
215	50	999	Statewide	56	Other support services	50	5619	53.599999999999994	159.6	8427.6
216	50	999	Statewide	56	Remediation and other waste management services	50	5629	45.8	212.8	12889.399999999998
217	50	999	Statewide	56	Services to buildings and dwellings	50	5617	670.6	2256.9999999999995	70131.6
218	50	999	Statewide	56	Travel arrangement and reservation services	50	5615	57.00000000000001	255.2	11350.0
219	50	999	Statewide	56	Waste collection	50	5621	46.8	224.2	10169.400000000001
220	50	999	Statewide	56	Waste treatment and disposal	50	5622	5.5	0.0	0.0
221	50	999	Statewide	61	Business schools and computer and management training	50	6114	35.2	58.2	4564.4
222	50	999	Statewide	61	Colleges, universities, and professional schools	50	6113	24.0	3977.2	110941.8
223	50	999	Statewide	61	Educational support services	50	6117	39.65	217.0	8429.4
224	50	999	Statewide	61	Elementary and secondary schools	50	6111	95.99999999999999	2726.6	88244.2
225	50	999	Statewide	61	Other schools and instruction	50	6116	166.00000000000003	884.0	16298.800000000001
226	50	999	Statewide	61	Technical and trade schools	50	6115	21.0	142.2	4239.6
227	50	999	Statewide	62	Child day care services	50	6244	271.20000000000005	2345.6000000000004	46907.0
228	50	999	Statewide	62	Community food and housing, and emergency and other relief services	50	6242	84.2	688.8	21992.0
229	50	999	Statewide	62	Continuing care retirement communities and assisted living facilities for the elderly	50	6233	71.39999999999999	1795.9999999999998	44496.0
230	50	999	Statewide	62	General medical and surgical hospitals	50	6221	15.0	1668.2	128195.0
231	50	999	Statewide	62	Home health care services	50	6216	40.199999999999996	641.2	21561.2
232	50	999	Statewide	62	Individual and family services	50	6241	285.99999999999994	4129.600000000001	110523.0
233	50	999	Statewide	62	Medical and diagnostic laboratories	50	6215	15.0	74.2	3923.4
234	50	999	Statewide	62	Nursing care facilities (skilled nursing facilities)	50	6231	49.800000000000004	2536.3999999999996	75653.2
235	50	999	Statewide	62	Offices of dentists	50	6212	258.20000000000005	1809.8000000000002	98919.0
236	50	999	Statewide	62	Offices of other health practitioners	50	6213	374.40000000000003	1591.6	66610.6
237	50	999	Statewide	62	Offices of physicians	50	6211	348.8	4231.2	263371.0
238	50	999	Statewide	62	Other ambulatory health care services	50	6219	53.4	616.1999999999999	19071.2
239	50	999	Statewide	62	Other residential care facilities	50	6239	19.933333333333334	251.2	6874.599999999999
240	50	999	Statewide	62	Outpatient care centers	50	6214	131.4	2519.6000000000004	134985.80000000002
241	50	999	Statewide	62	Psychiatric and substance abuse hospitals	50	6222	1.0	0.0	0.0
242	50	999	Statewide	62	Residential intellectual and developmental disability, mental health, and substance abuse facilities	50	6232	61.6	887.9999999999999	28018.399999999998
243	50	999	Statewide	62	Vocational rehabilitation services	50	6243	17.4	211.8	7227.0
244	50	999	Statewide	71	Agents and managers for artists, athletes, entertainers, and other public figures	50	7114	7.5	0.0	0.0
245	50	999	Statewide	71	Amusement parks and arcades	50	7131	7.2	0.4	8.4
246	50	999	Statewide	71	Gambling industries	50	7132	2.4	0.0	0.0
247	50	999	Statewide	71	Independent artists, writers, and performers	50	7115	60.8	77.39999999999999	6325.200000000001
248	50	999	Statewide	71	Museums, historical sites, and similar institutions	50	7121	49.599999999999994	403.19999999999993	13528.599999999999
249	50	999	Statewide	71	Other amusement and recreation industries	50	7139	258.4	3719.4	75102.8
250	50	999	Statewide	71	Performing arts companies	50	7111	27.799999999999997	146.8	4405.0
251	50	999	Statewide	71	Promoters of performing arts, sports, and similar events	50	7113	47.79999999999999	181.0	7043.400000000001
252	50	999	Statewide	71	Spectator sports	50	7112	8.6	3.0	144.2
253	50	999	Statewide	72	Drinking places (alcoholic beverages)	50	7224	100.8	608.2	8516.4
254	50	999	Statewide	72	RV (recreational vehicle) parks and recreational camps	50	7212	73.45	174.20000000000005	13133.0
255	50	999	Statewide	72	Restaurants and other eating places	50	7225	1243.4	16670.199999999997	283895.0
256	50	999	Statewide	72	Rooming and boarding houses	50	7213	9.2	7.0	137.4
257	50	999	Statewide	72	Special food services	50	7223	155.99999999999997	1241.8	24240.6
258	50	999	Statewide	72	Traveler accommodation	50	7211	360.0	10931.2	194070.59999999998
259	50	999	Statewide	81	Automotive repair and maintenance	50	8111	490.79999999999995	1813.2	64504.600000000006
260	50	999	Statewide	81	Business, professional, labor, political, and similar organizations	50	8139	199.2	998.4000000000001	36067.799999999996
261	50	999	Statewide	81	Civic and social organizations	50	8134	141.4	732.1999999999999	10779.8
262	50	999	Statewide	81	Commercial and industrial machinery and equipment (except automotive and electronic) repair and maintenance	50	8113	48.6	95.6	4311.6
263	50	999	Statewide	81	Death care services	50	8122	79.19999999999999	171.8	6547.200000000001
