	id	state	COUNTY	GEO_TTL	relevant_naics	NAICS2012_TTL	NAICS_Sector	estab	emp	payann
5372	24	24	0	Maryland	1131	Timber tract operations	11	3.6	4.2	194.4
5373	24	24	0	Maryland	1132	Forest nurseries and gathering of forest products	11	1.5	0.0	0.0
5374	24	24	0	Maryland	1133	Logging	11	42.4	133.4	4865.0
5375	24	24	0	Maryland	1141	Fishing	11	20.0	12.8	267.0
5376	24	24	0	Maryland	1142	Hunting and trapping	11	6.6	76.8	3515.2
5377	24	24	0	Maryland	1151	Support activities for crop production	11	17.6	440.4	14925.0
5378	24	24	0	Maryland	1152	Support activities for animal production	11	92.2	434.2	15300.4
5379	24	24	0	Maryland	1153	Support activities for forestry	11	9.0	15.0	782.2
5380	24	24	0	Maryland	2111	Oil and gas extraction	21	2.0	0.0	0.0
5381	24	24	0	Maryland	2121	Coal mining	21	8.4	262.2	16548.8
5382	24	24	0	Maryland	2122	Metal ore mining	21	1.0	0.0	0.0
5383	24	24	0	Maryland	2123	Nonmetallic mineral mining and quarrying	21	45.8	728.8	42124.2
5384	24	24	0	Maryland	2131	Support activities for mining	21	17.6	166.8	14482.2
5385	24	24	0	Maryland	2211	Electric power generation, transmission and distribution	22	101.2	8709.4	1040662.6
5386	24	24	0	Maryland	2212	Natural gas distribution	22	14.0	1289.4	115865.6
5387	24	24	0	Maryland	2213	Water, sewage and other systems	22	28.6	226.8	17386.2
5388	24	24	0	Maryland	2361	Residential building construction	23	3825.2	16470.8	836272.8
5389	24	24	0	Maryland	2362	Nonresidential building construction	23	860.4	12599.8	949962.8
5390	24	24	0	Maryland	2371	Utility system construction	23	320.6	8286.8	494011.4
5391	24	24	0	Maryland	2372	Land subdivision	23	104.4	1002.8	81128.0
5392	24	24	0	Maryland	2373	Highway, street, and bridge construction	23	163.6	4894.4	318536.4
5393	24	24	0	Maryland	2379	Other heavy and civil engineering construction	23	89.6	952.4	55235.2
5394	24	24	0	Maryland	2381	Foundation, structure, and building exterior contractors	23	1659.8	21382.2	1061336.2
5395	24	24	0	Maryland	2382	Building equipment contractors	23	3638.8	47724.2	2905827.4
5396	24	24	0	Maryland	2383	Building finishing contractors	23	2279.0	18393.8	864260.8
5397	24	24	0	Maryland	2389	Other specialty trade contractors	23	955.0	11709.6	627004.8
5398	24	24	0	Maryland	3111	Animal food manufacturing	31	18.4	321.8	16115.6
5399	24	24	0	Maryland	3112	Grain and oilseed milling	31	10.6	352.0	21847.4
5400	24	24	0	Maryland	3113	Sugar and confectionery product manufacturing	31	27.4	345.6	19163.0
5401	24	24	0	Maryland	3114	Fruit and vegetable preserving and specialty food manufacturing	31	9.8	476.6	24139.6
5402	24	24	0	Maryland	3115	Dairy product manufacturing	31	19.8	1833.4	94648.4
5403	24	24	0	Maryland	3116	Animal slaughtering and processing	31	30.4	2454.2	77061.8
5404	24	24	0	Maryland	3117	Seafood product preparation and packaging	31	17.0	281.4	14115.8
5405	24	24	0	Maryland	3118	Bakeries and tortilla manufacturing	31	170.6	3816.6	134246.0
5406	24	24	0	Maryland	3119	Other food manufacturing	31	38.8	2835.2	164922.8
5407	24	24	0	Maryland	3121	Beverage manufacturing	31	59.2	1480.2	72258.8
5408	24	24	0	Maryland	3122	Tobacco manufacturing	31	2.5	0.0	0.0
5409	24	24	0	Maryland	3131	Fiber, yarn, and thread mills	31	3.2	1.0	27.0
5410	24	24	0	Maryland	3132	Fabric mills	31	10.0	527.4	39551.8
5411	24	24	0	Maryland	3133	Textile and fabric finishing and fabric coating mills	31	11.0	152.6	7244.2
5412	24	24	0	Maryland	3141	Textile furnishings mills	31	19.8	121.0	5857.2
5413	24	24	0	Maryland	3149	Other textile product mills	31	71.0	598.0	23069.2
5414	24	24	0	Maryland	3152	Cut and sew apparel manufacturing	31	28.8	730.0	15155.4
5415	24	24	0	Maryland	3159	Apparel accessories and other apparel manufacturing	31	4.6	29.6	1444.6
5416	24	24	0	Maryland	3161	Leather and hide tanning and finishing	31	1.0	0.0	0.0
5417	24	24	0	Maryland	3162	Footwear manufacturing	31	2.2	0.0	0.0
5418	24	24	0	Maryland	3169	Other leather and allied product manufacturing	31	5.0	6.2	389.2
5419	24	24	0	Maryland	3211	Sawmills and wood preservation	32	21.2	365.0	14825.4
5420	24	24	0	Maryland	3212	Veneer, plywood, and engineered wood product manufacturing	32	14.8	630.0	26608.8
5421	24	24	0	Maryland	3219	Other wood product manufacturing	32	64.4	1352.6	53276.8
5422	24	24	0	Maryland	3221	Pulp, paper, and paperboard mills	32	3.6	0.0	0.0
5423	24	24	0	Maryland	3222	Converted paper product manufacturing	32	32.0	1980.0	87952.2
5424	24	24	0	Maryland	3231	Printing and related support activities	32	417.2	7751.4	357314.8
5425	24	24	0	Maryland	3241	Petroleum and coal products manufacturing	32	31.0	479.4	36589.4
5426	24	24	0	Maryland	3251	Basic chemical manufacturing	32	25.6	540.8	40768.6
5427	24	24	0	Maryland	3252	Resin, synthetic rubber, and artificial synthetic fibers and filaments manufacturing	32	7.8	176.6	8913.4
5428	24	24	0	Maryland	3253	Pesticide, fertilizer, and other agricultural chemical manufacturing	32	15.4	220.4	12894.2
5429	24	24	0	Maryland	3254	Pharmaceutical and medicine manufacturing	32	46.8	4383.4	385989.2
5430	24	24	0	Maryland	3255	Paint, coating, and adhesive manufacturing	32	16.0	1072.8	67580.0
5431	24	24	0	Maryland	3256	Soap, cleaning compound, and toilet preparation manufacturing	32	19.8	1139.6	74825.6
5432	24	24	0	Maryland	3259	Other chemical product and preparation manufacturing	32	27.4	624.4	28426.2
5433	24	24	0	Maryland	3261	Plastics product manufacturing	32	90.0	5733.8	326416.0
5434	24	24	0	Maryland	3262	Rubber product manufacturing	32	17.0	715.8	29983.8
5435	24	24	0	Maryland	3271	Clay product and refractory manufacturing	32	23.8	373.0	16177.4
5436	24	24	0	Maryland	3272	Glass and glass product manufacturing	32	18.6	243.6	12551.6
5437	24	24	0	Maryland	3273	Cement and concrete product manufacturing	32	98.2	2255.8	133009.8
5438	24	24	0	Maryland	3274	Lime and gypsum product manufacturing	32	7.6	312.8	21175.8
5439	24	24	0	Maryland	3279	Other nonmetallic mineral product manufacturing	32	26.6	603.0	25591.6
5440	24	24	0	Maryland	3311	Iron and steel mills and ferroalloy manufacturing	33	4.8	7.0	494.8
5441	24	24	0	Maryland	3312	Steel product manufacturing from purchased steel	33	2.4	14.0	803.2
5442	24	24	0	Maryland	3313	Alumina and aluminum production and processing	33	6.2	57.6	3348.0
5443	24	24	0	Maryland	3314	Nonferrous metal (except aluminum) production and processing	33	7.6	83.4	5753.0
5444	24	24	0	Maryland	3315	Foundries	33	8.4	94.2	6314.8
5445	24	24	0	Maryland	3321	Forging and stamping	33	11.2	457.6	24537.2
5446	24	24	0	Maryland	3322	Cutlery and handtool manufacturing	33	3.4	0.0	0.0
5447	24	24	0	Maryland	3323	Architectural and structural metals manufacturing	33	117.8	2794.4	155674.2
5448	24	24	0	Maryland	3324	Boiler, tank, and shipping container manufacturing	33	11.8	805.0	46985.8
5449	24	24	0	Maryland	3325	Hardware manufacturing	33	6.0	31.4	1229.8
5450	24	24	0	Maryland	3326	Spring and wire product manufacturing	33	10.6	441.0	23959.8
5451	24	24	0	Maryland	3327	Machine shops; turned product; and screw, nut, and bolt manufacturing	33	172.4	2540.4	128714.0
5452	24	24	0	Maryland	3328	Coating, engraving, heat treating, and allied activities	33	36.0	412.0	21202.6
5453	24	24	0	Maryland	3329	Other fabricated metal product manufacturing	33	22.8	893.4	52321.8
5454	24	24	0	Maryland	3331	Agriculture, construction, and mining machinery manufacturing	33	8.0	124.2	6605.8
5455	24	24	0	Maryland	3332	Industrial machinery manufacturing	33	19.2	252.4	25468.6
5456	24	24	0	Maryland	3333	Commercial and service industry machinery manufacturing	33	15.8	304.2	17115.6
5457	24	24	0	Maryland	3334	Ventilation, heating, air-conditioning, and commercial refrigeration equipment manufacturing	33	26.6	1548.6	98966.6
5458	24	24	0	Maryland	3335	Metalworking machinery manufacturing	33	25.0	814.2	44073.8
5459	24	24	0	Maryland	3336	Engine, turbine, and power transmission equipment manufacturing	33	7.4	0.0	0.0
5460	24	24	0	Maryland	3339	Other general purpose machinery manufacturing	33	38.4	1628.4	99999.4
5461	24	24	0	Maryland	3341	Computer and peripheral equipment manufacturing	33	14.4	378.4	30667.2
5462	24	24	0	Maryland	3342	Communications equipment manufacturing	33	40.2	3254.8	331708.4
5463	24	24	0	Maryland	3343	Audio and video equipment manufacturing	33	6.0	7.4	765.2
5464	24	24	0	Maryland	3344	Semiconductor and other electronic component manufacturing	33	44.8	1791.8	113685.4
5465	24	24	0	Maryland	3345	Navigational, measuring, electromedical, and control instruments manufacturing	33	82.4	10798.8	1128136.4
5466	24	24	0	Maryland	3346	Manufacturing and reproducing magnetic and optical media	33	4.6	97.6	5762.4
5467	24	24	0	Maryland	3351	Electric lighting equipment manufacturing	33	9.0	199.4	12577.8
5468	24	24	0	Maryland	3352	Household appliance manufacturing	33	1.3333333333333333	0.0	0.0
5469	24	24	0	Maryland	3353	Electrical equipment manufacturing	33	15.2	943.4	61981.2
5470	24	24	0	Maryland	3359	Other electrical equipment and component manufacturing	33	22.8	698.0	42915.6
5471	24	24	0	Maryland	3361	Motor vehicle manufacturing	33	1.2	0.0	0.0
5472	24	24	0	Maryland	3362	Motor vehicle body and trailer manufacturing	33	13.6	298.6	16561.0
5473	24	24	0	Maryland	3363	Motor vehicle parts manufacturing	33	20.6	663.4	46473.2
5474	24	24	0	Maryland	3364	Aerospace product and parts manufacturing	33	11.4	4036.4	316606.4
5475	24	24	0	Maryland	3365	Railroad rolling stock manufacturing	33	2.0	0.0	0.0
5476	24	24	0	Maryland	3366	Ship and boat building	33	34.4	427.2	18319.0
5477	24	24	0	Maryland	3369	Other transportation equipment manufacturing	33	3.2	13.8	1102.4
5478	24	24	0	Maryland	3371	Household and institutional furniture and kitchen cabinet manufacturing	33	119.0	1687.0	62919.2
5479	24	24	0	Maryland	3372	Office furniture (including fixtures) manufacturing	33	62.8	1034.0	51564.0
5480	24	24	0	Maryland	3379	Other furniture related product manufacturing	33	11.4	1311.2	61734.0
5481	24	24	0	Maryland	3391	Medical equipment and supplies manufacturing	33	150.2	1819.6	102588.8
5482	24	24	0	Maryland	3399	Other miscellaneous manufacturing	33	184.6	2492.8	114862.8
5483	24	24	0	Maryland	4231	Motor vehicle and motor vehicle parts and supplies merchant wholesalers	42	352.4	4824.0	233366.4
5484	24	24	0	Maryland	4232	Furniture and home furnishing merchant wholesalers	42	208.4	2859.0	169038.6
5485	24	24	0	Maryland	4233	Lumber and other construction materials merchant wholesalers	42	285.0	4369.2	252616.6
5486	24	24	0	Maryland	4234	Professional and commercial equipment and supplies merchant wholesalers	42	602.0	11151.6	1008861.8
5487	24	24	0	Maryland	4235	Metal and mineral (except petroleum) merchant wholesalers	42	116.6	1556.2	102035.0
5488	24	24	0	Maryland	4236	Household appliances and electrical and electronic goods merchant wholesalers	42	462.6	7424.4	719357.8
5489	24	24	0	Maryland	4237	Hardware, plumbing and heating equipment and supplies merchant wholesalers	42	369.6	4446.0	306258.0
5490	24	24	0	Maryland	4238	Machinery, equipment, and supplies merchant wholesalers	42	629.6	7526.6	513175.6
5491	24	24	0	Maryland	4239	Miscellaneous durable goods merchant wholesalers	42	381.6	4621.4	257047.8
5492	24	24	0	Maryland	4241	Paper and paper product merchant wholesalers	42	158.0	2709.4	165735.4
5493	24	24	0	Maryland	4242	Drugs and druggists' sundries merchant wholesalers	42	141.2	4335.0	530010.4
5494	24	24	0	Maryland	4243	Apparel, piece goods, and notions merchant wholesalers	42	115.6	1042.0	56242.2
5495	24	24	0	Maryland	4244	Grocery and related product merchant wholesalers	42	569.6	17543.6	911172.6
5496	24	24	0	Maryland	4245	Farm product raw material merchant wholesalers	42	30.6	215.8	11714.8
5497	24	24	0	Maryland	4246	Chemical and allied products merchant wholesalers	42	127.2	1336.0	92354.4
5498	24	24	0	Maryland	4247	Petroleum and petroleum products merchant wholesalers	42	59.8	923.0	59648.8
5499	24	24	0	Maryland	4248	Beer, wine, and distilled alcoholic beverage merchant wholesalers	42	86.0	2890.2	202817.8
5500	24	24	0	Maryland	4249	Miscellaneous nondurable goods merchant wholesalers	42	330.2	3837.2	163668.6
5501	24	24	0	Maryland	4251	Wholesale electronic markets and agents and brokers	42	659.8	4009.0	243746.4
5502	24	24	0	Maryland	4411	Automobile dealers	44	608.4	25898.2	1333445.0
5503	24	24	0	Maryland	4412	Other motor vehicle dealers	44	203.8	1923.8	83763.8
5504	24	24	0	Maryland	4413	Automotive parts, accessories, and tire stores	44	807.4	8771.8	256230.0
5505	24	24	0	Maryland	4421	Furniture stores	44	452.8	3553.4	122529.2
5506	24	24	0	Maryland	4422	Home furnishings stores	44	494.2	4395.0	110292.2
5507	24	24	0	Maryland	4431	Electronics and appliance stores	44	853.6	7602.0	202058.2
5508	24	24	0	Maryland	4441	Building material and supplies dealers	44	863.0	19876.2	645805.0
5509	24	24	0	Maryland	4442	Lawn and garden equipment and supplies stores	44	226.2	2679.8	86904.2
5510	24	24	0	Maryland	4451	Grocery stores	44	1916.8	57325.6	1365250.8
5511	24	24	0	Maryland	4452	Specialty food stores	44	419.8	2857.2	57166.0
5512	24	24	0	Maryland	4453	Beer, wine, and liquor stores	44	1190.6	5584.2	138432.8
5513	24	24	0	Maryland	4461	Health and personal care stores	44	1753.0	18644.8	606437.6
5514	24	24	0	Maryland	4471	Gasoline stations	44	1547.0	13068.0	272189.2
5515	24	24	0	Maryland	4481	Clothing stores	44	1828.4	26272.8	413362.8
5516	24	24	0	Maryland	4482	Shoe stores	44	543.6	5407.4	81893.4
5517	24	24	0	Maryland	4483	Jewelry, luggage, and leather goods stores	44	412.0	2850.4	95311.2
5518	24	24	0	Maryland	4511	Sporting goods, hobby, and musical instrument stores	45	612.6	7697.4	141270.6
5519	24	24	0	Maryland	4512	Book stores and news dealers	45	129.4	930.8	26791.8
5520	24	24	0	Maryland	4521	Department stores	45	177.0	27430.4	524095.4
5521	24	24	0	Maryland	4529	Other general merchandise stores	45	572.0	21745.4	500315.2
5522	24	24	0	Maryland	4531	Florists	45	191.2	1224.0	22050.8
5523	24	24	0	Maryland	4532	Office supplies, stationery, and gift stores	45	523.2	4770.2	78606.2
5524	24	24	0	Maryland	4533	Used merchandise stores	45	333.6	4374.6	81140.0
5525	24	24	0	Maryland	4539	Other miscellaneous store retailers	45	599.0	3998.0	96554.2
5526	24	24	0	Maryland	4541	Electronic shopping and mail-order houses	45	441.2	5214.2	203606.0
5527	24	24	0	Maryland	4542	Vending machine operators	45	66.4	846.6	35843.6
5528	24	24	0	Maryland	4543	Direct selling establishments	45	449.6	3770.4	168019.2
5529	24	24	0	Maryland	4811	Scheduled air transportation	48	19.6	921.4	72579.2
5530	24	24	0	Maryland	4812	Nonscheduled air transportation	48	20.6	152.4	11441.4
5531	24	24	0	Maryland	4831	Deep sea, coastal, and great lakes water transportation	48	18.6	895.2	73783.0
5532	24	24	0	Maryland	4832	Inland water transportation	48	11.8	17.2	1938.4
5533	24	24	0	Maryland	4841	General freight trucking	48	768.0	9455.8	451833.2
5534	24	24	0	Maryland	4842	Specialized freight trucking	48	715.4	6552.2	277868.8
5535	24	24	0	Maryland	4851	Urban transit systems	48	25.0	1788.0	59900.2
5536	24	24	0	Maryland	4852	Interurban and rural bus transportation	48	8.6	220.2	6824.8
5537	24	24	0	Maryland	4853	Taxi and limousine service	48	149.2	1246.6	31417.4
5538	24	24	0	Maryland	4854	School and employee bus transportation	48	371.4	5418.8	129460.0
5539	24	24	0	Maryland	4855	Charter bus industry	48	51.8	841.2	30071.6
5540	24	24	0	Maryland	4859	Other transit and ground passenger transportation	48	78.2	2102.4	54321.0
5541	24	24	0	Maryland	4861	Pipeline transportation of crude oil	48	1.0	0.0	0.0
5542	24	24	0	Maryland	4862	Pipeline transportation of natural gas	48	8.6	34.6	3107.2
5543	24	24	0	Maryland	4869	Other pipeline transportation	48	4.0	0.0	0.0
5544	24	24	0	Maryland	4871	Scenic and sightseeing transportation, land	48	10.8	147.8	5886.8
5545	24	24	0	Maryland	4872	Scenic and sightseeing transportation, water	48	29.2	88.0	5435.8
5546	24	24	0	Maryland	4879	Scenic and sightseeing transportation, other	48	1.2	0.0	0.0
5547	24	24	0	Maryland	4881	Support activities for air transportation	48	59.6	1026.6	56917.6
5548	24	24	0	Maryland	4882	Support activities for rail transportation	48	11.4	163.8	6396.8
5549	24	24	0	Maryland	4883	Support activities for water transportation	48	58.0	2752.6	142275.0
5550	24	24	0	Maryland	4884	Support activities for road transportation	48	248.8	1447.0	49160.8
5551	24	24	0	Maryland	4885	Freight transportation arrangement	48	238.6	3040.8	158726.4
5552	24	24	0	Maryland	4889	Other support activities for transportation	48	28.8	246.2	8611.2
5553	24	24	0	Maryland	4921	Couriers and express delivery services	49	144.0	10139.0	479896.2
5554	24	24	0	Maryland	4922	Local messengers and local delivery	49	95.6	777.6	25127.4
5555	24	24	0	Maryland	4931	Warehousing and storage	49	242.8	13423.8	623577.8
5556	24	24	0	Maryland	5111	Newspaper, periodical, book, and directory publishers	51	289.2	6370.8	359492.8
5557	24	24	0	Maryland	5112	Software publishers	51	184.8	6305.8	829974.4
5558	24	24	0	Maryland	5121	Motion picture and video industries	51	276.0	3492.6	124109.0
5559	24	24	0	Maryland	5122	Sound recording industries	51	55.6	197.6	10157.4
5560	24	24	0	Maryland	5151	Radio and television broadcasting	51	113.6	2527.0	172954.2
5561	24	24	0	Maryland	5152	Cable and other subscription programming	51	17.0	2044.0	277294.2
5562	24	24	0	Maryland	5171	Wired telecommunications carriers	51	714.6	14256.4	1010670.6
5563	24	24	0	Maryland	5172	Wireless telecommunications carriers (except satellite)	51	221.6	1747.2	131601.8
5564	24	24	0	Maryland	5174	Satellite telecommunications	51	17.0	322.4	38961.8
5565	24	24	0	Maryland	5179	Other telecommunications	51	90.2	583.8	42302.4
5566	24	24	0	Maryland	5182	Data processing, hosting, and related services	51	328.0	9824.2	792718.0
5567	24	24	0	Maryland	5191	Other information services	51	167.6	2652.2	169115.0
5568	24	24	0	Maryland	5211	Monetary authorities - central bank	52	1.0	0.0	0.0
5569	24	24	0	Maryland	5221	Depository credit intermediation	52	2242.6	26771.6	1704186.4
5570	24	24	0	Maryland	5222	Nondepository credit intermediation	52	646.4	12872.8	1191315.0
5571	24	24	0	Maryland	5223	Activities related to credit intermediation	52	374.2	6476.6	428809.6
5572	24	24	0	Maryland	5231	Securities and commodity contracts intermediation and brokerage	52	627.0	4625.4	716647.2
5573	24	24	0	Maryland	5232	Securities and commodity exchanges	52	1.0	0.0	0.0
5574	24	24	0	Maryland	5239	Other financial investment activities	52	922.8	12742.0	2095437.0
5575	24	24	0	Maryland	5241	Insurance carriers	52	511.4	21289.4	1957240.0
5576	24	24	0	Maryland	5242	Agencies, brokerages, and other insurance related activities	52	2212.4	14756.0	1023238.8
5577	24	24	0	Maryland	5259	Other investment pools and funds	52	14.2	58.2	7829.0
5578	24	24	0	Maryland	5311	Lessors of real estate	53	1858.4	13374.6	765284.8
5579	24	24	0	Maryland	5312	Offices of real estate agents and brokers	53	1649.6	4810.0	358672.8
5580	24	24	0	Maryland	5313	Activities related to real estate	53	1782.2	15747.4	903464.0
5581	24	24	0	Maryland	5321	Automotive equipment rental and leasing	53	304.8	4067.8	201456.6
5582	24	24	0	Maryland	5322	Consumer goods rental	53	318.0	2493.0	92688.4
5583	24	24	0	Maryland	5323	General rental centers	53	38.6	271.0	13702.2
5584	24	24	0	Maryland	5324	Commercial and industrial machinery and equipment rental and leasing	53	217.0	2533.0	157794.8
5585	24	24	0	Maryland	5331	Lessors of nonfinancial intangible assets (except copyrighted works)	53	34.4	454.0	48409.6
5586	24	24	0	Maryland	5411	Legal services	54	3337.0	19632.4	1570112.6
5587	24	24	0	Maryland	5412	Accounting, tax preparation, bookkeeping, and payroll services	54	2567.8	21481.8	1264988.4
5588	24	24	0	Maryland	5413	Architectural, engineering, and related services	54	2390.8	45851.0	3882926.8
5589	24	24	0	Maryland	5414	Specialized design services	54	604.0	2279.2	120145.4
5590	24	24	0	Maryland	5415	Computer systems design and related services	54	4942.6	80910.2	7812346.6
5591	24	24	0	Maryland	5416	Management, scientific, and technical consulting services	54	3873.8	42262.0	3294507.6
5592	24	24	0	Maryland	5417	Scientific research and development services	54	772.0	35318.6	3615516.0
5593	24	24	0	Maryland	5418	Advertising, public relations, and related services	54	587.2	7162.0	381939.6
5594	24	24	0	Maryland	5419	Other professional, scientific, and technical services	54	1214.4	13913.6	720470.4
5595	24	24	0	Maryland	5511	Management of companies and enterprises	55	1202.2	51814.0	5016477.4
5596	24	24	0	Maryland	5611	Office administrative services	56	639.2	11489.8	680764.4
5597	24	24	0	Maryland	5612	Facilities support services	56	332.6	13055.0	788928.6
5598	24	24	0	Maryland	5613	Employment services	56	937.0	61589.6	2578963.2
5599	24	24	0	Maryland	5614	Business support services	56	547.8	8885.8	397074.4
5600	24	24	0	Maryland	5615	Travel arrangement and reservation services	56	369.4	2185.2	103112.2
5601	24	24	0	Maryland	5616	Investigation and security services	56	610.4	24757.6	761012.6
5602	24	24	0	Maryland	5617	Services to buildings and dwellings	56	3943.4	49984.2	1336091.4
5603	24	24	0	Maryland	5619	Other support services	56	375.4	6839.4	302384.0
5604	24	24	0	Maryland	5621	Waste collection	56	233.0	3900.4	183269.6
5605	24	24	0	Maryland	5622	Waste treatment and disposal	56	48.8	872.0	67990.8
5606	24	24	0	Maryland	5629	Remediation and other waste management services	56	184.4	2873.4	136418.6
5607	24	24	0	Maryland	6111	Elementary and secondary schools	61	437.4	23650.8	906969.2
5608	24	24	0	Maryland	6112	Junior colleges	61	8.8	303.4	11807.6
5609	24	24	0	Maryland	6113	Colleges, universities, and professional schools	61	65.8	42046.6	2271497.2
5610	24	24	0	Maryland	6114	Business schools and computer and management training	61	180.4	1133.2	93654.8
5611	24	24	0	Maryland	6115	Technical and trade schools	61	155.6	2498.2	92663.6
5612	24	24	0	Maryland	6116	Other schools and instruction	61	1046.4	9285.0	201433.2
5613	24	24	0	Maryland	6117	Educational support services	61	195.0	2354.8	109093.8
5614	24	24	0	Maryland	6211	Offices of physicians	62	4671.0	48991.0	4042149.2
5615	24	24	0	Maryland	6212	Offices of dentists	62	2667.8	17170.6	897254.2
5616	24	24	0	Maryland	6213	Offices of other health practitioners	62	2408.8	15819.8	649033.0
5617	24	24	0	Maryland	6214	Outpatient care centers	62	841.8	16252.2	814171.6
5618	24	24	0	Maryland	6215	Medical and diagnostic laboratories	62	343.2	5448.0	316235.6
5619	24	24	0	Maryland	6216	Home health care services	62	470.8	14278.0	459770.4
5620	24	24	0	Maryland	6219	Other ambulatory health care services	62	135.2	4975.8	258884.8
5621	24	24	0	Maryland	6221	General medical and surgical hospitals	62	50.8	94044.2	5386665.4
5622	24	24	0	Maryland	6222	Psychiatric and substance abuse hospitals	62	13.8	6310.6	386998.6
5623	24	24	0	Maryland	6223	Specialty (except psychiatric and substance abuse) hospitals	62	11.2	2510.8	178442.4
5624	24	24	0	Maryland	6231	Nursing care facilities (skilled nursing facilities)	62	257.8	34050.2	1200108.6
5625	24	24	0	Maryland	6232	Residential intellectual and developmental disability, mental health, and substance abuse facilities	62	931.2	17430.0	457055.4
5626	24	24	0	Maryland	6233	Continuing care retirement communities and assisted living facilities for the elderly	62	483.4	22655.2	610143.0
5627	24	24	0	Maryland	6239	Other residential care facilities	62	85.2	1909.0	56886.2
5628	24	24	0	Maryland	6241	Individual and family services	62	1012.4	25196.6	651218.6
5629	24	24	0	Maryland	6242	Community food and housing, and emergency and other relief services	62	229.4	3752.4	154471.4
5630	24	24	0	Maryland	6243	Vocational rehabilitation services	62	131.2	9196.0	230536.2
5631	24	24	0	Maryland	6244	Child day care services	62	1475.4	17817.8	365870.8
5632	24	24	0	Maryland	7111	Performing arts companies	71	107.4	2168.0	71924.6
5633	24	24	0	Maryland	7112	Spectator sports	71	102.0	2714.8	396912.6
5634	24	24	0	Maryland	7113	Promoters of performing arts, sports, and similar events	71	121.2	2420.6	58435.4
5635	24	24	0	Maryland	7114	Agents and managers for artists, athletes, entertainers, and other public figures	71	35.6	94.4	5895.4
5636	24	24	0	Maryland	7115	Independent artists, writers, and performers	71	211.4	527.4	28146.6
5637	24	24	0	Maryland	7121	Museums, historical sites, and similar institutions	71	100.4	1816.6	53482.4
5638	24	24	0	Maryland	7131	Amusement parks and arcades	71	65.0	1809.2	27956.0
5639	24	24	0	Maryland	7132	Gambling industries	71	26.2	1743.2	62477.0
5640	24	24	0	Maryland	7139	Other amusement and recreation industries	71	1284.4	25465.6	498030.2
5641	24	24	0	Maryland	7211	Traveler accommodation	72	700.6	23612.6	672814.8
5642	24	24	0	Maryland	7212	RV (recreational vehicle) parks and recreational camps	72	68.0	585.0	19873.2
5643	24	24	0	Maryland	7213	Rooming and boarding houses	72	20.2	67.8	1538.0
5644	24	24	0	Maryland	7223	Special food services	72	834.0	14287.4	322503.2
5645	24	24	0	Maryland	7224	Drinking places (alcoholic beverages)	72	517.4	5025.6	88197.0
5646	24	24	0	Maryland	7225	Restaurants and other eating places	72	9435.2	172000.4	2882950.8
5647	24	24	0	Maryland	8111	Automotive repair and maintenance	81	2853.2	17590.4	688312.6
5648	24	24	0	Maryland	8112	Electronic and precision equipment repair and maintenance	81	229.8	1771.0	106640.2
5649	24	24	0	Maryland	8113	Commercial and industrial machinery and equipment (except automotive and electronic) repair and maintenance	81	320.6	3283.4	171562.8
5650	24	24	0	Maryland	8114	Personal and household goods repair and maintenance	81	472.4	1767.8	61233.8
5651	24	24	0	Maryland	8121	Personal care services	81	2305.0	17081.4	380101.6
5652	24	24	0	Maryland	8122	Death care services	81	306.0	2916.4	108008.2
5653	24	24	0	Maryland	8123	Drycleaning and laundry services	81	761.4	5484.2	141451.0
5654	24	24	0	Maryland	8129	Other personal services	81	778.8	6161.0	157617.8
5655	24	24	0	Maryland	8131	Religious organizations	81	3225.6	31111.4	772055.4
5656	24	24	0	Maryland	8132	Grantmaking and giving services	81	477.8	5161.8	336491.8
