"city","facebook","name","state","street","tags","twitter","type","website","x","y","zip"
"Parsons ","https://www.facebook.com/pages/Parsons-Farmers-Market/390076924351813","Parsons Farmers Market","Kansas","1618 Broadway Ave.","baked goods crafts flowers eggs herbs vegetables honey jams meat nuts plants soap fruits pet food","","market","","-95.2595140","37.3395530","67357"
"Perry","https://www.facebook.com/#!/perrylecomptonfarmersmarket","Perry Lecompton Farmers Market","Kansas","2115 Ferguson Rd.","baked goods crafts flowers eggs herbs vegetables honey jams meat plants poultry prepared soap fruits pet food","","market","http://www.perrylecomptonfarmersmarket.com","-95.391621","39.080865","66073"
"Pittsburg","https://www.facebook.com/pages/Pittsburg-Farmers-Market/285206420600","Pittsburg Farmers Market","Kansas","2nd & Broadway","baked goods eggs herbs vegetables honey jams meat plants poultry soap fruits","","market","http://www.Pittsburgfarmersmarket.org","-94.7048169","37.4090664","66762"
"Hutchinson","","Reno County Farmers Market","Kansas","115 West 2nd Ave","baked goods crafts flowers eggs herbs vegetables honey jams meat nursery plants soap","","market","http://www.renocountyfarmersmarket.org","-97.9339","38.0545","67501"
"Russell","","Russell Area Farmers Market","Kansas","28 N. Kansas St. St. Mary's Parking Lot","","","market","","-98.8586","38.8858","67665"
"Sabetha","","Sabetha Farmers Market","Kansas","915 S. Washington Mary Cotton Library Park","","","market","","-95.8024","39.896","66534"
"Salina","","Salina Farmers Market","Kansas","460 South  Ohio","","","market","http://www.salina-ks.gov/content/134/1488.aspx","-97.596","38.8336","67401"
"Seneca","","Seneca Farmers Market","Kansas","11th & Elk St.","","","market","","-96.0707","39.8383","66538"
"Severy","Severy Station","Severy Station","Kansas","99 S Road","baked goods crafts vegetables jams meat nuts coffee","","market","","-96.234365","37.620849","67137"
"Shawnee","","Shawnee Farmers Market","Kansas","11110 Johnson Drive","baked goods crafts flowers herbs vegetables honey maple plants prepared soap trees fruits","","market","http://www.cityofshawnee.org/WEB/ShawneeCMS.nsf/vwContent/FarmersMarket?OpenDocument","-94.7152040","39.0233950","66203"
"Silver Lake ","https://www.facebook.com/SLFarmersMarket","Silver Lake Farmer's Market & Family Fun Fair","Kansas","203 Railroad Street","baked goods crafts eggs vegetables honey jams prepared soap fruits","","market","http://www.silverlakelibrary.org/silver-lake-farmers-market/","-95.859428","39.105480","66539"
"Smith Center","","Smith County Farmer' Market","Kansas","122 W. Highway 36","baked goods crafts eggs herbs vegetables honey jams soap","","market","http://www.postrock.ksu.edu","-98.7854843","39.7851363","66967"
"South Hutchinson ","https://www.facebook.com/southhutchfarmersmarket/","South Hutch Farmers Market","Kansas","401 N Main","baked goods crafts flowers eggs herbs vegetables honey jams meat poultry prepared soap fruits mushrooms wild","","market","http://www.renocountyfpc.com/","-97.941149","38.033046","67505"
"Spring Hill","https://www.facebook.com/pages/Spring-Hill-Farmers-Market/108892312475844","Spring Hill Farmers Market","Kansas","300 Webster","baked goods crafts flowers eggs herbs vegetables honey jams plants soap fruits","","market","http://www.springhillmarket.org","-94.8253440","38.7461000","66083"
"St. John","","St.John Farmers Market","Kansas","4th & Main","","","market","","-98.7616","38.0024","67576"
"El Dorado","","The Original El Dorado Farmers Market","Kansas","1000 South Main","","","market","","-96.8477","37.8089","67042"
"Colby","facebook.com/ThomasCountyFarmersMarket.com","Thomas County Farmers Market","Kansas","8th and Court Ave","organic baked goods eggs herbs vegetables honey jams meat fruits","","market","","-101.044393","39.400676","67701"
"Winfield","https://www.facebook.com/pages/Walnut-Valley-Farmers-Market/489969211063190","Walnut Valley Farmers' Market","Kansas","301 Main Street","baked goods crafts flowers eggs herbs vegetables honey jams meat nuts plants soap coffee fruits pet food","","market","http://www.wvfmarket.com","-96.9979989","37.2471559","67156"
"Washington","","Washington Farmer's Market","Kansas","Washington County High School","","","market","","-97.0541","39.8238","66968"
"Wellington","","Wellington Farmers Market","Kansas","Heritage Park","","","market","","-97.398","37.2673","67152"
"Leoti","","Wichita County Farmers' Market","Kansas","206 South 4th Street","baked goods eggs vegetables honey jams plants prepared fruits","","market","","-101.3583497","38.4802674","67861"
