"city","facebook","name","state","street","tags","twitter","type","website","x","y","zip"
"Woodland ","https://www.facebook.com/pages/The-Woodland-Farmers-Market/128409933892000","The Woodland Farmers Market","ca","250 First Street ","organic baked goods crafts flowers eggs seafood herbs vegetables honey jams meat prepared-foods soap fruits grains","","market","http://www.thewoodlandfarmersmarket.org","-121.7737712","38.6792311","95695"
"Woodland","https://www.facebook.com/pages/The-Woodland-Farmers-Market/128409933892000","The Woodland Farmers Market at Woodland Healthcare","ca","Corner of Cottonwood and Gibson Rd","organic baked goods flowers eggs herbs vegetables honey jams plants prepared-foods fruits","","market","http://www.thewoodlandfarmersmarket.org","-121.793045","38.663686","95695"
"San Rafael ","https://www.facebook.com/MarinFarmersMarkets/","Thursday Marin Farmers Market","ca","Avenue of the Flags, San Rafael , California 94903","organic baked goods cheese flowers eggs seafood herbs vegetables honey jams maple meat nuts poultry prepared-foods trees coffee beans fruits grains juices mushrooms wild","","market","http://agriculturalinstitue.org","-122.534505","38.001229","94903"
"Lakeport","https://www.facebook.com/Tuesday-Farmers-Market-at-Library-Park-238157099542658/","Tuesday Morning Market at Library Park","ca","www.lakecountyfarmersfinest.org","organic cheese crafts flowers herbs vegetables honey jams nuts plants prepared-foods soap fruits","","market","http://www.lakecountyfarmersfinest.org","-122.913740","39.043566","95453"
"Fresno ","https://www.facebook.com/VineyardFarmersMarket/","Vineyard Farmers Market","ca","100 W. Shaw","organic baked goods cheese flowers eggs herbs vegetables honey jams meat nuts plants prepared-foods coffee fruits grains juices mushrooms","","market","http://www.vineyardfarmersmarket.com","-119.7910413","36.8097606","93704"
"Walnut Creek","https://www.facebook.com/WalnutCreekFarmersMarket","Walnut Creek Certified Farmers' Market","ca","1799 Locust Street","organic baked goods cheese crafts flowers eggs seafood vegetables honey jams meat nuts poultry prepared-foods trees wine coffee fruits juices mushrooms","","market","http://www.cccfm.org/","-122.040479","37.902666","94596"
"Los Angeles","https://www.facebook.com/wellingtonsquarefarmersmarket","Wellington Square Certified Farmers Market","ca","4394 W Washington Blvd.","organic baked goods crafts flowers eggs herbs vegetables honey jams nuts prepared-foods soap coffee fruits juices","https://twitter.com/wsfarmersmarket","market","http://www.wellingtonsquarefarmersmarket.com","-118.334753","34.039790","90016"
"Los Angeles","https://www.facebook.com/WestLaFarmersMarket/","West LA Farmers Market","ca","1600 Purdue Ave.","organic baked goods cheese crafts flowers eggs herbs vegetables honey nuts prepared-foods soap trees coffee fruits juices wild","","market","http://www.wlafarmersmarket.com","-118.450674","34.045724","90025"
"Santa Cruz","www.facebook.com/santacruzfarmersmarket/","Westside Santa Cruz Farmers' Market","ca","Corner of Western Drive and Mission St.","organic baked goods cheese flowers eggs seafood herbs vegetables honey jams meat nuts plants poultry prepared-foods soap wine coffee beans fruits juices","","market","http://www.santacruzfarmersmarket.org","-122.057","36.9598","95060"
"Los Angeles","https://www.facebook.com/farmermarkwv","Westwood Village Farmers Market","ca","1030 Broxton St","organic baked goods crafts eggs vegetables honey jams nuts prepared-foods coffee beans fruits juices","","market","http://www.farmermark.com/westwood","-118.446530","34.061784","90024"
"Los Angeles","https://www.facebook.com/farmermarkwv/","Westwood Village Farmers Market by Farmer Mark","ca","1030 Broxton Avenue","organic baked goods crafts flowers eggs seafood herbs vegetables honey jams nuts prepared-foods soap coffee fruits grains juices tofu","","market","http://www.farmermark.com/westwood/","-118.446688","34.061997","90024"
"San Jose","https://www.facebook.com/UrbanVillageOnFB","Willow Glen Farmers' Market","ca","1425 Lincoln Avenue","organic baked goods cheese crafts flowers eggs seafood herbs vegetables honey jams meat nuts poultry prepared-foods soap trees wine coffee beans fruits juices mushrooms pet food tofu wild","","market","https://uvfm.org/willow-glen-saturday","-121.819306","37.296867","95125"
"Yreka ","","Yreka Community Certified Farmers Market","ca","1712 Fairlane Road","baked goods crafts flowers eggs herbs vegetables honey jams plants prepared-foods fruits","","market","","-122.6401341","41.7070195","96097"
