3392	16053	16	53	Jerome County, Idaho	8113	Commercial and industrial machinery and equipment (except automotive and electronic) repair and maintenance	81	10.4	19.2	768.4
3394	16053	16	53	Jerome County, Idaho	8121	Personal care services	81	5.0	12.0	259.0
3395	16053	16	53	Jerome County, Idaho	8122	Death care services	81	2.8	1.8	44.0
3398	16053	16	53	Jerome County, Idaho	8131	Religious organizations	81	11.6	39.2	601.6
3404	16055	16	55	Kootenai County, Idaho	1133	Logging	11	30.8	103.8	5074.0
3408	16055	16	55	Kootenai County, Idaho	1153	Support activities for forestry	11	9.0	169.8	3742.2
3411	16055	16	55	Kootenai County, Idaho	2123	Nonmetallic mineral mining and quarrying	21	2.8	4.8	568.6
3412	16055	16	55	Kootenai County, Idaho	2131	Support activities for mining	21	5.2	6.0	605.8
3414	16055	16	55	Kootenai County, Idaho	2213	Water, sewage and other systems	22	10.0	21.8	238.2
3415	16055	16	55	Kootenai County, Idaho	2361	Residential building construction	23	140.4	535.8	18589.2
3416	16055	16	55	Kootenai County, Idaho	2362	Nonresidential building construction	23	20.8	287.2	15703.4
3417	16055	16	55	Kootenai County, Idaho	2371	Utility system construction	23	19.2	282.2	22021.4
3418	16055	16	55	Kootenai County, Idaho	2372	Land subdivision	23	5.6	8.8	550.0
3419	16055	16	55	Kootenai County, Idaho	2373	Highway, street, and bridge construction	23	10.0	45.8	3864.4
3420	16055	16	55	Kootenai County, Idaho	2379	Other heavy and civil engineering construction	23	7.0	116.6	4740.0
3421	16055	16	55	Kootenai County, Idaho	2381	Foundation, structure, and building exterior contractors	23	121.4	736.4	24914.6
3422	16055	16	55	Kootenai County, Idaho	2382	Building equipment contractors	23	145.2	796.4	33534.6
3423	16055	16	55	Kootenai County, Idaho	2383	Building finishing contractors	23	111.0	650.8	27698.0
3424	16055	16	55	Kootenai County, Idaho	2389	Other specialty trade contractors	23	89.0	469.8	24367.6
3426	16055	16	55	Kootenai County, Idaho	3114	Fruit and vegetable preserving and specialty food manufacturing	31	2.8	1.2	67.2
3427	16055	16	55	Kootenai County, Idaho	3116	Animal slaughtering and processing	31	2.0	0.0	16.8
3428	16055	16	55	Kootenai County, Idaho	3118	Bakeries and tortilla manufacturing	31	3.6	34.2	601.0
3429	16055	16	55	Kootenai County, Idaho	3119	Other food manufacturing	31	3.2	7.2	190.2
3430	16055	16	55	Kootenai County, Idaho	3121	Beverage manufacturing	31	7.4	15.2	405.2
3434	16055	16	55	Kootenai County, Idaho	3149	Other textile product mills	31	4.2	26.4	811.6
3438	16055	16	55	Kootenai County, Idaho	3211	Sawmills and wood preservation	32	6.6	96.4	5264.4
3439	16055	16	55	Kootenai County, Idaho	3212	Veneer, plywood, and engineered wood product manufacturing	32	3.2	87.6	4763.4
3440	16055	16	55	Kootenai County, Idaho	3219	Other wood product manufacturing	32	19.8	245.2	8591.8
3442	16055	16	55	Kootenai County, Idaho	3231	Printing and related support activities	32	14.4	174.4	7724.4
3444	16055	16	55	Kootenai County, Idaho	3256	Soap, cleaning compound, and toilet preparation manufacturing	32	2.8	4.8	114.0
3446	16055	16	55	Kootenai County, Idaho	3261	Plastics product manufacturing	32	8.0	254.8	9079.6
3447	16055	16	55	Kootenai County, Idaho	3262	Rubber product manufacturing	32	3.0	8.6	314.2
3449	16055	16	55	Kootenai County, Idaho	3273	Cement and concrete product manufacturing	32	3.0	29.6	1637.8
3450	16055	16	55	Kootenai County, Idaho	3279	Other nonmetallic mineral product manufacturing	32	5.2	19.2	1793.0
3455	16055	16	55	Kootenai County, Idaho	3323	Architectural and structural metals manufacturing	33	8.4	63.0	2444.0
3457	16055	16	55	Kootenai County, Idaho	3327	Machine shops; turned product; and screw, nut, and bolt manufacturing	33	19.8	195.4	7858.4
3458	16055	16	55	Kootenai County, Idaho	3328	Coating, engraving, heat treating, and allied activities	33	3.4	12.8	521.6
3459	16055	16	55	Kootenai County, Idaho	3329	Other fabricated metal product manufacturing	33	6.4	44.8	1461.0
3460	16055	16	55	Kootenai County, Idaho	3331	Agriculture, construction, and mining machinery manufacturing	33	5.4	111.8	5157.8
3461	16055	16	55	Kootenai County, Idaho	3332	Industrial machinery manufacturing	33	3.4	16.8	606.2
3462	16055	16	55	Kootenai County, Idaho	3333	Commercial and service industry machinery manufacturing	33	2.2	14.0	578.2
3464	16055	16	55	Kootenai County, Idaho	3335	Metalworking machinery manufacturing	33	5.8	24.4	1390.6
3466	16055	16	55	Kootenai County, Idaho	3339	Other general purpose machinery manufacturing	33	5.6	111.0	6247.4
3477	16055	16	55	Kootenai County, Idaho	3363	Motor vehicle parts manufacturing	33	2.4	3.0	96.6
3478	16055	16	55	Kootenai County, Idaho	3364	Aerospace product and parts manufacturing	33	3.0	57.8	2011.0
3480	16055	16	55	Kootenai County, Idaho	3369	Other transportation equipment manufacturing	33	2.0	0.0	12.25
3481	16055	16	55	Kootenai County, Idaho	3371	Household and institutional furniture and kitchen cabinet manufacturing	33	10.4	55.0	2289.0
3482	16055	16	55	Kootenai County, Idaho	3372	Office furniture (including fixtures) manufacturing	33	3.2	56.0	1929.4
3483	16055	16	55	Kootenai County, Idaho	3391	Medical equipment and supplies manufacturing	33	15.0	84.0	3182.4
3484	16055	16	55	Kootenai County, Idaho	3399	Other miscellaneous manufacturing	33	14.0	58.4	1744.2
3485	16055	16	55	Kootenai County, Idaho	4231	Motor vehicle and motor vehicle parts and supplies merchant wholesalers	42	8.2	15.2	801.8
3487	16055	16	55	Kootenai County, Idaho	4233	Lumber and other construction materials merchant wholesalers	42	19.4	126.2	6727.6
3488	16055	16	55	Kootenai County, Idaho	4234	Professional and commercial equipment and supplies merchant wholesalers	42	9.8	32.2	1083.6
3489	16055	16	55	Kootenai County, Idaho	4235	Metal and mineral (except petroleum) merchant wholesalers	42	3.0	0.0	285.4
3490	16055	16	55	Kootenai County, Idaho	4236	Household appliances and electrical and electronic goods merchant wholesalers	42	15.0	114.8	6357.6
3491	16055	16	55	Kootenai County, Idaho	4237	Hardware, plumbing and heating equipment and supplies merchant wholesalers	42	11.2	139.4	7175.4
3492	16055	16	55	Kootenai County, Idaho	4238	Machinery, equipment, and supplies merchant wholesalers	42	19.4	151.2	7990.2
3493	16055	16	55	Kootenai County, Idaho	4239	Miscellaneous durable goods merchant wholesalers	42	17.6	125.0	4921.6
3495	16055	16	55	Kootenai County, Idaho	4242	Drugs and druggists' sundries merchant wholesalers	42	4.4	15.0	859.6
3496	16055	16	55	Kootenai County, Idaho	4243	Apparel, piece goods, and notions merchant wholesalers	42	2.0	1.0	49.0
3499	16055	16	55	Kootenai County, Idaho	4246	Chemical and allied products merchant wholesalers	42	4.4	12.0	653.0
3500	16055	16	55	Kootenai County, Idaho	4247	Petroleum and petroleum products merchant wholesalers	42	3.6	52.2	3469.8
3501	16055	16	55	Kootenai County, Idaho	4248	Beer, wine, and distilled alcoholic beverage merchant wholesalers	42	3.6	78.2	2513.4
3502	16055	16	55	Kootenai County, Idaho	4249	Miscellaneous nondurable goods merchant wholesalers	42	9.2	167.6	7430.8
3503	16055	16	55	Kootenai County, Idaho	4251	Wholesale electronic markets and agents and brokers	42	17.2	17.2	1231.0
3504	16055	16	55	Kootenai County, Idaho	4411	Automobile dealers	44	35.2	776.8	38633.6
3505	16055	16	55	Kootenai County, Idaho	4412	Other motor vehicle dealers	44	16.2	245.4	13291.0
3506	16055	16	55	Kootenai County, Idaho	4413	Automotive parts, accessories, and tire stores	44	39.0	396.4	12871.2
3507	16055	16	55	Kootenai County, Idaho	4421	Furniture stores	44	9.8	68.4	2669.8
3508	16055	16	55	Kootenai County, Idaho	4422	Home furnishings stores	44	21.0	178.4	5659.6
3509	16055	16	55	Kootenai County, Idaho	4431	Electronics and appliance stores	44	18.8	180.0	4726.8
3510	16055	16	55	Kootenai County, Idaho	4441	Building material and supplies dealers	44	35.4	627.6	18289.4
3511	16055	16	55	Kootenai County, Idaho	4442	Lawn and garden equipment and supplies stores	44	11.8	59.4	2239.0
3512	16055	16	55	Kootenai County, Idaho	4451	Grocery stores	44	30.0	1125.6	24234.8
3513	16055	16	55	Kootenai County, Idaho	4452	Specialty food stores	44	9.8	101.8	1089.2
3514	16055	16	55	Kootenai County, Idaho	4453	Beer, wine, and liquor stores	44	14.6	44.0	1347.2
3515	16055	16	55	Kootenai County, Idaho	4461	Health and personal care stores	44	33.8	319.0	11736.2
3516	16055	16	55	Kootenai County, Idaho	4471	Gasoline stations	44	56.2	495.0	9544.0
3517	16055	16	55	Kootenai County, Idaho	4481	Clothing stores	44	35.4	292.2	3855.6
3518	16055	16	55	Kootenai County, Idaho	4482	Shoe stores	44	6.0	9.0	138.2
3519	16055	16	55	Kootenai County, Idaho	4483	Jewelry, luggage, and leather goods stores	44	9.4	34.6	1179.8
3520	16055	16	55	Kootenai County, Idaho	4511	Sporting goods, hobby, and musical instrument stores	45	42.8	492.4	9182.0
3521	16055	16	55	Kootenai County, Idaho	4512	Book stores and news dealers	45	2.8	30.0	422.2
3522	16055	16	55	Kootenai County, Idaho	4521	Department stores	45	6.8	584.8	10635.4
3523	16055	16	55	Kootenai County, Idaho	4529	Other general merchandise stores	45	15.2	1595.6	45095.4
3524	16055	16	55	Kootenai County, Idaho	4531	Florists	45	3.6	8.8	134.6
3525	16055	16	55	Kootenai County, Idaho	4532	Office supplies, stationery, and gift stores	45	15.8	80.0	1494.0
3526	16055	16	55	Kootenai County, Idaho	4533	Used merchandise stores	45	19.4	178.6	3609.0
3527	16055	16	55	Kootenai County, Idaho	4539	Other miscellaneous store retailers	45	37.2	110.0	2686.2
3528	16055	16	55	Kootenai County, Idaho	4541	Electronic shopping and mail-order houses	45	29.6	167.2	6061.4
3530	16055	16	55	Kootenai County, Idaho	4543	Direct selling establishments	45	21.2	65.8	2658.8
3532	16055	16	55	Kootenai County, Idaho	4812	Nonscheduled air transportation	48	2.6	4.0	325.6
3534	16055	16	55	Kootenai County, Idaho	4841	General freight trucking	48	30.4	121.4	4702.8
3535	16055	16	55	Kootenai County, Idaho	4842	Specialized freight trucking	48	38.0	132.2	4562.8
3536	16055	16	55	Kootenai County, Idaho	4853	Taxi and limousine service	48	3.0	5.2	39.0
3543	16055	16	55	Kootenai County, Idaho	4884	Support activities for road transportation	48	5.2	14.4	620.0
3544	16055	16	55	Kootenai County, Idaho	4885	Freight transportation arrangement	48	5.0	6.8	264.8
3545	16055	16	55	Kootenai County, Idaho	4889	Other support activities for transportation	48	1.8	1.2	34.8
3546	16055	16	55	Kootenai County, Idaho	4921	Couriers and express delivery services	49	5.2	67.4	2992.4
3548	16055	16	55	Kootenai County, Idaho	4931	Warehousing and storage	49	3.0	2.0	86.6
3549	16055	16	55	Kootenai County, Idaho	5111	Newspaper, periodical, book, and directory publishers	51	10.4	93.0	3197.4
3551	16055	16	55	Kootenai County, Idaho	5121	Motion picture and video industries	51	7.2	30.0	575.0
3554	16055	16	55	Kootenai County, Idaho	5171	Wired telecommunications carriers	51	20.8	227.6	12730.2
3555	16055	16	55	Kootenai County, Idaho	5172	Wireless telecommunications carriers (except satellite)	51	5.4	12.6	725.6
3556	16055	16	55	Kootenai County, Idaho	5179	Other telecommunications	51	1.8	2.6	92.2
3557	16055	16	55	Kootenai County, Idaho	5182	Data processing, hosting, and related services	51	5.6	0.0	514.8
3558	16055	16	55	Kootenai County, Idaho	5191	Other information services	51	3.6	3.0	301.4
3559	16055	16	55	Kootenai County, Idaho	5221	Depository credit intermediation	52	62.2	1348.8	55862.0
3560	16055	16	55	Kootenai County, Idaho	5222	Nondepository credit intermediation	52	30.6	85.8	5765.2
3561	16055	16	55	Kootenai County, Idaho	5223	Activities related to credit intermediation	52	20.6	20.2	758.6
3562	16055	16	55	Kootenai County, Idaho	5231	Securities and commodity contracts intermediation and brokerage	52	29.2	71.4	11873.2
3563	16055	16	55	Kootenai County, Idaho	5239	Other financial investment activities	52	16.8	34.6	2843.6
3564	16055	16	55	Kootenai County, Idaho	5241	Insurance carriers	52	13.4	69.4	4088.2
3565	16055	16	55	Kootenai County, Idaho	5242	Agencies, brokerages, and other insurance related activities	52	93.2	347.8	14888.4
3567	16055	16	55	Kootenai County, Idaho	5311	Lessors of real estate	53	76.8	212.0	6255.4
3568	16055	16	55	Kootenai County, Idaho	5312	Offices of real estate agents and brokers	53	70.0	162.4	6459.4
3569	16055	16	55	Kootenai County, Idaho	5313	Activities related to real estate	53	53.4	161.8	5667.0
3570	16055	16	55	Kootenai County, Idaho	5321	Automotive equipment rental and leasing	53	2.4	4.0	85.2
3571	16055	16	55	Kootenai County, Idaho	5322	Consumer goods rental	53	12.6	17.0	1606.6
3572	16055	16	55	Kootenai County, Idaho	5323	General rental centers	53	6.0	6.6	350.0
3573	16055	16	55	Kootenai County, Idaho	5324	Commercial and industrial machinery and equipment rental and leasing	53	2.6	1.4	142.4
3574	16055	16	55	Kootenai County, Idaho	5331	Lessors of nonfinancial intangible assets (except copyrighted works)	53	2.8	35.4	2104.4
3575	16055	16	55	Kootenai County, Idaho	5411	Legal services	54	109.8	370.4	18126.2
3576	16055	16	55	Kootenai County, Idaho	5412	Accounting, tax preparation, bookkeeping, and payroll services	54	79.0	394.2	24394.4
3577	16055	16	55	Kootenai County, Idaho	5413	Architectural, engineering, and related services	54	80.2	428.0	25497.0
3578	16055	16	55	Kootenai County, Idaho	5414	Specialized design services	54	6.8	5.8	323.2
3579	16055	16	55	Kootenai County, Idaho	5415	Computer systems design and related services	54	46.8	214.2	13168.8
3580	16055	16	55	Kootenai County, Idaho	5416	Management, scientific, and technical consulting services	54	65.6	185.2	8293.4
3581	16055	16	55	Kootenai County, Idaho	5417	Scientific research and development services	54	7.8	17.8	1148.2
3582	16055	16	55	Kootenai County, Idaho	5418	Advertising, public relations, and related services	54	12.4	45.8	1308.8
3583	16055	16	55	Kootenai County, Idaho	5419	Other professional, scientific, and technical services	54	46.4	306.8	8558.2
3584	16055	16	55	Kootenai County, Idaho	5511	Management of companies and enterprises	55	19.6	96.4	12674.6
3585	16055	16	55	Kootenai County, Idaho	5611	Office administrative services	56	12.8	63.0	4866.4
3587	16055	16	55	Kootenai County, Idaho	5613	Employment services	56	17.8	217.6	4445.4
3588	16055	16	55	Kootenai County, Idaho	5614	Business support services	56	17.8	93.2	3834.2
3589	16055	16	55	Kootenai County, Idaho	5615	Travel arrangement and reservation services	56	10.2	30.8	979.8
3590	16055	16	55	Kootenai County, Idaho	5616	Investigation and security services	56	14.6	54.8	1285.2
3591	16055	16	55	Kootenai County, Idaho	5617	Services to buildings and dwellings	56	132.0	579.2	14745.0
3592	16055	16	55	Kootenai County, Idaho	5619	Other support services	56	12.2	34.2	2552.8
3593	16055	16	55	Kootenai County, Idaho	5621	Waste collection	56	4.4	34.0	1216.2
3595	16055	16	55	Kootenai County, Idaho	5629	Remediation and other waste management services	56	9.4	28.8	1722.8
3596	16055	16	55	Kootenai County, Idaho	6111	Elementary and secondary schools	61	12.8	168.2	3499.8
3598	16055	16	55	Kootenai County, Idaho	6114	Business schools and computer and management training	61	3.4	3.2	165.2
3599	16055	16	55	Kootenai County, Idaho	6115	Technical and trade schools	61	5.2	44.0	724.4
3600	16055	16	55	Kootenai County, Idaho	6116	Other schools and instruction	61	25.0	106.0	1870.4
3601	16055	16	55	Kootenai County, Idaho	6117	Educational support services	61	7.2	26.8	881.2
3602	16055	16	55	Kootenai County, Idaho	6211	Offices of physicians	62	107.2	983.2	83115.4
3603	16055	16	55	Kootenai County, Idaho	6212	Offices of dentists	62	79.0	602.0	24514.4
3604	16055	16	55	Kootenai County, Idaho	6213	Offices of other health practitioners	62	129.0	580.8	18748.4
3605	16055	16	55	Kootenai County, Idaho	6214	Outpatient care centers	62	21.4	402.2	15781.4
3606	16055	16	55	Kootenai County, Idaho	6215	Medical and diagnostic laboratories	62	7.2	15.6	2802.2
3607	16055	16	55	Kootenai County, Idaho	6216	Home health care services	62	15.0	594.2	12711.0
3608	16055	16	55	Kootenai County, Idaho	6219	Other ambulatory health care services	62	6.8	30.0	821.2
3611	16055	16	55	Kootenai County, Idaho	6231	Nursing care facilities (skilled nursing facilities)	62	8.0	658.6	19964.0
3612	16055	16	55	Kootenai County, Idaho	6232	Residential intellectual and developmental disability, mental health, and substance abuse facilities	62	16.0	267.0	7326.2
3613	16055	16	55	Kootenai County, Idaho	6233	Continuing care retirement communities and assisted living facilities for the elderly	62	25.2	741.0	14985.4
3614	16055	16	55	Kootenai County, Idaho	6239	Other residential care facilities	62	3.0	22.2	470.4
3615	16055	16	55	Kootenai County, Idaho	6241	Individual and family services	62	39.4	731.6	12973.0
3616	16055	16	55	Kootenai County, Idaho	6242	Community food and housing, and emergency and other relief services	62	5.8	19.8	456.2
3617	16055	16	55	Kootenai County, Idaho	6243	Vocational rehabilitation services	62	6.2	117.4	2249.4
3618	16055	16	55	Kootenai County, Idaho	6244	Child day care services	62	31.4	255.4	3992.8
3619	16055	16	55	Kootenai County, Idaho	7111	Performing arts companies	71	7.0	15.0	713.4
3620	16055	16	55	Kootenai County, Idaho	7112	Spectator sports	71	5.0	32.4	553.0
3623	16055	16	55	Kootenai County, Idaho	7115	Independent artists, writers, and performers	71	16.2	34.2	1046.0
3627	16055	16	55	Kootenai County, Idaho	7139	Other amusement and recreation industries	71	54.4	535.2	17698.4
3628	16055	16	55	Kootenai County, Idaho	7211	Traveler accommodation	72	36.2	2133.2	50431.4
3629	16055	16	55	Kootenai County, Idaho	7212	RV (recreational vehicle) parks and recreational camps	72	9.8	34.0	1472.4
3630	16055	16	55	Kootenai County, Idaho	7223	Special food services	72	13.0	46.2	532.6
3631	16055	16	55	Kootenai County, Idaho	7224	Drinking places (alcoholic beverages)	72	37.8	200.4	2356.2
3632	16055	16	55	Kootenai County, Idaho	7225	Restaurants and other eating places	72	275.0	4264.2	64397.8
3633	16055	16	55	Kootenai County, Idaho	8111	Automotive repair and maintenance	81	91.2	423.0	12765.8
3634	16055	16	55	Kootenai County, Idaho	8112	Electronic and precision equipment repair and maintenance	81	4.0	5.8	240.8
3635	16055	16	55	Kootenai County, Idaho	8113	Commercial and industrial machinery and equipment (except automotive and electronic) repair and maintenance	81	11.4	64.6	3207.2
3636	16055	16	55	Kootenai County, Idaho	8114	Personal and household goods repair and maintenance	81	21.0	63.4	1995.0
3637	16055	16	55	Kootenai County, Idaho	8121	Personal care services	81	46.2	242.6	4093.0
3638	16055	16	55	Kootenai County, Idaho	8122	Death care services	81	7.2	11.8	538.4
3639	16055	16	55	Kootenai County, Idaho	8123	Drycleaning and laundry services	81	10.0	55.0	882.4
3640	16055	16	55	Kootenai County, Idaho	8129	Other personal services	81	20.4	24.0	1269.4
3641	16055	16	55	Kootenai County, Idaho	8131	Religious organizations	81	71.0	600.6	12329.0
3642	16055	16	55	Kootenai County, Idaho	8132	Grantmaking and giving services	81	3.6	2.8	190.6
3643	16055	16	55	Kootenai County, Idaho	8133	Social advocacy organizations	81	4.0	13.2	158.8
3644	16055	16	55	Kootenai County, Idaho	8134	Civic and social organizations	81	9.6	32.2	566.0
3645	16055	16	55	Kootenai County, Idaho	8139	Business, professional, labor, political, and similar organizations	81	27.0	105.2	3097.6
3647	16057	16	57	Latah County, Idaho	1133	Logging	11	25.8	179.4	11168.0
3649	16057	16	57	Latah County, Idaho	1151	Support activities for crop production	11	6.2	16.8	726.8
3656	16057	16	57	Latah County, Idaho	2361	Residential building construction	23	37.4	46.8	1806.0
3657	16057	16	57	Latah County, Idaho	2362	Nonresidential building construction	23	4.0	10.4	789.4
3660	16057	16	57	Latah County, Idaho	2381	Foundation, structure, and building exterior contractors	23	11.4	15.0	649.8
3661	16057	16	57	Latah County, Idaho	2382	Building equipment contractors	23	20.4	153.0	6532.8
3662	16057	16	57	Latah County, Idaho	2383	Building finishing contractors	23	14.6	43.6	933.4
3663	16057	16	57	Latah County, Idaho	2389	Other specialty trade contractors	23	13.6	36.6	2209.2
3672	16057	16	57	Latah County, Idaho	3231	Printing and related support activities	32	3.2	2.0	204.8
3675	16057	16	57	Latah County, Idaho	3327	Machine shops; turned product; and screw, nut, and bolt manufacturing	33	2.6	1.4	130.8
3694	16057	16	57	Latah County, Idaho	4244	Grocery and related product merchant wholesalers	42	2.4	1.4	80.2
3695	16057	16	57	Latah County, Idaho	4245	Farm product raw material merchant wholesalers	42	4.0	29.0	1821.2
3698	16057	16	57	Latah County, Idaho	4249	Miscellaneous nondurable goods merchant wholesalers	42	5.0	47.2	2081.0
3702	16057	16	57	Latah County, Idaho	4413	Automotive parts, accessories, and tire stores	44	7.6	28.8	792.0
3704	16057	16	57	Latah County, Idaho	4422	Home furnishings stores	44	4.0	43.4	1073.8
3705	16057	16	57	Latah County, Idaho	4431	Electronics and appliance stores	44	9.6	84.0	1879.6
3706	16057	16	57	Latah County, Idaho	4441	Building material and supplies dealers	44	7.8	160.0	5070.6
3708	16057	16	57	Latah County, Idaho	4451	Grocery stores	44	9.0	455.8	9905.4
3709	16057	16	57	Latah County, Idaho	4452	Specialty food stores	44	7.6	23.0	464.4
3710	16057	16	57	Latah County, Idaho	4453	Beer, wine, and liquor stores	44	3.6	7.8	90.6
3711	16057	16	57	Latah County, Idaho	4461	Health and personal care stores	44	10.2	108.6	2794.6
3712	16057	16	57	Latah County, Idaho	4471	Gasoline stations	44	11.2	93.4	1326.2
3713	16057	16	57	Latah County, Idaho	4481	Clothing stores	44	10.8	145.8	1474.0
3714	16057	16	57	Latah County, Idaho	4482	Shoe stores	44	3.4	8.6	132.0
3715	16057	16	57	Latah County, Idaho	4483	Jewelry, luggage, and leather goods stores	44	3.4	13.8	328.2
3716	16057	16	57	Latah County, Idaho	4511	Sporting goods, hobby, and musical instrument stores	45	11.4	110.8	3160.6
3721	16057	16	57	Latah County, Idaho	4532	Office supplies, stationery, and gift stores	45	3.6	28.0	468.6
3722	16057	16	57	Latah County, Idaho	4533	Used merchandise stores	45	3.8	8.2	121.0
3723	16057	16	57	Latah County, Idaho	4539	Other miscellaneous store retailers	45	3.4	9.0	375.4
3724	16057	16	57	Latah County, Idaho	4541	Electronic shopping and mail-order houses	45	6.4	18.8	891.4
3725	16057	16	57	Latah County, Idaho	4543	Direct selling establishments	45	3.2	10.6	354.6
3727	16057	16	57	Latah County, Idaho	4842	Specialized freight trucking	48	12.2	55.0	1849.2
3737	16057	16	57	Latah County, Idaho	5151	Radio and television broadcasting	51	4.0	22.2	393.6
3738	16057	16	57	Latah County, Idaho	5171	Wired telecommunications carriers	51	8.4	50.6	3025.2
3742	16057	16	57	Latah County, Idaho	5221	Depository credit intermediation	52	19.0	108.0	4981.2
3743	16057	16	57	Latah County, Idaho	5222	Nondepository credit intermediation	52	3.0	4.2	109.0
3745	16057	16	57	Latah County, Idaho	5231	Securities and commodity contracts intermediation and brokerage	52	4.6	10.8	1148.0
3747	16057	16	57	Latah County, Idaho	5241	Insurance carriers	52	1.4	0.8	20.8
3748	16057	16	57	Latah County, Idaho	5242	Agencies, brokerages, and other insurance related activities	52	18.2	48.6	2035.8
3749	16057	16	57	Latah County, Idaho	5311	Lessors of real estate	53	14.2	45.2	942.6
3750	16057	16	57	Latah County, Idaho	5312	Offices of real estate agents and brokers	53	10.6	20.6	1078.6
3751	16057	16	57	Latah County, Idaho	5313	Activities related to real estate	53	14.8	40.4	1216.6
3753	16057	16	57	Latah County, Idaho	5322	Consumer goods rental	53	3.4	9.6	357.6
3755	16057	16	57	Latah County, Idaho	5411	Legal services	54	23.0	23.0	1871.8
3756	16057	16	57	Latah County, Idaho	5412	Accounting, tax preparation, bookkeeping, and payroll services	54	10.4	29.2	1715.8
3757	16057	16	57	Latah County, Idaho	5413	Architectural, engineering, and related services	54	10.4	120.2	4663.6
3759	16057	16	57	Latah County, Idaho	5415	Computer systems design and related services	54	6.0	12.4	1552.4
3760	16057	16	57	Latah County, Idaho	5416	Management, scientific, and technical consulting services	54	15.0	165.8	8005.0
3761	16057	16	57	Latah County, Idaho	5417	Scientific research and development services	54	2.0	4.4	178.0
3763	16057	16	57	Latah County, Idaho	5419	Other professional, scientific, and technical services	54	6.0	60.4	1425.2
3766	16057	16	57	Latah County, Idaho	5614	Business support services	56	3.0	1.4	48.0
3769	16057	16	57	Latah County, Idaho	5617	Services to buildings and dwellings	56	20.4	72.0	1818.6
3770	16057	16	57	Latah County, Idaho	5619	Other support services	56	4.8	17.8	459.0
3773	16057	16	57	Latah County, Idaho	6111	Elementary and secondary schools	61	7.0	137.6	3368.4
3775	16057	16	57	Latah County, Idaho	6116	Other schools and instruction	61	5.4	42.0	344.8
3777	16057	16	57	Latah County, Idaho	6211	Offices of physicians	62	16.6	74.8	8877.2
3778	16057	16	57	Latah County, Idaho	6212	Offices of dentists	62	12.2	95.4	3326.2
3779	16057	16	57	Latah County, Idaho	6213	Offices of other health practitioners	62	19.4	60.2	1834.2
3780	16057	16	57	Latah County, Idaho	6214	Outpatient care centers	62	4.2	19.0	1023.2
3783	16057	16	57	Latah County, Idaho	6219	Other ambulatory health care services	62	2.2	3.6	70.2
3789	16057	16	57	Latah County, Idaho	6241	Individual and family services	62	9.8	152.6	2304.4
3790	16057	16	57	Latah County, Idaho	6242	Community food and housing, and emergency and other relief services	62	6.2	13.2	197.4
3791	16057	16	57	Latah County, Idaho	6244	Child day care services	62	10.2	40.6	533.2
3796	16057	16	57	Latah County, Idaho	7139	Other amusement and recreation industries	71	7.8	56.6	557.4
3797	16057	16	57	Latah County, Idaho	7211	Traveler accommodation	72	8.0	201.4	3410.0
3798	16057	16	57	Latah County, Idaho	7213	Rooming and boarding houses	72	20.4	90.8	732.6
3800	16057	16	57	Latah County, Idaho	7224	Drinking places (alcoholic beverages)	72	14.8	133.4	1133.8
3801	16057	16	57	Latah County, Idaho	7225	Restaurants and other eating places	72	70.4	1156.2	15227.0
