494	16015	16	15	Boise County, Idaho	6114	Business schools and computer and management training	61	1.4	1.2078431372549019	104.78039215686273
495	16015	16	15	Boise County, Idaho	6212	Offices of dentists	62	2.6	17.974167709637047	695.7372215269087
496	16015	16	15	Boise County, Idaho	6213	Offices of other health practitioners	62	1.8	8.74781531929949	268.8619847868389
497	16015	16	15	Boise County, Idaho	6241	Individual and family services	62	1.0	17.372846595570138	305.5159967186218
498	16015	16	15	Boise County, Idaho	7111	Performing arts companies	71	1.0	9.593939393939396	192.11515151515152
499	16015	16	15	Boise County, Idaho	7113	Promoters of performing arts, sports, and similar events	71	1.0	24.908496732026148	255.36601307189542
500	16015	16	15	Boise County, Idaho	7121	Museums, historical sites, and similar institutions	71	1.0	4.445414847161572	111.82532751091705
501	16015	16	15	Boise County, Idaho	8113	Commercial and industrial machinery and equipment (except automotive and electronic) repair and maintenance	81	1.3333333333333333	6.499762920815551	281.959222380275
502	16015	16	15	Boise County, Idaho	8114	Personal and household goods repair and maintenance	81	1.0	2.532137518684604	68.41106128550074
503	16015	16	15	Boise County, Idaho	8121	Personal care services	81	1.0	5.236301369863013	89.92857142857143
504	16015	16	15	Boise County, Idaho	8129	Other personal services	81	1.0	5.131027253668763	89.26205450733752
505	16015	16	15	Boise County, Idaho	8134	Civic and social organizations	81	1.0	5.174863387978143	106.00546448087432
506	16017	16	17	Bonner County, Idaho	1131	Timber tract operations	11	1.4	4.409999999999999	134.36499999999998
507	16017	16	17	Bonner County, Idaho	1141	Fishing	11	1.0	0.48888888888888893	33.08888888888889
508	16017	16	17	Bonner County, Idaho	1151	Support activities for crop production	11	1.0	15.259813084112148	433.53644859813085
509	16017	16	17	Bonner County, Idaho	1152	Support activities for animal production	11	1.0	2.9663461538461537	96.56249999999999
510	16017	16	17	Bonner County, Idaho	2111	Oil and gas extraction	21	1.0	0.9333333333333332	84.66666666666666
511	16017	16	17	Bonner County, Idaho	2122	Metal ore mining	21	1.0	44.32967032967033	3473.8021978021975
512	16017	16	17	Bonner County, Idaho	2211	Electric power generation, transmission and distribution	22	3.0	28.47584973166369	2908.2343470483006
513	16017	16	17	Bonner County, Idaho	2372	Land subdivision	23	1.6	3.106382978723404	162.79148936170213
514	16017	16	17	Bonner County, Idaho	3114	Fruit and vegetable preserving and specialty food manufacturing	31	1.0	194.453125	6773.354166666667
515	16017	16	17	Bonner County, Idaho	3115	Dairy product manufacturing	31	1.0	125.64566929133858	5682.59842519685
516	16017	16	17	Bonner County, Idaho	3116	Animal slaughtering and processing	31	2.0	70.33663366336634	2259.742574257426
517	16017	16	17	Bonner County, Idaho	3118	Bakeries and tortilla manufacturing	31	1.0	20.925133689839573	740.9358288770053
518	16017	16	17	Bonner County, Idaho	3119	Other food manufacturing	31	2.2	22.533333333333335	1117.088888888889
519	16017	16	17	Bonner County, Idaho	3141	Textile furnishings mills	31	1.0	1.5714285714285716	84.85714285714286
520	16017	16	17	Bonner County, Idaho	3149	Other textile product mills	31	1.2	6.458823529411766	296.9382352941177
521	16017	16	17	Bonner County, Idaho	3152	Cut and sew apparel manufacturing	31	1.0	5.852941176470588	163.16176470588235
522	16017	16	17	Bonner County, Idaho	3212	Veneer, plywood, and engineered wood product manufacturing	32	1.0	23.409836065573774	946.516393442623
523	16017	16	17	Bonner County, Idaho	3254	Pharmaceutical and medicine manufacturing	32	1.0	36.82608695652174	2394.6521739130435
524	16017	16	17	Bonner County, Idaho	3256	Soap, cleaning compound, and toilet preparation manufacturing	32	1.0	35.359375	1508.4375
525	16017	16	17	Bonner County, Idaho	3261	Plastics product manufacturing	32	1.0	29.948936170212765	1166.2808510638297
526	16017	16	17	Bonner County, Idaho	3279	Other nonmetallic mineral product manufacturing	32	1.0	9.303797468354428	460.79746835443035
527	16017	16	17	Bonner County, Idaho	3315	Foundries	33	1.0	3.959183673469387	292.87755102040813
528	16017	16	17	Bonner County, Idaho	3322	Cutlery and handtool manufacturing	33	1.0	19.633333333333333	718.35
529	16017	16	17	Bonner County, Idaho	3324	Boiler, tank, and shipping container manufacturing	33	1.0	48.19512195121951	3072.317073170732
530	16017	16	17	Bonner County, Idaho	3328	Coating, engraving, heat treating, and allied activities	33	1.0	7.346153846153847	240.44871794871798
531	16017	16	17	Bonner County, Idaho	3329	Other fabricated metal product manufacturing	33	1.0	22.436170212765962	981.0744680851064
532	16017	16	17	Bonner County, Idaho	3331	Agriculture, construction, and mining machinery manufacturing	33	1.0	31.35353535353535	1357.3636363636363
533	16017	16	17	Bonner County, Idaho	3333	Commercial and service industry machinery manufacturing	33	1.0	10.512820512820515	912.0000000000001
534	16017	16	17	Bonner County, Idaho	3334	Ventilation, heating, air-conditioning, and commercial refrigeration equipment manufacturing	33	1.0	14.257142857142856	594.6857142857143
535	16017	16	17	Bonner County, Idaho	3335	Metalworking machinery manufacturing	33	1.0	13.308641975308642	643.7530864197531
536	16017	16	17	Bonner County, Idaho	3339	Other general purpose machinery manufacturing	33	1.0	24.717241379310344	1189.8689655172413
537	16017	16	17	Bonner County, Idaho	3341	Computer and peripheral equipment manufacturing	33	1.0	0.0	0.0
538	16017	16	17	Bonner County, Idaho	3345	Navigational, measuring, electromedical, and control instruments manufacturing	33	2.0	58.51282051282052	2776.769230769231
539	16017	16	17	Bonner County, Idaho	3351	Electric lighting equipment manufacturing	33	1.0	1.346153846153846	76.11538461538461
540	16017	16	17	Bonner County, Idaho	3353	Electrical equipment manufacturing	33	1.0	41.09803921568628	1790.980392156863
541	16017	16	17	Bonner County, Idaho	3363	Motor vehicle parts manufacturing	33	2.0	8.704225352112676	193.29577464788736
542	16017	16	17	Bonner County, Idaho	3365	Railroad rolling stock manufacturing	33	1.0	0.0	0.0
543	16017	16	17	Bonner County, Idaho	3366	Ship and boat building	33	1.0	16.066666666666666	596.8
544	16017	16	17	Bonner County, Idaho	3369	Other transportation equipment manufacturing	33	1.0	14.03921568627451	498.0000000000001
545	16017	16	17	Bonner County, Idaho	3372	Office furniture (including fixtures) manufacturing	33	1.5	34.92857142857143	1593.75
546	16017	16	17	Bonner County, Idaho	3399	Other miscellaneous manufacturing	33	1.3333333333333333	11.577971014492753	408.2689855072463
547	16017	16	17	Bonner County, Idaho	4231	Motor vehicle and motor vehicle parts and supplies merchant wholesalers	42	1.2	17.68186046511628	806.4186046511628
548	16017	16	17	Bonner County, Idaho	4233	Lumber and other construction materials merchant wholesalers	42	1.8	16.311917098445598	929.9751295336789
549	16017	16	17	Bonner County, Idaho	4237	Hardware, plumbing and heating equipment and supplies merchant wholesalers	42	2.0	15.554327808471456	805.6979742173113
550	16017	16	17	Bonner County, Idaho	4241	Paper and paper product merchant wholesalers	42	1.0	11.42	663.1
551	16017	16	17	Bonner County, Idaho	4243	Apparel, piece goods, and notions merchant wholesalers	42	1.0	5.8	182.49411764705883
552	16017	16	17	Bonner County, Idaho	4244	Grocery and related product merchant wholesalers	42	2.4	56.54156560088202	2475.857993384785
553	16017	16	17	Bonner County, Idaho	4247	Petroleum and petroleum products merchant wholesalers	42	1.6	16.120353982300884	908.446017699115
554	16017	16	17	Bonner County, Idaho	4248	Beer, wine, and distilled alcoholic beverage merchant wholesalers	42	1.2	49.76052631578947	1752.3631578947366
555	16017	16	17	Bonner County, Idaho	4251	Wholesale electronic markets and agents and brokers	42	1.2	12.291449814126393	380.4163568773234
556	16017	16	17	Bonner County, Idaho	4421	Furniture stores	44	3.2	28.723418803418806	1019.197264957265
557	16017	16	17	Bonner County, Idaho	4453	Beer, wine, and liquor stores	44	4.0	7.080851063829788	192.57872340425533
558	16017	16	17	Bonner County, Idaho	4482	Shoe stores	44	1.2	7.644444444444444	117.56666666666665
559	16017	16	17	Bonner County, Idaho	4512	Book stores and news dealers	45	1.0	9.749999999999998	136.22959183673467
560	16017	16	17	Bonner County, Idaho	4521	Department stores	45	1.0	83.29296875	1532.86328125
561	16017	16	17	Bonner County, Idaho	4542	Vending machine operators	45	1.0	2.989010989010989	138.5934065934066
562	16017	16	17	Bonner County, Idaho	4851	Urban transit systems	48	1.0	3.3333333333333335	90.75000000000001
563	16017	16	17	Bonner County, Idaho	4859	Other transit and ground passenger transportation	48	1.0	9.747252747252748	204.7032967032967
564	16017	16	17	Bonner County, Idaho	4872	Scenic and sightseeing transportation, water	48	1.2	1.7999999999999998	212.39999999999998
565	16017	16	17	Bonner County, Idaho	4881	Support activities for air transportation	48	1.0	9.675555555555555	344.0755555555556
566	16017	16	17	Bonner County, Idaho	4882	Support activities for rail transportation	48	1.0	3.423076923076923	234.65384615384613
567	16017	16	17	Bonner County, Idaho	4883	Support activities for water transportation	48	1.0	3.8000000000000003	182.88
568	16017	16	17	Bonner County, Idaho	4885	Freight transportation arrangement	48	1.2	7.130935251798561	270.48057553956835
569	16017	16	17	Bonner County, Idaho	4889	Other support activities for transportation	48	1.0	1.452380952380952	49.42857142857142
570	16017	16	17	Bonner County, Idaho	4921	Couriers and express delivery services	49	2.6	57.31641791044776	2466.35223880597
571	16017	16	17	Bonner County, Idaho	4931	Warehousing and storage	49	1.0	22.428125	822.43125
572	16017	16	17	Bonner County, Idaho	5121	Motion picture and video industries	51	1.0	11.87125748502994	159.748502994012
573	16017	16	17	Bonner County, Idaho	5151	Radio and television broadcasting	51	1.6	28.35675675675676	1025.6324324324326
574	16017	16	17	Bonner County, Idaho	5172	Wireless telecommunications carriers (except satellite)	51	1.0	9.150326797385622	436.35947712418306
575	16017	16	17	Bonner County, Idaho	5191	Other information services	51	3.0	53.31496062992126	2242.6889763779527
576	16017	16	17	Bonner County, Idaho	5231	Securities and commodity contracts intermediation and brokerage	52	5.4	6.954483798040695	1917.9766390354187
577	16017	16	17	Bonner County, Idaho	5241	Insurance carriers	52	1.3333333333333333	30.608386638237388	1736.189054726368
578	16017	16	17	Bonner County, Idaho	5321	Automotive equipment rental and leasing	53	1.0	9.512987012987011	254.71103896103895
579	16017	16	17	Bonner County, Idaho	5323	General rental centers	53	1.2	6.373869346733669	217.41105527638194
580	16017	16	17	Bonner County, Idaho	5511	Management of companies and enterprises	55	3.2	102.33652892561985	7650.610247933885
581	16017	16	17	Bonner County, Idaho	5611	Office administrative services	56	1.8	17.4672	898.37568
582	16017	16	17	Bonner County, Idaho	5612	Facilities support services	56	1.0	18.314814814814813	975.0555555555555
583	16017	16	17	Bonner County, Idaho	5613	Employment services	56	1.0	92.45171673819742	2277.8723175965665
584	16017	16	17	Bonner County, Idaho	5614	Business support services	56	1.0	31.410285714285717	683.6388571428572
585	16017	16	17	Bonner County, Idaho	5615	Travel arrangement and reservation services	56	1.0	5.276276276276277	240.14414414414418
586	16017	16	17	Bonner County, Idaho	5621	Waste collection	56	3.6	39.09164265129683	1682.5383285302592
587	16017	16	17	Bonner County, Idaho	5629	Remediation and other waste management services	56	1.0	10.19811320754717	572.8459119496855
588	16017	16	17	Bonner County, Idaho	6114	Business schools and computer and management training	61	1.0	0.8627450980392157	74.84313725490196
589	16017	16	17	Bonner County, Idaho	6115	Technical and trade schools	61	2.2	23.963984674329502	730.4842911877396
590	16017	16	17	Bonner County, Idaho	6117	Educational support services	61	1.2	3.541224489795918	132.47020408163263
591	16017	16	17	Bonner County, Idaho	6215	Medical and diagnostic laboratories	62	1.0	11.22397476340694	591.788643533123
592	16017	16	17	Bonner County, Idaho	6221	General medical and surgical hospitals	62	1.2	754.4018433179723	40258.36313364055
593	16017	16	17	Bonner County, Idaho	6232	Residential intellectual and developmental disability, mental health, and substance abuse facilities	62	2.25	48.03280318091451	1172.7062624254474
594	16017	16	17	Bonner County, Idaho	6239	Other residential care facilities	62	1.2	30.125	573.0583333333333
595	16017	16	17	Bonner County, Idaho	7111	Performing arts companies	71	1.0	9.593939393939396	192.11515151515152
596	16017	16	17	Bonner County, Idaho	7112	Spectator sports	71	1.0	6.482993197278912	171.57823129251702
597	16017	16	17	Bonner County, Idaho	7113	Promoters of performing arts, sports, and similar events	71	2.0	49.816993464052295	510.73202614379085
598	16017	16	17	Bonner County, Idaho	7121	Museums, historical sites, and similar institutions	71	1.2	5.3344978165938866	134.19039301310045
599	16017	16	17	Bonner County, Idaho	7213	Rooming and boarding houses	72	1.0	4.040322580645161	37.443548387096776
600	16017	16	17	Bonner County, Idaho	8113	Commercial and industrial machinery and equipment (except automotive and electronic) repair and maintenance	81	1.2	5.849786628733997	253.76330014224752
601	16019	16	19	Bonneville County, Idaho	1152	Support activities for animal production	11	1.4	4.1528846153846155	135.1875
602	16019	16	19	Bonneville County, Idaho	1153	Support activities for forestry	11	1.0	6.981042654028436	270.2132701421801
603	16019	16	19	Bonneville County, Idaho	2123	Nonmetallic mineral mining and quarrying	21	2.0	29.753424657534243	2367.082191780822
604	16019	16	19	Bonneville County, Idaho	2131	Support activities for mining	21	2.0	29.99	2526.34
605	16019	16	19	Bonneville County, Idaho	2212	Natural gas distribution	22	1.0	0.0	0.0
606	16019	16	19	Bonneville County, Idaho	2213	Water, sewage and other systems	22	1.0	5.545454545454546	204.03636363636363
607	16019	16	19	Bonneville County, Idaho	2373	Highway, street, and bridge construction	23	4.6	67.15818540433925	4194.537672583826
608	16019	16	19	Bonneville County, Idaho	3111	Animal food manufacturing	31	1.0	8.342857142857142	580.4285714285714
609	16019	16	19	Bonneville County, Idaho	3114	Fruit and vegetable preserving and specialty food manufacturing	31	1.0	194.453125	6773.354166666667
610	16019	16	19	Bonneville County, Idaho	3115	Dairy product manufacturing	31	2.0	251.29133858267716	11365.1968503937
611	16019	16	19	Bonneville County, Idaho	3116	Animal slaughtering and processing	31	1.8	63.30297029702971	2033.7683168316835
612	16019	16	19	Bonneville County, Idaho	3119	Other food manufacturing	31	1.0	10.242424242424242	507.76767676767673
613	16019	16	19	Bonneville County, Idaho	3141	Textile furnishings mills	31	1.0	1.5714285714285716	84.85714285714286
614	16019	16	19	Bonneville County, Idaho	3151	Apparel knitting mills	31	1.0	0.0	0.0
615	16019	16	19	Bonneville County, Idaho	3152	Cut and sew apparel manufacturing	31	1.0	5.852941176470588	163.16176470588235
616	16019	16	19	Bonneville County, Idaho	3159	Apparel accessories and other apparel manufacturing	31	1.0	6.3428571428571425	160.9142857142857
617	16019	16	19	Bonneville County, Idaho	3161	Leather and hide tanning and finishing	31	1.0	2.392857142857143	93.07142857142858
618	16019	16	19	Bonneville County, Idaho	3169	Other leather and allied product manufacturing	31	1.0	9.225806451612904	329.06451612903226
619	16019	16	19	Bonneville County, Idaho	3211	Sawmills and wood preservation	32	1.0	46.666666666666664	2176.7529411764704
620	16019	16	19	Bonneville County, Idaho	3222	Converted paper product manufacturing	32	1.0	55.41463414634146	3073.0243902439024
621	16019	16	19	Bonneville County, Idaho	3251	Basic chemical manufacturing	32	1.0	39.070422535211264	3130.957746478873
622	16019	16	19	Bonneville County, Idaho	3254	Pharmaceutical and medicine manufacturing	32	1.0	36.82608695652174	2394.6521739130435
623	16019	16	19	Bonneville County, Idaho	3256	Soap, cleaning compound, and toilet preparation manufacturing	32	3.0	106.078125	4525.3125
624	16019	16	19	Bonneville County, Idaho	3262	Rubber product manufacturing	32	1.0	4.690909090909091	172.70909090909092
625	16019	16	19	Bonneville County, Idaho	3279	Other nonmetallic mineral product manufacturing	32	2.6	24.189873417721518	1198.073417721519
626	16019	16	19	Bonneville County, Idaho	3315	Foundries	33	1.0	3.959183673469387	292.87755102040813
627	16019	16	19	Bonneville County, Idaho	3321	Forging and stamping	33	1.25	22.974137931034484	999.6982758620691
628	16019	16	19	Bonneville County, Idaho	3322	Cutlery and handtool manufacturing	33	3.0	58.9	2155.05
629	16019	16	19	Bonneville County, Idaho	3324	Boiler, tank, and shipping container manufacturing	33	1.0	48.19512195121951	3072.317073170732
630	16019	16	19	Bonneville County, Idaho	3328	Coating, engraving, heat treating, and allied activities	33	1.0	7.346153846153847	240.44871794871798
631	16019	16	19	Bonneville County, Idaho	3331	Agriculture, construction, and mining machinery manufacturing	33	1.6	50.16565656565657	2171.7818181818184
632	16019	16	19	Bonneville County, Idaho	3332	Industrial machinery manufacturing	33	1.0	23.45945945945946	1162.8288288288288
633	16019	16	19	Bonneville County, Idaho	3333	Commercial and service industry machinery manufacturing	33	1.4	14.717948717948717	1276.8000000000002
634	16019	16	19	Bonneville County, Idaho	3335	Metalworking machinery manufacturing	33	1.0	13.308641975308642	643.7530864197531
635	16019	16	19	Bonneville County, Idaho	3342	Communications equipment manufacturing	33	1.6	50.10526315789474	4522.82105263158
636	16019	16	19	Bonneville County, Idaho	3345	Navigational, measuring, electromedical, and control instruments manufacturing	33	1.0	29.25641025641026	1388.3846153846155
637	16019	16	19	Bonneville County, Idaho	3351	Electric lighting equipment manufacturing	33	1.0	1.346153846153846	76.11538461538461
638	16019	16	19	Bonneville County, Idaho	3352	Household appliance manufacturing	33	1.0	5.55	211.25
639	16019	16	19	Bonneville County, Idaho	3353	Electrical equipment manufacturing	33	1.0	41.09803921568628	1790.980392156863
640	16019	16	19	Bonneville County, Idaho	3359	Other electrical equipment and component manufacturing	33	1.0	50.82352941176471	2619.137254901961
641	16019	16	19	Bonneville County, Idaho	3362	Motor vehicle body and trailer manufacturing	33	1.0	44.84684684684685	1488.1171171171172
642	16019	16	19	Bonneville County, Idaho	3366	Ship and boat building	33	1.0	16.066666666666666	596.8
643	16019	16	19	Bonneville County, Idaho	3369	Other transportation equipment manufacturing	33	1.0	14.03921568627451	498.0000000000001
644	16019	16	19	Bonneville County, Idaho	4242	Drugs and druggists' sundries merchant wholesalers	42	5.6	56.544129554655875	3476.7157894736843
645	16019	16	19	Bonneville County, Idaho	4453	Beer, wine, and liquor stores	44	5.0	8.851063829787234	240.72340425531917
646	16019	16	19	Bonneville County, Idaho	4811	Scheduled air transportation	48	2.0	107.25301204819276	4098.843373493975
647	16019	16	19	Bonneville County, Idaho	4832	Inland water transportation	48	1.0	0.4444444444444444	24.444444444444443
648	16019	16	19	Bonneville County, Idaho	4851	Urban transit systems	48	1.2	4.0	108.9
649	16019	16	19	Bonneville County, Idaho	4853	Taxi and limousine service	48	1.0	4.782608695652175	59.184782608695656
650	16019	16	19	Bonneville County, Idaho	4854	School and employee bus transportation	48	1.0	59.54639175257733	839.4845360824743
651	16019	16	19	Bonneville County, Idaho	4855	Charter bus industry	48	1.0	11.45	218.8
652	16019	16	19	Bonneville County, Idaho	4922	Local messengers and local delivery	49	2.0	9.24031007751938	236.5581395348837
653	16019	16	19	Bonneville County, Idaho	5112	Software publishers	51	2.2	30.881860465116283	2938.3813953488375
654	16019	16	19	Bonneville County, Idaho	5121	Motion picture and video industries	51	4.0	47.48502994011976	638.994011976048
655	16019	16	19	Bonneville County, Idaho	5179	Other telecommunications	51	3.0	7.892857142857143	402.71428571428567
656	16019	16	19	Bonneville County, Idaho	5182	Data processing, hosting, and related services	51	2.4	47.236363636363635	3207.149090909091
657	16019	16	19	Bonneville County, Idaho	5259	Other investment pools and funds	52	1.0	0.7560975609756099	46.585365853658544
658	16019	16	19	Bonneville County, Idaho	5417	Scientific research and development services	54	13.4	300.5578125	28487.143750000003
659	16019	16	19	Bonneville County, Idaho	5612	Facilities support services	56	1.3333333333333333	24.41975308641975	1300.074074074074
660	16019	16	19	Bonneville County, Idaho	5622	Waste treatment and disposal	56	1.0	28.47169811320755	3072.4150943396226
661	16019	16	19	Bonneville County, Idaho	6112	Junior colleges	61	1.0	34.652173913043484	1241.9565217391305
662	16019	16	19	Bonneville County, Idaho	6219	Other ambulatory health care services	62	4.0	45.08387096774193	2099.9870967741936
663	16019	16	19	Bonneville County, Idaho	6221	General medical and surgical hospitals	62	2.2	1383.0700460829494	73806.99907834102
664	16019	16	19	Bonneville County, Idaho	7112	Spectator sports	71	1.6	10.37278911564626	274.5251700680272
665	16019	16	19	Bonneville County, Idaho	7113	Promoters of performing arts, sports, and similar events	71	1.2	29.890196078431373	306.4392156862745
666	16019	16	19	Bonneville County, Idaho	7114	Agents and managers for artists, athletes, entertainers, and other public figures	71	1.0	0.0	0.0
667	16019	16	19	Bonneville County, Idaho	7115	Independent artists, writers, and performers	71	2.4	1.7853658536585364	122.73951219512196
668	16019	16	19	Bonneville County, Idaho	7121	Museums, historical sites, and similar institutions	71	2.0	8.890829694323145	223.6506550218341
669	16019	16	19	Bonneville County, Idaho	7131	Amusement parks and arcades	71	1.2	38.512149532710275	962.9046728971962
670	16019	16	19	Bonneville County, Idaho	7132	Gambling industries	71	1.0	33.857142857142854	984.3333333333333
671	16019	16	19	Bonneville County, Idaho	7213	Rooming and boarding houses	72	1.0	4.040322580645161	37.443548387096776
672	16021	16	21	Boundary County, Idaho	1131	Timber tract operations	11	1.0	3.15	95.975
673	16021	16	21	Boundary County, Idaho	1142	Hunting and trapping	11	1.25	0.22058823529411767	7.647058823529412
674	16021	16	21	Boundary County, Idaho	1151	Support activities for crop production	11	2.0	30.519626168224296	867.0728971962617
675	16021	16	21	Boundary County, Idaho	1153	Support activities for forestry	11	1.2	8.377251184834124	324.2559241706161
676	16021	16	21	Boundary County, Idaho	2131	Support activities for mining	21	1.0	14.995	1263.17
677	16021	16	21	Boundary County, Idaho	2362	Nonresidential building construction	23	1.6	16.364326375711574	913.4583175205566
678	16021	16	21	Boundary County, Idaho	2371	Utility system construction	23	1.5	17.165625	988.45125
679	16021	16	21	Boundary County, Idaho	2372	Land subdivision	23	1.0	1.9414893617021276	101.74468085106383
680	16021	16	21	Boundary County, Idaho	2379	Other heavy and civil engineering construction	23	1.0	3.0718954248366015	142.64705882352942
681	16021	16	21	Boundary County, Idaho	3116	Animal slaughtering and processing	31	1.0	35.16831683168317	1129.871287128713
682	16021	16	21	Boundary County, Idaho	3121	Beverage manufacturing	31	1.0	10.195652173913043	317.8434782608695
683	16021	16	21	Boundary County, Idaho	3152	Cut and sew apparel manufacturing	31	1.0	5.852941176470588	163.16176470588235
684	16021	16	21	Boundary County, Idaho	3159	Apparel accessories and other apparel manufacturing	31	1.0	6.3428571428571425	160.9142857142857
685	16021	16	21	Boundary County, Idaho	3212	Veneer, plywood, and engineered wood product manufacturing	32	2.0	46.81967213114755	1893.032786885246
686	16021	16	21	Boundary County, Idaho	3241	Petroleum and coal products manufacturing	32	1.0	0.0	0.0
687	16021	16	21	Boundary County, Idaho	3273	Cement and concrete product manufacturing	32	1.0	14.919491525423728	674.6652542372881
688	16021	16	21	Boundary County, Idaho	3279	Other nonmetallic mineral product manufacturing	32	1.25	11.629746835443036	575.996835443038
689	16021	16	21	Boundary County, Idaho	3315	Foundries	33	1.0	3.959183673469387	292.87755102040813
690	16021	16	21	Boundary County, Idaho	3327	Machine shops; turned product; and screw, nut, and bolt manufacturing	33	1.0	12.240484429065745	485.04325259515576
691	16021	16	21	Boundary County, Idaho	3331	Agriculture, construction, and mining machinery manufacturing	33	1.0	31.35353535353535	1357.3636363636363
692	16021	16	21	Boundary County, Idaho	3352	Household appliance manufacturing	33	1.0	5.55	211.25
693	16021	16	21	Boundary County, Idaho	3371	Household and institutional furniture and kitchen cabinet manufacturing	33	2.0	19.539078156312623	610.7294589178357
694	16021	16	21	Boundary County, Idaho	3399	Other miscellaneous manufacturing	33	1.25	10.854347826086956	382.75217391304346
695	16021	16	21	Boundary County, Idaho	4235	Metal and mineral (except petroleum) merchant wholesalers	42	1.0	10.784	474.968
696	16021	16	21	Boundary County, Idaho	4244	Grocery and related product merchant wholesalers	42	2.0	47.11797133406836	2063.214994487321
697	16021	16	21	Boundary County, Idaho	4249	Miscellaneous nondurable goods merchant wholesalers	42	2.4	38.144725370531816	1808.719093286835
698	16021	16	21	Boundary County, Idaho	4251	Wholesale electronic markets and agents and brokers	42	1.0	10.242874845105328	317.0136307311028
699	16021	16	21	Boundary County, Idaho	4411	Automobile dealers	44	1.0	22.381818181818183	1095.4756363636363
700	16021	16	21	Boundary County, Idaho	4421	Furniture stores	44	1.0	8.976068376068378	318.49914529914537
