1928	16057	16	57	Latah County, Idaho	2211	Electric power generation, transmission and distribution	22	2.0	18.983899821109123	1938.8228980322003
1929	16057	16	57	Latah County, Idaho	2213	Water, sewage and other systems	22	1.0	5.545454545454546	204.03636363636363
1930	16057	16	57	Latah County, Idaho	2371	Utility system construction	23	1.0	11.443750000000001	658.9675000000001
1931	16057	16	57	Latah County, Idaho	2373	Highway, street, and bridge construction	23	1.0	14.599605522682447	911.8560157790927
1932	16057	16	57	Latah County, Idaho	3114	Fruit and vegetable preserving and specialty food manufacturing	31	1.0	194.453125	6773.354166666667
1933	16057	16	57	Latah County, Idaho	3115	Dairy product manufacturing	31	1.0	125.64566929133858	5682.59842519685
1934	16057	16	57	Latah County, Idaho	3116	Animal slaughtering and processing	31	2.0	70.33663366336634	2259.742574257426
1935	16057	16	57	Latah County, Idaho	3118	Bakeries and tortilla manufacturing	31	1.0	20.925133689839573	740.9358288770053
1936	16057	16	57	Latah County, Idaho	3121	Beverage manufacturing	31	1.75	17.842391304347828	556.2260869565217
1937	16057	16	57	Latah County, Idaho	3152	Cut and sew apparel manufacturing	31	1.0	5.852941176470588	163.16176470588235
1938	16057	16	57	Latah County, Idaho	3211	Sawmills and wood preservation	32	1.8	84.0	3918.155294117647
1939	16057	16	57	Latah County, Idaho	3219	Other wood product manufacturing	32	1.8	40.01580547112462	1450.0313069908814
1940	16057	16	57	Latah County, Idaho	3261	Plastics product manufacturing	32	1.3333333333333333	39.93191489361702	1555.041134751773
1941	16057	16	57	Latah County, Idaho	3323	Architectural and structural metals manufacturing	33	1.0	17.32367149758454	736.56038647343
1942	16057	16	57	Latah County, Idaho	3328	Coating, engraving, heat treating, and allied activities	33	1.5	11.01923076923077	360.67307692307696
1943	16057	16	57	Latah County, Idaho	3331	Agriculture, construction, and mining machinery manufacturing	33	1.0	31.35353535353535	1357.3636363636363
1944	16057	16	57	Latah County, Idaho	3334	Ventilation, heating, air-conditioning, and commercial refrigeration equipment manufacturing	33	1.0	14.257142857142856	594.6857142857143
1945	16057	16	57	Latah County, Idaho	3339	Other general purpose machinery manufacturing	33	1.0	24.717241379310344	1189.8689655172413
1946	16057	16	57	Latah County, Idaho	3342	Communications equipment manufacturing	33	1.0	31.31578947368421	2826.7631578947367
1947	16057	16	57	Latah County, Idaho	3345	Navigational, measuring, electromedical, and control instruments manufacturing	33	1.0	29.25641025641026	1388.3846153846155
1948	16057	16	57	Latah County, Idaho	3362	Motor vehicle body and trailer manufacturing	33	1.0	44.84684684684685	1488.1171171171172
1949	16057	16	57	Latah County, Idaho	3363	Motor vehicle parts manufacturing	33	1.0	4.352112676056338	96.64788732394368
1950	16057	16	57	Latah County, Idaho	3369	Other transportation equipment manufacturing	33	1.0	14.03921568627451	498.0000000000001
1951	16057	16	57	Latah County, Idaho	3371	Household and institutional furniture and kitchen cabinet manufacturing	33	1.6	15.631262525050102	488.5835671342686
1952	16057	16	57	Latah County, Idaho	3372	Office furniture (including fixtures) manufacturing	33	1.0	23.28571428571429	1062.5
1953	16057	16	57	Latah County, Idaho	3399	Other miscellaneous manufacturing	33	1.0	8.683478260869565	306.20173913043476
1954	16057	16	57	Latah County, Idaho	4233	Lumber and other construction materials merchant wholesalers	42	1.0	9.062176165803109	516.6528497409327
1955	16057	16	57	Latah County, Idaho	4234	Professional and commercial equipment and supplies merchant wholesalers	42	1.8	30.731043956043962	3141.0717032967036
1956	16057	16	57	Latah County, Idaho	4236	Household appliances and electrical and electronic goods merchant wholesalers	42	1.0	11.604781997187061	1033.0886075949368
1957	16057	16	57	Latah County, Idaho	4238	Machinery, equipment, and supplies merchant wholesalers	42	2.0	23.836805555555554	1413.6354166666667
1958	16057	16	57	Latah County, Idaho	4239	Miscellaneous durable goods merchant wholesalers	42	4.0	34.29569892473118	1512.7419354838707
1959	16057	16	57	Latah County, Idaho	4242	Drugs and druggists' sundries merchant wholesalers	42	1.0	10.097165991902834	620.8421052631579
1960	16057	16	57	Latah County, Idaho	4247	Petroleum and petroleum products merchant wholesalers	42	1.0	10.075221238938052	567.7787610619469
1961	16057	16	57	Latah County, Idaho	4248	Beer, wine, and distilled alcoholic beverage merchant wholesalers	42	1.0	41.46710526315789	1460.3026315789473
1962	16057	16	57	Latah County, Idaho	4251	Wholesale electronic markets and agents and brokers	42	2.2	22.53432465923172	697.4299876084262
1963	16057	16	57	Latah County, Idaho	4411	Automobile dealers	44	1.8	40.28727272727273	1971.8561454545454
1964	16057	16	57	Latah County, Idaho	4412	Other motor vehicle dealers	44	1.0	11.112449799196787	465.98795180722897
1965	16057	16	57	Latah County, Idaho	4421	Furniture stores	44	1.0	8.976068376068378	318.49914529914537
1966	16057	16	57	Latah County, Idaho	4442	Lawn and garden equipment and supplies stores	44	1.8	15.41640378548896	414.2044164037855
1967	16057	16	57	Latah County, Idaho	4512	Book stores and news dealers	45	1.0	9.749999999999998	136.22959183673467
1968	16057	16	57	Latah County, Idaho	4521	Department stores	45	1.0	83.29296875	1532.86328125
1969	16057	16	57	Latah County, Idaho	4529	Other general merchandise stores	45	3.4	190.2313796212804	4891.226510369702
1970	16057	16	57	Latah County, Idaho	4531	Florists	45	1.0	4.3428571428571425	55.166666666666664
1971	16057	16	57	Latah County, Idaho	4841	General freight trucking	48	1.6	13.574706413730803	541.7939174947305
1972	16057	16	57	Latah County, Idaho	4853	Taxi and limousine service	48	1.0	4.782608695652175	59.184782608695656
1973	16057	16	57	Latah County, Idaho	4859	Other transit and ground passenger transportation	48	1.0	9.747252747252748	204.7032967032967
1974	16057	16	57	Latah County, Idaho	4884	Support activities for road transportation	48	1.8	6.703812316715543	163.3724340175953
1975	16057	16	57	Latah County, Idaho	4885	Freight transportation arrangement	48	1.0	5.942446043165468	225.40047961630697
1976	16057	16	57	Latah County, Idaho	4922	Local messengers and local delivery	49	1.0	4.62015503875969	118.27906976744185
1977	16057	16	57	Latah County, Idaho	4931	Warehousing and storage	49	1.0	22.428125	822.43125
1978	16057	16	57	Latah County, Idaho	5111	Newspaper, periodical, book, and directory publishers	51	2.2	41.752	1662.408
1979	16057	16	57	Latah County, Idaho	5112	Software publishers	51	1.8	25.266976744186046	2404.1302325581396
1980	16057	16	57	Latah County, Idaho	5121	Motion picture and video industries	51	1.2	14.245508982035927	191.69820359281437
1981	16057	16	57	Latah County, Idaho	5172	Wireless telecommunications carriers (except satellite)	51	1.2	10.980392156862745	523.6313725490196
1982	16057	16	57	Latah County, Idaho	5179	Other telecommunications	51	1.0	2.630952380952381	134.2380952380952
1983	16057	16	57	Latah County, Idaho	5191	Other information services	51	1.0	17.771653543307085	747.5629921259842
1984	16057	16	57	Latah County, Idaho	5223	Activities related to credit intermediation	52	2.6666666666666665	8.493427704752275	379.98247387933935
1985	16057	16	57	Latah County, Idaho	5239	Other financial investment activities	52	1.5	5.553805774278215	427.03412073490813
1986	16057	16	57	Latah County, Idaho	5321	Automotive equipment rental and leasing	53	1.0	9.512987012987011	254.71103896103895
1987	16057	16	57	Latah County, Idaho	5323	General rental centers	53	1.0	5.311557788944724	181.17587939698493
1988	16057	16	57	Latah County, Idaho	5414	Specialized design services	54	2.2	5.333225806451614	189.31354838709677
1989	16057	16	57	Latah County, Idaho	5418	Advertising, public relations, and related services	54	1.0	6.376470588235295	251.98382352941178
1990	16057	16	57	Latah County, Idaho	5511	Management of companies and enterprises	55	1.0	31.9801652892562	2390.815702479339
1991	16057	16	57	Latah County, Idaho	5611	Office administrative services	56	1.0	9.704	499.0976
1992	16057	16	57	Latah County, Idaho	5615	Travel arrangement and reservation services	56	2.0	10.552552552552553	480.28828828828836
1993	16057	16	57	Latah County, Idaho	5616	Investigation and security services	56	2.2	22.850241545893724	548.3349436392915
1994	16057	16	57	Latah County, Idaho	5621	Waste collection	56	1.2	13.030547550432276	560.8461095100864
1995	16057	16	57	Latah County, Idaho	5629	Remediation and other waste management services	56	1.0	10.19811320754717	572.8459119496855
1996	16057	16	57	Latah County, Idaho	6113	Colleges, universities, and professional schools	61	1.2	562.1428571428571	10670.800000000001
1997	16057	16	57	Latah County, Idaho	6117	Educational support services	61	1.0	2.951020408163265	110.39183673469387
1998	16057	16	57	Latah County, Idaho	6215	Medical and diagnostic laboratories	62	1.2	13.468769716088328	710.1463722397476
1999	16057	16	57	Latah County, Idaho	6216	Home health care services	62	1.0	28.15782828282828	700.3775252525253
2000	16057	16	57	Latah County, Idaho	6221	General medical and surgical hospitals	62	1.0	628.668202764977	33548.635944700465
2001	16057	16	57	Latah County, Idaho	6231	Nursing care facilities (skilled nursing facilities)	62	1.0	69.80941704035874	1923.134529147982
2002	16057	16	57	Latah County, Idaho	6232	Residential intellectual and developmental disability, mental health, and substance abuse facilities	62	1.0	21.347912524850894	521.2027833001988
2003	16057	16	57	Latah County, Idaho	6233	Continuing care retirement communities and assisted living facilities for the elderly	62	2.0	52.303773584905656	987.2603773584906
2004	16057	16	57	Latah County, Idaho	6239	Other residential care facilities	62	1.0	25.104166666666668	477.54861111111114
2005	16057	16	57	Latah County, Idaho	7113	Promoters of performing arts, sports, and similar events	71	1.2	29.890196078431373	306.4392156862745
2006	16057	16	57	Latah County, Idaho	7115	Independent artists, writers, and performers	71	1.0	0.7439024390243902	51.14146341463415
2007	16057	16	57	Latah County, Idaho	7121	Museums, historical sites, and similar institutions	71	1.8	8.001746724890829	201.28558951965067
2008	16057	16	57	Latah County, Idaho	7131	Amusement parks and arcades	71	1.0	32.09345794392524	802.4205607476636
2009	16057	16	57	Latah County, Idaho	7223	Special food services	72	5.8	23.73784461152882	1023.7726817042607
2010	16057	16	57	Latah County, Idaho	8112	Electronic and precision equipment repair and maintenance	81	1.2	5.378501628664495	246.84820846905535
2011	16057	16	57	Latah County, Idaho	8113	Commercial and industrial machinery and equipment (except automotive and electronic) repair and maintenance	81	1.2	5.849786628733997	253.76330014224752
2012	16057	16	57	Latah County, Idaho	8122	Death care services	81	1.0	4.90521327014218	165.23459715639808
2013	16057	16	57	Latah County, Idaho	8123	Drycleaning and laundry services	81	1.0	10.736486486486488	245.472972972973
2014	16059	16	59	Lemhi County, Idaho	1131	Timber tract operations	11	1.0	3.15	95.975
2015	16059	16	59	Lemhi County, Idaho	1133	Logging	11	1.8	9.209122203098106	473.29311531841654
2016	16059	16	59	Lemhi County, Idaho	1152	Support activities for animal production	11	1.0	2.9663461538461537	96.56249999999999
2017	16059	16	59	Lemhi County, Idaho	2121	Coal mining	21	1.0	1.5454545454545454	104.63636363636363
2018	16059	16	59	Lemhi County, Idaho	2122	Metal ore mining	21	2.0	88.65934065934066	6947.604395604395
2019	16059	16	59	Lemhi County, Idaho	2123	Nonmetallic mineral mining and quarrying	21	1.2	17.852054794520544	1420.2493150684932
2020	16059	16	59	Lemhi County, Idaho	2131	Support activities for mining	21	1.0	14.995	1263.17
2021	16059	16	59	Lemhi County, Idaho	2211	Electric power generation, transmission and distribution	22	1.4	13.288729874776386	1357.1760286225401
2022	16059	16	59	Lemhi County, Idaho	2213	Water, sewage and other systems	22	1.0	5.545454545454546	204.03636363636363
2023	16059	16	59	Lemhi County, Idaho	2362	Nonresidential building construction	23	1.0	10.227703984819735	570.911448450348
2024	16059	16	59	Lemhi County, Idaho	2371	Utility system construction	23	1.2	13.7325	790.761
2025	16059	16	59	Lemhi County, Idaho	2373	Highway, street, and bridge construction	23	2.333333333333333	34.06574621959237	2127.664036817883
2026	16059	16	59	Lemhi County, Idaho	2379	Other heavy and civil engineering construction	23	1.0	3.0718954248366015	142.64705882352942
2027	16059	16	59	Lemhi County, Idaho	3116	Animal slaughtering and processing	31	1.2	42.2019801980198	1355.8455445544555
2028	16059	16	59	Lemhi County, Idaho	3152	Cut and sew apparel manufacturing	31	1.0	5.852941176470588	163.16176470588235
2029	16059	16	59	Lemhi County, Idaho	3161	Leather and hide tanning and finishing	31	1.0	2.392857142857143	93.07142857142858
2030	16059	16	59	Lemhi County, Idaho	3169	Other leather and allied product manufacturing	31	1.4	12.916129032258063	460.6903225806451
2031	16059	16	59	Lemhi County, Idaho	3212	Veneer, plywood, and engineered wood product manufacturing	32	1.0	23.409836065573774	946.516393442623
2032	16059	16	59	Lemhi County, Idaho	3219	Other wood product manufacturing	32	1.2	26.677203647416412	966.6875379939208
2033	16059	16	59	Lemhi County, Idaho	3231	Printing and related support activities	32	1.0	10.7447216890595	363.33589251439537
2034	16059	16	59	Lemhi County, Idaho	3273	Cement and concrete product manufacturing	32	1.0	14.919491525423728	674.6652542372881
2035	16059	16	59	Lemhi County, Idaho	3323	Architectural and structural metals manufacturing	33	2.0	34.64734299516908	1473.12077294686
2036	16059	16	59	Lemhi County, Idaho	4238	Machinery, equipment, and supplies merchant wholesalers	42	1.0	11.918402777777777	706.8177083333334
2037	16059	16	59	Lemhi County, Idaho	4241	Paper and paper product merchant wholesalers	42	1.0	11.42	663.1
2038	16059	16	59	Lemhi County, Idaho	4244	Grocery and related product merchant wholesalers	42	1.4	32.982579933847845	1444.2504961411244
2039	16059	16	59	Lemhi County, Idaho	4247	Petroleum and petroleum products merchant wholesalers	42	1.0	10.075221238938052	567.7787610619469
2040	16059	16	59	Lemhi County, Idaho	4248	Beer, wine, and distilled alcoholic beverage merchant wholesalers	42	1.0	41.46710526315789	1460.3026315789473
2041	16059	16	59	Lemhi County, Idaho	4251	Wholesale electronic markets and agents and brokers	42	1.0	10.242874845105328	317.0136307311028
2042	16059	16	59	Lemhi County, Idaho	4411	Automobile dealers	44	2.8	62.669090909090905	3067.3317818181813
2043	16059	16	59	Lemhi County, Idaho	4412	Other motor vehicle dealers	44	1.6	17.779919678714858	745.5807228915663
2044	16059	16	59	Lemhi County, Idaho	4421	Furniture stores	44	1.0	8.976068376068378	318.49914529914537
2045	16059	16	59	Lemhi County, Idaho	4422	Home furnishings stores	44	1.0	7.273923444976077	196.45574162679426
2046	16059	16	59	Lemhi County, Idaho	4431	Electronics and appliance stores	44	1.8	16.353333333333335	372.58133333333336
2047	16059	16	59	Lemhi County, Idaho	4442	Lawn and garden equipment and supplies stores	44	2.0	17.129337539432175	460.22712933753945
2048	16059	16	59	Lemhi County, Idaho	4451	Grocery stores	44	5.0	193.9082384460817	4262.203616878767
2049	16059	16	59	Lemhi County, Idaho	4452	Specialty food stores	44	1.0	6.90192926045016	92.57717041800643
2050	16059	16	59	Lemhi County, Idaho	4453	Beer, wine, and liquor stores	44	1.0	1.770212765957447	48.14468085106383
2051	16059	16	59	Lemhi County, Idaho	4461	Health and personal care stores	44	1.5	15.30612244897959	482.68622448979585
2052	16059	16	59	Lemhi County, Idaho	4481	Clothing stores	44	2.0	21.723993727130164	283.35284892838473
2053	16059	16	59	Lemhi County, Idaho	4483	Jewelry, luggage, and leather goods stores	44	1.0	4.919148936170212	151.39574468085107
2054	16059	16	59	Lemhi County, Idaho	4511	Sporting goods, hobby, and musical instrument stores	45	1.0	10.932551319648093	197.3483870967742
2055	16059	16	59	Lemhi County, Idaho	4531	Florists	45	1.0	4.3428571428571425	55.166666666666664
2056	16059	16	59	Lemhi County, Idaho	4532	Office supplies, stationery, and gift stores	45	1.0	6.21937321937322	112.497150997151
2057	16059	16	59	Lemhi County, Idaho	4533	Used merchandise stores	45	1.4	10.70911392405063	187.95265822784808
2058	16059	16	59	Lemhi County, Idaho	4541	Electronic shopping and mail-order houses	45	2.0	14.998266897746966	740.0797227036395
2059	16059	16	59	Lemhi County, Idaho	4543	Direct selling establishments	45	2.0	6.947067238912732	246.55364806866947
2060	16059	16	59	Lemhi County, Idaho	4812	Nonscheduled air transportation	48	1.0	10.496932515337424	572.8343558282209
2061	16059	16	59	Lemhi County, Idaho	4832	Inland water transportation	48	1.0	0.4444444444444444	24.444444444444443
2062	16059	16	59	Lemhi County, Idaho	4841	General freight trucking	48	2.4	20.362059620596202	812.6908762420957
2063	16059	16	59	Lemhi County, Idaho	4851	Urban transit systems	48	1.0	3.3333333333333335	90.75000000000001
2064	16059	16	59	Lemhi County, Idaho	4859	Other transit and ground passenger transportation	48	2.2	21.443956043956046	450.3472527472528
2065	16059	16	59	Lemhi County, Idaho	4872	Scenic and sightseeing transportation, water	48	1.0	1.4999999999999998	176.99999999999997
2066	16059	16	59	Lemhi County, Idaho	4881	Support activities for air transportation	48	1.0	9.675555555555555	344.0755555555556
2067	16059	16	59	Lemhi County, Idaho	4884	Support activities for road transportation	48	1.2	4.469208211143695	108.9149560117302
2068	16059	16	59	Lemhi County, Idaho	4921	Couriers and express delivery services	49	2.0	44.08955223880597	1897.1940298507461
2069	16059	16	59	Lemhi County, Idaho	5111	Newspaper, periodical, book, and directory publishers	51	1.0	18.978181818181817	755.6399999999999
2070	16059	16	59	Lemhi County, Idaho	5121	Motion picture and video industries	51	1.0	11.87125748502994	159.748502994012
2071	16059	16	59	Lemhi County, Idaho	5151	Radio and television broadcasting	51	1.0	17.722972972972972	641.0202702702702
2072	16059	16	59	Lemhi County, Idaho	5171	Wired telecommunications carriers	51	2.0	47.990407673860915	2395.0047961630694
2073	16059	16	59	Lemhi County, Idaho	5191	Other information services	51	1.0	17.771653543307085	747.5629921259842
2074	16059	16	59	Lemhi County, Idaho	5324	Commercial and industrial machinery and equipment rental and leasing	53	1.2	6.117293233082706	326.57593984962404
2075	16059	16	59	Lemhi County, Idaho	5613	Employment services	56	1.0	92.45171673819742	2277.8723175965665
2076	16059	16	59	Lemhi County, Idaho	5614	Business support services	56	1.0	31.410285714285717	683.6388571428572
2077	16059	16	59	Lemhi County, Idaho	5619	Other support services	56	1.0	9.62087912087912	313.5659340659341
2078	16059	16	59	Lemhi County, Idaho	5621	Waste collection	56	1.6	17.374063400576368	747.7948126801152
2079	16059	16	59	Lemhi County, Idaho	5629	Remediation and other waste management services	56	1.6	16.316981132075473	916.5534591194969
2080	16059	16	59	Lemhi County, Idaho	6111	Elementary and secondary schools	61	1.0	22.83253588516746	570.6682615629984
2081	16059	16	59	Lemhi County, Idaho	6211	Offices of physicians	62	1.0	7.620689655172414	593.0252873563219
2082	16059	16	59	Lemhi County, Idaho	6216	Home health care services	62	2.2	61.94722222222222	1540.8305555555557
2083	16059	16	59	Lemhi County, Idaho	6219	Other ambulatory health care services	62	1.0	11.270967741935483	524.9967741935484
2084	16059	16	59	Lemhi County, Idaho	6221	General medical and surgical hospitals	62	1.0	628.668202764977	33548.635944700465
2085	16059	16	59	Lemhi County, Idaho	6233	Continuing care retirement communities and assisted living facilities for the elderly	62	1.0	26.151886792452828	493.6301886792453
2086	16059	16	59	Lemhi County, Idaho	6242	Community food and housing, and emergency and other relief services	62	1.0	7.888461538461539	187.97500000000002
2087	16059	16	59	Lemhi County, Idaho	6243	Vocational rehabilitation services	62	1.0	27.131355932203387	396.8686440677966
2088	16059	16	59	Lemhi County, Idaho	6244	Child day care services	62	1.3333333333333333	10.972501676727028	158.92823608316564
2089	16059	16	59	Lemhi County, Idaho	7115	Independent artists, writers, and performers	71	1.0	0.7439024390243902	51.14146341463415
2090	16059	16	59	Lemhi County, Idaho	7121	Museums, historical sites, and similar institutions	71	1.4	6.223580786026201	156.55545851528385
2091	16059	16	59	Lemhi County, Idaho	8113	Commercial and industrial machinery and equipment (except automotive and electronic) repair and maintenance	81	1.8	8.774679943100995	380.64495021337126
2092	16059	16	59	Lemhi County, Idaho	8114	Personal and household goods repair and maintenance	81	1.0	2.532137518684604	68.41106128550074
2093	16059	16	59	Lemhi County, Idaho	8121	Personal care services	81	2.2	11.51986301369863	197.84285714285718
2094	16059	16	59	Lemhi County, Idaho	8122	Death care services	81	1.2	5.886255924170616	198.28151658767771
2095	16059	16	59	Lemhi County, Idaho	8129	Other personal services	81	1.0	5.131027253668763	89.26205450733752
2096	16059	16	59	Lemhi County, Idaho	8139	Business, professional, labor, political, and similar organizations	81	1.6	6.687445887445888	211.3535353535354
2097	16061	16	61	Lewis County, Idaho	2123	Nonmetallic mineral mining and quarrying	21	1.0	14.876712328767121	1183.541095890411
2098	16061	16	61	Lewis County, Idaho	2131	Support activities for mining	21	1.0	14.995	1263.17
2099	16061	16	61	Lewis County, Idaho	2373	Highway, street, and bridge construction	23	1.0	14.599605522682447	911.8560157790927
2100	16061	16	61	Lewis County, Idaho	2382	Building equipment contractors	23	1.6	10.80773039450567	480.7293403609647
2101	16061	16	61	Lewis County, Idaho	2383	Building finishing contractors	23	1.0	4.285538965023522	140.96379627735735
2102	16061	16	61	Lewis County, Idaho	2389	Other specialty trade contractors	23	1.4	6.856937033084311	296.3577374599786
2103	16061	16	61	Lewis County, Idaho	3211	Sawmills and wood preservation	32	1.0	46.666666666666664	2176.7529411764704
2104	16061	16	61	Lewis County, Idaho	3219	Other wood product manufacturing	32	1.4	31.123404255319148	1127.8021276595744
2105	16061	16	61	Lewis County, Idaho	3315	Foundries	33	1.0	3.959183673469387	292.87755102040813
2106	16061	16	61	Lewis County, Idaho	3331	Agriculture, construction, and mining machinery manufacturing	33	1.0	31.35353535353535	1357.3636363636363
2107	16061	16	61	Lewis County, Idaho	4233	Lumber and other construction materials merchant wholesalers	42	1.0	9.062176165803109	516.6528497409327
2108	16061	16	61	Lewis County, Idaho	4238	Machinery, equipment, and supplies merchant wholesalers	42	2.0	23.836805555555554	1413.6354166666667
2109	16061	16	61	Lewis County, Idaho	4244	Grocery and related product merchant wholesalers	42	1.0	23.55898566703418	1031.6074972436604
2110	16061	16	61	Lewis County, Idaho	4245	Farm product raw material merchant wholesalers	42	1.6	14.230123456790123	654.1906172839506
2111	16061	16	61	Lewis County, Idaho	4249	Miscellaneous nondurable goods merchant wholesalers	42	2.4	38.144725370531816	1808.719093286835
2112	16061	16	61	Lewis County, Idaho	4412	Other motor vehicle dealers	44	1.0	11.112449799196787	465.98795180722897
2113	16061	16	61	Lewis County, Idaho	4413	Automotive parts, accessories, and tire stores	44	1.6	14.351947442515252	456.84317221961527
2114	16061	16	61	Lewis County, Idaho	4422	Home furnishings stores	44	1.0	7.273923444976077	196.45574162679426
2115	16061	16	61	Lewis County, Idaho	4441	Building material and supplies dealers	44	3.0	40.78185151237397	1217.4184234647114
2116	16061	16	61	Lewis County, Idaho	4442	Lawn and garden equipment and supplies stores	44	1.4	11.990536277602523	322.1589905362776
2117	16061	16	61	Lewis County, Idaho	4452	Specialty food stores	44	1.0	6.90192926045016	92.57717041800643
2118	16061	16	61	Lewis County, Idaho	4461	Health and personal care stores	44	1.0	10.204081632653061	321.7908163265306
2119	16061	16	61	Lewis County, Idaho	4471	Gasoline stations	44	1.6	15.437953599048187	302.21820345032717
2120	16061	16	61	Lewis County, Idaho	4481	Clothing stores	44	1.0	10.861996863565082	141.67642446419237
2121	16061	16	61	Lewis County, Idaho	4483	Jewelry, luggage, and leather goods stores	44	1.0	4.919148936170212	151.39574468085107
2122	16061	16	61	Lewis County, Idaho	4511	Sporting goods, hobby, and musical instrument stores	45	1.6666666666666667	18.220918866080158	328.9139784946237
2123	16061	16	61	Lewis County, Idaho	4529	Other general merchandise stores	45	1.0	55.95040577096483	1438.596032461677
2124	16061	16	61	Lewis County, Idaho	4531	Florists	45	1.0	4.3428571428571425	55.166666666666664
2125	16061	16	61	Lewis County, Idaho	4533	Used merchandise stores	45	1.2	9.179240506329112	161.10227848101263
2126	16061	16	61	Lewis County, Idaho	4539	Other miscellaneous store retailers	45	1.0	4.958139534883721	107.66821705426356
2127	16061	16	61	Lewis County, Idaho	4541	Electronic shopping and mail-order houses	45	1.0	7.499133448873483	370.03986135181975
2128	16061	16	61	Lewis County, Idaho	4841	General freight trucking	48	2.0	16.968383017163504	677.2423968684132
2129	16061	16	61	Lewis County, Idaho	4854	School and employee bus transportation	48	1.0	59.54639175257733	839.4845360824743
2130	16061	16	61	Lewis County, Idaho	4885	Freight transportation arrangement	48	1.0	5.942446043165468	225.40047961630697
2131	16061	16	61	Lewis County, Idaho	4931	Warehousing and storage	49	1.0	22.428125	822.43125
2132	16061	16	61	Lewis County, Idaho	5111	Newspaper, periodical, book, and directory publishers	51	1.0	18.978181818181817	755.6399999999999
2133	16061	16	61	Lewis County, Idaho	5171	Wired telecommunications carriers	51	1.0	23.995203836930457	1197.5023980815347
