"city","facebook","name","state","street","tags","twitter","type","website","x","y","zip"
"Alna","","Albee Farming","me","1628 Alna Road","cut-flowers fresh-fruits fresh-vegetables","","farm","","-69.6152679","44.1032357","04535"
"Cape Elizabeth","","Alewive's Brook Farm","me","83 Old Ocean House Rd","canned preserved cut-flowers eggs fish seafood herbs fresh-fruits fresh-vegetables grains flour","","farm","www.alewivesbrookfarm.com","-70.218065","43.584075","4107"
"fayette","B and T Provisions","B and T Provisions","me","3381 Main street","canned preserved cut-flowers dairy products dry beans eggs fish seafood herbs fresh-vegetables poultry fowl soap body-care","","farm","bantprovisions.com","-70.116146","44.462783","04349"
"EDGECOMB","https://www.facebook.com/scullymarket/","Barbara Scully's Oyster & Lobster Market","me","707 RIVER RD","fish seafood","","farm","https://www.scullyseaproducts.com/visit-us","-69.575254","43.978885","04556"
"Waldoboro","","Beau Chemin Preservation Farm","me","1749 FinntownRoad","bedding plants crafts woodworking cut-flowers eggs fresh-fruits nursery-stock","","farm","www.beaucheminpreservationfarm.com","-69.294017","44.073350","04572"
"Livermore","https://www.facebook.com/BoothbysOrchard","Boothby's Orchard and Farm","me","366 Boothby Road,  Route 108 East","canned preserved fresh-fruits fresh-vegetables honey maple-products wine spirits beer hard-cider","","farm","www.mainehoneycrisp.com","-70.205271","44.375926","4253"
"Wells","https://www.facebook.com/ChickFamilyFarm","Chick Farm","me","19 Waldo Way","poultry fowl","","farm","http://www.chickfarm.com","-70.6266262","43.3778844","04090"
"Caribou","Sam Blackstone / Circle B Farms","Circle B Farms","me","287 E Presque Isle Rd","fresh-fruits fresh-vegetables","","farm","www.circlebfarmsinc.com","-67.989111","46.834200","04736"
"Waldoboro","www.facebook.com/eastfortyfarm","East Forty Farm and Dairy","me","2361 Friendship Road","dairy products","","farm","www.eastfortyfarm.com","-69.332312","44.047112","04572"
"Farmington","","Fleur de Lis Farm","me","538 Whittier Road","baked-goods canned preserved crafts woodworking cut-flowers dairy products eggs herbs fresh-fruits fresh-vegetables honey poultry fowl red-meat non-poultry-meat","","farm","www.cotswoldsofmaine.com","-70.114737","44.634314","04938"
"Rumford","https://www.facebook.com/NoViewFarmCOOP","Gone Loco! @ No View Farm ","me","855 S Rumford Rd","baked-goods bedding plants canned preserved coffee tea crafts woodworking cut-flowers dairy products eggs herbs fresh-fruits fresh-vegetables grains flour honey maple-products mushrooms nursery-stock poultry fowl red-meat non-poultry-meat soap body-care wild-harvested forest-products","","farm","www.noviewfarm.com","-70.6379580","44.4820470","04276"
"Cary Plantation","https://www.facebook.com/GreenAnchorFarm","Green Anchor Farm","me","2000 US Hwy 1","","","farm","","-67.850248","46.070086","04471"
"Harrison","https://www.facebook.com/HighViewFarmSleighrides/","High View Farm Dairy","me","48 Leander Harmon Rd","dairy products eggs maple-products","","farm","http://www.high-view-farm.com/","-70.654938","44.096314","04040"
"Hope","www.facebook.com/HopeOrchards","Hope Orchards","me","434 Camden Road","canned preserved fresh-fruits fresh-vegetables honey juices ciders maple-products","","farm","www.hopeorchards.com","-69.1567388","44.2636548","4847"
"Limerick","","Libby & Son U-Picks","me","86 Sawyer Mt. Road","baked-goods coffee tea crafts woodworking fresh-fruits honey juices ciders maple-products prepared-foods","","farm","www.libbysonupicks.com","-70.760577","43.722072","4048"
"Springvale","https://www.facebook.com/mcdougalorchards","McDougal Orchards LLC","me","201 Hanson Ridge Road","baked-goods bedding plants canned preserved coffee tea crafts woodworking cut-flowers dry beans herbs fresh-fruits fresh-vegetables honey juices ciders maple-products red-meat non-poultry-meat","https://twitter.com/McDougalOrchard","farm","http://www.mcdougalorchards.com","-70.798639","43.447129","04083"
"Casco","https://www.facebook.com/pages/Almost-a-Farmer/511766258923231?ref=bookmarks","Murramarang Farm","me","37 Quaker Ridge Road","eggs","https://www.twitter.com/almostafarmer2","farm","www.almostafarmer.com","-70.529045","43.977657","04015"
"Turner","https://www.facebook.com/NezinscotFarm/","Nezinscot Farm Store","me","284 Turner Center Road","baked-goods canned preserved coffee tea crafts woodworking dairy products dry beans eggs herbs fresh-fruits fresh-vegetables honey maple-products prepared-foods red-meat non-poultry-meat soap body-care","https://twitter.com/","farm","www.nezinscotfarm.com","-70.239038","44.267812","04282"
"Unity","https://www.facebook.com/pages/Northern-Solstice-Alpaca-Farm/171755526185731?ref=br_tf","Northern Solstice Alpaca Farm","me","141 Crosby Brook Rd","","","farm","www.northernsolsticealpaca.com","-69.295265","44.593633","4988"
"Kingsbury Plantation","","Perseverance Wild Blueberry Farm","me","Campbell And Prebble Lane","fresh-fruits","","farm","www.perseverancefarm.com","-69.610695","45.115331","4443"
"Whitefield","","Sheepscot General at Uncas Farm","me","98 Townhouse","baked-goods bedding plants canned preserved coffee tea crafts woodworking cut-flowers dairy products dry beans eggs herbs fresh-fruits fresh-vegetables grains flour honey juices ciders maple-products mushrooms nursery-stock nuts poultry fowl prepared-foods red-meat non-poultry-meat soap body-care tofu non-animal protein wild-harvested forest-products wine spirits beer hard-cider","","farm","","-69.6100800","44.2196226","04353"
"Athens","Sites Farm","Sites Farm","me","98 Joaquin rd","fresh-fruits","","farm","","-69.597973","44.920872","04912"
"Dennysville","","Smith Ridge Farm","me","387 Smith Ridge Farm","bedding plants fresh-vegetables","","farm","smithridgefarm.com","-67.231575","44.921117","04628"
"Buxton","","Snell Family Farm","me","1000 River Road","bedding plants cut-flowers herbs fresh-fruits fresh-vegetables juices ciders","","farm","www.snellfamilyfarm.com","-70.542567","43.619659","04093"
"Hallowell","https://www.facebook.com/pages/The-Maine-Accent/107071032654298","The Maine Accent Field Grown Perennial and Cut Flower Farm","me","60 Shady Lane","bedding plants canned preserved cut-flowers herbs","","farm","www.themaineaccent.com","-69.825454","44.287386","4347"
"Lyman","https://www.facebook.com/pages/Tibbetts-Family-Farm/328792836854","Tibbetts Family Farm","me","920 Clarks Woods Rd","bedding plants cut-flowers eggs herbs fresh-fruits fresh-vegetables nursery-stock red-meat non-poultry-meat","","farm","http://www.tibbettsfamilyfarm.com/","-70.6379682","43.5050963","4002"
"Monroe","https://www.facebook.com/ToddyPondFarm","Toddy Pond Farm","me","174 Carver Rd","","","farm","","-69.052304","44.55061","4951"
"Auburn ","4 Season Farm Market","Valley View Farm","me","#9 Third Street","","","farm","","-70.224720","44.087681","04210"
"Auburn","https://www.facebook.com/WhitingFarm1930/","Whiting Farm","me","876 Summer Street","baked-goods bedding plants canned preserved crafts woodworking eggs herbs fresh-fruits fresh-vegetables honey juices ciders maple-products soap body-care","","farm","www.whitingfarm.org","-70.253660","44.121527","04210"
"Freeport","https://www.facebook.com/wolfesneckfarm","Wolfe's Neck Farm","me","184 Burnett Rd.","eggs herbs fresh-vegetables poultry fowl","https://twitter.com/wolfesneckfarm","farm","www.wolfesneckfarm.org","-70.072353","43.830637","04032"
"Bangor","www.facebook.com/bangorfarmersmarket","Bangor Farmers' Market","me","Corner of Franklin and Harlow Streets","organic baked goods cheese flowers eggs herbs vegetables jams maple meat plants poultry prepared-foods coffee beans fruits juices","","market","http://www.bangorfarmersmarket.org","-68.7716490","44.8039587","04401"
"Berwick","https://www.facebook.com/berwickmainefarmersmarket","Berwick Winter Farmers Market","me","11 Sullivan Street","organic baked goods cheese crafts flowers eggs herbs vegetables honey jams maple meat prepared-foods soap coffee beans fruits","","market","https://berwickfarmersmarket.wordpress.com/","-70.86243","43.269956","03901"
"Brunswick","","Brunswick-Topsham Land Trust Farmers' Market at Crystal Spring Farm","me","277 Pleasant Hill Rd","baked goods cheese crafts flowers eggs seafood herbs vegetables honey jams maple meat plants poultry wine coffee beans fruits grains mushrooms wild","","market","http://www.btlt.org/farmers-market","-69.995923","43.890786","04011"
"Bucksport ","https://www.facebook.com/BucksportBayFarmersMarket","Bucksport Bay Farmers' Market","me","99 Main Street","organic baked goods crafts flowers eggs herbs vegetables honey jams maple meat plants poultry prepared-foods soap coffee beans fruits juices mushrooms","","market","","-68.796497","44.572636","04416"
"Hampden","https://www.facebook.com/HampdenFarmersMarket/","Hampden Farmers Market","me","106 Western Ave.","organic baked goods cheese crafts flowers eggs herbs vegetables honey jams maple meat plants poultry prepared-foods soap coffee fruits mushrooms","","market","http://www.hampdenfarmersmarket.com/","-68.847236","44.745580","04444"
"Kittery ","facebook.com/kitterymarket","Kittery Community Market","me","10 Shapleigh Road","organic baked goods cheese crafts flowers eggs seafood herbs vegetables honey jams maple meat plants poultry prepared-foods soap coffee beans fruits juices mushrooms pet food wild","twitter.com/kitterymarket","market","http://www.kitterycommunitymarket.com","-70.736542","43.090021","03904"
"Lewiston","https://www.facebook.com/lewistonfarmersmarket/","Lewiston Farmers Market","me","65 Main St.","organic baked goods cheese crafts flowers eggs herbs vegetables honey jams maple meat plants poultry prepared-foods soap trees coffee beans fruits grains juices mushrooms tofu wild","https://twitter.com/LewistonMarket","market","https://www.lewistonfarmersmarket.com/","-70.220379","44.096575","04240"
"Lewiston","https://www.facebook.com/lewistonfarmersmarket/","Lewiston Winter Farmers Market","me","130 East Ave.","organic baked goods cheese crafts flowers eggs herbs vegetables honey jams maple meat nuts poultry prepared-foods soap trees coffee beans fruits grains juices mushrooms tofu wild","@LewistonMarket","market","https://www.lewistonfarmersmarket.com/","-70.172185","44.089594","04240"
"Sanford","https://www.facebook.com/SanfordFarmersMarket/","Sanford Farmers' Market","me","919 Main St","baked goods cheese crafts flowers eggs herbs vegetables jams maple meat soap wine fruits juices mushrooms","https://twitter.com/SanfrdFarmrsMkt","market","http://www.sanfordfarmersmarket.org/","-70.774653","43.438711","04073"
"Old Orchard Beach ","","The Ballpark Farmers & Artisan Market","me","7 Ballpark way","baked goods crafts flowers eggs seafood herbs vegetables honey jams maple plants prepared-foods trees coffee fruits","","market","http://oobballpark.com","-70.391653","43.514488","04064"
"Union","","Union Farmers Market","me","280 Common Road","organic baked goods cheese crafts flowers eggs herbs vegetables maple meat poultry soap trees beans fruits","","market","http://www.unionfarmersmarket.org/","-69.274562","44.211498","04862"
