"city","facebook","name","state","street","tags","twitter","type","website","x","y","zip"
"St. Charles","https://www.facebook.com/bennesbest","Benne's Best Meat","mo","850 South Breeze","eggs fresh-vegetables poultry fowl red-meat non-poultry-meat","","farm","www.bennesbest.com","-90.658483","38.718752","63304"
"Forsyth","https://www.facebook.com/beyondeden","Beyond Eden","mo","1804 Burmingham Rd","poultry fowl","","farm","vintagepoultry.com","-93.0777380","36.6569689","65653"
"Ashland","https://www.facebook.com/pages/Blue-Fox-Farm/357267831061749","Blue Fox Farm","mo","120 E Fox Hollow Rd","baked-goods canned preserved coffee tea cut-flowers dairy products eggs herbs fresh-fruits fresh-vegetables honey juices ciders maple-products mushrooms poultry fowl prepared-foods red-meat non-poultry-meat soap body-care wild-harvested forest-products wine spirits beer hard-cider","","farm","http://www.bluefoxfood.com/","-92.3456505","38.7866936","65010"
"Ash Grove","https://www.facebook.com/bluesilobeef","Blue Silo Beef","mo","7226 Highway O","red-meat non-poultry-meat","","farm","https://bluesilobeef.com/","-93.638307","37.173422","65604"
"Camdenton","https://www.facebook.com/pages/Canyon-Goat-Company/218608414896707?sk=info","Canyon Goat Company, Inc.","mo","324 Velvet Antler Road","red-meat non-poultry-meat","","farm","http://www.canyongoat.com/index.html","-92.8551303","38.0903328","65020"
"Augusta ","","Centennial Farms and Orchard","mo","199 Jackson St.","baked-goods bedding plants canned preserved herbs fresh-fruits fresh-vegetables honey soap body-care","","farm","CENTENNIAL FARMS.BIZ","-90.8878600","38.5742400","63332"
"Paris","","Davis Farm","mo","13948 Highway 15","grains flour red-meat non-poultry-meat","","farm","","-91.997360","39.394888","65275"
"Richland","","Farm Market","mo","30305 Thrush Drive","bedding plants fresh-fruits fresh-vegetables","","farm","","-92.4438987","37.7770030","65556"
"Boonville","https://www.facebook.com/boatrightfarms/","Fed From The Farm","mo","13906 Osage Valley Rd","dairy products eggs poultry fowl red-meat non-poultry-meat","","farm","https://fedfromthefarm.com/","-92.7573691","38.8851101","65233"
"Verona","","G's Orchard","mo","2096 Farm Road 1130","fresh-fruits fresh-vegetables","","farm","","-93.827266","36.896851","65769"
"Weston","https://www.facebook.com/greendirtfarm","Green Dirt Farm, LLC","mo","P.O. Box 74","dairy products red-meat non-poultry-meat","","farm","","-94.9016298","39.4111092","64098"
"Wheatland","","Green Gate Family Farm LLC","mo","RR 71 Box 1168","cut-flowers eggs fresh-fruits fresh-vegetables mushrooms poultry fowl","","farm","","-93.383060","37.993085","65779"
"Hartville","","Greenhill Vineyard and Farm.  We sell grapes.","mo","4905 highway 5","fresh-fruits","","farm","www.greenhillgrapes.com","-92.555292","37.286090","65667"
"richmond","www.facebook.com/hainesfarms","haines farms","mo","41903 e. 144th","bedding plants crafts woodworking cut-flowers eggs herbs fresh-fruits fresh-vegetables nursery-stock nuts wild-harvested forest-products","","farm","","-93.963643","39.350219","64085"
"Sikeston","Hamra Farms","Hamra Farms","mo","160 county road 831","canned preserved fresh-vegetables","https://www.twitter.com/HamraFarms","farm","","-89.676996","36.828947","63801"
"Lonedell","","Hart Apiaries","mo","3738 Highway 47","fresh-fruits honey","","farm","www.hartapiaries.com","-90.868656","38.238180","63060"
"Lampe","https://www.facebook.com/HeritageRanchBB","Heritage Farm and Ranch","mo","4738 W. State Hwy 86","canned preserved eggs herbs fresh-fruits fresh-vegetables red-meat non-poultry-meat","","farm","http://www.heritageranch.co/","-93.495140","36.509845","65681"
"St. Charles","https://www.facebook.com/pages/Hermans-Farm-Orchard/159616344096544","Hermans Farm Orchard","mo","3663 N. Highway 94","bedding plants canned preserved eggs herbs fresh-fruits fresh-vegetables honey juices ciders nursery-stock","","farm","www.hermansfarmorchard.com","-90.470826","38.832144","63301"
"Cape Girardeau","https://www.facebook.com/hinkebeins?rf=110698638992813","Hinkebein Hills Farm","mo","434 Whispering Wind Lane","eggs poultry fowl red-meat non-poultry-meat","","farm","","-89.494019","37.371078","63701"
"Spickard","https://www.facebook.com/HomesteadHillFarmandNursery/","Homestead Hill Farm & Nursery","mo","26 NE 80th Street","baked-goods bedding plants canned preserved crafts woodworking cut-flowers eggs herbs fresh-fruits fresh-vegetables nursery-stock soap body-care wild-harvested forest-products","","farm","homesteadhillfarming.com","-93.588959","40.189456","64679"
"Bates City","","John & Linda Fruit and Berry Farm","mo","2428 Texas Prairie Rd","cut-flowers fresh-fruits fresh-vegetables","","farm","","-94.066232","39.025235","64011"
"West Plains","","Jolliff Farm","mo","5550 County Road 1820","fresh-fruits fresh-vegetables","","farm","http://jollifffarm.wordpress.com/","-91.8615530","36.8335309","65775"
"Jefferson City","lagefarms.com","Lage Farms LLC","mo","8001 Bode Ferry Rd","red-meat non-poultry-meat","","farm","lagefarms.com","-92.089989","38.469585","65101"
"Louisiana","Www.facebook.com/lilsproutsfarm","Lil' Sprouts Farm","mo","11529 HWY NN","cut-flowers dry beans eggs herbs fresh-fruits fresh-vegetables grains flour mushrooms soap body-care wild-harvested forest-products","","farm","www.EarthSprouts.com","-91.076797","39.427775","63353"
"Brashear","www.facebook.com/lostbranchblueberryfarm","Lost Branch Blueberry Farm","mo","21507 Lost Branch Way","","@pricefamilylbbf","farm","www.lostbranchblueberries.com","-92.4550740","40.1729085","63533"
"West Plains","","Lucky Falling Star Ranch LLC","mo","12465 ST RT JJ","eggs red-meat non-poultry-meat","","farm","www.luckyfallingstarranch.com ","-91.901681","36.591597","65775"
"Salem","https://www.facebook.com/pages/Meramec-Bison-Farm-LLC/195576180525013","Meramec Bison Farm, LLC","mo","603 South Main Street","","","farm","www.meramecbison.com","-91.535215","37.638961","65560"
"Louisiana","Meyer farm","Meyer farm","mo","17819 Hwy UU","cut-flowers herbs fresh-fruits fresh-vegetables honey prepared-foods","","farm","","-91.143758","39.411628","63353"
"La Grange ","www.facebook.com/MilesFarmsMarket","Miles Farms","mo","29286 State Highway C","baked-goods herbs fresh-fruits fresh-vegetables soap body-care","https://twitter.com/Miles_Farms","farm","","-91.591174","40.048545","63448"
"Marshfield","Millers Berry Farm","Millers Berry Farm","mo","11425 Street Highway KK","fresh-fruits","","farm","","-92.927052","37.294758","65706"
"Koshkonong","","Missouri's Best Beef Co-Op","mo","Rt. 81, Box 149","","","farm","www.mobest beef.com","-91.6456994","36.5958946","65692"
"Sullivan","https://www.facebook.com/pages/Northern-Prairie-Alpacas-LLC/122810441106955?ref=bookmarks","Northern Prairie Alpacas, LLC","mo","7470 Jakes Prairie Road","","","farm","http://www.northernprairiealpacas.com/","-91.2978842","38.2798417","63080"
"Granby","https://www.facebook.com/pages/OakWoods-Farm/260088397378669","OakWoods Farm","mo","1775 Old Hwy E","bedding plants canned preserved eggs herbs fresh-fruits fresh-vegetables mushrooms","https://twitter.com/oakwoodsfarm","farm","oakwoodsfarm.com","-94.2634316","36.9352568","64844"
"Leasburg","https://www.facebook.com/Berries.Bugs.Blooms","Ozark Berry Farm","mo","552 Lick Creek","fresh-fruits","","farm","Ozarkberryfarm.com","-91.308962","38.090853","65535"
"Pierce City","www.facebook.com/hatfieldtomatofarm","Ozark Country Creations","mo","30226 Holly Rd","fresh-vegetables","","farm","","-94.0961713","36.9292199","65723"
"Wright City","","Palme Acres Farms","mo","12650 State Highway M","red-meat non-poultry-meat","","farm","http://www.palmeacres.com","-91.012318","38.785607","63390"
"West Plains","","Peace Valley Poultry","mo","8290 CR 1980","pet-food poultry fowl soap body-care","","farm","www.freshchickenandturkey.com","-91.738379","36.846826","65775"
"Napoleon","https://www.facebook.com/PlayHavenFarm","PlayHaven Farm LLC","mo","3194 Oakwood Dr.","eggs poultry fowl red-meat non-poultry-meat","","farm","http://www.playhavenfarm.com/","-94.0485164","39.0615522","64074"
"Eagle Rock ","Prier Farms Grassfed #0389","Prier Farms Grassfed #0389","mo","25717 FR 1168","","","farm","","-93.7812378","36.5594726","65641"
"Highlandville","https://www.facebook.com/pages/Purple-Gate-Farm/566680560033305","Purple Gate Farm","mo","416 Poplar Drive","eggs poultry fowl","","farm","","-93.317071","36.901720","65669"
"Seymour","","Rachel's Goat & Chicken Farm","mo","624 Stringtown Rd","eggs fresh-fruits fresh-vegetables poultry fowl red-meat non-poultry-meat soap body-care","","farm","http://www.rachelsgoatfarm.com/","-92.7887619","37.2556817","65746"
"Monett","","Rausch's Blueberries","mo","21655 Hwy H","fresh-fruits","","farm","","-93.918396","36.960386","65708"
"Malden ","https://www.facebook.com/SarasProduce","Sara's Produce","mo","37013 State Highway 25 South","canned preserved eggs fresh-vegetables honey","","farm","","-89.971274","36.527500","63863"
"Hermann","https://www.facebook.com/Schneider-Farms-162860030399928","Schneider Farms LLC","mo","1784 Doll Road","eggs poultry fowl red-meat non-poultry-meat","","farm","www.schneiderfarmsllc.com","-91.4205244","38.5912056","65041"
"Clever","https://www.facebook.com/Serendipityacresevans/","Serendipity Acres, LLC","mo","1068 S Metzletein Rd","bedding plants canned preserved crafts woodworking cut-flowers eggs fresh-fruits fresh-vegetables honey maple-products mushrooms soap body-care","","farm","","-93.4996849","37.0244265","65631"
"Platte City","http://www.facebook.com/?ref=tn_tnmn#%21/SerendipityFarmOrchard","Serendipity Farm & Orchard","mo","12780 Jantzen Ln","baked-goods canned preserved cut-flowers eggs fresh-fruits fresh-vegetables","","farm","","-94.845979","39.321550","64079"
"Gray Summit","https://www.facebook.com/pages/Seven-Gables-Farm/618425231566963?sk=timeline","Seven Gables Farm","mo","4487 Elder Road Post Office Box 216","bedding plants canned preserved crafts woodworking cut-flowers dry beans eggs fresh-fruits fresh-vegetables mushrooms nursery-stock wine spirits beer hard-cider","","farm","sevengablesfarm.com","-90.862958","38.492664","63089"
"Dittmer","www.facebook.com/StoneLeadyFarms","Stone-Leady Farms","mo","8725 N Horseshoe Rd","dairy products fresh-vegetables red-meat non-poultry-meat soap body-care","","farm","www.stoneleadyfarms.com","-90.7561350","38.1978360","63023"
"Rolla","https://www.facebook.com/TheBlueHillCo/","The Blue Hill Company, LLC","mo","19410 State Route O","baked-goods canned preserved coffee tea honey nuts soap body-care","","farm","www.thebluehillco.com","-91.743907","37.815275","65401"
"Eolia","","Thistle Hill Plantation","mo","21505 Hwy OO","crafts woodworking eggs juices ciders maple-products red-meat non-poultry-meat","","farm","thistlehillplantation.com","-96.690674","36.544949","63344"
"Forsyth","https://www.facebook.com/pages/Tri-Lakes-Orchards-LLC/279365858871273","Tri-Lakes Orchards","mo","15920 US highway 160","fresh-vegetables","","farm","www.accounting-taxpros.com","-93.032275","36.729878","65653"
"Hermann","","Wil farm","mo","1002 Highway 19","bedding plants cut-flowers eggs fresh-fruits fresh-vegetables","","farm","wilfarm.org","-91.468241","38.773117","65041"
"New Melle","https://www.facebook.com/PickingUpdate?ref=ts","Wind Ridge Farm","mo","3511 Hwy F","fresh-vegetables","HTTPS://www.twitter.com/Pickingupdate","farm","Http://www.windridgefarm.net","-90.878906","38.708905","63365"
"Arnold","https://www.facebook.com/arnoldfarmersmarket/?ref=settings","Arnold Farmers Market","mo","2400 Bradley Beach Road","organic baked goods crafts flowers eggs herbs vegetables honey jams meat nuts plants poultry prepared-foods soap coffee beans fruits pet food wild","ArnoldFarmMarket","market","https://www.arnoldmo.org/government/departments/parks-recreation/arnold-farmers-market/","-90.353093","38.453275","63010"
"Aurora","Aurora Local Farmers Market","Aurora Local Farmer's Market - Summer Market","mo","2031 S. Elliott Ave.","baked goods crafts flowers eggs herbs vegetables jams plants prepared-foods soap fruits wild","","market","","-93.7201867","36.9489080","65605"
"Belton ","https://www.facebook.com/BeltonMoFarmersMarket/","Belton Farmers Market","mo","Memorial Park","baked goods crafts flowers eggs vegetables honey jams maple soap fruits","","market","","-94.525252","38.808556","64012"
"Boonville","@BoonvilleMOFarmersMarket","Boonville Farmers Market Inc","mo","1931 Boone Village Shopping Center","baked goods crafts flowers eggs herbs vegetables honey jams meat plants poultry soap fruits mushrooms","@boonfarmmarket","market","https://boonvillemofarmersmarket.weebly.com/","-92.741591","38.955643","65233"
"Cape Girardeau","https://www.facebook.com/CapeRiverfrontMarket","Cape Riverfront Market","mo","35 S. Spanish St.","baked goods cheese crafts flowers eggs seafood herbs vegetables honey jams maple meat nuts plants prepared-foods soap trees coffee beans fruits mushrooms pet food","","market","http://www.downtowncapegirardeau.com/cape-riverfront-market/","-89.519874","37.302699","63701"
"Carrollton","https://www.facebook.com/CarrolltonFarmersMarket","Carrollton Farmers Market","mo","Carrollton Uptown Square","organic baked goods crafts eggs herbs vegetables honey jams plants prepared-foods fruits","","market","","-93.496941","39.358097","64633"
"Columbia","https://www.facebook.com/ColumbiaFarmersMarket","Columbia Farmers Market","mo","1769 West Ash Street","organic baked goods cheese crafts flowers eggs herbs vegetables honey jams meat nuts plants poultry prepared-foods soap trees coffee beans fruits juices mushrooms wild","https://twitter.com/comofarmers","market","http://columbiafarmersmarket.org","-92.364624","38.958293","65203"
"DeSoto","https://www.facebook.com/cultivatingfoodandcommunity/","De Soto Farmers' Market","mo","520 N. Main Street","baked goods crafts flowers eggs herbs vegetables honey jams meat plants poultry prepared-foods soap fruits","","market","http://www.gethealthydesoto.org","-90.552184","38.143961","63020"
"Joplin","https://www.facebook.com/JoplinEmpireMarket","Empire Market","mo","931 E 4th St","organic baked goods crafts flowers eggs herbs vegetables honey jams meat plants poultry prepared-foods soap coffee fruits mushrooms","https://twitter.com/TheEmpireMarket","market","https://downtownjoplin.com/joplin-empire-market/","-94.502691","37.087883","64801"
"Springfield","https://www.facebook.com/FMOZARKS/","Farmers Market of the Ozarks","mo","2144 E Republic Rd","organic baked goods cheese crafts flowers eggs seafood herbs vegetables honey meat nuts plants poultry prepared-foods soap wine coffee fruits grains juices mushrooms wild","https://twitter.com/FMOzarks","market","http://www.LoveYourFarmer.com","-93.255076","37.136365","65804"
"Ferguson","https://www.facebook.com/FergusonFarmersMarket/","Ferguson Farmers' Market","mo","Plaza 501, 501 S. Florissant Rd.","organic baked goods crafts flowers eggs herbs vegetables honey plants prepared-foods soap wine coffee fruits grains","","market","http://fergusonfarmersmarket.com/","-90.3027133","38.7375795","63135"
"Joplin","","Freeman Health System, West - Farmers Market","mo","1102 W 32nd Street","baked goods flowers eggs vegetables honey jams meat poultry fruits","","market","","-94.5268459","37.0526877","64801"
"Gladstone","https://www.facebook.com/pages/Gladstone-Farmers-Market/107406389284555?fref=ts","Gladstone Farmers' Market","mo","602 NE 70th Street","baked goods crafts flowers eggs herbs vegetables honey jams meat plants beans fruits","","market","http://www.gladstone.mo.us/farmersmarket/","-94.5730016","39.2214548","64118"
"Hillsboro","","Hillsboro Farmers Market","mo","5137 Glade Chapel Road","baked goods vegetables honey jams meat plants poultry soap trees fruits juices mushrooms","","market","http://www.kressfarm.org","-90.566655","38.232278","63050"
"Holden","https://www.facebook.com/holdenmarket","Holden MO Farmer's Market","mo","101 S Market St.","baked goods crafts vegetables jams plants prepared-foods soap fruits pet food wild","","market","","-93.9908869","38.7186566","64040"
"Independence ","","INDEPENDENCE UPTOWN MARKET","mo","211 W. Truman Rd.","baked goods crafts flowers eggs vegetables honey jams meat nuts plants soap fruits","","market","http://independenceuptownmarket.com","-94.418179","39.093845","64050"
"Jackson ","Jackson Farmers Market","Jackson (MO) Farmers Market","mo","252 E. Jackson Blvd.","baked goods crafts eggs herbs vegetables honey jams maple nuts plants soap fruits","","market","","-89.6659726","37.3778137","63755"
"Kirksville","Kirksville Kiwanis Farmers' Market","Kirksville Kiwanis Farmers' Market","mo","100 North Elson Street","baked goods crafts flowers eggs herbs vegetables honey jams meat plants poultry prepared-foods soap trees fruits juices","","market","","-92.584293","40.195114","63501"
"Seymour","https://www.facebook.com/PleasantValleyFamilyFarm/","Little Farm Store Market","mo","520 Lucky Road","baked goods crafts flowers eggs herbs vegetables honey jams plants prepared-foods soap coffee fruits mushrooms","","market","","-92.680159","37.118045","65746"
"Louisiana ","Louisiana Community Betterment Farmers Market","Louisiana Community Betterment Farmer's Market","mo","Sunset Park, Georgia Street","baked goods crafts flowers eggs herbs vegetables honey jams maple nuts plants prepared-foods soap fruits juices","","market","","-91.062659","39.441188","63353"
"University City","https://www.facebook.com/Midtown-Farmers-Market-655879797806495/","Midtown Farmers Market","mo","6655 Delmar Blvd, Back Lot","organic baked goods cheese crafts flowers eggs seafood herbs vegetables honey jams meat nuts plants poultry prepared-foods soap trees coffee fruits juices mushrooms pet food wild","https://twitter.com/MidtownFmsMkt","market","http://www.midwestfarmersmarkets.org/markets/midtown-farmers-market/","-90.307251","38.656378","63130"
"Downtown Neosho","https://www.facebook.com/NeoshoFarmersMarket","Neosho Farmers Market","mo","Spring & Jefferson St","baked goods cheese crafts flowers eggs herbs vegetables honey meat plants poultry prepared-foods soap trees coffee fruits juices","","market","http://neoshofarmersmarket@gmail.com","-94.370028","36.870009","64850"
"Parkville","https://www.facebook.com/pages/Parkville-Farmers-Market","Parkville Farmers' Market","mo","English Landing Park, off Hwy 9 in Parkville MO","baked goods crafts flowers eggs herbs vegetables honey jams meat plants prepared-foods soap coffee fruits wild","","market","http://www.parkvillefarmersmarket.com","-94.683086","39.187828",""
"Rogersville","https://www.facebook.com/rogersvillefriendsofthepark/","Rogersville Farmer's Market","mo","270 County Line Road","baked goods crafts flowers eggs herbs vegetables honey jams meat plants poultry prepared-foods soap trees coffee fruits juices mushrooms pet food","","market","","-93.066381","37.115153","65741"
"Sedalia, MO","https://www.facebook.com/SedaliaFarmersMarket/","Sedalia Area Farmers' Market","mo","2233 W 16th St","baked goods crafts flowers eggs herbs vegetables honey jams meat plants poultry prepared-foods soap coffee beans fruits grains juices mushrooms pet food wild","","market","http://www.sedaliaareafarmersmarket.com/","-93.255481","38.698011","65301"
"St. Joseph ","Southside Junction Farmers Market","South St. Joseph Farmers Market at the Junction","mo","Lake & Illinois Avenues","baked goods crafts flowers eggs herbs vegetables honey jams nuts plants prepared-foods soap fruits juices mushrooms pet food wild","","market","","-94.865955","39.718654","64504"
"Nevada","Nevada Vernon County Farmers Market","Vernon County Farmers Market","mo","PO Box 873","baked goods flowers eggs herbs vegetables honey jams meat plants poultry soap fruits pet food","","market","","-94.340102","37.843772","64772"
"West Plains","www.facebook.com/WestPlainsAreaFarmersMarket/","West Plains Area Farmers' Market","mo","1380 Bill Virdon Blvd.","organic baked goods crafts eggs herbs vegetables honey jams plants poultry soap fruits","","market","","-91.835774","36.723987","65775"
