235	39	999	Statewide	61	Business schools and computer and management training	39	6114	235.40000000000003	1067.4	64020.60000000001
236	39	999	Statewide	61	Colleges, universities, and professional schools	39	6113	157.9	36868.600000000006	931529.2000000001
237	39	999	Statewide	61	Educational support services	39	6117	206.04999999999998	1403.8000000000004	43424.40000000001
238	39	999	Statewide	61	Elementary and secondary schools	39	6111	859.6000000000003	33186.399999999994	1074116.8000000003
239	39	999	Statewide	61	Junior colleges	39	6112	62.0	2633.3999999999996	84295.8
240	39	999	Statewide	61	Other schools and instruction	39	6116	1270.45	9188.399999999998	158292.59999999998
241	39	999	Statewide	61	Technical and trade schools	39	6115	296.00000000000006	3067.4	109344.0
242	39	999	Statewide	62	Child day care services	39	6244	2593.6999999999994	31872.600000000006	572086.4
243	39	999	Statewide	62	Community food and housing, and emergency and other relief services	39	6242	553.4000000000001	6137.400000000001	187959.00000000006
244	39	999	Statewide	62	Continuing care retirement communities and assisted living facilities for the elderly	39	6233	623.2000000000002	37396.799999999996	895511.7999999999
245	39	999	Statewide	62	General medical and surgical hospitals	39	6221	188.8	144783.19999999998	8208841.8
246	39	999	Statewide	62	Home health care services	39	6216	1381.5666666666664	63276.600000000006	1485126.1999999997
247	39	999	Statewide	62	Individual and family services	39	6241	2360.3999999999996	53078.600000000006	1175008.8000000003
248	39	999	Statewide	62	Medical and diagnostic laboratories	39	6215	437.03333333333325	5256.999999999999	334719.19999999995
249	39	999	Statewide	62	Nursing care facilities (skilled nursing facilities)	39	6231	950.0	86484.59999999999	2247998.9999999995
250	39	999	Statewide	62	Offices of dentists	39	6212	4252.000000000001	31547.00000000001	1471154.2
251	39	999	Statewide	62	Offices of other health practitioners	39	6213	4499.000000000002	29848.8	1077198.8
252	39	999	Statewide	62	Offices of physicians	39	6211	6986.200000000004	90995.90000000001	7968772.649999999
253	39	999	Statewide	62	Other ambulatory health care services	39	6219	353.18333333333334	8916.699999999999	328055.39999999997
254	39	999	Statewide	62	Other residential care facilities	39	6239	151.6	2392.8	75863.2
255	39	999	Statewide	62	Outpatient care centers	39	6214	1361.5333333333335	26775.0	1165259.9999999995
256	39	999	Statewide	62	Psychiatric and substance abuse hospitals	39	6222	22.2	846.2	52012.6
257	39	999	Statewide	62	Residential intellectual and developmental disability, mental health, and substance abuse facilities	39	6232	1675.4	24413.600000000006	584304.7999999999
258	39	999	Statewide	62	Specialty (except psychiatric and substance abuse) hospitals	39	6223	48.599999999999994	4636.0	218634.19999999998
259	39	999	Statewide	62	Vocational rehabilitation services	39	6243	330.3499999999999	12655.600000000006	162689.00000000003
260	39	999	Statewide	71	Agents and managers for artists, athletes, entertainers, and other public figures	39	7114	53.33333333333333	120.6	18149.399999999998
261	39	999	Statewide	71	Amusement parks and arcades	39	7131	140.85000000000002	1023.0666666666668	13431.866666666669
262	39	999	Statewide	71	Gambling industries	39	7132	47.833333333333336	77.89999999999999	2435.2
263	39	999	Statewide	71	Independent artists, writers, and performers	39	7115	219.45	394.19999999999993	16986.800000000003
264	39	999	Statewide	71	Museums, historical sites, and similar institutions	39	7121	261.90000000000003	5154.600000000001	151162.4
265	39	999	Statewide	71	Other amusement and recreation industries	39	7139	2531.4	37771.80000000001	663980.8
266	39	999	Statewide	71	Performing arts companies	39	7111	171.66666666666666	2331.4	83219.59999999999
267	39	999	Statewide	71	Promoters of performing arts, sports, and similar events	39	7113	284.20000000000005	2258.6	64183.6
268	39	999	Statewide	71	Spectator sports	39	7112	136.33333333333334	5498.000000000002	822169.0999999999
269	39	999	Statewide	72	Drinking places (alcoholic beverages)	39	7224	2038.7500000000002	12460.199999999999	163941.00000000003
270	39	999	Statewide	72	RV (recreational vehicle) parks and recreational camps	39	7212	232.20000000000002	285.20000000000016	12890.199999999999
271	39	999	Statewide	72	Restaurants and other eating places	39	7225	18631.000000000004	385773.40000000014	5296791.199999999
272	39	999	Statewide	72	Rooming and boarding houses	39	7213	61.51666666666668	96.4	1954.0
273	39	999	Statewide	72	Special food services	39	7223	1385.3000000000006	15989.600000000004	328233.2000000001
274	39	999	Statewide	72	Traveler accommodation	39	7211	1400.8500000000004	33526.200000000004	679499.8000000002
275	39	999	Statewide	81	Automotive repair and maintenance	39	8111	5499.2	29632.400000000005	978948.2
276	39	999	Statewide	81	Business, professional, labor, political, and similar organizations	39	8139	2024.4000000000005	14901.999999999998	554715.9999999999
277	39	999	Statewide	81	Civic and social organizations	39	8134	1490.0	11592.399999999998	183825.80000000005
278	39	999	Statewide	81	Commercial and industrial machinery and equipment (except automotive and electronic) repair and maintenance	39	8113	853.4999999999998	6917.2	368473.60000000003
279	39	999	Statewide	81	Death care services	39	8122	1144.0	6568.0	223857.4000000001
280	39	999	Statewide	81	Drycleaning and laundry services	39	8123	959.0000000000005	8646.199999999999	224421.39999999997
281	39	999	Statewide	81	Electronic and precision equipment repair and maintenance	39	8112	400.6	2325.7999999999997	104090.39999999997
282	39	999	Statewide	81	Grantmaking and giving services	39	8132	699.7333333333333	4711.800000000001	271913.80000000005
283	39	999	Statewide	81	Other personal services	39	8129	1298.2500000000005	8068.0	141260.44999999998
284	39	999	Statewide	81	Personal and household goods repair and maintenance	39	8114	536.3833333333332	1637.15	53211.25
285	39	999	Statewide	81	Personal care services	39	8121	4258.6	28333.000000000004	528666.2000000001
286	39	999	Statewide	81	Religious organizations	39	8131	7968.4	64605.80000000001	1206781.2
287	39	999	Statewide	81	Social advocacy organizations	39	8133	480.6	3161.0	98363.2
