37636	47	47	0	Tennessee	623210	Residential intellectual and developmental disability facilities	62	512.4	11230.4	233156.8
37637	47	47	0	Tennessee	623220	Residential mental health and substance abuse facilities	62	131.8	6728.0	170980.8
37638	47	47	0	Tennessee	623311	Continuing care retirement communities	62	84.0	5585.4	147716.8
37639	47	47	0	Tennessee	623312	Assisted living facilities for the elderly	62	249.4	7133.8	155941.2
37640	47	47	0	Tennessee	623990	Other residential care facilities	62	81.2	2254.6	58549.4
37641	47	47	0	Tennessee	624110	Child and youth services	62	169.2	2043.8	61577.2
37642	47	47	0	Tennessee	624120	Services for the elderly and persons with disabilities	62	484.8	17311.0	295904.4
37643	47	47	0	Tennessee	624190	Other individual and family services	62	458.0	5589.2	152163.8
37644	47	47	0	Tennessee	624210	Community food services	62	50.6	487.8	15109.0
37645	47	47	0	Tennessee	624221	Temporary shelters	62	75.8	782.2	20625.2
37646	47	47	0	Tennessee	624229	Other community housing services	62	98.0	785.2	24126.8
37647	47	47	0	Tennessee	624230	Emergency and other relief services	62	33.8	414.6	16452.8
37648	47	47	0	Tennessee	624310	Vocational rehabilitation services	62	110.4	2727.0	52044.0
37649	47	47	0	Tennessee	624410	Child day care services	62	1358.0	16485.6	267535.4
37650	47	47	0	Tennessee	711110	Theater companies and dinner theaters	71	56.0	1310.6	33706.6
37651	47	47	0	Tennessee	711120	Dance companies	71	6.8	136.2	3646.4
37652	47	47	0	Tennessee	711130	Musical groups and artists	71	386.4	3119.6	350501.4
37653	47	47	0	Tennessee	711190	Other performing arts companies	71	5.6	27.2	1712.6
37654	47	47	0	Tennessee	711211	Sports teams and clubs	71	14.0	1246.0	337773.4
37655	47	47	0	Tennessee	711212	Racetracks	71	9.6	30.6	1598.0
37656	47	47	0	Tennessee	711219	Other spectator sports	71	20.4	92.2	3683.0
37657	47	47	0	Tennessee	711310	Promoters of performing arts, sports, and similar events with facilities	71	50.2	1298.6	32046.0
37658	47	47	0	Tennessee	711320	Promoters of performing arts, sports, and similar events without facilities	71	94.8	420.0	27495.4
37659	47	47	0	Tennessee	711410	Agents and managers for artists, athletes, entertainers, and other public figures	71	150.0	760.4	99750.6
37660	47	47	0	Tennessee	711510	Independent artists, writers, and performers	71	285.0	843.4	52239.4
37661	47	47	0	Tennessee	712110	Museums	71	96.0	1714.0	49027.6
37662	47	47	0	Tennessee	712120	Historical sites	71	27.4	414.2	11111.8
37663	47	47	0	Tennessee	712130	Zoos and botanical gardens	71	12.0	1094.6	27147.4
37664	47	47	0	Tennessee	712190	Nature parks and other similar institutions	71	16.6	261.0	6696.6
37665	47	47	0	Tennessee	713110	Amusement and theme parks	71	6.8	301.2	7696.4
37666	47	47	0	Tennessee	713120	Amusement arcades	71	47.2	975.4	14570.8
37667	47	47	0	Tennessee	713290	Other gambling industries	71	7.8	0.0	0.0
37668	47	47	0	Tennessee	713910	Golf courses and country clubs	71	198.8	4390.2	109025.2
37669	47	47	0	Tennessee	713920	Skiing facilities	71	1.8	0.0	0.0
37670	47	47	0	Tennessee	713930	Marinas	71	100.0	518.0	17871.4
37671	47	47	0	Tennessee	713940	Fitness and recreational sports centers	71	527.4	9102.6	109486.2
37672	47	47	0	Tennessee	713950	Bowling centers	71	46.2	1097.0	14935.6
37673	47	47	0	Tennessee	713990	All other amusement and recreation industries	71	284.6	2188.4	41845.8
37674	47	47	0	Tennessee	721110	Hotels (except casino hotels) and motels	72	1301.4	29420.4	662910.6
37675	47	47	0	Tennessee	721120	Casino hotels	72	1.0	0.0	0.0
37676	47	47	0	Tennessee	721191	Bed-and-breakfast inns	72	28.6	145.8	3395.4
37677	47	47	0	Tennessee	721199	All other traveler accommodation	72	55.2	281.2	7231.8
37678	47	47	0	Tennessee	721211	RV (recreational vehicle) parks and campgrounds	72	82.2	362.4	8772.6
37679	47	47	0	Tennessee	721214	Recreational and vacation camps (except campgrounds)	72	61.4	407.2	9222.0
37680	47	47	0	Tennessee	721310	Rooming and boarding houses	72	23.8	53.8	1442.2
37681	47	47	0	Tennessee	722310	Food service contractors	72	393.2	4194.2	83412.4
37682	47	47	0	Tennessee	722320	Caterers	72	178.6	1580.4	28777.4
37683	47	47	0	Tennessee	722330	Mobile food services	72	41.4	53.0	1173.4
37684	47	47	0	Tennessee	722410	Drinking places (alcoholic beverages)	72	333.8	3897.8	77889.4
37685	47	47	0	Tennessee	722511	Full-service restaurants	72	4363.4	105868.4	1769477.6
37686	47	47	0	Tennessee	722513	Limited-service restaurants	72	4704.6	96991.0	1246162.0
37687	47	47	0	Tennessee	722514	Cafeterias, grill buffets, and buffets	72	156.2	2848.2	38188.0
37688	47	47	0	Tennessee	722515	Snack and nonalcoholic beverage bars	72	654.0	7293.6	101293.2
37689	47	47	0	Tennessee	811111	General automotive repair	81	1190.0	5074.4	175225.4
37690	47	47	0	Tennessee	811112	Automotive exhaust system repair	81	44.0	111.0	3159.8
37691	47	47	0	Tennessee	811113	Automotive transmission repair	81	105.8	390.0	14409.8
37692	47	47	0	Tennessee	811118	Other automotive mechanical and electrical repair and maintenance	81	71.4	259.0	7583.2
37693	47	47	0	Tennessee	811121	Automotive body, paint, and interior repair and maintenance	81	598.6	4076.4	174331.0
37694	47	47	0	Tennessee	811122	Automotive glass replacement shops	81	93.0	525.8	20932.0
37695	47	47	0	Tennessee	811191	Automotive oil change and lubrication shops	81	202.0	1473.6	32906.4
37696	47	47	0	Tennessee	811192	Car washes	81	255.4	1978.6	34311.2
37697	47	47	0	Tennessee	811198	All other automotive repair and maintenance	81	49.0	303.2	11397.4
37698	47	47	0	Tennessee	811211	Consumer electronics repair and maintenance	81	24.6	113.8	4264.8
37699	47	47	0	Tennessee	811212	Computer and office machine repair and maintenance	81	81.6	1742.6	70776.0
37700	47	47	0	Tennessee	811213	Communication equipment repair and maintenance	81	37.6	405.6	22105.2
37701	47	47	0	Tennessee	811219	Other electronic and precision equipment repair and maintenance	81	57.8	415.6	19032.8
37702	47	47	0	Tennessee	811310	Commercial and industrial machinery and equipment (except automotive and electronic) repair and maintenance	81	310.4	2803.6	128055.2
37703	47	47	0	Tennessee	811411	Home and garden equipment repair and maintenance	81	45.6	119.6	3195.0
37704	47	47	0	Tennessee	811412	Appliance repair and maintenance	81	65.4	299.6	9714.2
37705	47	47	0	Tennessee	811420	Reupholstery and furniture repair	81	45.6	122.4	4192.8
37706	47	47	0	Tennessee	811430	Footwear and leather goods repair	81	15.8	13.4	544.4
37707	47	47	0	Tennessee	811490	Other personal and household goods repair and maintenance	81	120.8	366.8	9794.8
37708	47	47	0	Tennessee	812111	Barber shops	81	44.0	284.0	8245.0
37709	47	47	0	Tennessee	812112	Beauty salons	81	1031.4	6927.4	161345.6
37710	47	47	0	Tennessee	812113	Nail salons	81	120.4	327.4	6604.0
37711	47	47	0	Tennessee	812191	Diet and weight reducing centers	81	70.8	578.6	10325.2
37712	47	47	0	Tennessee	812199	Other personal care services	81	276.4	2201.2	36885.0
37713	47	47	0	Tennessee	812210	Funeral homes and funeral services	81	381.8	3020.2	101266.0
37714	47	47	0	Tennessee	812220	Cemeteries and crematories	81	120.4	779.2	25739.4
37715	47	47	0	Tennessee	812310	Coin-operated laundries and drycleaners	81	114.4	453.0	8933.6
37716	47	47	0	Tennessee	812320	Drycleaning and laundry services (except coin-operated)	81	343.4	2485.4	44997.4
37717	47	47	0	Tennessee	812331	Linen supply	81	26.4	856.0	27603.8
37718	47	47	0	Tennessee	812332	Industrial launderers	81	38.6	1510.2	64005.0
37719	47	47	0	Tennessee	812910	Pet care (except veterinary) services	81	248.4	1359.4	25542.6
37720	47	47	0	Tennessee	812921	Photofinishing laboratories (except one-hour)	81	13.2	378.0	10043.4
37721	47	47	0	Tennessee	812922	One-hour photofinishing	81	3.6	13.6	260.8
37722	47	47	0	Tennessee	812930	Parking lots and garages	81	171.4	2514.4	40829.8
37723	47	47	0	Tennessee	812990	All other personal services	81	172.0	706.8	15204.8
37724	47	47	0	Tennessee	813110	Religious organizations	81	5650.6	49895.0	953736.4
37725	47	47	0	Tennessee	813211	Grantmaking foundations	81	176.6	673.6	38995.0
37726	47	47	0	Tennessee	813212	Voluntary health organizations	81	102.4	1472.2	91812.0
37727	47	47	0	Tennessee	813219	Other grantmaking and giving services	81	81.6	604.2	25686.4
37728	47	47	0	Tennessee	813311	Human rights organizations	81	65.0	242.2	14293.0
37729	47	47	0	Tennessee	813312	Environment, conservation and wildlife organizations	81	117.2	1018.0	43505.2
37730	47	47	0	Tennessee	813319	Other social advocacy organizations	81	100.2	509.4	19031.0
37731	47	47	0	Tennessee	813410	Civic and social organizations	81	404.0	2702.4	68506.6
37732	47	47	0	Tennessee	813910	Business associations	81	271.2	2050.8	129978.2
37733	47	47	0	Tennessee	813920	Professional organizations	81	114.2	806.2	56086.4
37734	47	47	0	Tennessee	813930	Labor unions and similar labor organizations	81	247.0	1793.2	41272.8
37735	47	47	0	Tennessee	813940	Political organizations	81	24.0	60.4	2278.2
37736	47	47	0	Tennessee	813990	Other similar organizations (except business, professional, labor, and political organizations)	81	154.4	967.4	26282.6
