	id	state	COUNTY	GEO_TTL	relevant_naics	NAICS2012_TTL	NAICS_Sector	estab	emp	payann
36796	47	47	0	Tennessee	113110	Timber tract operations	11	6.4	5.0	866.6
36797	47	47	0	Tennessee	113310	Logging	11	138.2	781.2	23501.4
36798	47	47	0	Tennessee	114111	Finfish fishing	11	1.25	0.0	0.0
36799	47	47	0	Tennessee	114210	Hunting and trapping	11	2.6	2.8	86.8
36800	47	47	0	Tennessee	115111	Cotton ginning	11	5.8	18.4	1924.4
36801	47	47	0	Tennessee	115112	Soil preparation, planting, and cultivating	11	12.6	53.2	11898.0
36802	47	47	0	Tennessee	115113	Crop harvesting, primarily by machine	11	1.25	0.0	0.0
36803	47	47	0	Tennessee	115114	Postharvest crop activities (except cotton ginning)	11	4.0	0.0	0.0
36804	47	47	0	Tennessee	115115	Farm labor contractors and crew leaders	11	1.4	0.0	0.0
36805	47	47	0	Tennessee	115116	Farm management services	11	7.4	20.4	642.6
36806	47	47	0	Tennessee	115210	Support activities for animal production	11	46.0	127.6	3908.6
36807	47	47	0	Tennessee	115310	Support activities for forestry	11	11.4	281.0	2736.8
36808	47	47	0	Tennessee	211111	Crude petroleum and natural gas extraction	21	12.2	142.4	10964.4
36809	47	47	0	Tennessee	211112	Natural gas liquid extraction	21	1.0	0.0	0.0
36810	47	47	0	Tennessee	212111	Bituminous coal and lignite surface mining	21	5.6	12.8	513.4
36811	47	47	0	Tennessee	212112	Bituminous coal underground mining	21	2.6	0.0	0.0
36812	47	47	0	Tennessee	212231	Lead ore and zinc ore mining	21	2.0	0.0	0.0
36813	47	47	0	Tennessee	212234	Copper ore and nickel ore mining	21	1.0	0.0	0.0
36814	47	47	0	Tennessee	212311	Dimension stone mining and quarrying	21	4.2	8.6	490.6
36815	47	47	0	Tennessee	212312	Crushed and broken limestone mining and quarrying	21	96.8	508.4	26474.2
36816	47	47	0	Tennessee	212319	Other crushed and broken stone mining and quarrying	21	7.2	80.4	3462.4
36817	47	47	0	Tennessee	212321	Construction sand and gravel mining	21	21.6	202.0	8040.8
36818	47	47	0	Tennessee	212322	Industrial sand mining	21	4.0	102.8	6152.8
36819	47	47	0	Tennessee	212324	Kaolin and ball clay mining	21	3.2	64.6	3633.6
36820	47	47	0	Tennessee	212399	All other nonmetallic mineral mining	21	1.6	0.0	0.0
36821	47	47	0	Tennessee	213111	Drilling oil and gas wells	21	14.2	33.6	3136.0
36822	47	47	0	Tennessee	213112	Support activities for oil and gas operations	21	16.0	53.0	3523.4
36823	47	47	0	Tennessee	213113	Support activities for coal mining	21	4.4	15.0	833.4
36824	47	47	0	Tennessee	213114	Support activities for metal mining	21	1.0	0.0	0.0
36825	47	47	0	Tennessee	213115	Support activities for nonmetallic minerals (except fuels) mining	21	4.8	25.4	1200.4
36826	47	47	0	Tennessee	221111	Hydroelectric power generation	22	1.4	0.0	0.0
36827	47	47	0	Tennessee	221112	Fossil fuel electric power generation	22	1.0	0.0	0.0
36828	47	47	0	Tennessee	221113	Nuclear electric power generation	22	1.0	0.0	0.0
36829	47	47	0	Tennessee	221114	Solar electric power generation	22	1.0	0.0	0.0
36830	47	47	0	Tennessee	221115	Wind electric power generation	22	1.0	0.0	0.0
36831	47	47	0	Tennessee	221118	Other electric power generation	22	1.2	0.0	0.0
36832	47	47	0	Tennessee	221122	Electric power distribution	22	84.0	2300.0	155026.0
36833	47	47	0	Tennessee	221210	Natural gas distribution	22	26.2	227.6	17026.6
36834	47	47	0	Tennessee	221310	Water supply and irrigation systems	22	17.2	206.0	9774.2
36835	47	47	0	Tennessee	221320	Sewage treatment facilities	22	9.6	99.4	4558.6
36836	47	47	0	Tennessee	221330	Steam and air-conditioning supply	22	1.0	0.0	0.0
36837	47	47	0	Tennessee	236115	New single-family housing construction (except for-sale builders)	23	687.4	2340.8	98157.2
36838	47	47	0	Tennessee	236116	New multifamily housing construction (except for-sale builders)	23	28.2	253.2	20162.6
36839	47	47	0	Tennessee	236117	New housing for-sale builders	23	285.8	1488.2	103896.4
36840	47	47	0	Tennessee	236118	Residential remodelers	23	904.0	3868.8	163411.6
36841	47	47	0	Tennessee	236210	Industrial building construction	23	54.4	6664.2	284974.0
36842	47	47	0	Tennessee	236220	Commercial and institutional building construction	23	620.6	8878.8	570490.2
36843	47	47	0	Tennessee	237110	Water and sewer line and related structures construction	23	202.4	2311.2	104269.2
36844	47	47	0	Tennessee	237120	Oil and gas pipeline and related structures construction	23	28.0	556.0	53513.0
36845	47	47	0	Tennessee	237130	Power and communication line and related structures construction	23	112.8	4991.6	264558.6
36846	47	47	0	Tennessee	237210	Land subdivision	23	97.8	472.6	31596.2
36847	47	47	0	Tennessee	237310	Highway, street, and bridge construction	23	177.8	4963.6	272299.8
36848	47	47	0	Tennessee	237990	Other heavy and civil engineering construction	23	74.6	888.8	45032.8
36849	47	47	0	Tennessee	238110	Poured concrete foundation and structure contractors	23	279.6	2978.0	135510.4
36850	47	47	0	Tennessee	238120	Structural steel and precast concrete contractors	23	63.0	1512.0	80576.0
36851	47	47	0	Tennessee	238130	Framing contractors	23	121.6	706.2	24305.2
36852	47	47	0	Tennessee	238140	Masonry contractors	23	236.2	2546.0	90943.0
36853	47	47	0	Tennessee	238150	Glass and glazing contractors	23	83.4	877.8	42340.4
36854	47	47	0	Tennessee	238160	Roofing contractors	23	309.0	3442.8	143697.8
36855	47	47	0	Tennessee	238170	Siding contractors	23	124.2	681.4	28324.6
36856	47	47	0	Tennessee	238190	Other foundation, structure, and building exterior contractors	23	58.6	420.6	17291.4
36857	47	47	0	Tennessee	238210	Electrical contractors and other wiring installation contractors	23	1023.2	14797.4	738261.6
36858	47	47	0	Tennessee	238220	Plumbing, heating, and air-conditioning contractors	23	1477.2	16640.8	798942.2
36859	47	47	0	Tennessee	238290	Other building equipment contractors	23	152.8	3061.0	184821.8
36860	47	47	0	Tennessee	238310	Drywall and insulation contractors	23	242.6	2582.0	105810.2
36861	47	47	0	Tennessee	238320	Painting and wall covering contractors	23	320.0	2058.6	79503.4
36862	47	47	0	Tennessee	238330	Flooring contractors	23	166.0	868.8	36573.2
36863	47	47	0	Tennessee	238340	Tile and terrazzo contractors	23	119.4	628.8	21636.8
36864	47	47	0	Tennessee	238350	Finish carpentry contractors	23	271.0	1445.0	55455.6
36865	47	47	0	Tennessee	238390	Other building finishing contractors	23	120.4	1287.4	49111.2
36866	47	47	0	Tennessee	238910	Site preparation contractors	23	578.0	5012.0	230042.8
36867	47	47	0	Tennessee	238990	All other specialty trade contractors	23	403.6	2983.2	132929.4
36868	47	47	0	Tennessee	311111	Dog and cat food manufacturing	31	4.6	217.8	12675.0
36869	47	47	0	Tennessee	311119	Other animal food manufacturing	31	13.0	388.4	19384.0
36870	47	47	0	Tennessee	311211	Flour milling	31	4.2	0.0	0.0
36871	47	47	0	Tennessee	311212	Rice milling	31	1.0	0.0	0.0
36872	47	47	0	Tennessee	311221	Wet corn milling	31	2.0	0.0	0.0
36873	47	47	0	Tennessee	311224	Soybean and other oilseed processing	31	1.8	0.0	0.0
36874	47	47	0	Tennessee	311225	Fats and oils refining and blending	31	6.2	220.6	10419.6
36875	47	47	0	Tennessee	311230	Breakfast cereal manufacturing	31	2.0	0.0	0.0
36876	47	47	0	Tennessee	311340	Nonchocolate confectionery manufacturing	31	11.2	1177.8	54684.6
36877	47	47	0	Tennessee	311351	Chocolate and confectionery manufacturing from cacao beans	31	6.4	27.4	572.0
36878	47	47	0	Tennessee	311352	Confectionery manufacturing from purchased chocolate	31	19.0	1286.8	57024.0
36879	47	47	0	Tennessee	311411	Frozen fruit, juice, and vegetable manufacturing	31	1.2	0.0	0.0
36880	47	47	0	Tennessee	311412	Frozen specialty food manufacturing	31	5.2	1145.8	64545.4
36881	47	47	0	Tennessee	311421	Fruit and vegetable canning	31	13.0	694.6	38994.4
36882	47	47	0	Tennessee	311422	Specialty canning	31	2.0	0.0	0.0
36883	47	47	0	Tennessee	311423	Dried and dehydrated food manufacturing	31	1.0	0.0	0.0
36884	47	47	0	Tennessee	311511	Fluid milk manufacturing	31	7.4	1230.4	64232.0
36885	47	47	0	Tennessee	311513	Cheese manufacturing	31	6.8	99.4	5918.8
36886	47	47	0	Tennessee	311514	Dry, condensed, and evaporated dairy product manufacturing	31	1.0	0.0	0.0
36887	47	47	0	Tennessee	311520	Ice cream and frozen dessert manufacturing	31	5.8	379.2	16155.0
36888	47	47	0	Tennessee	311611	Animal (except poultry) slaughtering	31	27.2	685.8	23207.0
36889	47	47	0	Tennessee	311612	Meat processed from carcasses	31	19.8	3163.6	107911.6
36890	47	47	0	Tennessee	311613	Rendering and meat byproduct processing	31	5.6	137.2	8422.6
36891	47	47	0	Tennessee	311615	Poultry processing	31	9.2	5889.0	170855.4
36892	47	47	0	Tennessee	311710	Seafood product preparation and packaging	31	1.6	2.0	120.6
36893	47	47	0	Tennessee	311811	Retail bakeries	31	52.4	457.2	6930.0
36894	47	47	0	Tennessee	311812	Commercial bakeries	31	36.0	2424.8	112103.6
36895	47	47	0	Tennessee	311813	Frozen cakes, pies, and other pastries manufacturing	31	3.2	110.2	2673.4
36896	47	47	0	Tennessee	311821	Cookie and cracker manufacturing	31	4.2	139.2	13879.4
36897	47	47	0	Tennessee	311824	Dry pasta, dough, and flour mixes manufacturing from purchased flour	31	10.4	1440.0	91313.8
36898	47	47	0	Tennessee	311830	Tortilla manufacturing	31	1.0	0.0	0.0
36899	47	47	0	Tennessee	311911	Roasted nuts and peanut butter manufacturing	31	1.0	0.0	0.0
36900	47	47	0	Tennessee	311919	Other snack food manufacturing	31	5.2	0.0	0.0
36901	47	47	0	Tennessee	311920	Coffee and tea manufacturing	31	9.0	451.2	28787.0
36902	47	47	0	Tennessee	311930	Flavoring syrup and concentrate manufacturing	31	1.4	0.0	0.0
36903	47	47	0	Tennessee	311941	Mayonnaise, dressing, and other prepared sauce manufacturing	31	6.0	306.8	13388.8
36904	47	47	0	Tennessee	311942	Spice and extract manufacturing	31	3.4	34.8	1195.2
36905	47	47	0	Tennessee	311991	Perishable prepared food manufacturing	31	8.6	674.8	27512.4
36906	47	47	0	Tennessee	311999	All other miscellaneous food manufacturing	31	7.2	113.4	7064.4
36907	47	47	0	Tennessee	312111	Soft drink manufacturing	31	14.8	1286.8	66122.6
36908	47	47	0	Tennessee	312112	Bottled water manufacturing	31	7.0	86.4	4097.0
36909	47	47	0	Tennessee	312113	Ice manufacturing	31	5.4	39.8	1798.0
36910	47	47	0	Tennessee	312120	Breweries	31	26.4	289.4	14272.8
36911	47	47	0	Tennessee	312130	Wineries	31	26.8	192.4	5063.6
36912	47	47	0	Tennessee	312140	Distilleries	31	17.0	693.2	41737.0
36913	47	47	0	Tennessee	312230	Tobacco manufacturing	31	7.0	829.0	56709.0
36914	47	47	0	Tennessee	313110	Fiber, yarn, and thread mills	31	8.8	926.0	35172.8
36915	47	47	0	Tennessee	313210	Broadwoven fabric mills	31	2.2	5.0	411.0
36916	47	47	0	Tennessee	313220	Narrow fabric mills and schiffli machine embroidery	31	1.6	0.0	0.0
36917	47	47	0	Tennessee	313230	Nonwoven fabric mills	31	8.4	672.6	39843.0
36918	47	47	0	Tennessee	313240	Knit fabric mills	31	4.2	54.8	1755.8
36919	47	47	0	Tennessee	313310	Textile and fabric finishing mills	31	17.0	177.0	6184.4
36920	47	47	0	Tennessee	313320	Fabric coating mills	31	6.8	398.8	18452.2
36921	47	47	0	Tennessee	314110	Carpet and rug mills	31	8.0	256.0	10528.0
36922	47	47	0	Tennessee	314120	Curtain and linen mills	31	33.6	117.2	5625.6
36923	47	47	0	Tennessee	314910	Textile bag and canvas mills	31	28.2	669.4	20324.2
36924	47	47	0	Tennessee	314994	Rope, cordage, twine, tire cord, and tire fabric mills	31	4.4	0.0	0.0
36925	47	47	0	Tennessee	314999	All other miscellaneous textile product mills	31	61.2	647.2	20494.4
36926	47	47	0	Tennessee	315110	Hosiery and sock mills	31	4.4	768.4	21585.4
36927	47	47	0	Tennessee	315190	Other apparel knitting mills	31	4.8	0.0	0.0
36928	47	47	0	Tennessee	315210	Cut and sew apparel contractors	31	31.2	667.4	10994.6
36929	47	47	0	Tennessee	315220	Men's and boys' cut and sew apparel manufacturing	31	21.0	1537.0	41887.2
36930	47	47	0	Tennessee	315240	Women's, girls', and infants' cut and sew apparel manufacturing	31	12.2	100.4	2494.8
36931	47	47	0	Tennessee	315280	Other cut and sew apparel manufacturing	31	7.2	138.0	3678.2
36932	47	47	0	Tennessee	315990	Apparel accessories and other apparel manufacturing	31	11.0	59.8	2153.4
36933	47	47	0	Tennessee	316110	Leather and hide tanning and finishing	31	2.2	0.0	0.0
36934	47	47	0	Tennessee	316210	Footwear manufacturing	31	4.8	0.0	771.4
36935	47	47	0	Tennessee	316992	Women's handbag and purse manufacturing	31	2.2	0.0	0.0
36936	47	47	0	Tennessee	316998	All other leather good and allied product manufacturing	31	19.6	186.6	5637.8
36937	47	47	0	Tennessee	321113	Sawmills	32	142.8	2140.0	67454.8
36938	47	47	0	Tennessee	321114	Wood preservation	32	5.0	34.6	1227.0
36939	47	47	0	Tennessee	321211	Hardwood veneer and plywood manufacturing	32	4.4	28.2	741.4
36940	47	47	0	Tennessee	321212	Softwood veneer and plywood manufacturing	32	1.0	0.0	0.0
36941	47	47	0	Tennessee	321213	Engineered wood member (except truss) manufacturing	32	1.8	0.0	0.0
36942	47	47	0	Tennessee	321214	Truss manufacturing	32	28.4	487.6	17281.8
36943	47	47	0	Tennessee	321219	Reconstituted wood product manufacturing	32	4.8	43.6	2275.8
36944	47	47	0	Tennessee	321911	Wood window and door manufacturing	32	20.0	1341.0	48763.6
36945	47	47	0	Tennessee	321912	Cut stock, resawing lumber, and planing	32	31.8	815.6	27125.4
36946	47	47	0	Tennessee	321918	Other millwork (including flooring)	32	37.8	874.8	30951.8
36947	47	47	0	Tennessee	321920	Wood container and pallet manufacturing	32	108.6	1933.4	54639.6
36948	47	47	0	Tennessee	321991	Manufactured home (mobile home) manufacturing	32	17.4	829.0	33663.8
36949	47	47	0	Tennessee	321992	Prefabricated wood building manufacturing	32	19.2	180.0	8934.6
36950	47	47	0	Tennessee	321999	All other miscellaneous wood product manufacturing	32	39.8	590.6	17957.6
36951	47	47	0	Tennessee	322110	Pulp mills	32	2.0	0.0	0.0
36952	47	47	0	Tennessee	322121	Paper (except newsprint) mills	32	4.6	1226.8	79547.6
36953	47	47	0	Tennessee	322122	Newsprint mills	32	1.0	0.0	0.0
36954	47	47	0	Tennessee	322130	Paperboard mills	32	3.8	923.0	80022.4
36955	47	47	0	Tennessee	322211	Corrugated and solid fiber box manufacturing	32	46.8	3065.6	171057.6
36956	47	47	0	Tennessee	322212	Folding paperboard box manufacturing	32	18.4	1731.6	83945.0
36957	47	47	0	Tennessee	322219	Other paperboard container manufacturing	32	8.8	813.0	38182.4
36958	47	47	0	Tennessee	322220	Paper bag and coated and treated paper manufacturing	32	22.0	1687.2	54236.0
36959	47	47	0	Tennessee	322230	Stationery product manufacturing	32	7.8	605.8	23518.2
36960	47	47	0	Tennessee	322291	Sanitary paper product manufacturing	32	3.8	229.6	9496.8
36961	47	47	0	Tennessee	322299	All other converted paper product manufacturing	32	8.8	125.4	6135.4
36962	47	47	0	Tennessee	323111	Commercial printing (except screen and books)	32	395.2	8822.8	394429.2
36963	47	47	0	Tennessee	323113	Commercial screen printing	32	104.4	1026.6	33384.4
36964	47	47	0	Tennessee	323117	Books printing	32	14.2	370.0	19148.8
36965	47	47	0	Tennessee	323120	Support activities for printing	32	33.2	588.8	25504.6
36966	47	47	0	Tennessee	324110	Petroleum refineries	32	1.2	0.0	0.0
36967	47	47	0	Tennessee	324121	Asphalt paving mixture and block manufacturing	32	48.6	259.0	14075.0
36968	47	47	0	Tennessee	324122	Asphalt shingle and coating materials manufacturing	32	3.8	0.0	0.0
36969	47	47	0	Tennessee	324191	Petroleum lubricating oil and grease manufacturing	32	3.6	0.0	0.0
36970	47	47	0	Tennessee	324199	All other petroleum and coal products manufacturing	32	1.6666666666666667	0.0	0.0
36971	47	47	0	Tennessee	325120	Industrial gas manufacturing	32	12.0	166.2	20091.4
36972	47	47	0	Tennessee	325130	Synthetic dye and pigment manufacturing	32	4.6	0.0	0.0
36973	47	47	0	Tennessee	325180	Other basic inorganic chemical manufacturing	32	21.6	1926.2	175950.2
36974	47	47	0	Tennessee	325193	Ethyl alcohol manufacturing	32	2.0	0.0	0.0
36975	47	47	0	Tennessee	325194	Cyclic crude, intermediate, and gum and wood chemical manufacturing	32	3.0	62.4	2364.2
36976	47	47	0	Tennessee	325199	All other basic organic chemical manufacturing	32	16.4	3806.6	312638.0
36977	47	47	0	Tennessee	325211	Plastics material and resin manufacturing	32	20.0	1086.2	71382.0
36978	47	47	0	Tennessee	325212	Synthetic rubber manufacturing	32	2.8	0.0	0.0
36979	47	47	0	Tennessee	325220	Artificial and synthetic fibers and filaments manufacturing	32	6.2	621.0	37788.4
36980	47	47	0	Tennessee	325311	Nitrogenous fertilizer manufacturing	32	1.25	0.0	0.0
36981	47	47	0	Tennessee	325312	Phosphatic fertilizer manufacturing	32	1.0	0.0	0.0
36982	47	47	0	Tennessee	325314	Fertilizer (mixing only) manufacturing	32	5.6	28.0	1253.8
36983	47	47	0	Tennessee	325320	Pesticide and other agricultural chemical manufacturing	32	9.2	86.4	10642.8
36984	47	47	0	Tennessee	325411	Medicinal and botanical manufacturing	32	2.4	0.0	0.0
36985	47	47	0	Tennessee	325412	Pharmaceutical preparation manufacturing	32	12.4	2092.2	182564.4
36986	47	47	0	Tennessee	325413	In-vitro diagnostic substance manufacturing	32	2.4	0.0	0.0
36987	47	47	0	Tennessee	325414	Biological product (except diagnostic) manufacturing	32	1.4	0.0	0.0
36988	47	47	0	Tennessee	325510	Paint and coating manufacturing	32	16.6	328.4	43398.8
36989	47	47	0	Tennessee	325520	Adhesive manufacturing	32	11.6	508.2	28442.2
36990	47	47	0	Tennessee	325611	Soap and other detergent manufacturing	32	16.8	908.0	45943.8
36991	47	47	0	Tennessee	325612	Polish and other sanitation good manufacturing	32	10.8	118.8	6891.4
36992	47	47	0	Tennessee	325613	Surface active agent manufacturing	32	3.2	22.4	2375.6
36993	47	47	0	Tennessee	325620	Toilet preparation manufacturing	32	12.0	2095.6	99294.2
36994	47	47	0	Tennessee	325910	Printing ink manufacturing	32	10.8	74.8	3962.4
36995	47	47	0	Tennessee	325920	Explosives manufacturing	32	4.2	118.6	7159.2
36996	47	47	0	Tennessee	325991	Custom compounding of purchased resins	32	18.4	1758.0	96449.6
36997	47	47	0	Tennessee	325992	Photographic film, paper, plate, and chemical manufacturing	32	8.2	30.4	1275.2
36998	47	47	0	Tennessee	325998	All other miscellaneous chemical product and preparation manufacturing	32	16.4	1316.8	69479.6
36999	47	47	0	Tennessee	326111	Plastics bag and pouch manufacturing	32	5.4	82.0	2789.8
37000	47	47	0	Tennessee	326112	Plastics packaging film and sheet (including laminated) manufacturing	32	12.8	1031.0	60254.6
37001	47	47	0	Tennessee	326113	Unlaminated plastics film and sheet (except packaging) manufacturing	32	12.0	363.0	18024.0
37002	47	47	0	Tennessee	326121	Unlaminated plastics profile shape manufacturing	32	12.4	1034.0	52957.2
37003	47	47	0	Tennessee	326122	Plastics pipe and pipe fitting manufacturing	32	11.6	783.4	36525.4
37004	47	47	0	Tennessee	326130	Laminated plastics plate, sheet (except packaging), and shape manufacturing	32	2.6	0.0	0.0
37005	47	47	0	Tennessee	326140	Polystyrene foam product manufacturing	32	12.6	249.6	10489.6
37006	47	47	0	Tennessee	326150	Urethane and other foam product (except polystyrene) manufacturing	32	18.2	998.4	41001.8
37007	47	47	0	Tennessee	326160	Plastics bottle manufacturing	32	9.6	683.2	38603.8
37008	47	47	0	Tennessee	326191	Plastics plumbing fixture manufacturing	32	19.8	1107.0	37859.4
37009	47	47	0	Tennessee	326199	All other plastics product manufacturing	32	134.2	8655.4	340139.8
37010	47	47	0	Tennessee	326211	Tire manufacturing (except retreading)	32	7.6	2928.4	158699.8
37011	47	47	0	Tennessee	326212	Tire retreading	32	14.2	151.4	5537.0
37012	47	47	0	Tennessee	326220	Rubber and plastics hoses and belting manufacturing	32	8.2	670.4	25867.6
37013	47	47	0	Tennessee	326291	Rubber product manufacturing for mechanical use	32	14.8	2778.6	119942.8
37014	47	47	0	Tennessee	326299	All other rubber product manufacturing	32	18.0	1355.0	56849.8
37015	47	47	0	Tennessee	327110	Pottery, ceramics, and plumbing fixture manufacturing	32	11.4	58.4	1914.8
37016	47	47	0	Tennessee	327120	Clay building material and refractories manufacturing	32	17.2	1418.8	63531.0
37017	47	47	0	Tennessee	327211	Flat glass manufacturing	32	2.6	0.0	0.0
37018	47	47	0	Tennessee	327212	Other pressed and blown glass and glassware manufacturing	32	6.8	266.2	17627.0
37019	47	47	0	Tennessee	327215	Glass product manufacturing made of purchased glass	32	22.6	2178.6	90234.4
37020	47	47	0	Tennessee	327310	Cement manufacturing	32	4.0	43.2	3157.0
37021	47	47	0	Tennessee	327320	Ready-mix concrete manufacturing	32	117.4	1867.6	81290.0
37022	47	47	0	Tennessee	327331	Concrete block and brick manufacturing	32	27.4	622.6	30652.6
37023	47	47	0	Tennessee	327332	Concrete pipe manufacturing	32	6.6	139.6	7857.0
37024	47	47	0	Tennessee	327390	Other concrete product manufacturing	32	43.4	729.6	25785.0
37025	47	47	0	Tennessee	327410	Lime manufacturing	32	2.0	0.0	0.0
37026	47	47	0	Tennessee	327420	Gypsum product manufacturing	32	2.4	0.0	0.0
37027	47	47	0	Tennessee	327910	Abrasive product manufacturing	32	3.0	26.8	1388.0
37028	47	47	0	Tennessee	327991	Cut stone and stone product manufacturing	32	48.0	628.4	24036.0
37029	47	47	0	Tennessee	327992	Ground or treated mineral and earth manufacturing	32	7.6	253.0	11575.4
37030	47	47	0	Tennessee	327993	Mineral wool manufacturing	32	9.4	95.4	4413.6
37031	47	47	0	Tennessee	327999	All other miscellaneous nonmetallic mineral product manufacturing	32	7.8	157.6	7956.2
37032	47	47	0	Tennessee	331110	Iron and steel mills and ferroalloy manufacturing	33	17.4	1536.2	113500.8
37033	47	47	0	Tennessee	331210	Iron and steel pipe and tube manufacturing from purchased steel	33	10.4	1253.8	57120.0
37034	47	47	0	Tennessee	331221	Rolled steel shape manufacturing	33	4.2	246.2	13311.4
37035	47	47	0	Tennessee	331222	Steel wire drawing	33	4.4	301.4	13786.2
37036	47	47	0	Tennessee	331313	Alumina refining and primary aluminum production	33	1.0	0.0	0.0
37037	47	47	0	Tennessee	331314	Secondary smelting and alloying of aluminum	33	6.8	488.4	27953.4
37038	47	47	0	Tennessee	331315	Aluminum sheet, plate, and foil manufacturing	33	5.2	510.2	42765.2
37039	47	47	0	Tennessee	331318	Other aluminum rolling, drawing, and extruding	33	5.2	895.6	43727.8
37040	47	47	0	Tennessee	331410	Nonferrous metal (except aluminum) smelting and refining	33	2.6	0.0	0.0
37041	47	47	0	Tennessee	331420	Copper rolling, drawing, extruding, and alloying	33	8.6	490.6	24347.2
37042	47	47	0	Tennessee	331491	Nonferrous metal (except copper and aluminum) rolling, drawing, extruding, and alloying	33	3.0	91.4	7141.2
37043	47	47	0	Tennessee	331492	Secondary smelting, refining, and alloying of nonferrous metal (except copper and aluminum)	33	7.2	258.6	13883.6
37044	47	47	0	Tennessee	331511	Iron foundries	33	5.8	384.2	24054.8
37045	47	47	0	Tennessee	331512	Steel investment foundries	33	2.0	0.0	0.0
37046	47	47	0	Tennessee	331513	Steel foundries (except investment)	33	2.4	0.0	0.0
37047	47	47	0	Tennessee	331523	Nonferrous metal die-casting foundries	33	8.2	1004.4	49838.0
37048	47	47	0	Tennessee	331524	Aluminum foundries (except die-casting)	33	6.2	755.0	42022.4
37049	47	47	0	Tennessee	331529	Other nonferrous metal foundries (except die-casting)	33	6.0	273.0	12948.6
37050	47	47	0	Tennessee	332111	Iron and steel forging	33	14.2	925.2	42791.0
37051	47	47	0	Tennessee	332112	Nonferrous forging	33	1.0	0.0	0.0
37052	47	47	0	Tennessee	332114	Custom roll forming	33	8.4	193.0	8929.0
37053	47	47	0	Tennessee	332117	Powder metallurgy part manufacturing	33	6.8	286.6	14730.6
37054	47	47	0	Tennessee	332119	Metal crown, closure, and other metal stamping (except automotive)	33	29.8	1093.6	48426.2
37055	47	47	0	Tennessee	332215	Metal kitchen cookware, utensil, cutlery, and flatware (except precious) manufacturing	33	5.8	267.4	12644.2
37056	47	47	0	Tennessee	332216	Saw blade and handtool manufacturing	33	13.8	701.8	29722.2
37057	47	47	0	Tennessee	332311	Prefabricated metal building and component manufacturing	33	13.0	1012.0	60311.4
37058	47	47	0	Tennessee	332312	Fabricated structural metal manufacturing	33	80.4	1732.0	96107.0
37059	47	47	0	Tennessee	332313	Plate work manufacturing	33	30.8	856.8	38923.2
37060	47	47	0	Tennessee	332321	Metal window and door manufacturing	33	22.0	1865.6	91926.4
37061	47	47	0	Tennessee	332322	Sheet metal work manufacturing	33	86.4	1940.8	87678.2
37062	47	47	0	Tennessee	332323	Ornamental and architectural metal work manufacturing	33	43.4	557.6	22636.0
37063	47	47	0	Tennessee	332410	Power boiler and heat exchanger manufacturing	33	4.8	303.6	18819.6
37064	47	47	0	Tennessee	332420	Metal tank (heavy gauge) manufacturing	33	14.0	855.2	43082.4
37065	47	47	0	Tennessee	332431	Metal can manufacturing	33	3.2	282.0	16264.6
37066	47	47	0	Tennessee	332439	Other metal container manufacturing	33	9.6	96.8	3512.0
37067	47	47	0	Tennessee	332510	Hardware manufacturing	33	8.6	944.8	43892.4
37068	47	47	0	Tennessee	332613	Spring manufacturing	33	4.6	18.8	879.8
37069	47	47	0	Tennessee	332618	Other fabricated wire product manufacturing	33	27.6	1395.0	55119.6
37070	47	47	0	Tennessee	332710	Machine shops	33	320.0	4242.0	208728.6
37071	47	47	0	Tennessee	332721	Precision turned product manufacturing	33	54.0	975.4	45706.2
37072	47	47	0	Tennessee	332722	Bolt, nut, screw, rivet, and washer manufacturing	33	13.0	273.4	23244.2
37073	47	47	0	Tennessee	332811	Metal heat treating	33	14.0	276.2	13039.4
37074	47	47	0	Tennessee	332812	Metal coating, engraving (except jewelry and silverware), and allied services to manufacturers	33	54.0	1191.0	43230.6
37075	47	47	0	Tennessee	332813	Electroplating, plating, polishing, anodizing, and coloring	33	40.4	617.8	25871.0
37076	47	47	0	Tennessee	332911	Industrial valve manufacturing	33	8.4	992.2	50562.4
37077	47	47	0	Tennessee	332912	Fluid power valve and hose fitting manufacturing	33	3.2	54.8	2340.6
37078	47	47	0	Tennessee	332913	Plumbing fixture fitting and trim manufacturing	33	4.6	801.6	47817.6
37079	47	47	0	Tennessee	332919	Other metal valve and pipe fitting manufacturing	33	1.0	0.0	0.0
37080	47	47	0	Tennessee	332991	Ball and roller bearing manufacturing	33	8.0	938.6	38893.4
37081	47	47	0	Tennessee	332992	Small arms ammunition manufacturing	33	3.2	7.4	347.2
