3438	8045	8	45	Garfield County, Colorado	4532	Office supplies, stationery, and gift stores	45	5.6	36.8	759.6
3439	8045	8	45	Garfield County, Colorado	4533	Used merchandise stores	45	10.8	20.0	592.4
3440	8045	8	45	Garfield County, Colorado	4539	Other miscellaneous store retailers	45	15.8	89.6	2818.6
3441	8045	8	45	Garfield County, Colorado	4541	Electronic shopping and mail-order houses	45	5.2	13.8	549.2
3442	8045	8	45	Garfield County, Colorado	4543	Direct selling establishments	45	8.6	24.2	1640.2
3445	8045	8	45	Garfield County, Colorado	4841	General freight trucking	48	18.2	49.2	2165.4
3446	8045	8	45	Garfield County, Colorado	4842	Specialized freight trucking	48	30.4	279.6	15363.2
3453	8045	8	45	Garfield County, Colorado	4884	Support activities for road transportation	48	5.8	10.2	494.0
3456	8045	8	45	Garfield County, Colorado	4921	Couriers and express delivery services	49	4.6	49.2	2158.6
3457	8045	8	45	Garfield County, Colorado	4922	Local messengers and local delivery	49	1.8	0.0	21.8
3458	8045	8	45	Garfield County, Colorado	5111	Newspaper, periodical, book, and directory publishers	51	6.0	14.4	1073.0
3459	8045	8	45	Garfield County, Colorado	5112	Software publishers	51	2.4	3.4	231.4
3460	8045	8	45	Garfield County, Colorado	5121	Motion picture and video industries	51	8.0	51.6	624.2
3461	8045	8	45	Garfield County, Colorado	5151	Radio and television broadcasting	51	2.4	6.8	258.4
3462	8045	8	45	Garfield County, Colorado	5171	Wired telecommunications carriers	51	8.6	22.2	1384.6
3467	8045	8	45	Garfield County, Colorado	5221	Depository credit intermediation	52	37.6	334.2	24384.6
3468	8045	8	45	Garfield County, Colorado	5222	Nondepository credit intermediation	52	7.4	13.0	2991.6
3469	8045	8	45	Garfield County, Colorado	5223	Activities related to credit intermediation	52	2.2	2.6	161.4
3470	8045	8	45	Garfield County, Colorado	5231	Securities and commodity contracts intermediation and brokerage	52	8.8	5.0	486.4
3471	8045	8	45	Garfield County, Colorado	5239	Other financial investment activities	52	8.0	13.2	1157.4
3473	8045	8	45	Garfield County, Colorado	5242	Agencies, brokerages, and other insurance related activities	52	29.0	150.0	8879.8
3474	8045	8	45	Garfield County, Colorado	5311	Lessors of real estate	53	45.4	196.2	5238.8
3475	8045	8	45	Garfield County, Colorado	5312	Offices of real estate agents and brokers	53	52.6	46.4	3400.4
3476	8045	8	45	Garfield County, Colorado	5313	Activities related to real estate	53	38.4	166.2	7731.8
3478	8045	8	45	Garfield County, Colorado	5322	Consumer goods rental	53	8.8	34.4	3314.4
3480	8045	8	45	Garfield County, Colorado	5324	Commercial and industrial machinery and equipment rental and leasing	53	6.2	138.4	9217.2
3481	8045	8	45	Garfield County, Colorado	5411	Legal services	54	49.0	167.0	9767.2
3482	8045	8	45	Garfield County, Colorado	5412	Accounting, tax preparation, bookkeeping, and payroll services	54	55.0	187.2	10410.2
3483	8045	8	45	Garfield County, Colorado	5413	Architectural, engineering, and related services	54	81.0	321.6	21798.0
3484	8045	8	45	Garfield County, Colorado	5414	Specialized design services	54	11.2	6.6	686.2
3485	8045	8	45	Garfield County, Colorado	5415	Computer systems design and related services	54	16.6	37.4	2250.4
3486	8045	8	45	Garfield County, Colorado	5416	Management, scientific, and technical consulting services	54	47.6	109.0	7034.4
3487	8045	8	45	Garfield County, Colorado	5417	Scientific research and development services	54	1.8	2.2	190.4
3488	8045	8	45	Garfield County, Colorado	5418	Advertising, public relations, and related services	54	7.6	17.2	1032.4
3489	8045	8	45	Garfield County, Colorado	5419	Other professional, scientific, and technical services	54	26.6	112.6	4093.0
3490	8045	8	45	Garfield County, Colorado	5511	Management of companies and enterprises	55	6.4	27.6	1894.6
3491	8045	8	45	Garfield County, Colorado	5611	Office administrative services	56	6.8	9.8	869.0
3493	8045	8	45	Garfield County, Colorado	5613	Employment services	56	5.6	190.8	6159.0
3494	8045	8	45	Garfield County, Colorado	5614	Business support services	56	5.6	10.2	502.6
3495	8045	8	45	Garfield County, Colorado	5615	Travel arrangement and reservation services	56	7.4	26.0	1166.8
3496	8045	8	45	Garfield County, Colorado	5616	Investigation and security services	56	7.8	65.6	1324.2
3497	8045	8	45	Garfield County, Colorado	5617	Services to buildings and dwellings	56	89.6	299.4	15906.6
3498	8045	8	45	Garfield County, Colorado	5619	Other support services	56	6.8	6.0	340.4
3499	8045	8	45	Garfield County, Colorado	5621	Waste collection	56	10.2	82.2	5308.0
3501	8045	8	45	Garfield County, Colorado	5629	Remediation and other waste management services	56	6.2	43.0	2245.4
3502	8045	8	45	Garfield County, Colorado	6111	Elementary and secondary schools	61	5.2	142.0	4788.2
3504	8045	8	45	Garfield County, Colorado	6115	Technical and trade schools	61	2.8	6.4	322.2
3505	8045	8	45	Garfield County, Colorado	6116	Other schools and instruction	61	14.8	80.0	1050.2
3506	8045	8	45	Garfield County, Colorado	6117	Educational support services	61	1.8	1.6	51.6
3507	8045	8	45	Garfield County, Colorado	6211	Offices of physicians	62	32.8	416.0	37654.6
3508	8045	8	45	Garfield County, Colorado	6212	Offices of dentists	62	30.6	176.2	8489.2
3509	8045	8	45	Garfield County, Colorado	6213	Offices of other health practitioners	62	31.4	92.2	3929.2
3510	8045	8	45	Garfield County, Colorado	6214	Outpatient care centers	62	3.0	7.8	399.6
3511	8045	8	45	Garfield County, Colorado	6215	Medical and diagnostic laboratories	62	2.4	0.0	123.8
3515	8045	8	45	Garfield County, Colorado	6231	Nursing care facilities (skilled nursing facilities)	62	2.2	39.2	1574.8
3516	8045	8	45	Garfield County, Colorado	6232	Residential intellectual and developmental disability, mental health, and substance abuse facilities	62	3.4	214.4	6215.4
3517	8045	8	45	Garfield County, Colorado	6233	Continuing care retirement communities and assisted living facilities for the elderly	62	6.8	40.6	829.0
3518	8045	8	45	Garfield County, Colorado	6241	Individual and family services	62	19.6	73.0	3732.2
3519	8045	8	45	Garfield County, Colorado	6242	Community food and housing, and emergency and other relief services	62	5.4	22.4	1525.0
3520	8045	8	45	Garfield County, Colorado	6244	Child day care services	62	13.0	74.2	1658.4
3521	8045	8	45	Garfield County, Colorado	7111	Performing arts companies	71	3.2	5.2	111.8
3525	8045	8	45	Garfield County, Colorado	7115	Independent artists, writers, and performers	71	7.0	3.0	678.6
3526	8045	8	45	Garfield County, Colorado	7121	Museums, historical sites, and similar institutions	71	2.6	0.0	22.0
3527	8045	8	45	Garfield County, Colorado	7139	Other amusement and recreation industries	71	26.4	280.4	6214.4
3528	8045	8	45	Garfield County, Colorado	7211	Traveler accommodation	72	44.0	814.4	17848.2
3529	8045	8	45	Garfield County, Colorado	7212	RV (recreational vehicle) parks and recreational camps	72	6.2	11.6	996.6
3530	8045	8	45	Garfield County, Colorado	7223	Special food services	72	7.0	15.2	489.4
3531	8045	8	45	Garfield County, Colorado	7224	Drinking places (alcoholic beverages)	72	7.0	34.2	687.4
3532	8045	8	45	Garfield County, Colorado	7225	Restaurants and other eating places	72	143.6	2038.6	37738.2
3533	8045	8	45	Garfield County, Colorado	8111	Automotive repair and maintenance	81	51.6	228.8	9094.6
3534	8045	8	45	Garfield County, Colorado	8112	Electronic and precision equipment repair and maintenance	81	4.2	1.2	207.8
3535	8045	8	45	Garfield County, Colorado	8113	Commercial and industrial machinery and equipment (except automotive and electronic) repair and maintenance	81	6.6	17.8	720.8
3536	8045	8	45	Garfield County, Colorado	8114	Personal and household goods repair and maintenance	81	12.2	13.8	524.4
3537	8045	8	45	Garfield County, Colorado	8121	Personal care services	81	26.6	96.4	2974.2
3539	8045	8	45	Garfield County, Colorado	8123	Drycleaning and laundry services	81	6.8	49.6	1141.8
3540	8045	8	45	Garfield County, Colorado	8129	Other personal services	81	5.8	9.4	435.0
3541	8045	8	45	Garfield County, Colorado	8131	Religious organizations	81	33.2	182.8	4039.2
3542	8045	8	45	Garfield County, Colorado	8132	Grantmaking and giving services	81	9.0	17.4	1571.0
3543	8045	8	45	Garfield County, Colorado	8133	Social advocacy organizations	81	10.4	42.6	1961.8
3544	8045	8	45	Garfield County, Colorado	8134	Civic and social organizations	81	7.6	27.8	572.0
3545	8045	8	45	Garfield County, Colorado	8139	Business, professional, labor, political, and similar organizations	81	11.4	21.2	1431.4
3546	8047	8	47	Gilpin County, Colorado	2361	Residential building construction	23	2.4	0.6	56.2
3548	8047	8	47	Gilpin County, Colorado	2381	Foundation, structure, and building exterior contractors	23	1.8	1.2	50.4
3549	8047	8	47	Gilpin County, Colorado	2382	Building equipment contractors	23	2.6	2.6	109.4
3551	8047	8	47	Gilpin County, Colorado	2389	Other specialty trade contractors	23	3.4	8.6	382.6
3584	8047	8	47	Gilpin County, Colorado	5313	Activities related to real estate	53	2.2	1.4	87.8
3589	8047	8	47	Gilpin County, Colorado	5415	Computer systems design and related services	54	6.6	3.0	323.6
3590	8047	8	47	Gilpin County, Colorado	5416	Management, scientific, and technical consulting services	54	6.6	4.6	447.0
3608	8047	8	47	Gilpin County, Colorado	7132	Gambling industries	71	21.2	2094.0	71030.8
3610	8047	8	47	Gilpin County, Colorado	7211	Traveler accommodation	72	5.0	2397.4	90320.4
3613	8047	8	47	Gilpin County, Colorado	7225	Restaurants and other eating places	72	3.6	11.2	176.4
3617	8047	8	47	Gilpin County, Colorado	8131	Religious organizations	81	3.0	1.8	111.8
3620	8049	8	49	Grand County, Colorado	1133	Logging	11	5.0	5.6	373.8
3626	8049	8	49	Grand County, Colorado	2211	Electric power generation, transmission and distribution	22	4.0	11.6	996.4
3628	8049	8	49	Grand County, Colorado	2361	Residential building construction	23	58.8	155.0	6162.6
3629	8049	8	49	Grand County, Colorado	2362	Nonresidential building construction	23	2.2	2.2	72.8
3630	8049	8	49	Grand County, Colorado	2371	Utility system construction	23	4.4	9.4	489.2
3634	8049	8	49	Grand County, Colorado	2381	Foundation, structure, and building exterior contractors	23	17.8	45.8	3980.4
3635	8049	8	49	Grand County, Colorado	2382	Building equipment contractors	23	24.6	99.6	4430.2
3636	8049	8	49	Grand County, Colorado	2383	Building finishing contractors	23	17.8	24.2	1240.2
3637	8049	8	49	Grand County, Colorado	2389	Other specialty trade contractors	23	21.0	62.2	2627.0
3638	8049	8	49	Grand County, Colorado	3121	Beverage manufacturing	31	2.0	0.75	33.5
3639	8049	8	49	Grand County, Colorado	3211	Sawmills and wood preservation	32	4.0	69.6	2352.4
3641	8049	8	49	Grand County, Colorado	3231	Printing and related support activities	32	2.2	1.0	35.8
3651	8049	8	49	Grand County, Colorado	4238	Machinery, equipment, and supplies merchant wholesalers	42	2.0	2.0	205.5
3658	8049	8	49	Grand County, Colorado	4412	Other motor vehicle dealers	44	3.0	9.4	734.2
3659	8049	8	49	Grand County, Colorado	4413	Automotive parts, accessories, and tire stores	44	3.4	13.8	478.2
3661	8049	8	49	Grand County, Colorado	4422	Home furnishings stores	44	6.6	11.8	340.2
3663	8049	8	49	Grand County, Colorado	4441	Building material and supplies dealers	44	12.6	54.4	2829.0
3665	8049	8	49	Grand County, Colorado	4451	Grocery stores	44	5.6	84.4	2827.2
3667	8049	8	49	Grand County, Colorado	4453	Beer, wine, and liquor stores	44	9.2	15.8	837.0
3668	8049	8	49	Grand County, Colorado	4461	Health and personal care stores	44	2.4	1.6	54.0
3669	8049	8	49	Grand County, Colorado	4471	Gasoline stations	44	10.4	48.6	1340.2
3670	8049	8	49	Grand County, Colorado	4481	Clothing stores	44	4.6	6.6	154.0
3672	8049	8	49	Grand County, Colorado	4511	Sporting goods, hobby, and musical instrument stores	45	15.2	92.2	1194.8
3675	8049	8	49	Grand County, Colorado	4532	Office supplies, stationery, and gift stores	45	9.6	35.0	830.6
3678	8049	8	49	Grand County, Colorado	4543	Direct selling establishments	45	2.8	0.8	12.8
3679	8049	8	49	Grand County, Colorado	4841	General freight trucking	48	4.0	6.4	236.0
3680	8049	8	49	Grand County, Colorado	4842	Specialized freight trucking	48	6.0	4.6	265.2
3689	8049	8	49	Grand County, Colorado	5111	Newspaper, periodical, book, and directory publishers	51	2.8	1.6	71.4
3694	8049	8	49	Grand County, Colorado	5221	Depository credit intermediation	52	11.2	25.0	1138.8
3700	8049	8	49	Grand County, Colorado	5242	Agencies, brokerages, and other insurance related activities	52	10.0	19.8	965.8
3701	8049	8	49	Grand County, Colorado	5311	Lessors of real estate	53	8.4	12.6	545.0
3702	8049	8	49	Grand County, Colorado	5312	Offices of real estate agents and brokers	53	33.4	82.0	5593.2
3703	8049	8	49	Grand County, Colorado	5313	Activities related to real estate	53	19.0	223.2	6065.2
3705	8049	8	49	Grand County, Colorado	5322	Consumer goods rental	53	10.2	38.8	1057.2
3708	8049	8	49	Grand County, Colorado	5411	Legal services	54	14.6	11.8	1225.8
3709	8049	8	49	Grand County, Colorado	5412	Accounting, tax preparation, bookkeeping, and payroll services	54	10.4	22.8	983.0
3710	8049	8	49	Grand County, Colorado	5413	Architectural, engineering, and related services	54	17.2	277.4	14171.0
3711	8049	8	49	Grand County, Colorado	5414	Specialized design services	54	7.4	9.2	266.2
3712	8049	8	49	Grand County, Colorado	5415	Computer systems design and related services	54	6.8	6.8	384.4
3713	8049	8	49	Grand County, Colorado	5416	Management, scientific, and technical consulting services	54	10.8	18.2	693.4
3714	8049	8	49	Grand County, Colorado	5418	Advertising, public relations, and related services	54	3.0	2.0	54.4
3715	8049	8	49	Grand County, Colorado	5419	Other professional, scientific, and technical services	54	9.8	15.8	382.8
3716	8049	8	49	Grand County, Colorado	5611	Office administrative services	56	2.2	2.4	126.8
3719	8049	8	49	Grand County, Colorado	5615	Travel arrangement and reservation services	56	5.4	4.8	372.8
3721	8049	8	49	Grand County, Colorado	5617	Services to buildings and dwellings	56	28.0	97.8	3387.8
3729	8049	8	49	Grand County, Colorado	6211	Offices of physicians	62	4.8	6.2	833.6
3730	8049	8	49	Grand County, Colorado	6212	Offices of dentists	62	7.0	26.2	1513.2
3731	8049	8	49	Grand County, Colorado	6213	Offices of other health practitioners	62	8.2	20.0	443.6
3732	8049	8	49	Grand County, Colorado	6214	Outpatient care centers	62	2.8	4.4	177.6
3735	8049	8	49	Grand County, Colorado	6241	Individual and family services	62	4.4	15.0	614.0
3737	8049	8	49	Grand County, Colorado	6244	Child day care services	62	6.4	27.8	653.6
3741	8049	8	49	Grand County, Colorado	7115	Independent artists, writers, and performers	71	2.0	0.8	15.2
3744	8049	8	49	Grand County, Colorado	7139	Other amusement and recreation industries	71	24.6	827.0	9979.8
3745	8049	8	49	Grand County, Colorado	7211	Traveler accommodation	72	33.2	543.0	19496.0
3746	8049	8	49	Grand County, Colorado	7212	RV (recreational vehicle) parks and recreational camps	72	8.6	150.8	4817.0
3748	8049	8	49	Grand County, Colorado	7223	Special food services	72	2.4	0.0	68.6
3749	8049	8	49	Grand County, Colorado	7224	Drinking places (alcoholic beverages)	72	4.8	22.0	294.6
3750	8049	8	49	Grand County, Colorado	7225	Restaurants and other eating places	72	82.4	950.2	14851.4
3751	8049	8	49	Grand County, Colorado	8111	Automotive repair and maintenance	81	13.6	22.6	830.8
3753	8049	8	49	Grand County, Colorado	8113	Commercial and industrial machinery and equipment (except automotive and electronic) repair and maintenance	81	3.0	1.8	38.4
3754	8049	8	49	Grand County, Colorado	8114	Personal and household goods repair and maintenance	81	2.2	1.2	19.2
3755	8049	8	49	Grand County, Colorado	8121	Personal care services	81	5.8	6.4	235.2
3757	8049	8	49	Grand County, Colorado	8129	Other personal services	81	5.0	13.0	370.2
3758	8049	8	49	Grand County, Colorado	8131	Religious organizations	81	13.8	84.4	1392.4
3760	8049	8	49	Grand County, Colorado	8133	Social advocacy organizations	81	4.4	3.2	279.4
3762	8049	8	49	Grand County, Colorado	8139	Business, professional, labor, political, and similar organizations	81	6.6	11.2	690.8
3765	8051	8	51	Gunnison County, Colorado	1152	Support activities for animal production	11	3.4	2.2	47.4
3772	8051	8	51	Gunnison County, Colorado	2361	Residential building construction	23	92.2	188.8	7929.8
3773	8051	8	51	Gunnison County, Colorado	2362	Nonresidential building construction	23	2.4	1.8	178.0
3774	8051	8	51	Gunnison County, Colorado	2371	Utility system construction	23	4.4	11.4	724.6
3776	8051	8	51	Gunnison County, Colorado	2381	Foundation, structure, and building exterior contractors	23	27.6	48.2	2270.8
3777	8051	8	51	Gunnison County, Colorado	2382	Building equipment contractors	23	35.4	104.6	4225.6
3778	8051	8	51	Gunnison County, Colorado	2383	Building finishing contractors	23	33.6	41.0	2431.2
3779	8051	8	51	Gunnison County, Colorado	2389	Other specialty trade contractors	23	21.4	22.6	2173.6
3788	8051	8	51	Gunnison County, Colorado	3231	Printing and related support activities	32	4.2	20.2	484.2
3793	8051	8	51	Gunnison County, Colorado	3371	Household and institutional furniture and kitchen cabinet manufacturing	33	5.2	6.0	309.8
3795	8051	8	51	Gunnison County, Colorado	3399	Other miscellaneous manufacturing	33	4.6	15.0	444.0
3803	8051	8	51	Gunnison County, Colorado	4244	Grocery and related product merchant wholesalers	42	3.6	8.0	247.2
3804	8051	8	51	Gunnison County, Colorado	4251	Wholesale electronic markets and agents and brokers	42	5.6	4.0	172.8
3805	8051	8	51	Gunnison County, Colorado	4411	Automobile dealers	44	3.0	12.0	487.0
3806	8051	8	51	Gunnison County, Colorado	4412	Other motor vehicle dealers	44	3.2	7.2	221.2
3807	8051	8	51	Gunnison County, Colorado	4413	Automotive parts, accessories, and tire stores	44	3.6	13.2	394.2
3808	8051	8	51	Gunnison County, Colorado	4421	Furniture stores	44	3.8	24.2	498.4
3809	8051	8	51	Gunnison County, Colorado	4422	Home furnishings stores	44	7.6	21.8	653.2
3810	8051	8	51	Gunnison County, Colorado	4431	Electronics and appliance stores	44	6.4	10.4	307.6
3811	8051	8	51	Gunnison County, Colorado	4441	Building material and supplies dealers	44	14.6	95.0	3253.4
3813	8051	8	51	Gunnison County, Colorado	4451	Grocery stores	44	5.8	88.2	2404.2
3814	8051	8	51	Gunnison County, Colorado	4452	Specialty food stores	44	2.8	4.2	26.6
3815	8051	8	51	Gunnison County, Colorado	4453	Beer, wine, and liquor stores	44	10.4	62.4	1184.6
3816	8051	8	51	Gunnison County, Colorado	4461	Health and personal care stores	44	3.0	0.0	140.4
3817	8051	8	51	Gunnison County, Colorado	4471	Gasoline stations	44	7.8	41.6	903.2
3818	8051	8	51	Gunnison County, Colorado	4481	Clothing stores	44	15.0	52.0	799.6
3820	8051	8	51	Gunnison County, Colorado	4483	Jewelry, luggage, and leather goods stores	44	2.8	4.4	176.6
3821	8051	8	51	Gunnison County, Colorado	4511	Sporting goods, hobby, and musical instrument stores	45	18.0	109.4	2281.6
3824	8051	8	51	Gunnison County, Colorado	4529	Other general merchandise stores	45	1.6666666666666667	4.666666666666667	63.33333333333334
3826	8051	8	51	Gunnison County, Colorado	4532	Office supplies, stationery, and gift stores	45	5.6	12.2	413.8
3828	8051	8	51	Gunnison County, Colorado	4539	Other miscellaneous store retailers	45	5.8	7.6	217.0
3834	8051	8	51	Gunnison County, Colorado	4842	Specialized freight trucking	48	4.2	3.8	69.0
3838	8051	8	51	Gunnison County, Colorado	4884	Support activities for road transportation	48	2.2	0.4	10.8
3841	8051	8	51	Gunnison County, Colorado	5111	Newspaper, periodical, book, and directory publishers	51	5.2	32.2	1081.6
3847	8051	8	51	Gunnison County, Colorado	5171	Wired telecommunications carriers	51	4.2	6.4	411.8
3850	8051	8	51	Gunnison County, Colorado	5221	Depository credit intermediation	52	9.6	34.8	1477.2
3853	8051	8	51	Gunnison County, Colorado	5231	Securities and commodity contracts intermediation and brokerage	52	3.0	3.2	229.4
3854	8051	8	51	Gunnison County, Colorado	5239	Other financial investment activities	52	3.8	5.0	695.2
3856	8051	8	51	Gunnison County, Colorado	5242	Agencies, brokerages, and other insurance related activities	52	12.8	26.8	1981.6
3857	8051	8	51	Gunnison County, Colorado	5311	Lessors of real estate	53	6.2	5.2	282.8
3858	8051	8	51	Gunnison County, Colorado	5312	Offices of real estate agents and brokers	53	40.8	20.2	1904.0
3859	8051	8	51	Gunnison County, Colorado	5313	Activities related to real estate	53	34.4	115.6	3306.6
3860	8051	8	51	Gunnison County, Colorado	5321	Automotive equipment rental and leasing	53	3.4	3.4	100.0
3861	8051	8	51	Gunnison County, Colorado	5322	Consumer goods rental	53	6.4	15.8	533.8
3865	8051	8	51	Gunnison County, Colorado	5411	Legal services	54	24.0	28.0	2281.2
3866	8051	8	51	Gunnison County, Colorado	5412	Accounting, tax preparation, bookkeeping, and payroll services	54	20.0	81.0	1512.2
3867	8051	8	51	Gunnison County, Colorado	5413	Architectural, engineering, and related services	54	31.4	28.4	3628.0
3868	8051	8	51	Gunnison County, Colorado	5414	Specialized design services	54	7.2	7.0	364.6
3869	8051	8	51	Gunnison County, Colorado	5415	Computer systems design and related services	54	7.0	7.6	621.4
3870	8051	8	51	Gunnison County, Colorado	5416	Management, scientific, and technical consulting services	54	21.0	22.8	2322.4
3872	8051	8	51	Gunnison County, Colorado	5418	Advertising, public relations, and related services	54	3.2	2.6	74.6
3873	8051	8	51	Gunnison County, Colorado	5419	Other professional, scientific, and technical services	54	14.6	29.2	979.0
3875	8051	8	51	Gunnison County, Colorado	5611	Office administrative services	56	3.6	2.4	219.0
3878	8051	8	51	Gunnison County, Colorado	5615	Travel arrangement and reservation services	56	6.0	4.6	324.0
3880	8051	8	51	Gunnison County, Colorado	5617	Services to buildings and dwellings	56	39.4	73.8	2916.8
3882	8051	8	51	Gunnison County, Colorado	5621	Waste collection	56	2.2	0.0	52.8
3887	8051	8	51	Gunnison County, Colorado	6116	Other schools and instruction	61	8.2	23.6	362.4
3889	8051	8	51	Gunnison County, Colorado	6211	Offices of physicians	62	15.0	66.2	3606.0
3890	8051	8	51	Gunnison County, Colorado	6212	Offices of dentists	62	8.4	23.0	1362.2
3891	8051	8	51	Gunnison County, Colorado	6213	Offices of other health practitioners	62	19.2	37.2	1733.6
3892	8051	8	51	Gunnison County, Colorado	6214	Outpatient care centers	62	3.8	13.4	467.8
3896	8051	8	51	Gunnison County, Colorado	6241	Individual and family services	62	4.6	22.0	728.2
3898	8051	8	51	Gunnison County, Colorado	6244	Child day care services	62	5.0	52.6	925.6
3901	8051	8	51	Gunnison County, Colorado	7113	Promoters of performing arts, sports, and similar events	71	2.6	9.0	232.4
3903	8051	8	51	Gunnison County, Colorado	7115	Independent artists, writers, and performers	71	2.4	0.0	8.2
3904	8051	8	51	Gunnison County, Colorado	7121	Museums, historical sites, and similar institutions	71	2.2	3.6	51.2
3905	8051	8	51	Gunnison County, Colorado	7139	Other amusement and recreation industries	71	27.0	97.4	3149.6
3906	8051	8	51	Gunnison County, Colorado	7211	Traveler accommodation	72	28.4	381.4	14239.8
3907	8051	8	51	Gunnison County, Colorado	7212	RV (recreational vehicle) parks and recreational camps	72	7.2	17.4	1154.2
3908	8051	8	51	Gunnison County, Colorado	7223	Special food services	72	5.4	31.2	441.6
3909	8051	8	51	Gunnison County, Colorado	7224	Drinking places (alcoholic beverages)	72	11.0	139.6	1343.0
3910	8051	8	51	Gunnison County, Colorado	7225	Restaurants and other eating places	72	69.2	947.0	14214.6
3911	8051	8	51	Gunnison County, Colorado	8111	Automotive repair and maintenance	81	14.4	62.4	2224.2
3913	8051	8	51	Gunnison County, Colorado	8113	Commercial and industrial machinery and equipment (except automotive and electronic) repair and maintenance	81	3.4	4.6	130.8
3915	8051	8	51	Gunnison County, Colorado	8121	Personal care services	81	11.8	22.2	460.6
3918	8051	8	51	Gunnison County, Colorado	8129	Other personal services	81	3.2	8.6	108.2
3919	8051	8	51	Gunnison County, Colorado	8131	Religious organizations	81	16.6	51.6	1047.0
3920	8051	8	51	Gunnison County, Colorado	8132	Grantmaking and giving services	81	5.0	7.6	634.6
3921	8051	8	51	Gunnison County, Colorado	8133	Social advocacy organizations	81	6.6	5.6	327.0
3922	8051	8	51	Gunnison County, Colorado	8134	Civic and social organizations	81	3.0	4.2	99.4
3923	8051	8	51	Gunnison County, Colorado	8139	Business, professional, labor, political, and similar organizations	81	17.2	41.0	1518.6
3925	8053	8	53	Hinsdale County, Colorado	2361	Residential building construction	23	6.4	10.6	919.4
3937	8053	8	53	Hinsdale County, Colorado	4471	Gasoline stations	44	2.8	1.6	71.2
3941	8053	8	53	Hinsdale County, Colorado	4532	Office supplies, stationery, and gift stores	45	3.4	2.2	32.0
3952	8053	8	53	Hinsdale County, Colorado	5312	Offices of real estate agents and brokers	53	3.0	1.4	86.0
3962	8053	8	53	Hinsdale County, Colorado	7211	Traveler accommodation	72	3.4	1.2	34.4
3963	8053	8	53	Hinsdale County, Colorado	7212	RV (recreational vehicle) parks and recreational camps	72	3.4	0.0	52.4
3965	8053	8	53	Hinsdale County, Colorado	7225	Restaurants and other eating places	72	8.6	5.6	447.0
3972	8053	8	53	Hinsdale County, Colorado	8139	Business, professional, labor, political, and similar organizations	81	2.2	0.0	19.8
3977	8055	8	55	Huerfano County, Colorado	2361	Residential building construction	23	3.8	3.2	212.6
3979	8055	8	55	Huerfano County, Colorado	2371	Utility system construction	23	3.4	3.0	110.2
3982	8055	8	55	Huerfano County, Colorado	2382	Building equipment contractors	23	3.2	1.6	110.6
3984	8055	8	55	Huerfano County, Colorado	2389	Other specialty trade contractors	23	4.4	9.4	591.0
3998	8055	8	55	Huerfano County, Colorado	4451	Grocery stores	44	5.0	88.8	2025.2
3999	8055	8	55	Huerfano County, Colorado	4453	Beer, wine, and liquor stores	44	2.4	2.0	41.2
