	id	state	COUNTY	GEO_TTL	relevant_naics	NAICS2012_TTL	NAICS_Sector	estab	emp	payann
640918	42	42	999	Pennsylvania -- Statewide	115210	Support activities for animal production	11	1.0	0.0	0.0
640919	42	42	999	Pennsylvania -- Statewide	211111	Crude petroleum and natural gas extraction	21	3.8	425.2	73058.2
640920	42	42	999	Pennsylvania -- Statewide	211112	Natural gas liquid extraction	21	1.0	0.0	0.0
640921	42	42	999	Pennsylvania -- Statewide	213111	Drilling oil and gas wells	21	6.0	428.2	33252.0
640922	42	42	999	Pennsylvania -- Statewide	213112	Support activities for oil and gas operations	21	7.6	501.8	34449.0
640923	42	42	999	Pennsylvania -- Statewide	213113	Support activities for coal mining	21	2.4	4.0	117.2
640924	42	42	999	Pennsylvania -- Statewide	213114	Support activities for metal mining	21	1.2	0.0	0.0
640925	42	42	999	Pennsylvania -- Statewide	221115	Wind electric power generation	22	1.4	0.0	0.0
640926	42	42	999	Pennsylvania -- Statewide	221118	Other electric power generation	22	1.0	0.0	0.0
640927	42	42	999	Pennsylvania -- Statewide	221210	Natural gas distribution	22	4.4	0.0	0.0
640928	42	42	999	Pennsylvania -- Statewide	236210	Industrial building construction	23	1.75	0.0	0.0
640929	42	42	999	Pennsylvania -- Statewide	236220	Commercial and institutional building construction	23	1.0	0.0	0.0
640930	42	42	999	Pennsylvania -- Statewide	237130	Power and communication line and related structures construction	23	2.4	0.0	0.0
640931	42	42	999	Pennsylvania -- Statewide	237310	Highway, street, and bridge construction	23	1.0	0.0	0.0
640932	42	42	999	Pennsylvania -- Statewide	238210	Electrical contractors and other wiring installation contractors	23	1.0	0.0	0.0
640933	42	42	999	Pennsylvania -- Statewide	238220	Plumbing, heating, and air-conditioning contractors	23	1.0	0.0	0.0
640934	42	42	999	Pennsylvania -- Statewide	326199	All other plastics product manufacturing	32	1.0	0.0	0.0
640935	42	42	999	Pennsylvania -- Statewide	333132	Oil and gas field machinery and equipment manufacturing	33	1.0	0.0	0.0
640936	42	42	999	Pennsylvania -- Statewide	423110	Automobile and other motor vehicle merchant wholesalers	42	1.0	0.0	0.0
640937	42	42	999	Pennsylvania -- Statewide	423120	Motor vehicle supplies and new parts merchant wholesalers	42	1.4	0.0	0.0
640938	42	42	999	Pennsylvania -- Statewide	423210	Furniture merchant wholesalers	42	3.0	0.0	0.0
640939	42	42	999	Pennsylvania -- Statewide	423220	Home furnishing merchant wholesalers	42	1.2	0.0	0.0
640940	42	42	999	Pennsylvania -- Statewide	423330	Roofing, siding, and insulation material merchant wholesalers	42	2.2	6.6	843.6
640941	42	42	999	Pennsylvania -- Statewide	423390	Other construction material merchant wholesalers	42	2.0	0.0	0.0
640942	42	42	999	Pennsylvania -- Statewide	423410	Photographic equipment and supplies merchant wholesalers	42	1.2	0.0	0.0
640943	42	42	999	Pennsylvania -- Statewide	423420	Office equipment merchant wholesalers	42	2.4	0.0	0.0
640944	42	42	999	Pennsylvania -- Statewide	423430	Computer and computer peripheral equipment and software merchant wholesalers	42	11.6	50.6	10368.6
640945	42	42	999	Pennsylvania -- Statewide	423440	Other commercial equipment merchant wholesalers	42	1.4	0.0	0.0
640946	42	42	999	Pennsylvania -- Statewide	423450	Medical, dental, and hospital equipment and supplies merchant wholesalers	42	15.6	876.6	131200.0
640947	42	42	999	Pennsylvania -- Statewide	423460	Ophthalmic goods merchant wholesalers	42	1.0	0.0	0.0
640948	42	42	999	Pennsylvania -- Statewide	423490	Other professional equipment and supplies merchant wholesalers	42	1.25	0.0	0.0
640949	42	42	999	Pennsylvania -- Statewide	423510	Metal service centers and other metal merchant wholesalers	42	1.2	0.0	0.0
640950	42	42	999	Pennsylvania -- Statewide	423610	Electrical apparatus and equipment, wiring supplies, and related equipment merchant wholesalers	42	6.2	9.4	1170.4
640951	42	42	999	Pennsylvania -- Statewide	423620	Household appliances, electric housewares, and consumer electronics merchant wholesalers 	42	1.0	0.0	0.0
640952	42	42	999	Pennsylvania -- Statewide	423690	Other electronic parts and equipment merchant wholesalers	42	10.6	155.4	23076.4
640953	42	42	999	Pennsylvania -- Statewide	423720	Plumbing and heating equipment and supplies (hydronics) merchant wholesalers	42	1.6	0.0	0.0
640954	42	42	999	Pennsylvania -- Statewide	423810	Construction and mining (except oil well) machinery and equipment merchant wholesalers	42	1.0	0.0	0.0
640955	42	42	999	Pennsylvania -- Statewide	423830	Industrial machinery and equipment merchant wholesalers	42	8.0	132.0	18434.0
640956	42	42	999	Pennsylvania -- Statewide	423840	Industrial supplies merchant wholesalers	42	7.4	74.2	6516.0
640957	42	42	999	Pennsylvania -- Statewide	423920	Toy and hobby goods and supplies merchant wholesalers	42	1.0	0.0	0.0
640958	42	42	999	Pennsylvania -- Statewide	423930	Recyclable material merchant wholesalers	42	1.0	0.0	0.0
640959	42	42	999	Pennsylvania -- Statewide	423940	Jewelry, watch, precious stone, and precious metal merchant wholesalers	42	1.2	0.0	0.0
640960	42	42	999	Pennsylvania -- Statewide	423990	Other miscellaneous durable goods merchant wholesalers	42	1.5	0.0	0.0
640961	42	42	999	Pennsylvania -- Statewide	424110	Printing and writing paper merchant wholesalers	42	1.0	0.0	0.0
640962	42	42	999	Pennsylvania -- Statewide	424120	Stationery and office supplies merchant wholesalers	42	2.0	0.0	0.0
640963	42	42	999	Pennsylvania -- Statewide	424130	Industrial and personal service paper merchant wholesalers	42	1.0	0.0	0.0
640964	42	42	999	Pennsylvania -- Statewide	424210	Drugs and druggists' sundries merchant wholesalers	42	15.4	2219.6	411539.2
640965	42	42	999	Pennsylvania -- Statewide	424310	Piece goods, notions, and other dry goods merchant wholesalers	42	3.0	0.0	0.0
640966	42	42	999	Pennsylvania -- Statewide	424320	Men's and boys' clothing and furnishings merchant wholesalers	42	1.8	0.0	0.0
640967	42	42	999	Pennsylvania -- Statewide	424420	Packaged frozen food merchant wholesalers	42	1.6	0.0	0.0
640968	42	42	999	Pennsylvania -- Statewide	424440	Poultry and poultry product merchant wholesalers	42	1.0	0.0	0.0
640969	42	42	999	Pennsylvania -- Statewide	424450	Confectionery merchant wholesalers	42	2.8	0.0	0.0
640970	42	42	999	Pennsylvania -- Statewide	424470	Meat and meat product merchant wholesalers	42	1.0	0.0	0.0
640971	42	42	999	Pennsylvania -- Statewide	424490	Other grocery and related products merchant wholesalers	42	7.2	92.6	5039.6
640972	42	42	999	Pennsylvania -- Statewide	424610	Plastics materials and basic forms and shapes merchant wholesalers	42	2.0	0.0	0.0
640973	42	42	999	Pennsylvania -- Statewide	424690	Other chemical and allied products merchant wholesalers	42	9.0	282.6	22073.6
640974	42	42	999	Pennsylvania -- Statewide	424720	Petroleum and petroleum products merchant wholesalers (except bulk stations and terminals) 	42	5.2	4.8	607.4
640975	42	42	999	Pennsylvania -- Statewide	424820	Wine and distilled alcoholic beverage merchant wholesalers	42	2.8	3.8	488.0
640976	42	42	999	Pennsylvania -- Statewide	424910	Farm supplies merchant wholesalers	42	1.6	0.0	0.0
640977	42	42	999	Pennsylvania -- Statewide	424920	Book, periodical, and newspaper merchant wholesalers	42	1.0	0.0	0.0
640978	42	42	999	Pennsylvania -- Statewide	424950	Paint, varnish, and supplies merchant wholesalers	42	1.0	0.0	0.0
640979	42	42	999	Pennsylvania -- Statewide	425110	Business to business electronic markets	42	1.2	0.0	0.0
640980	42	42	999	Pennsylvania -- Statewide	425120	Wholesale trade agents and brokers	42	6.0	0.0	0.0
640981	42	42	999	Pennsylvania -- Statewide	446120	Cosmetics, beauty supplies, and perfume stores	44	1.0	0.0	0.0
640982	42	42	999	Pennsylvania -- Statewide	448140	Family clothing stores	44	1.0	0.0	0.0
640983	42	42	999	Pennsylvania -- Statewide	448190	Other clothing stores	44	1.0	0.0	0.0
640984	42	42	999	Pennsylvania -- Statewide	451140	Musical instrument and supplies stores	45	1.0	0.0	0.0
640985	42	42	999	Pennsylvania -- Statewide	451211	Book stores	45	1.0	0.0	0.0
640986	42	42	999	Pennsylvania -- Statewide	454113	Mail-order houses	45	3.0	0.0	0.0
640987	42	42	999	Pennsylvania -- Statewide	484121	General freight trucking, long-distance, truckload	48	1.0	0.0	0.0
640988	42	42	999	Pennsylvania -- Statewide	485410	School and employee bus transportation	48	1.0	0.0	0.0
640989	42	42	999	Pennsylvania -- Statewide	488190	Other support activities for air transportation	48	1.0	0.0	0.0
640990	42	42	999	Pennsylvania -- Statewide	493110	General warehousing and storage	49	4.5	0.0	0.0
640991	42	42	999	Pennsylvania -- Statewide	511130	Book publishers	51	1.0	0.0	0.0
640992	42	42	999	Pennsylvania -- Statewide	511140	Directory and mailing list publishers	51	1.25	0.0	0.0
640993	42	42	999	Pennsylvania -- Statewide	511199	All other publishers	51	1.0	0.0	0.0
640994	42	42	999	Pennsylvania -- Statewide	511210	Software publishers	51	13.4	320.4	56518.0
640995	42	42	999	Pennsylvania -- Statewide	512110	Motion picture and video production	51	2.0	0.0	0.0
640996	42	42	999	Pennsylvania -- Statewide	515120	Television broadcasting	51	1.3333333333333333	0.0	0.0
640997	42	42	999	Pennsylvania -- Statewide	517110	Wired telecommunications carriers	51	8.8	57.8	5704.0
640998	42	42	999	Pennsylvania -- Statewide	517210	Wireless telecommunications carriers (except satellite)	51	2.8	13.2	2133.0
640999	42	42	999	Pennsylvania -- Statewide	517410	Satellite telecommunications	51	1.0	0.0	0.0
641000	42	42	999	Pennsylvania -- Statewide	517919	All other telecommunications	51	2.2	0.0	0.0
641001	42	42	999	Pennsylvania -- Statewide	518210	Data processing, hosting, and related services	51	8.8	179.2	14888.8
641002	42	42	999	Pennsylvania -- Statewide	519120	Libraries and archives	51	1.0	0.0	0.0
641003	42	42	999	Pennsylvania -- Statewide	519130	Internet publishing and broadcasting and web search portals	51	5.0	0.0	0.0
641004	42	42	999	Pennsylvania -- Statewide	522110	Commercial banking	52	10.2	91.6	13465.2
641005	42	42	999	Pennsylvania -- Statewide	522120	Savings institutions	52	1.8	0.0	0.0
641006	42	42	999	Pennsylvania -- Statewide	522210	Credit card issuing	52	2.8	0.0	0.0
641007	42	42	999	Pennsylvania -- Statewide	522220	Sales financing	52	9.4	19.0	3101.2
641008	42	42	999	Pennsylvania -- Statewide	522291	Consumer lending	52	1.6	0.0	0.0
641009	42	42	999	Pennsylvania -- Statewide	522292	Real estate credit	52	9.0	337.2	30703.4
641010	42	42	999	Pennsylvania -- Statewide	522298	All other nondepository credit intermediation	52	1.0	0.0	0.0
641011	42	42	999	Pennsylvania -- Statewide	522320	Financial transactions processing, reserve, and clearinghouse activities	52	9.4	15.2	4864.2
641012	42	42	999	Pennsylvania -- Statewide	522390	Other activities related to credit intermediation	52	1.5	0.0	0.0
641013	42	42	999	Pennsylvania -- Statewide	523110	Investment banking and securities dealing	52	1.75	0.0	0.0
641014	42	42	999	Pennsylvania -- Statewide	523120	Securities brokerage	52	17.6	123.8	21085.8
641015	42	42	999	Pennsylvania -- Statewide	523920	Portfolio management	52	17.4	70.0	24333.2
641016	42	42	999	Pennsylvania -- Statewide	523930	Investment advice	52	8.2	26.4	7267.6
641017	42	42	999	Pennsylvania -- Statewide	523991	Trust, fiduciary, and custody activities	52	7.0	0.0	0.0
641018	42	42	999	Pennsylvania -- Statewide	523999	Miscellaneous financial investment activities	52	10.5	0.0	0.0
641019	42	42	999	Pennsylvania -- Statewide	524113	Direct life insurance carriers	52	25.0	1958.2	170935.8
641020	42	42	999	Pennsylvania -- Statewide	524114	Direct health and medical insurance carriers	52	17.2	2745.0	210723.0
641021	42	42	999	Pennsylvania -- Statewide	524126	Direct property and casualty insurance carriers	52	20.2	334.8	39011.4
641022	42	42	999	Pennsylvania -- Statewide	524128	Other direct insurance (except life, health, and medical) carriers	52	1.4	0.0	0.0
641023	42	42	999	Pennsylvania -- Statewide	524130	Reinsurance carriers	52	3.0	0.0	0.0
641024	42	42	999	Pennsylvania -- Statewide	524210	Insurance agencies and brokerages	52	18.6	413.4	24889.6
641025	42	42	999	Pennsylvania -- Statewide	524291	Claims adjusting	52	3.0	0.0	0.0
641026	42	42	999	Pennsylvania -- Statewide	524292	Third party administration of insurance and pension funds	52	3.75	392.5	20990.5
641027	42	42	999	Pennsylvania -- Statewide	524298	All other insurance related activities	52	1.6	0.0	0.0
641028	42	42	999	Pennsylvania -- Statewide	531210	Offices of real estate agents and brokers	53	1.0	0.0	0.0
641029	42	42	999	Pennsylvania -- Statewide	531311	Residential property managers	53	2.0	0.0	0.0
641030	42	42	999	Pennsylvania -- Statewide	531312	Nonresidential property managers	53	1.25	0.0	0.0
641031	42	42	999	Pennsylvania -- Statewide	531320	Offices of real estate appraisers	53	1.0	0.0	0.0
641032	42	42	999	Pennsylvania -- Statewide	532411	Commercial air, rail, and water transportation equipment rental and leasing	53	1.0	0.0	0.0
641033	42	42	999	Pennsylvania -- Statewide	532412	Construction, mining, and forestry machinery and equipment rental and leasing	53	2.0	0.0	0.0
641034	42	42	999	Pennsylvania -- Statewide	532420	Office machinery and equipment rental and leasing	53	1.0	0.0	0.0
641035	42	42	999	Pennsylvania -- Statewide	532490	Other commercial and industrial machinery and equipment rental and leasing	53	1.0	0.0	0.0
641036	42	42	999	Pennsylvania -- Statewide	533110	Lessors of nonfinancial intangible assets (except copyrighted works)	53	1.0	0.0	0.0
641037	42	42	999	Pennsylvania -- Statewide	541213	Tax preparation services	54	1.0	0.0	0.0
641038	42	42	999	Pennsylvania -- Statewide	541214	Payroll services	54	8.6	3623.6	148501.6
641039	42	42	999	Pennsylvania -- Statewide	541330	Engineering services	54	7.4	48.0	6136.2
641040	42	42	999	Pennsylvania -- Statewide	541511	Custom computer programming services	54	14.0	1553.6	161698.0
641041	42	42	999	Pennsylvania -- Statewide	541512	Computer systems design services	54	15.4	990.0	93986.2
641042	42	42	999	Pennsylvania -- Statewide	541513	Computer facilities management services	54	2.0	0.0	0.0
641043	42	42	999	Pennsylvania -- Statewide	541519	Other computer related services	54	8.4	34.2	3547.4
641044	42	42	999	Pennsylvania -- Statewide	541611	Administrative management and general management consulting services	54	4.2	36.2	2505.0
641045	42	42	999	Pennsylvania -- Statewide	541612	Human resources consulting services	54	4.6	55.0	6944.2
641046	42	42	999	Pennsylvania -- Statewide	541613	Marketing consulting services	54	1.0	0.0	0.0
641047	42	42	999	Pennsylvania -- Statewide	541614	Process, physical distribution, and logistics consulting services	54	1.0	0.0	0.0
641048	42	42	999	Pennsylvania -- Statewide	541620	Environmental consulting services	54	2.0	0.0	0.0
641049	42	42	999	Pennsylvania -- Statewide	541690	Other scientific and technical consulting services	54	4.2	0.0	0.0
641050	42	42	999	Pennsylvania -- Statewide	541712	Research and development in the physical, engineering, and life sciences (except biotechnology)	54	6.2	237.0	24346.4
641051	42	42	999	Pennsylvania -- Statewide	541810	Advertising agencies	54	1.3333333333333333	0.0	0.0
641052	42	42	999	Pennsylvania -- Statewide	541850	Outdoor advertising	54	1.0	0.0	0.0
641053	42	42	999	Pennsylvania -- Statewide	541870	Advertising material distribution services	54	1.0	0.0	0.0
641054	42	42	999	Pennsylvania -- Statewide	541890	Other services related to advertising	54	2.0	15.4	715.8
641055	42	42	999	Pennsylvania -- Statewide	541910	Marketing research and public opinion polling	54	1.4	0.0	0.0
641056	42	42	999	Pennsylvania -- Statewide	541921	Photography studios, portrait	54	2.0	0.0	0.0
641057	42	42	999	Pennsylvania -- Statewide	551114	Corporate, subsidiary, and regional managing offices	55	15.4	55.8	7689.0
641058	42	42	999	Pennsylvania -- Statewide	561110	Office administrative services	56	3.0	10.4	944.0
641059	42	42	999	Pennsylvania -- Statewide	561210	Facilities support services	56	1.0	0.0	0.0
641060	42	42	999	Pennsylvania -- Statewide	561320	Temporary help services	56	60.6	22278.4	565660.2
641061	42	42	999	Pennsylvania -- Statewide	561330	Professional employer organizations	56	4.2	2129.8	49364.0
641062	42	42	999	Pennsylvania -- Statewide	561410	Document preparation services	56	2.75	150.5	7385.75
641063	42	42	999	Pennsylvania -- Statewide	561422	Telemarketing bureaus and other contact centers	56	2.6	0.0	0.0
641064	42	42	999	Pennsylvania -- Statewide	561439	Other business service centers (including copy shops)	56	1.2	0.0	0.0
641065	42	42	999	Pennsylvania -- Statewide	561450	Credit bureaus	56	1.4	0.0	0.0
641066	42	42	999	Pennsylvania -- Statewide	561499	All other business support services	56	2.6	0.0	0.0
641067	42	42	999	Pennsylvania -- Statewide	561510	Travel agencies	56	4.0	0.0	0.0
641068	42	42	999	Pennsylvania -- Statewide	561520	Tour operators	56	1.6666666666666667	0.0	0.0
641069	42	42	999	Pennsylvania -- Statewide	561599	All other travel arrangement and reservation services	56	1.0	0.0	0.0
641070	42	42	999	Pennsylvania -- Statewide	561611	Investigation services	56	2.0	0.0	0.0
641071	42	42	999	Pennsylvania -- Statewide	561612	Security guards and patrol services	56	1.8	0.0	0.0
641072	42	42	999	Pennsylvania -- Statewide	561621	Security systems services (except locksmiths)	56	1.0	0.0	0.0
641073	42	42	999	Pennsylvania -- Statewide	561720	Janitorial services	56	1.0	0.0	0.0
641074	42	42	999	Pennsylvania -- Statewide	561730	Landscaping services	56	1.0	0.0	0.0
641075	42	42	999	Pennsylvania -- Statewide	561990	All other support services	56	2.6	52.0	967.8
641076	42	42	999	Pennsylvania -- Statewide	562211	Hazardous waste treatment and disposal	56	1.0	0.0	0.0
641077	42	42	999	Pennsylvania -- Statewide	562219	Other nonhazardous waste treatment and disposal	56	1.0	0.0	0.0
641078	42	42	999	Pennsylvania -- Statewide	611310	Colleges, universities, and professional schools	61	3.5	0.0	0.0
641079	42	42	999	Pennsylvania -- Statewide	611430	Professional and management development training	61	1.0	0.0	0.0
641080	42	42	999	Pennsylvania -- Statewide	611691	Exam preparation and tutoring	61	1.0	0.0	0.0
641081	42	42	999	Pennsylvania -- Statewide	611710	Educational support services	61	1.0	0.0	0.0
641082	42	42	999	Pennsylvania -- Statewide	621111	Offices of physicians (except mental health specialists)	62	11.4	0.0	0.0
641083	42	42	999	Pennsylvania -- Statewide	621340	Offices of physical, occupational and speech therapists, and audiologists	62	4.4	0.0	0.0
641084	42	42	999	Pennsylvania -- Statewide	621420	Outpatient mental health and substance abuse centers	62	2.0	0.0	0.0
641085	42	42	999	Pennsylvania -- Statewide	621498	All other outpatient care centers	62	1.0	0.0	0.0
641086	42	42	999	Pennsylvania -- Statewide	621512	Diagnostic imaging centers	62	1.0	0.0	0.0
641087	42	42	999	Pennsylvania -- Statewide	621610	Home health care services	62	7.0	0.0	0.0
641088	42	42	999	Pennsylvania -- Statewide	621999	All other miscellaneous ambulatory health care services	62	2.2	0.0	0.0
641089	42	42	999	Pennsylvania -- Statewide	622110	General medical and surgical hospitals	62	2.0	0.0	0.0
641090	42	42	999	Pennsylvania -- Statewide	624120	Services for the elderly and persons with disabilities	62	3.0	1191.0	29910.0
641091	42	42	999	Pennsylvania -- Statewide	711320	Promoters of performing arts, sports, and similar events without facilities	71	1.5	0.0	0.0
641092	42	42	999	Pennsylvania -- Statewide	713940	Fitness and recreational sports centers	71	1.0	0.0	0.0
641093	42	42	999	Pennsylvania -- Statewide	722310	Food service contractors	72	5.5	0.0	0.0
641094	42	42	999	Pennsylvania -- Statewide	722513	Limited-service restaurants	72	1.0	0.0	0.0
641095	42	42	999	Pennsylvania -- Statewide	811122	Automotive glass replacement shops	81	1.0	0.0	0.0
641096	42	42	999	Pennsylvania -- Statewide	811219	Other electronic and precision equipment repair and maintenance	81	1.8	0.0	0.0
641097	42	42	999	Pennsylvania -- Statewide	811310	Commercial and industrial machinery and equipment (except automotive and electronic) repair and maintenance	81	1.8	0.0	0.0
641098	42	42	999	Pennsylvania -- Statewide	811490	Other personal and household goods repair and maintenance	81	1.0	0.0	0.0
641099	42	42	999	Pennsylvania -- Statewide	812199	Other personal care services	81	1.0	0.0	0.0
641100	42	42	999	Pennsylvania -- Statewide	812990	All other personal services	81	1.2	0.0	0.0
641101	42	42	999	Pennsylvania -- Statewide	813212	Voluntary health organizations	81	1.2	0.0	0.0
641102	42	42	999	Pennsylvania -- Statewide	813312	Environment, conservation and wildlife organizations	81	1.0	0.0	0.0
641103	42	42	999	Pennsylvania -- Statewide	813410	Civic and social organizations	81	1.0	0.0	0.0
