"city","facebook","name","state","street","tags","twitter","type","website","x","y","zip"
"WASHINGTON COURT HOUSE","https://www.facebook.com/OHFCFM/","Fayette County Farmers Market","oh","100 E EAST ST.","baked goods crafts flowers eggs herbs vegetables honey jams plants prepared-foods soap fruits juices pet food","https://twitter.com/FAYCOFARMERSMKT","market","https://fayettecountyfarmersmarket.wordpress.com/","-83.427938","39.53886","43160"
"Washington Court House ","https://www.facebook.com/OHFCFM/","Fayette County Farmers Market","oh","100 E EAST STREET","baked goods crafts flowers eggs herbs vegetables honey jams plants prepared-foods soap fruits pet food","https://twitter.com/FAYCOFARMERSMKT","market","https://fayettecountyfarmersmarket.wordpress.com/","-83.427938","39.53886","43160"
"Cincinnati","https://www.facebook.com/events/722787851585113/","Fibonacci's Mount Healthy Farmers Market","oh","1445 Compton Road","baked goods cheese eggs herbs vegetables jams maple meat poultry prepared-foods soap wine coffee fruits juices","","market","http://fibbrew.com/farmers-market-application/","-84.540950","39.231610","45231"
"Sycamore","FifthStreetFarmersMarket","Fifth Street Farmers' Market","oh","West Fifth Street","baked goods crafts eggs herbs vegetables honey jams plants soap trees fruits","","market","","-83.1700053","40.9509375","44882"
"Columbus","https://www.facebook.com/FPConservatory","Franklin Park Conservatory and Botanical Gardens Farmers' Market","oh","1777 E. Broad Street","organic baked goods cheese crafts flowers eggs seafood herbs vegetables honey jams maple meat plants poultry prepared-foods soap wine coffee fruits grains juices mushrooms pet food tofu","https://twitter.com/FPConservatory","market","https://www.fpconservatory.org/education-programs/outreach-programs/farmers-market/","-82.952321","39.966884","43203"
"Hamilton","Hamilton's Historic Farmer's Market","Hamilton's Historic Farmers Market","oh","345 High Street ","baked goods crafts flowers eggs vegetables honey jams plants soap coffee fruits","","market","http://www.hamiltonshistoricfarmersmarket.com","-84.565522","39.394328","45011"
"Findlay","@HancockCountyFarmersMarket","Hancock County Farmers' Market","oh","200 West Main Cross","baked goods crafts flowers herbs vegetables honey jams maple meat nuts plants poultry prepared-foods soap trees coffee fruits juices mushrooms pet food","","market","https://hancockfarmmarket.wixsite.com/home","-83.653004","41.039589","45840"
"Akron","","HAPI Fresh Farmers' Market ","oh","647 E. Market Street","organic baked goods crafts vegetables honey jams maple soap coffee fruits","","market","","-81.521429","41.080456","44304"
"Akron ","","HAPI Fresh Farmers' Market ","oh","381 Ontario Street","organic baked goods crafts flowers vegetables honey jams maple plants prepared-foods fruits","","market","http://asiaohio.org ","-81.521429","41.080456","44310"
"Kent","http://www.facebook.com/haymaker.farmers.market","Haymaker Farmers' Market","oh","Franklin Avenue & Summit Street","organic baked goods cheese crafts flowers eggs herbs vegetables honey jams maple meat nuts plants poultry prepared-foods soap trees coffee fruits juices mushrooms pet food","https://twitter.com/haymakermarket","market","http://haymakermarket.com/","-81.360033","41.150692","44240"
"Kent","https://www.facebook.com/haymaker.farmers.market","Haymaker Farmers' Market","oh","1435 E Main St, ","organic baked goods cheese crafts flowers eggs herbs vegetables honey jams maple meat nuts plants poultry prepared-foods soap trees coffee fruits juices mushrooms pet food","https://twitter.com/haymakermarket","market","http://haymakermarket.com","-81.337712","41.155218","44240"
"Cincinnati","https://www.facebook.com/HydeParkFarmersMarket/","Hyde Park Farmers' Market","oh","2700 Erie Avenue","organic baked goods cheese flowers eggs herbs vegetables honey jams maple meat plants poultry prepared-foods soap coffee fruits grains mushrooms pet food wild","","market","http://www.HydeParkFarmersMarket.com","-84.442330","39.139602","45208"
"Lancaster","https://www.facebook.com/lancasterohfarmersmarket","Lancaster Farmers Market","oh","West Chestnut Street","baked goods cheese flowers eggs vegetables honey jams maple plants poultry soap coffee fruits juices pet food","","market","https://www.lancasterohfarmersmarket.org/","-82.603853","39.712631","43130"
"Cincinnati","lewfm","Lettuce Eat Well Farmers' Market","oh","4040 Harrison Ave","baked goods cheese crafts flowers eggs herbs vegetables honey jams maple meat plants poultry prepared-foods soap beans fruits grains pet food","","market","http://www.lewfm.org","-84.6172030","39.1587027","45211"
"Marion ","Marion Ohio Market","Marion Ohio Market","oh","Main and Church ","baked goods crafts eggs vegetables honey jams maple prepared-foods soap fruits","","market","","-83.122972","40.593304","43302"
"medina","medina farmers market","Medina Square Farmers Market","oh","2 public square, suite 305","organic baked goods cheese flowers eggs herbs vegetables honey maple meat prepared-foods soap coffee fruits","","market","http://www.medinafarmersmarket.com","-81.863333","41.138385","44256"
"Pomeroy","www.facebook.com/meigscountyfarmersmarket","Meigs County Farmers' Market","oh","PO Box 702","organic baked goods crafts flowers eggs herbs vegetables honey jams plants soap coffee fruits","","market","http://www.meigscountyfarmersmarket.com","-82.034026","39.026596","45769"
"McConnelsville","Morgan County Farmers Market","Morgan County Farmers Market","oh","Intersection Main and Kennebec","baked goods crafts vegetables plants fruits","","market","http://morgan.osu.edu","-81.853276","39.648855","43756"
"New Albany","https://www.facebook.com/nafarmersmarket","New Albany Farmers Market","oh","200 Market Street (outdoor); 150 West Main Street (indoor)","organic baked goods cheese crafts flowers eggs seafood herbs vegetables honey jams maple poultry prepared-foods soap coffee fruits grains juices mushrooms pet food wild","","market","http://www.healthynewalbany.org/farmers-market","-82.815383","40.081412","43054"
"North Canton","https://www.facebook.com/NorthCantonFarmersMarket/","North Canton Farmers' Market","oh","1447 North Main Street","organic baked goods crafts flowers eggs herbs vegetables honey jams maple meat poultry prepared-foods soap coffee fruits grains mushrooms","","market","https://www.knowyourrootsohio.com/north-canton-farmers-market","-81.408671","40.892808","44720"
" Mansfield ","www.facebook.com/nefm2014/","North End Farmers Market","oh","417 Blust Ave.","organic baked goods cheese crafts flowers herbs vegetables honey jams maple meat soap fruits juices","twitter.com/necic","market","http://www.necic-ohio.org","-82.5247140","40.7703620","44903"
"Columbus","https://www.facebook.com/NorthMarket/","North Market Farmers' Market","oh","59 Spruce Street","baked goods flowers eggs vegetables honey jams maple plants soap fruits mushrooms","https://twitter.com/NorthMarket","market","http://northmarket.com","-83.0043304","39.9718961","43215"
"Cincinnati ","","Northside Farmers Market","oh","4101 Hamilton Ave","baked goods flowers eggs herbs vegetables honey maple meat plants poultry prepared-foods soap coffee fruits mushrooms","","market","http://www.northsidefm.org","-84.540295","39.160611","45223"
"Canton, OH","https://www.facebook.com/PlainTownshipFarmersMarket/","Plain Township Farmers' Market","oh","1714 Schneider Street NE","organic baked goods cheese crafts flowers eggs vegetables honey jams maple meat nuts plants poultry prepared-foods soap coffee fruits juices mushrooms pet food","","market","https://www.plaintownship.com/farmersmarket.aspx","-81.350669","40.865422","44721"
"Galloway","","Prairie Township Farmer's Market","oh","5955 W. Broad Street","baked goods eggs vegetables honey jams maple poultry coffee fruits juices","","market","http://oh-prairietownship2.civicplus.com/219/Farmers-Market","-83.009303","39.9695356","43119"
"Columbus ","https://m.facebook.com/saintmaryfarmersmarketgv/","Saint Mary Farmers Market","oh","700 s third st","baked goods cheese crafts flowers eggs herbs vegetables honey jams meat poultry soap coffee fruits juices pet food","","market","","-82.994617","39.948137","43206"
"Saint Paris","SaintParis FarmersMarket","SaintParis FarmersMarket","oh","135 W. Main St","baked goods cheese crafts vegetables honey maple plants fruits","","market","","-83.959772","40.127699","43072"
"Columbus","https://www.facebook.com/Southeastfarmersgrowers43232/","SE Columbus Farmer's & Grower's Market","oh","5081 Carbondale Drive","baked goods crafts herbs vegetables honey jams soap fruits mushrooms","","market","","-82.847372","39.924927","43232"
"Dayton ","https://www.facebook.com/Shiloh-Farmers-Market-508150235911225/","Shiloh Farmers' Market","oh","5300 Philadelphia Dr.","baked goods cheese crafts flowers eggs herbs vegetables honey jams maple meat plants poultry prepared-foods soap coffee fruits juices mushrooms","","market","http://www.shilohfarmersmarket.com/","-84.235026","39.819046","45415"
"Stow","@StowCommunityFarmersMarket","Stow Community Farmers Market","oh","1567 Pilgrim Drive","baked goods crafts eggs herbs vegetables honey jams maple meat plants prepared-foods soap trees coffee fruits pet food","","market","http://www.stowfarmersmarket.com","-81.452156","41.168794","44224"
"Akron","https://www.facebook.com/LetsGrowAkron/","Summit Lake Neighborhood Farmers' Market","oh","380 W. Crosier St.","organic baked goods crafts flowers vegetables honey jams soap coffee beans fruits","letsgrowakron","market","http://www.letsgrowakron.org","-81.542318","41.058965","44311"
"Fairfield","http://bit.ly/thefairfieldfarmersmarket","The Fairfield Farmers Market","oh","411 Wessel Drive","baked goods cheese crafts eggs herbs vegetables honey jams poultry soap wine coffee fruits juices mushrooms pet food","","market","","-84.563916","39.334042","45014"
"Upper Arlington","","Upper Arlington Farmers Market","oh","2850 Tremont Rd","organic baked goods flowers eggs seafood vegetables honey jams meat plants poultry coffee fruits","","market","http://www.getfreshmarkets.org","-83.066903","40.013849","43221"
"Westerville","https://www.facebook.com/MarketWednesday/","Uptown Westerville Farmers' Market","oh","62 N. State St.","baked goods cheese flowers eggs seafood herbs vegetables honey jams maple meat plants poultry fruits","https://twitter.com/marketwednesday","market","https://www.marketwednesday.com/","-82.932051","40.127570","43081"
"Cleveland ","https://www.facebook.com/VillageMarketSlavicVillage/","Village Market- Slavic Village","oh","5106 Fleet Ave","baked goods herbs vegetables honey jams plants fruits","","market","http://slavicvillage.org/villagemarket","-81.654595","41.455724","44105"
"Wadsworth","https://www.facebook.com/MainStreetWadsworthFarmersMarket/","Wadsworth Farmers Market","oh","151 Main Street","baked goods cheese crafts flowers herbs vegetables honey jams maple meat plants trees coffee fruits pet food","","market","http://www.wadsworthfarmersmarket.com","-81.732318","41.028681","44281"
"Westerville","Westerville Saturday Farmers Market","Westerville Saturday Farmers Market","oh","1 S Grove St","organic baked goods crafts flowers eggs herbs vegetables honey jams meat nuts plants poultry prepared-foods soap coffee fruits grains juices mushrooms pet food","","market","http://www.UptownWestervilleInc.com","-82.935814","40.125435","43081"
"Columbus"," https://www.facebook.com/WestgateFarmersMarket/","Westgate Farmers Market","oh","2925 W. Broad Street","baked goods crafts flowers eggs herbs vegetables honey jams meat poultry prepared-foods soap coffee fruits mushrooms","","market","http://www.westgatefarmersmarket.com","-83.078781","39.954491","43204"
