	id	state	COUNTY	GEO_TTL	relevant_naics	NAICS2012_TTL	NAICS_Sector	estab	emp	payann
0	2013	2	13	Aleutians East Borough, Alaska	1141	Fishing	11	2.8	0.6	69.6
1	2013	2	13	Aleutians East Borough, Alaska	2211	Electric power generation, transmission and distribution	22	3.4	10.0	667.0
6	2013	2	13	Aleutians East Borough, Alaska	4451	Grocery stores	44	4.0	44.2	1054.8
14	2013	2	13	Aleutians East Borough, Alaska	5311	Lessors of real estate	53	3.4	4.2	112.2
25	2013	2	13	Aleutians East Borough, Alaska	7224	Drinking places (alcoholic beverages)	72	3.6	17.0	408.2
26	2013	2	13	Aleutians East Borough, Alaska	7225	Restaurants and other eating places	72	3.0	0.2	8.6
29	2016	2	16	Aleutians West Census Area, Alaska	1141	Fishing	11	7.2	2.0	120.6
37	2016	2	16	Aleutians West Census Area, Alaska	3117	Seafood product preparation and packaging	31	9.4	3103.6	78146.8
45	2016	2	16	Aleutians West Census Area, Alaska	4239	Miscellaneous durable goods merchant wholesalers	42	4.0	14.0	1037.8
47	2016	2	16	Aleutians West Census Area, Alaska	4247	Petroleum and petroleum products merchant wholesalers	42	2.8	33.0	2157.6
50	2016	2	16	Aleutians West Census Area, Alaska	4451	Grocery stores	44	4.6	50.0	2345.0
54	2016	2	16	Aleutians West Census Area, Alaska	4543	Direct selling establishments	45	2.6	2.8	246.4
56	2016	2	16	Aleutians West Census Area, Alaska	4831	Deep sea, coastal, and great lakes water transportation	48	3.8	66.0	14490.2
63	2016	2	16	Aleutians West Census Area, Alaska	4885	Freight transportation arrangement	48	3.0	2.0	251.4
75	2016	2	16	Aleutians West Census Area, Alaska	5413	Architectural, engineering, and related services	54	2.0	4.4	237.8
84	2016	2	16	Aleutians West Census Area, Alaska	6214	Outpatient care centers	62	5.4	38.8	2437.0
93	2016	2	16	Aleutians West Census Area, Alaska	7225	Restaurants and other eating places	72	3.8	9.6	220.8
98	2016	2	16	Aleutians West Census Area, Alaska	8139	Business, professional, labor, political, and similar organizations	81	3.8	11.2	648.6
100	2020	2	20	Anchorage Municipality, Alaska	1141	Fishing	11	33.8	57.0	5510.4
104	2020	2	20	Anchorage Municipality, Alaska	2111	Oil and gas extraction	21	13.8	1066.0	226270.6
105	2020	2	20	Anchorage Municipality, Alaska	2122	Metal ore mining	21	4.6	6.2	1166.6
106	2020	2	20	Anchorage Municipality, Alaska	2123	Nonmetallic mineral mining and quarrying	21	10.0	99.4	8034.0
107	2020	2	20	Anchorage Municipality, Alaska	2131	Support activities for mining	21	37.6	5410.4	529214.2
108	2020	2	20	Anchorage Municipality, Alaska	2211	Electric power generation, transmission and distribution	22	11.2	155.8	23686.2
111	2020	2	20	Anchorage Municipality, Alaska	2361	Residential building construction	23	154.6	572.6	34375.4
112	2020	2	20	Anchorage Municipality, Alaska	2362	Nonresidential building construction	23	124.0	3316.2	283172.2
113	2020	2	20	Anchorage Municipality, Alaska	2371	Utility system construction	23	38.6	2030.8	233400.6
114	2020	2	20	Anchorage Municipality, Alaska	2372	Land subdivision	23	3.2	6.4	553.6
115	2020	2	20	Anchorage Municipality, Alaska	2373	Highway, street, and bridge construction	23	28.2	669.0	78563.4
116	2020	2	20	Anchorage Municipality, Alaska	2379	Other heavy and civil engineering construction	23	8.4	70.6	10462.4
117	2020	2	20	Anchorage Municipality, Alaska	2381	Foundation, structure, and building exterior contractors	23	112.4	551.8	42249.8
118	2020	2	20	Anchorage Municipality, Alaska	2382	Building equipment contractors	23	204.0	2340.4	187877.0
119	2020	2	20	Anchorage Municipality, Alaska	2383	Building finishing contractors	23	182.2	640.4	31581.6
120	2020	2	20	Anchorage Municipality, Alaska	2389	Other specialty trade contractors	23	104.6	549.8	61336.2
126	2020	2	20	Anchorage Municipality, Alaska	3117	Seafood product preparation and packaging	31	5.6	19.6	5644.8
127	2020	2	20	Anchorage Municipality, Alaska	3118	Bakeries and tortilla manufacturing	31	8.4	132.8	3501.2
128	2020	2	20	Anchorage Municipality, Alaska	3119	Other food manufacturing	31	4.2	24.0	1068.0
129	2020	2	20	Anchorage Municipality, Alaska	3121	Beverage manufacturing	31	9.6	103.4	3735.0
135	2020	2	20	Anchorage Municipality, Alaska	3212	Veneer, plywood, and engineered wood product manufacturing	32	3.6	53.0	3423.0
136	2020	2	20	Anchorage Municipality, Alaska	3219	Other wood product manufacturing	32	5.2	32.2	2721.2
138	2020	2	20	Anchorage Municipality, Alaska	3231	Printing and related support activities	32	27.0	221.6	10817.8
139	2020	2	20	Anchorage Municipality, Alaska	3241	Petroleum and coal products manufacturing	32	6.4	44.0	3490.0
144	2020	2	20	Anchorage Municipality, Alaska	3261	Plastics product manufacturing	32	5.6	38.8	2029.8
148	2020	2	20	Anchorage Municipality, Alaska	3273	Cement and concrete product manufacturing	32	8.6	82.4	6675.0
153	2020	2	20	Anchorage Municipality, Alaska	3323	Architectural and structural metals manufacturing	33	8.8	82.2	6670.2
155	2020	2	20	Anchorage Municipality, Alaska	3327	Machine shops; turned product; and screw, nut, and bolt manufacturing	33	7.0	100.4	8089.0
163	2020	2	20	Anchorage Municipality, Alaska	3345	Navigational, measuring, electromedical, and control instruments manufacturing	33	2.2	3.8	312.0
167	2020	2	20	Anchorage Municipality, Alaska	3364	Aerospace product and parts manufacturing	33	4.8	36.0	2409.4
169	2020	2	20	Anchorage Municipality, Alaska	3371	Household and institutional furniture and kitchen cabinet manufacturing	33	2.4	4.2	266.0
170	2020	2	20	Anchorage Municipality, Alaska	3372	Office furniture (including fixtures) manufacturing	33	2.8	18.6	966.0
172	2020	2	20	Anchorage Municipality, Alaska	3391	Medical equipment and supplies manufacturing	33	16.6	41.0	3449.0
173	2020	2	20	Anchorage Municipality, Alaska	3399	Other miscellaneous manufacturing	33	7.8	68.4	4827.8
174	2020	2	20	Anchorage Municipality, Alaska	4231	Motor vehicle and motor vehicle parts and supplies merchant wholesalers	42	26.4	340.2	17593.2
175	2020	2	20	Anchorage Municipality, Alaska	4232	Furniture and home furnishing merchant wholesalers	42	12.0	88.2	6127.2
176	2020	2	20	Anchorage Municipality, Alaska	4233	Lumber and other construction materials merchant wholesalers	42	23.2	387.2	23251.8
177	2020	2	20	Anchorage Municipality, Alaska	4234	Professional and commercial equipment and supplies merchant wholesalers	42	36.0	554.2	39681.2
178	2020	2	20	Anchorage Municipality, Alaska	4235	Metal and mineral (except petroleum) merchant wholesalers	42	4.0	68.6	3654.6
179	2020	2	20	Anchorage Municipality, Alaska	4236	Household appliances and electrical and electronic goods merchant wholesalers	42	24.8	360.8	29686.2
180	2020	2	20	Anchorage Municipality, Alaska	4237	Hardware, plumbing and heating equipment and supplies merchant wholesalers	42	22.8	246.2	15705.8
181	2020	2	20	Anchorage Municipality, Alaska	4238	Machinery, equipment, and supplies merchant wholesalers	42	76.6	939.4	75017.2
182	2020	2	20	Anchorage Municipality, Alaska	4239	Miscellaneous durable goods merchant wholesalers	42	25.8	225.8	9933.4
183	2020	2	20	Anchorage Municipality, Alaska	4241	Paper and paper product merchant wholesalers	42	9.0	43.8	2132.0
184	2020	2	20	Anchorage Municipality, Alaska	4242	Drugs and druggists' sundries merchant wholesalers	42	8.0	42.4	2296.6
186	2020	2	20	Anchorage Municipality, Alaska	4244	Grocery and related product merchant wholesalers	42	42.2	1569.0	82695.4
188	2020	2	20	Anchorage Municipality, Alaska	4246	Chemical and allied products merchant wholesalers	42	10.4	109.2	7349.0
189	2020	2	20	Anchorage Municipality, Alaska	4247	Petroleum and petroleum products merchant wholesalers	42	14.4	246.6	23204.4
191	2020	2	20	Anchorage Municipality, Alaska	4249	Miscellaneous nondurable goods merchant wholesalers	42	11.8	93.2	3418.2
192	2020	2	20	Anchorage Municipality, Alaska	4251	Wholesale electronic markets and agents and brokers	42	34.2	229.0	12710.8
193	2020	2	20	Anchorage Municipality, Alaska	4411	Automobile dealers	44	34.2	1183.8	72259.2
194	2020	2	20	Anchorage Municipality, Alaska	4412	Other motor vehicle dealers	44	21.2	222.4	9433.0
195	2020	2	20	Anchorage Municipality, Alaska	4413	Automotive parts, accessories, and tire stores	44	52.4	557.2	20681.8
196	2020	2	20	Anchorage Municipality, Alaska	4421	Furniture stores	44	14.8	57.0	6857.2
197	2020	2	20	Anchorage Municipality, Alaska	4422	Home furnishings stores	44	28.2	261.4	7819.2
198	2020	2	20	Anchorage Municipality, Alaska	4431	Electronics and appliance stores	44	41.8	469.4	12476.2
199	2020	2	20	Anchorage Municipality, Alaska	4441	Building material and supplies dealers	44	62.4	1537.8	55779.0
200	2020	2	20	Anchorage Municipality, Alaska	4442	Lawn and garden equipment and supplies stores	44	7.0	46.2	1354.2
201	2020	2	20	Anchorage Municipality, Alaska	4451	Grocery stores	44	40.8	1526.0	44256.4
202	2020	2	20	Anchorage Municipality, Alaska	4452	Specialty food stores	44	18.8	133.4	3187.6
203	2020	2	20	Anchorage Municipality, Alaska	4453	Beer, wine, and liquor stores	44	36.4	250.6	5828.4
204	2020	2	20	Anchorage Municipality, Alaska	4461	Health and personal care stores	44	64.4	710.2	29030.2
205	2020	2	20	Anchorage Municipality, Alaska	4471	Gasoline stations	44	60.8	535.8	13976.8
206	2020	2	20	Anchorage Municipality, Alaska	4481	Clothing stores	44	83.2	1031.2	24558.6
207	2020	2	20	Anchorage Municipality, Alaska	4482	Shoe stores	44	24.2	183.8	4249.8
208	2020	2	20	Anchorage Municipality, Alaska	4483	Jewelry, luggage, and leather goods stores	44	25.4	137.0	4257.0
209	2020	2	20	Anchorage Municipality, Alaska	4511	Sporting goods, hobby, and musical instrument stores	45	61.6	1022.6	20282.0
210	2020	2	20	Anchorage Municipality, Alaska	4512	Book stores and news dealers	45	7.0	128.4	2603.2
211	2020	2	20	Anchorage Municipality, Alaska	4521	Department stores	45	5.0	278.8	6147.6
212	2020	2	20	Anchorage Municipality, Alaska	4529	Other general merchandise stores	45	16.8	3316.4	104967.0
213	2020	2	20	Anchorage Municipality, Alaska	4531	Florists	45	14.2	62.6	1573.6
214	2020	2	20	Anchorage Municipality, Alaska	4532	Office supplies, stationery, and gift stores	45	48.0	305.6	8116.8
215	2020	2	20	Anchorage Municipality, Alaska	4533	Used merchandise stores	45	23.6	269.8	5428.2
216	2020	2	20	Anchorage Municipality, Alaska	4539	Other miscellaneous store retailers	45	50.4	352.6	9188.6
217	2020	2	20	Anchorage Municipality, Alaska	4541	Electronic shopping and mail-order houses	45	10.6	19.0	1557.2
219	2020	2	20	Anchorage Municipality, Alaska	4543	Direct selling establishments	45	17.8	45.4	3675.8
220	2020	2	20	Anchorage Municipality, Alaska	4811	Scheduled air transportation	48	26.0	3108.8	194321.8
221	2020	2	20	Anchorage Municipality, Alaska	4812	Nonscheduled air transportation	48	23.8	207.0	18164.6
222	2020	2	20	Anchorage Municipality, Alaska	4831	Deep sea, coastal, and great lakes water transportation	48	13.4	289.6	23250.6
223	2020	2	20	Anchorage Municipality, Alaska	4832	Inland water transportation	48	2.4	9.0	1116.8
224	2020	2	20	Anchorage Municipality, Alaska	4841	General freight trucking	48	39.8	901.0	54628.2
225	2020	2	20	Anchorage Municipality, Alaska	4842	Specialized freight trucking	48	38.8	549.4	26206.2
228	2020	2	20	Anchorage Municipality, Alaska	4853	Taxi and limousine service	48	8.0	50.4	1656.0
231	2020	2	20	Anchorage Municipality, Alaska	4859	Other transit and ground passenger transportation	48	5.0	27.2	927.8
234	2020	2	20	Anchorage Municipality, Alaska	4871	Scenic and sightseeing transportation, land	48	7.0	47.8	3898.0
235	2020	2	20	Anchorage Municipality, Alaska	4872	Scenic and sightseeing transportation, water	48	7.4	5.4	1459.8
237	2020	2	20	Anchorage Municipality, Alaska	4881	Support activities for air transportation	48	39.0	913.2	38572.2
239	2020	2	20	Anchorage Municipality, Alaska	4883	Support activities for water transportation	48	13.4	212.0	18205.6
240	2020	2	20	Anchorage Municipality, Alaska	4884	Support activities for road transportation	48	12.0	82.2	3145.2
241	2020	2	20	Anchorage Municipality, Alaska	4885	Freight transportation arrangement	48	34.2	502.6	27197.4
243	2020	2	20	Anchorage Municipality, Alaska	4922	Local messengers and local delivery	49	4.2	19.4	1098.8
244	2020	2	20	Anchorage Municipality, Alaska	4931	Warehousing and storage	49	16.0	179.6	15119.4
245	2020	2	20	Anchorage Municipality, Alaska	5111	Newspaper, periodical, book, and directory publishers	51	17.6	320.6	14076.8
246	2020	2	20	Anchorage Municipality, Alaska	5112	Software publishers	51	3.2	7.0	620.2
247	2020	2	20	Anchorage Municipality, Alaska	5121	Motion picture and video industries	51	22.4	544.2	9974.0
248	2020	2	20	Anchorage Municipality, Alaska	5122	Sound recording industries	51	2.8	7.4	204.2
249	2020	2	20	Anchorage Municipality, Alaska	5151	Radio and television broadcasting	51	19.0	422.6	20958.0
250	2020	2	20	Anchorage Municipality, Alaska	5171	Wired telecommunications carriers	51	57.6	2604.8	227763.0
251	2020	2	20	Anchorage Municipality, Alaska	5172	Wireless telecommunications carriers (except satellite)	51	19.0	287.2	20879.0
253	2020	2	20	Anchorage Municipality, Alaska	5179	Other telecommunications	51	6.6	35.0	5447.2
254	2020	2	20	Anchorage Municipality, Alaska	5182	Data processing, hosting, and related services	51	17.6	231.0	11831.4
255	2020	2	20	Anchorage Municipality, Alaska	5191	Other information services	51	8.0	21.0	1662.6
256	2020	2	20	Anchorage Municipality, Alaska	5221	Depository credit intermediation	52	93.4	2647.0	151279.6
257	2020	2	20	Anchorage Municipality, Alaska	5222	Nondepository credit intermediation	52	33.6	411.4	29961.4
258	2020	2	20	Anchorage Municipality, Alaska	5223	Activities related to credit intermediation	52	16.6	35.0	2048.4
259	2020	2	20	Anchorage Municipality, Alaska	5231	Securities and commodity contracts intermediation and brokerage	52	37.6	114.8	31527.8
260	2020	2	20	Anchorage Municipality, Alaska	5239	Other financial investment activities	52	50.2	262.2	29336.8
261	2020	2	20	Anchorage Municipality, Alaska	5241	Insurance carriers	52	27.2	465.2	33257.2
262	2020	2	20	Anchorage Municipality, Alaska	5242	Agencies, brokerages, and other insurance related activities	52	128.2	734.0	49221.0
263	2020	2	20	Anchorage Municipality, Alaska	5259	Other investment pools and funds	52	5.0	85.0	7091.75
264	2020	2	20	Anchorage Municipality, Alaska	5311	Lessors of real estate	53	112.8	853.8	39919.4
265	2020	2	20	Anchorage Municipality, Alaska	5312	Offices of real estate agents and brokers	53	106.2	290.6	12689.0
266	2020	2	20	Anchorage Municipality, Alaska	5313	Activities related to real estate	53	103.0	553.4	24995.4
267	2020	2	20	Anchorage Municipality, Alaska	5321	Automotive equipment rental and leasing	53	29.2	342.0	17002.0
268	2020	2	20	Anchorage Municipality, Alaska	5322	Consumer goods rental	53	19.6	170.2	4834.4
270	2020	2	20	Anchorage Municipality, Alaska	5324	Commercial and industrial machinery and equipment rental and leasing	53	26.6	264.2	18981.2
272	2020	2	20	Anchorage Municipality, Alaska	5411	Legal services	54	271.2	1237.2	108539.0
273	2020	2	20	Anchorage Municipality, Alaska	5412	Accounting, tax preparation, bookkeeping, and payroll services	54	184.4	1070.8	52882.0
274	2020	2	20	Anchorage Municipality, Alaska	5413	Architectural, engineering, and related services	54	244.2	7111.0	575163.6
275	2020	2	20	Anchorage Municipality, Alaska	5414	Specialized design services	54	16.8	37.8	1996.6
276	2020	2	20	Anchorage Municipality, Alaska	5415	Computer systems design and related services	54	105.2	1264.8	88127.4
277	2020	2	20	Anchorage Municipality, Alaska	5416	Management, scientific, and technical consulting services	54	193.2	2482.6	187239.8
278	2020	2	20	Anchorage Municipality, Alaska	5417	Scientific research and development services	54	19.6	282.4	14235.8
279	2020	2	20	Anchorage Municipality, Alaska	5418	Advertising, public relations, and related services	54	39.2	349.2	16251.2
280	2020	2	20	Anchorage Municipality, Alaska	5419	Other professional, scientific, and technical services	54	73.2	572.4	26210.6
281	2020	2	20	Anchorage Municipality, Alaska	5511	Management of companies and enterprises	55	120.2	5446.6	609064.2
282	2020	2	20	Anchorage Municipality, Alaska	5611	Office administrative services	56	39.6	223.6	27913.0
283	2020	2	20	Anchorage Municipality, Alaska	5612	Facilities support services	56	44.0	4275.8	237093.2
284	2020	2	20	Anchorage Municipality, Alaska	5613	Employment services	56	32.6	1225.0	73102.8
285	2020	2	20	Anchorage Municipality, Alaska	5614	Business support services	56	40.8	256.2	9562.6
286	2020	2	20	Anchorage Municipality, Alaska	5615	Travel arrangement and reservation services	56	35.8	487.4	24593.8
287	2020	2	20	Anchorage Municipality, Alaska	5616	Investigation and security services	56	38.2	1821.2	63952.6
288	2020	2	20	Anchorage Municipality, Alaska	5617	Services to buildings and dwellings	56	248.8	2352.6	64076.4
289	2020	2	20	Anchorage Municipality, Alaska	5619	Other support services	56	27.2	229.0	30206.4
290	2020	2	20	Anchorage Municipality, Alaska	5621	Waste collection	56	14.8	226.4	12336.2
291	2020	2	20	Anchorage Municipality, Alaska	5622	Waste treatment and disposal	56	5.4	86.6	5265.6
292	2020	2	20	Anchorage Municipality, Alaska	5629	Remediation and other waste management services	56	31.0	529.4	49283.6
293	2020	2	20	Anchorage Municipality, Alaska	6111	Elementary and secondary schools	61	9.4	235.4	8099.8
294	2020	2	20	Anchorage Municipality, Alaska	6113	Colleges, universities, and professional schools	61	5.6	300.8	9044.8
295	2020	2	20	Anchorage Municipality, Alaska	6114	Business schools and computer and management training	61	7.0	9.2	884.0
296	2020	2	20	Anchorage Municipality, Alaska	6115	Technical and trade schools	61	19.8	128.6	6639.8
297	2020	2	20	Anchorage Municipality, Alaska	6116	Other schools and instruction	61	61.0	435.6	6752.0
298	2020	2	20	Anchorage Municipality, Alaska	6117	Educational support services	61	8.0	33.2	1060.2
299	2020	2	20	Anchorage Municipality, Alaska	6211	Offices of physicians	62	285.4	2834.2	325398.0
300	2020	2	20	Anchorage Municipality, Alaska	6212	Offices of dentists	62	166.8	1213.4	74357.8
301	2020	2	20	Anchorage Municipality, Alaska	6213	Offices of other health practitioners	62	232.4	1184.4	64972.8
302	2020	2	20	Anchorage Municipality, Alaska	6214	Outpatient care centers	62	48.2	2514.6	151709.8
303	2020	2	20	Anchorage Municipality, Alaska	6215	Medical and diagnostic laboratories	62	20.6	268.8	39597.4
304	2020	2	20	Anchorage Municipality, Alaska	6216	Home health care services	62	23.6	734.0	22479.8
305	2020	2	20	Anchorage Municipality, Alaska	6219	Other ambulatory health care services	62	16.8	394.2	23194.8
306	2020	2	20	Anchorage Municipality, Alaska	6221	General medical and surgical hospitals	62	5.0	6227.0	479509.8
310	2020	2	20	Anchorage Municipality, Alaska	6232	Residential intellectual and developmental disability, mental health, and substance abuse facilities	62	87.8	864.0	35339.8
311	2020	2	20	Anchorage Municipality, Alaska	6233	Continuing care retirement communities and assisted living facilities for the elderly	62	117.6	663.4	18522.0
312	2020	2	20	Anchorage Municipality, Alaska	6239	Other residential care facilities	62	11.0	166.4	3962.8
313	2020	2	20	Anchorage Municipality, Alaska	6241	Individual and family services	62	97.8	3834.4	102088.4
314	2020	2	20	Anchorage Municipality, Alaska	6242	Community food and housing, and emergency and other relief services	62	19.2	335.0	11182.6
315	2020	2	20	Anchorage Municipality, Alaska	6243	Vocational rehabilitation services	62	13.6	729.4	22136.8
316	2020	2	20	Anchorage Municipality, Alaska	6244	Child day care services	62	62.6	922.8	21163.6
317	2020	2	20	Anchorage Municipality, Alaska	7111	Performing arts companies	71	9.6	76.8	2209.4
318	2020	2	20	Anchorage Municipality, Alaska	7112	Spectator sports	71	4.6	14.0	524.8
319	2020	2	20	Anchorage Municipality, Alaska	7113	Promoters of performing arts, sports, and similar events	71	5.2	669.4	9756.0
321	2020	2	20	Anchorage Municipality, Alaska	7115	Independent artists, writers, and performers	71	10.8	24.0	781.2
322	2020	2	20	Anchorage Municipality, Alaska	7121	Museums, historical sites, and similar institutions	71	11.0	179.6	8033.6
324	2020	2	20	Anchorage Municipality, Alaska	7132	Gambling industries	71	18.2	198.0	5711.4
325	2020	2	20	Anchorage Municipality, Alaska	7139	Other amusement and recreation industries	71	91.2	1544.2	23513.8
326	2020	2	20	Anchorage Municipality, Alaska	7211	Traveler accommodation	72	77.2	3048.4	78909.2
327	2020	2	20	Anchorage Municipality, Alaska	7212	RV (recreational vehicle) parks and recreational camps	72	15.4	11.2	2655.4
328	2020	2	20	Anchorage Municipality, Alaska	7213	Rooming and boarding houses	72	5.0	2.0	37.0
329	2020	2	20	Anchorage Municipality, Alaska	7223	Special food services	72	76.4	2065.2	82654.0
330	2020	2	20	Anchorage Municipality, Alaska	7224	Drinking places (alcoholic beverages)	72	43.6	647.6	13820.4
331	2020	2	20	Anchorage Municipality, Alaska	7225	Restaurants and other eating places	72	570.2	9723.4	197438.0
332	2020	2	20	Anchorage Municipality, Alaska	8111	Automotive repair and maintenance	81	147.4	906.8	39426.0
333	2020	2	20	Anchorage Municipality, Alaska	8112	Electronic and precision equipment repair and maintenance	81	16.6	66.2	8532.6
334	2020	2	20	Anchorage Municipality, Alaska	8113	Commercial and industrial machinery and equipment (except automotive and electronic) repair and maintenance	81	13.4	133.4	7316.8
335	2020	2	20	Anchorage Municipality, Alaska	8114	Personal and household goods repair and maintenance	81	20.8	67.6	2770.8
336	2020	2	20	Anchorage Municipality, Alaska	8121	Personal care services	81	127.0	817.4	20128.8
337	2020	2	20	Anchorage Municipality, Alaska	8122	Death care services	81	10.6	17.6	787.6
338	2020	2	20	Anchorage Municipality, Alaska	8123	Drycleaning and laundry services	81	23.4	313.0	10013.8
339	2020	2	20	Anchorage Municipality, Alaska	8129	Other personal services	81	33.4	210.8	5119.0
340	2020	2	20	Anchorage Municipality, Alaska	8131	Religious organizations	81	154.4	1171.4	27472.6
341	2020	2	20	Anchorage Municipality, Alaska	8132	Grantmaking and giving services	81	33.4	268.6	12890.4
342	2020	2	20	Anchorage Municipality, Alaska	8133	Social advocacy organizations	81	52.0	273.8	13925.2
343	2020	2	20	Anchorage Municipality, Alaska	8134	Civic and social organizations	81	44.4	363.8	9549.4
344	2020	2	20	Anchorage Municipality, Alaska	8139	Business, professional, labor, political, and similar organizations	81	96.2	483.6	31018.2
347	2050	2	50	Bethel Census Area, Alaska	2211	Electric power generation, transmission and distribution	22	6.2	27.6	770.4
349	2050	2	50	Bethel Census Area, Alaska	2361	Residential building construction	23	3.2	3.8	163.6
351	2050	2	50	Bethel Census Area, Alaska	2371	Utility system construction	23	3.0	0.0	362.2
370	2050	2	50	Bethel Census Area, Alaska	4451	Grocery stores	44	22.6	457.4	7851.2
371	2050	2	50	Bethel Census Area, Alaska	4471	Gasoline stations	44	8.6	19.6	1359.4
374	2050	2	50	Bethel Census Area, Alaska	4529	Other general merchandise stores	45	13.0	195.2	2691.8
377	2050	2	50	Bethel Census Area, Alaska	4811	Scheduled air transportation	48	7.6	171.2	11765.6
391	2050	2	50	Bethel Census Area, Alaska	5221	Depository credit intermediation	52	3.0	23.6	1450.2
395	2050	2	50	Bethel Census Area, Alaska	5311	Lessors of real estate	53	5.8	26.6	1250.4
398	2050	2	50	Bethel Census Area, Alaska	5411	Legal services	54	4.0	7.4	650.6
405	2050	2	50	Bethel Census Area, Alaska	5617	Services to buildings and dwellings	56	2.8	5.0	115.4
420	2050	2	50	Bethel Census Area, Alaska	7132	Gambling industries	71	3.6	35.2	257.0
422	2050	2	50	Bethel Census Area, Alaska	7211	Traveler accommodation	72	3.4	3.4	66.0
425	2050	2	50	Bethel Census Area, Alaska	7225	Restaurants and other eating places	72	13.8	28.6	521.0
426	2050	2	50	Bethel Census Area, Alaska	8111	Automotive repair and maintenance	81	2.8	7.2	213.4
429	2050	2	50	Bethel Census Area, Alaska	8131	Religious organizations	81	2.8	3.4	91.4
432	2050	2	50	Bethel Census Area, Alaska	8134	Civic and social organizations	81	3.8	22.2	205.8
441	2060	2	60	Bristol Bay Borough, Alaska	3117	Seafood product preparation and packaging	31	6.6	65.2	21087.0
453	2060	2	60	Bristol Bay Borough, Alaska	4811	Scheduled air transportation	48	4.2	33.2	1650.0
454	2060	2	60	Bristol Bay Borough, Alaska	4812	Nonscheduled air transportation	48	3.4	6.2	844.4
473	2060	2	60	Bristol Bay Borough, Alaska	7139	Other amusement and recreation industries	71	2.25	0.5	34.25
474	2060	2	60	Bristol Bay Borough, Alaska	7211	Traveler accommodation	72	4.2	13.4	586.6
475	2060	2	60	Bristol Bay Borough, Alaska	7212	RV (recreational vehicle) parks and recreational camps	72	12.0	17.4	3812.6
477	2060	2	60	Bristol Bay Borough, Alaska	7225	Restaurants and other eating places	72	2.2	5.2	132.4
487	2068	2	68	Denali Borough, Alaska	2389	Other specialty trade contractors	23	3.0	3.0	225.2
494	2068	2	68	Denali Borough, Alaska	4532	Office supplies, stationery, and gift stores	45	3.4	0.8	478.4
502	2068	2	68	Denali Borough, Alaska	4879	Scenic and sightseeing transportation, other	48	3.2	3.6	711.8
507	2068	2	68	Denali Borough, Alaska	5311	Lessors of real estate	53	2.0	0.0	10.333333333333334
513	2068	2	68	Denali Borough, Alaska	5419	Other professional, scientific, and technical services	54	2.2	0.0	20.8
516	2068	2	68	Denali Borough, Alaska	5615	Travel arrangement and reservation services	56	2.6	1.0	101.6
525	2068	2	68	Denali Borough, Alaska	7139	Other amusement and recreation industries	71	8.0	2.8	1433.2
526	2068	2	68	Denali Borough, Alaska	7211	Traveler accommodation	72	17.0	87.8	11429.2
527	2068	2	68	Denali Borough, Alaska	7212	RV (recreational vehicle) parks and recreational camps	72	5.4	3.0	813.6
530	2068	2	68	Denali Borough, Alaska	7225	Restaurants and other eating places	72	9.0	7.2	1438.6
546	2070	2	70	Dillingham Census Area, Alaska	3117	Seafood product preparation and packaging	31	4.6	9.0	8249.6
