1916	2170	2	170	Matanuska-Susitna Borough, Alaska	423130	Tire and tube merchant wholesalers	42	1.0	0.0	0.0
1917	2170	2	170	Matanuska-Susitna Borough, Alaska	423140	Motor vehicle parts (used) merchant wholesalers	42	1.0	0.0	0.0
1918	2170	2	170	Matanuska-Susitna Borough, Alaska	423210	Furniture merchant wholesalers	42	1.0	3.6862745098039222	210.11764705882354
1919	2170	2	170	Matanuska-Susitna Borough, Alaska	423310	Lumber, plywood, millwork, and wood panel merchant wholesalers	42	3.0	31.61538461538461	1643.5961538461538
1920	2170	2	170	Matanuska-Susitna Borough, Alaska	423330	Roofing, siding, and insulation material merchant wholesalers	42	1.0	11.81081081081081	748.8108108108107
1921	2170	2	170	Matanuska-Susitna Borough, Alaska	423440	Other commercial equipment merchant wholesalers	42	1.0	6.958333333333333	276.7291666666667
1922	2170	2	170	Matanuska-Susitna Borough, Alaska	423450	Medical, dental, and hospital equipment and supplies merchant wholesalers	42	1.0	7.382022471910113	647.7078651685393
1923	2170	2	170	Matanuska-Susitna Borough, Alaska	423510	Metal service centers and other metal merchant wholesalers	42	2.0	16.424242424242426	946.5454545454545
1924	2170	2	170	Matanuska-Susitna Borough, Alaska	423610	Electrical apparatus and equipment, wiring supplies, and related equipment merchant wholesalers	42	2.0	25.16279069767442	1876.124031007752
1925	2170	2	170	Matanuska-Susitna Borough, Alaska	423690	Other electronic parts and equipment merchant wholesalers	42	2.0	12.95	1383.675
1926	2170	2	170	Matanuska-Susitna Borough, Alaska	423730	Warm air heating and air-conditioning equipment and supplies merchant wholesalers	42	1.0	6.666666666666667	453.27272727272725
1927	2170	2	170	Matanuska-Susitna Borough, Alaska	423810	Construction and mining (except oil well) machinery and equipment merchant wholesalers	42	1.0	13.789915966386554	1122.81512605042
1928	2170	2	170	Matanuska-Susitna Borough, Alaska	423820	Farm and garden machinery and equipment merchant wholesalers	42	2.0	2.0	95.375
1929	2170	2	170	Matanuska-Susitna Borough, Alaska	423830	Industrial machinery and equipment merchant wholesalers	42	1.4	15.80916905444126	1399.931805157593
1930	2170	2	170	Matanuska-Susitna Borough, Alaska	423840	Industrial supplies merchant wholesalers	42	1.0	13.037037037037038	766.7777777777778
1931	2170	2	170	Matanuska-Susitna Borough, Alaska	423850	Service establishment equipment and supplies merchant wholesalers	42	1.0	0.0	0.0
1932	2170	2	170	Matanuska-Susitna Borough, Alaska	423930	Recyclable material merchant wholesalers	42	1.6	6.16774193548387	292.46451612903223
1933	2170	2	170	Matanuska-Susitna Borough, Alaska	423940	Jewelry, watch, precious stone, and precious metal merchant wholesalers	42	1.0	0.45454545454545453	14.09090909090909
1934	2170	2	170	Matanuska-Susitna Borough, Alaska	423990	Other miscellaneous durable goods merchant wholesalers	42	1.0	3.4512195121951224	234.15853658536585
1935	2170	2	170	Matanuska-Susitna Borough, Alaska	424420	Packaged frozen food merchant wholesalers	42	1.2	58.26428571428571	3464.2714285714287
1936	2170	2	170	Matanuska-Susitna Borough, Alaska	424450	Confectionery merchant wholesalers	42	1.0	12.057142857142857	557.0285714285714
1937	2170	2	170	Matanuska-Susitna Borough, Alaska	424460	Fish and seafood merchant wholesalers	42	1.0	2.650246305418719	189.72906403940885
1938	2170	2	170	Matanuska-Susitna Borough, Alaska	424490	Other grocery and related products merchant wholesalers	42	1.0	27.78082191780822	1581.7328767123286
1939	2170	2	170	Matanuska-Susitna Borough, Alaska	424690	Other chemical and allied products merchant wholesalers	42	3.0	22.063636363636363	1438.7727272727273
1940	2170	2	170	Matanuska-Susitna Borough, Alaska	424710	Petroleum bulk stations and terminals 	42	2.0	29.8046875	2179.6640625
1941	2170	2	170	Matanuska-Susitna Borough, Alaska	424810	Beer and ale merchant wholesalers	42	1.0	0.0	0.0
1942	2170	2	170	Matanuska-Susitna Borough, Alaska	424930	Flower, nursery stock, and florists' supplies merchant wholesalers	42	1.8	1.705263157894737	54.568421052631585
1943	2170	2	170	Matanuska-Susitna Borough, Alaska	424990	Other miscellaneous nondurable goods merchant wholesalers	42	1.0	2.867469879518072	145.61445783132527
1944	2170	2	170	Matanuska-Susitna Borough, Alaska	441210	Recreational vehicle dealers	44	2.0	8.928571428571429	602.7142857142857
1945	2170	2	170	Matanuska-Susitna Borough, Alaska	441222	Boat dealers	44	1.0	6.162337662337662	284.07142857142856
1946	2170	2	170	Matanuska-Susitna Borough, Alaska	441320	Tire dealers	44	2.6	30.613872832369943	1363.3017341040463
1947	2170	2	170	Matanuska-Susitna Borough, Alaska	443141	Household appliance stores	44	1.0	7.307692307692308	289.2435897435898
1948	2170	2	170	Matanuska-Susitna Borough, Alaska	444110	Home centers	44	2.0	78.32000000000001	2328.1
1949	2170	2	170	Matanuska-Susitna Borough, Alaska	444120	Paint and wallpaper stores	44	2.0	6.575342465753424	418.2739726027397
1950	2170	2	170	Matanuska-Susitna Borough, Alaska	444210	Outdoor power equipment stores	44	1.0	2.4375	150.8125
1951	2170	2	170	Matanuska-Susitna Borough, Alaska	445210	Meat markets	44	1.2	7.7142857142857135	244.88571428571427
1952	2170	2	170	Matanuska-Susitna Borough, Alaska	445230	Fruit and vegetable markets	44	1.25	0.5	19.0625
1953	2170	2	170	Matanuska-Susitna Borough, Alaska	445291	Baked goods stores	44	1.0	6.28	112.92000000000002
1954	2170	2	170	Matanuska-Susitna Borough, Alaska	445292	Confectionery and nut stores	44	1.2	4.180645161290323	50.20645161290322
1955	2170	2	170	Matanuska-Susitna Borough, Alaska	446130	Optical goods stores	44	3.0	8.870503597122301	414.47482014388487
1956	2170	2	170	Matanuska-Susitna Borough, Alaska	446191	Food (health) supplement stores	44	3.0	8.444444444444445	251.88888888888889
1957	2170	2	170	Matanuska-Susitna Borough, Alaska	446199	All other health and personal care stores	44	1.0	7.043478260869565	351.71014492753625
1958	2170	2	170	Matanuska-Susitna Borough, Alaska	447190	Other gasoline stations	44	1.4	8.702272727272728	275.9378787878788
1959	2170	2	170	Matanuska-Susitna Borough, Alaska	448130	Children's and infants' clothing stores	44	1.0	7.26829268292683	97.07317073170732
1960	2170	2	170	Matanuska-Susitna Borough, Alaska	448150	Clothing accessories stores	44	1.0	1.9838709677419355	30.741935483870964
1961	2170	2	170	Matanuska-Susitna Borough, Alaska	448190	Other clothing stores	44	1.0	5.7938144329896915	171.4536082474227
1962	2170	2	170	Matanuska-Susitna Borough, Alaska	451140	Musical instrument and supplies stores	45	1.6	8.761904761904763	181.1809523809524
1963	2170	2	170	Matanuska-Susitna Borough, Alaska	451211	Book stores	45	1.8	13.165384615384616	240.05769230769232
1964	2170	2	170	Matanuska-Susitna Borough, Alaska	452111	Department stores (except discount department stores)	45	1.0	31.09523809523809	688.4285714285714
1965	2170	2	170	Matanuska-Susitna Borough, Alaska	452112	Discount department stores	45	1.0	49.67741935483871	1246.1612903225805
1966	2170	2	170	Matanuska-Susitna Borough, Alaska	452910	Warehouse clubs and supercenters	45	3.0	760.6475409836066	23611.500000000004
1967	2170	2	170	Matanuska-Susitna Borough, Alaska	452990	All other general merchandise stores	45	2.4	21.84161073825503	402.1208053691275
1968	2170	2	170	Matanuska-Susitna Borough, Alaska	453210	Office supplies and stationery stores	45	1.0	5.489130434782609	122.60869565217392
1969	2170	2	170	Matanuska-Susitna Borough, Alaska	453920	Art dealers	45	2.2	3.479807692307692	105.9701923076923
1970	2170	2	170	Matanuska-Susitna Borough, Alaska	481111	Scheduled passenger air transportation	48	1.0	54.421621621621625	2906.0135135135138
1971	2170	2	170	Matanuska-Susitna Borough, Alaska	481112	Scheduled freight air transportation	48	1.0	40.00000000000001	2663.3284671532847
1972	2170	2	170	Matanuska-Susitna Borough, Alaska	481219	Other nonscheduled air transportation	48	2.0	16.298507462686565	1536.8656716417909
1973	2170	2	170	Matanuska-Susitna Borough, Alaska	483112	Deep sea passenger transportation	48	1.0	0.0	0.0
1974	2170	2	170	Matanuska-Susitna Borough, Alaska	483113	Coastal and great lakes freight transportation	48	2.0	12.510769230769233	2140.5661538461536
1975	2170	2	170	Matanuska-Susitna Borough, Alaska	484122	General freight trucking, long-distance, less than truckload	48	1.0	20.9	1204.9499999999998
1976	2170	2	170	Matanuska-Susitna Borough, Alaska	484210	Used household and office goods moving	48	1.4	22.95348837209302	923.3081395348836
1977	2170	2	170	Matanuska-Susitna Borough, Alaska	484230	Specialized freight (except used goods) trucking, long-distance	48	1.0	16.333333333333332	1001.4040404040403
1978	2170	2	170	Matanuska-Susitna Borough, Alaska	485210	Interurban and rural bus transportation	48	1.8	0.0	0.0
1979	2170	2	170	Matanuska-Susitna Borough, Alaska	485310	Taxi service	48	1.0	5.813186813186813	158.67032967032966
1980	2170	2	170	Matanuska-Susitna Borough, Alaska	485410	School and employee bus transportation	48	5.2	154.13125	3795.796875
1981	2170	2	170	Matanuska-Susitna Borough, Alaska	485991	Special needs transportation	48	1.6	6.533333333333334	192.20000000000002
1982	2170	2	170	Matanuska-Susitna Borough, Alaska	487110	Scenic and sightseeing transportation, land	48	1.4	7.843274853801168	957.2888888888887
1983	2170	2	170	Matanuska-Susitna Borough, Alaska	488119	Other airport operations	48	1.2	35.3344537815126	1146.5042016806722
1984	2170	2	170	Matanuska-Susitna Borough, Alaska	488320	Marine cargo handling	48	1.5	41.19767441860465	3173.6511627906975
1985	2170	2	170	Matanuska-Susitna Borough, Alaska	488330	Navigational services to shipping	48	1.0	5.252173913043478	535.4347826086956
1986	2170	2	170	Matanuska-Susitna Borough, Alaska	488390	Other support activities for water transportation	48	1.2	3.5485714285714285	375.75428571428574
1987	2170	2	170	Matanuska-Susitna Borough, Alaska	488490	Other support activities for road transportation	48	1.6	3.4370370370370367	233.95555555555555
1988	2170	2	170	Matanuska-Susitna Borough, Alaska	488510	Freight transportation arrangement	48	1.2	11.861386138613861	643.219801980198
1989	2170	2	170	Matanuska-Susitna Borough, Alaska	488991	Packing and crating	48	1.0	0.0	0.0
1990	2170	2	170	Matanuska-Susitna Borough, Alaska	492210	Local messengers and local delivery	49	1.0	3.4857142857142853	206.31428571428572
1991	2170	2	170	Matanuska-Susitna Borough, Alaska	493110	General warehousing and storage	49	1.2	13.108860759493668	1196.3848101265821
1992	2170	2	170	Matanuska-Susitna Borough, Alaska	493190	Other warehousing and storage	49	1.0	4.904761904761905	368.5952380952381
1993	2170	2	170	Matanuska-Susitna Borough, Alaska	511110	Newspaper publishers	51	1.0	23.962616822429908	904.4953271028039
1994	2170	2	170	Matanuska-Susitna Borough, Alaska	512110	Motion picture and video production	51	1.0	1.0930232558139534	78.96511627906978
1995	2170	2	170	Matanuska-Susitna Borough, Alaska	512131	Motion picture theaters (except drive-ins)	51	1.0	43.32911392405063	636.4683544303797
1996	2170	2	170	Matanuska-Susitna Borough, Alaska	517410	Satellite telecommunications	51	5.0	0.0	0.0
1997	2170	2	170	Matanuska-Susitna Borough, Alaska	517919	All other telecommunications	51	1.0	3.0625	200.5625
1998	2170	2	170	Matanuska-Susitna Borough, Alaska	518210	Data processing, hosting, and related services	51	1.0	12.029126213592233	620.4466019417476
1999	2170	2	170	Matanuska-Susitna Borough, Alaska	519190	All other information services	51	1.0	0.0	0.0
2000	2170	2	170	Matanuska-Susitna Borough, Alaska	522298	All other nondepository credit intermediation	52	2.2	6.2595238095238095	427.87380952380954
2001	2170	2	170	Matanuska-Susitna Borough, Alaska	522310	Mortgage and nonmortgage loan brokers	52	1.2	1.3636363636363635	98.07272727272728
2002	2170	2	170	Matanuska-Susitna Borough, Alaska	522320	Financial transactions processing, reserve, and clearinghouse activities	52	1.0	2.8108108108108105	124.81081081081079
2003	2170	2	170	Matanuska-Susitna Borough, Alaska	523110	Investment banking and securities dealing	52	1.0	0.0	0.0
2004	2170	2	170	Matanuska-Susitna Borough, Alaska	523120	Securities brokerage	52	9.0	13.872928176795577	4844.660220994475
2005	2170	2	170	Matanuska-Susitna Borough, Alaska	523910	Miscellaneous intermediation	52	1.0	5.691358024691358	418.95061728395063
2006	2170	2	170	Matanuska-Susitna Borough, Alaska	523920	Portfolio management	52	1.4	8.916923076923077	1103.8030769230768
2007	2170	2	170	Matanuska-Susitna Borough, Alaska	523930	Investment advice	52	1.2	2.3142857142857145	234.7971428571429
2008	2170	2	170	Matanuska-Susitna Borough, Alaska	523991	Trust, fiduciary, and custody activities	52	1.0	3.8857142857142852	357.54285714285714
2009	2170	2	170	Matanuska-Susitna Borough, Alaska	524113	Direct life insurance carriers	52	1.0	4.351351351351351	388.7297297297297
2010	2170	2	170	Matanuska-Susitna Borough, Alaska	524126	Direct property and casualty insurance carriers	52	1.0	16.52747252747253	1229.2417582417584
2011	2170	2	170	Matanuska-Susitna Borough, Alaska	524127	Direct title insurance carriers	52	1.6	18.253061224489795	1113.8285714285714
2012	2170	2	170	Matanuska-Susitna Borough, Alaska	524291	Claims adjusting	52	1.0	2.72	155.36
2013	2170	2	170	Matanuska-Susitna Borough, Alaska	531311	Residential property managers	53	2.8	19.830927835051543	765.0254295532645
2014	2170	2	170	Matanuska-Susitna Borough, Alaska	531312	Nonresidential property managers	53	1.6	4.881105990783411	364.652534562212
2015	2170	2	170	Matanuska-Susitna Borough, Alaska	531390	Other activities related to real estate	53	1.6666666666666667	1.860119047619048	163.3184523809524
2016	2170	2	170	Matanuska-Susitna Borough, Alaska	532111	Passenger car rental	53	1.2	10.229885057471263	361.4666666666666
2017	2170	2	170	Matanuska-Susitna Borough, Alaska	532210	Consumer electronics and appliances rental	53	1.0	0.0	0.0
2018	2170	2	170	Matanuska-Susitna Borough, Alaska	532230	Video tape and disc rental	53	1.4	2.9399999999999995	62.70833333333333
2019	2170	2	170	Matanuska-Susitna Borough, Alaska	532291	Home health equipment rental	53	1.0	12.043478260869566	559.1739130434783
2020	2170	2	170	Matanuska-Susitna Borough, Alaska	532292	Recreational goods rental	53	1.8	0.54	73.26
2021	2170	2	170	Matanuska-Susitna Borough, Alaska	532299	All other consumer goods rental	53	1.2	1.2685714285714287	43.85142857142857
2022	2170	2	170	Matanuska-Susitna Borough, Alaska	541191	Title abstract and settlement offices	54	1.3333333333333333	5.214814814814815	268.5037037037037
2023	2170	2	170	Matanuska-Susitna Borough, Alaska	541214	Payroll services	54	1.0	8.06521739130435	472.8913043478262
2024	2170	2	170	Matanuska-Susitna Borough, Alaska	541320	Landscape architectural services	54	1.25	1.171875	137.03125
2025	2170	2	170	Matanuska-Susitna Borough, Alaska	541340	Drafting services	54	1.0	0.34615384615384615	23.576923076923073
2026	2170	2	170	Matanuska-Susitna Borough, Alaska	541380	Testing laboratories	54	1.0	38.371621621621614	3581.9189189189183
2027	2170	2	170	Matanuska-Susitna Borough, Alaska	541410	Interior design services	54	1.0	2.484375	126.5
2028	2170	2	170	Matanuska-Susitna Borough, Alaska	541490	Other specialized design services	54	1.0	1.0	17.5
2029	2170	2	170	Matanuska-Susitna Borough, Alaska	541513	Computer facilities management services	54	3.6	31.181102362204722	2342.6929133858266
2030	2170	2	170	Matanuska-Susitna Borough, Alaska	541519	Other computer related services	54	1.5	3.9749999999999996	299.83124999999995
2031	2170	2	170	Matanuska-Susitna Borough, Alaska	541612	Human resources consulting services	54	1.0	11.150943396226417	411.3018867924529
2032	2170	2	170	Matanuska-Susitna Borough, Alaska	541618	Other management consulting services	54	1.2	1.6975609756097563	164.3707317073171
2033	2170	2	170	Matanuska-Susitna Borough, Alaska	541712	Research and development in the physical, engineering, and life sciences (except biotechnology)	54	2.2	31.12108108108108	1609.5081081081082
2034	2170	2	170	Matanuska-Susitna Borough, Alaska	541810	Advertising agencies	54	1.0	8.513274336283185	562.8053097345132
2035	2170	2	170	Matanuska-Susitna Borough, Alaska	541820	Public relations agencies	54	1.0	2.0625	190.28125
2036	2170	2	170	Matanuska-Susitna Borough, Alaska	541850	Outdoor advertising	54	1.0	0.0	0.0
2037	2170	2	170	Matanuska-Susitna Borough, Alaska	541890	Other services related to advertising	54	1.0	6.914285714285714	156.05714285714285
2038	2170	2	170	Matanuska-Susitna Borough, Alaska	541921	Photography studios, portrait	54	2.333333333333333	5.994871794871794	180.00769230769228
2039	2170	2	170	Matanuska-Susitna Borough, Alaska	541922	Commercial photography	54	1.0	0.68	32.480000000000004
2040	2170	2	170	Matanuska-Susitna Borough, Alaska	541930	Translation and interpretation services	54	1.0	0.6363636363636364	28.0
2041	2170	2	170	Matanuska-Susitna Borough, Alaska	551112	Offices of other holding companies	55	1.4	10.446153846153845	1021.5006993006991
2042	2170	2	170	Matanuska-Susitna Borough, Alaska	561210	Facilities support services	56	1.6	140.08994082840238	7866.059171597634
2043	2170	2	170	Matanuska-Susitna Borough, Alaska	561312	Executive search services	56	1.3333333333333333	0.0	0.0
2044	2170	2	170	Matanuska-Susitna Borough, Alaska	561320	Temporary help services	56	1.4	29.002469135802464	1526.2995884773661
2045	2170	2	170	Matanuska-Susitna Borough, Alaska	561410	Document preparation services	56	2.0	1.7931034482758623	45.758620689655174
2046	2170	2	170	Matanuska-Susitna Borough, Alaska	561421	Telephone answering services	56	1.0	0.0	0.0
2047	2170	2	170	Matanuska-Susitna Borough, Alaska	561439	Other business service centers (including copy shops)	56	2.0	11.036144578313252	353.0843373493975
2048	2170	2	170	Matanuska-Susitna Borough, Alaska	561492	Court reporting and stenotype services	56	1.0	1.125	54.675
2049	2170	2	170	Matanuska-Susitna Borough, Alaska	561499	All other business support services	56	1.0	4.11764705882353	154.47058823529414
2050	2170	2	170	Matanuska-Susitna Borough, Alaska	561591	Convention and visitors bureaus	56	1.0	10.378787878787879	471.9545454545455
2051	2170	2	170	Matanuska-Susitna Borough, Alaska	561611	Investigation services	56	2.2	2.435714285714286	135.3
2052	2170	2	170	Matanuska-Susitna Borough, Alaska	561920	Convention and trade show organizers	56	1.6	7.5851851851851855	276.65185185185186
2053	2170	2	170	Matanuska-Susitna Borough, Alaska	562211	Hazardous waste treatment and disposal	56	1.0	5.217391304347826	400.804347826087
2054	2170	2	170	Matanuska-Susitna Borough, Alaska	562998	All other miscellaneous waste management services	56	1.4	2.678260869565218	385.9739130434783
2055	2170	2	170	Matanuska-Susitna Borough, Alaska	611310	Colleges, universities, and professional schools	61	1.0	61.688524590163944	1881.9836065573772
2056	2170	2	170	Matanuska-Susitna Borough, Alaska	611410	Business and secretarial schools	61	1.0	0.0	0.0
2057	2170	2	170	Matanuska-Susitna Borough, Alaska	611430	Professional and management development training	61	1.0	1.4222222222222223	131.6888888888889
2058	2170	2	170	Matanuska-Susitna Borough, Alaska	611512	Flight training	61	1.0	2.06	86.06
2059	2170	2	170	Matanuska-Susitna Borough, Alaska	611519	Other technical and trade schools	61	1.0	7.052631578947368	404.5614035087719
2060	2170	2	170	Matanuska-Susitna Borough, Alaska	611691	Exam preparation and tutoring	61	1.8	24.048000000000002	421.77600000000007
2061	2170	2	170	Matanuska-Susitna Borough, Alaska	611699	All other miscellaneous schools and instruction	61	1.4	7.496062992125984	196.0992125984252
2062	2170	2	170	Matanuska-Susitna Borough, Alaska	611710	Educational support services	61	1.8	9.570731707317073	428.4146341463414
2063	2170	2	170	Matanuska-Susitna Borough, Alaska	621112	Offices of physicians, mental health specialists	62	1.5	5.528089887640449	547.4494382022472
2064	2170	2	170	Matanuska-Susitna Borough, Alaska	621410	Family planning centers	62	1.0	5.483870967741935	198.51612903225805
2065	2170	2	170	Matanuska-Susitna Borough, Alaska	621492	Kidney dialysis centers	62	1.0	0.0	0.0
2066	2170	2	170	Matanuska-Susitna Borough, Alaska	621493	Freestanding ambulatory surgical and emergency centers	62	1.6	30.174358974358977	2607.138461538462
2067	2170	2	170	Matanuska-Susitna Borough, Alaska	621498	All other outpatient care centers	62	3.4	61.796208530805686	6561.194312796209
2068	2170	2	170	Matanuska-Susitna Borough, Alaska	621910	Ambulance services	62	1.0	20.14285714285714	1694.5584415584415
2069	2170	2	170	Matanuska-Susitna Borough, Alaska	621991	Blood and organ banks	62	1.0	0.0	0.0
2070	2170	2	170	Matanuska-Susitna Borough, Alaska	621999	All other miscellaneous ambulatory health care services	62	1.0	2.7294117647058824	136.1058823529412
2071	2170	2	170	Matanuska-Susitna Borough, Alaska	622110	General medical and surgical hospitals	62	1.6	826.725	60166.6625
2072	2170	2	170	Matanuska-Susitna Borough, Alaska	623220	Residential mental health and substance abuse facilities	62	1.0	30.229166666666668	1125.611111111111
2073	2170	2	170	Matanuska-Susitna Borough, Alaska	623311	Continuing care retirement communities	62	3.0	26.62222222222222	741.0888888888888
2074	2170	2	170	Matanuska-Susitna Borough, Alaska	623990	Other residential care facilities	62	6.0	53.84549356223175	2606.961373390558
2075	2170	2	170	Matanuska-Susitna Borough, Alaska	624221	Temporary shelters	62	1.0	16.765432098765434	541.6543209876543
2076	2170	2	170	Matanuska-Susitna Borough, Alaska	624229	Other community housing services	62	1.4	12.378947368421052	526.8421052631579
2077	2170	2	170	Matanuska-Susitna Borough, Alaska	624230	Emergency and other relief services	62	1.0	0.0	0.0
2078	2170	2	170	Matanuska-Susitna Borough, Alaska	624310	Vocational rehabilitation services	62	1.4	51.428318584070794	1548.6973451327433
2079	2170	2	170	Matanuska-Susitna Borough, Alaska	711110	Theater companies and dinner theaters	71	1.0	4.4743589743589745	126.44871794871796
2080	2170	2	170	Matanuska-Susitna Borough, Alaska	711211	Sports teams and clubs	71	1.0	2.142857142857143	72.19999999999999
2081	2170	2	170	Matanuska-Susitna Borough, Alaska	711212	Racetracks	71	1.0	0.0	0.0
2082	2170	2	170	Matanuska-Susitna Borough, Alaska	711219	Other spectator sports	71	2.0	2.1875	179.0
2083	2170	2	170	Matanuska-Susitna Borough, Alaska	711310	Promoters of performing arts, sports, and similar events with facilities	71	1.0	53.173913043478265	1337.0869565217392
2084	2170	2	170	Matanuska-Susitna Borough, Alaska	711320	Promoters of performing arts, sports, and similar events without facilities	71	1.25	6.607142857142857	206.3392857142857
2085	2170	2	170	Matanuska-Susitna Borough, Alaska	713930	Marinas	71	1.0	1.1052631578947367	106.19298245614034
2086	2170	2	170	Matanuska-Susitna Borough, Alaska	713950	Bowling centers	71	1.0	21.764705882352942	412.94117647058823
2087	2170	2	170	Matanuska-Susitna Borough, Alaska	721310	Rooming and boarding houses	72	1.4	15.776119402985074	828.4238805970149
2088	2170	2	170	Matanuska-Susitna Borough, Alaska	722320	Caterers	72	1.0	7.620253164556961	177.3544303797468
2089	2170	2	170	Matanuska-Susitna Borough, Alaska	722514	Cafeterias, grill buffets, and buffets	72	1.0	23.254901960784316	650.0392156862746
2090	2170	2	170	Matanuska-Susitna Borough, Alaska	811198	All other automotive repair and maintenance	81	1.2	1.7419354838709677	41.10967741935484
2091	2170	2	170	Matanuska-Susitna Borough, Alaska	811212	Computer and office machine repair and maintenance	81	1.0	0.9102564102564104	65.43589743589745
2092	2170	2	170	Matanuska-Susitna Borough, Alaska	811411	Home and garden equipment repair and maintenance	81	1.0	1.4333333333333331	33.233333333333334
2093	2170	2	170	Matanuska-Susitna Borough, Alaska	811412	Appliance repair and maintenance	81	2.2	7.830952380952381	312.9761904761905
2094	2170	2	170	Matanuska-Susitna Borough, Alaska	811490	Other personal and household goods repair and maintenance	81	1.0	2.8873239436619715	129.62910798122064
2095	2170	2	170	Matanuska-Susitna Borough, Alaska	812113	Nail salons	81	1.5	4.755555555555555	136.0111111111111
2096	2170	2	170	Matanuska-Susitna Borough, Alaska	812191	Diet and weight reducing centers	81	1.3333333333333333	15.33333333333333	559.3846153846154
2097	2170	2	170	Matanuska-Susitna Borough, Alaska	812220	Cemeteries and crematories	81	1.0	1.5217391304347827	89.08695652173914
2098	2170	2	170	Matanuska-Susitna Borough, Alaska	812320	Drycleaning and laundry services (except coin-operated)	81	1.4	12.145945945945945	335.36936936936934
2099	2170	2	170	Matanuska-Susitna Borough, Alaska	812990	All other personal services	81	2.4	3.1999999999999997	169.81052631578947
2100	2170	2	170	Matanuska-Susitna Borough, Alaska	813211	Grantmaking foundations	81	1.2	5.376699029126213	316.9106796116505
2101	2170	2	170	Matanuska-Susitna Borough, Alaska	813219	Other grantmaking and giving services	81	2.0	4.595744680851064	258.0851063829787
2102	2170	2	170	Matanuska-Susitna Borough, Alaska	813311	Human rights organizations	81	1.0	1.3611111111111112	171.625
2103	2170	2	170	Matanuska-Susitna Borough, Alaska	813319	Other social advocacy organizations	81	2.0	7.8584070796460175	408.9380530973451
2104	2170	2	170	Matanuska-Susitna Borough, Alaska	813920	Professional organizations	81	1.0	3.371212121212121	238.97727272727275
2105	2170	2	170	Matanuska-Susitna Borough, Alaska	813940	Political organizations	81	1.25	0.6907894736842106	119.3092105263158
2106	2170	2	170	Matanuska-Susitna Borough, Alaska	813990	Other similar organizations (except business, professional, labor, and political organizations)	81	1.0	5.846153846153845	244.28846153846152
2107	2180	2	180	Nome Census Area, Alaska	211111	Crude petroleum and natural gas extraction	21	1.0	57.111111111111114	15958.179487179488
2108	2180	2	180	Nome Census Area, Alaska	212221	Gold ore mining	21	1.6	75.39881656804735	8295.034319526629
2109	2180	2	180	Nome Census Area, Alaska	212234	Copper ore and nickel ore mining	21	1.0	0.0	0.0
