22514	29	29	0	Missouri	623990	Other residential care facilities	62	91.4	3091.4	86004.6
22515	29	29	0	Missouri	624110	Child and youth services	62	176.6	2787.2	89561.0
22516	29	29	0	Missouri	624120	Services for the elderly and persons with disabilities	62	9739.6	30750.2	451081.0
22517	29	29	0	Missouri	624190	Other individual and family services	62	572.4	6813.6	175759.0
22518	29	29	0	Missouri	624210	Community food services	62	115.4	1057.6	30522.8
22519	29	29	0	Missouri	624221	Temporary shelters	62	96.8	1679.0	43517.8
22520	29	29	0	Missouri	624229	Other community housing services	62	76.8	1052.8	28792.8
22521	29	29	0	Missouri	624230	Emergency and other relief services	62	20.2	122.0	5174.2
22522	29	29	0	Missouri	624310	Vocational rehabilitation services	62	232.0	11280.0	134641.8
22523	29	29	0	Missouri	624410	Child day care services	62	1562.4	17920.6	289390.4
22524	29	29	0	Missouri	711110	Theater companies and dinner theaters	71	74.8	1982.6	54104.0
22525	29	29	0	Missouri	711120	Dance companies	71	8.4	184.8	4213.6
22526	29	29	0	Missouri	711130	Musical groups and artists	71	65.4	294.4	12510.0
22527	29	29	0	Missouri	711190	Other performing arts companies	71	9.6	91.8	2179.8
22528	29	29	0	Missouri	711211	Sports teams and clubs	71	18.4	2412.2	767056.8
22529	29	29	0	Missouri	711212	Racetracks	71	12.8	66.4	1351.8
22530	29	29	0	Missouri	711219	Other spectator sports	71	22.4	34.8	1572.4
22531	29	29	0	Missouri	711310	Promoters of performing arts, sports, and similar events with facilities	71	59.4	2018.4	34321.6
22532	29	29	0	Missouri	711320	Promoters of performing arts, sports, and similar events without facilities	71	70.4	434.8	12623.4
22533	29	29	0	Missouri	711410	Agents and managers for artists, athletes, entertainers, and other public figures	71	28.4	77.0	10616.2
22534	29	29	0	Missouri	711510	Independent artists, writers, and performers	71	211.0	1017.8	34963.4
22535	29	29	0	Missouri	712110	Museums	71	103.2	1526.2	42758.6
22536	29	29	0	Missouri	712120	Historical sites	71	22.0	57.0	1803.2
22537	29	29	0	Missouri	712130	Zoos and botanical gardens	71	13.8	225.6	9061.8
22538	29	29	0	Missouri	712190	Nature parks and other similar institutions	71	19.8	310.4	10813.0
22539	29	29	0	Missouri	713110	Amusement and theme parks	71	13.0	3716.4	59569.0
22540	29	29	0	Missouri	713120	Amusement arcades	71	56.0	752.4	7959.2
22541	29	29	0	Missouri	713210	Casinos (except casino hotels)	71	8.4	3979.4	107543.8
22542	29	29	0	Missouri	713290	Other gambling industries	71	5.4	0.0	0.0
22543	29	29	0	Missouri	713910	Golf courses and country clubs	71	237.2	4920.8	129046.4
22544	29	29	0	Missouri	713920	Skiing facilities	71	3.4	0.0	0.0
22545	29	29	0	Missouri	713930	Marinas	71	61.4	267.4	10063.2
22546	29	29	0	Missouri	713940	Fitness and recreational sports centers	71	581.0	10128.2	114327.6
22547	29	29	0	Missouri	713950	Bowling centers	71	119.8	1755.8	20341.6
22548	29	29	0	Missouri	713990	All other amusement and recreation industries	71	290.2	1979.4	39401.8
22549	29	29	0	Missouri	721110	Hotels (except casino hotels) and motels	72	1026.6	24103.2	522222.6
22550	29	29	0	Missouri	721120	Casino hotels	72	8.4	5431.4	171257.6
22551	29	29	0	Missouri	721191	Bed-and-breakfast inns	72	39.0	159.4	2078.0
22552	29	29	0	Missouri	721199	All other traveler accommodation	72	50.6	153.4	3966.4
22553	29	29	0	Missouri	721211	RV (recreational vehicle) parks and campgrounds	72	87.2	321.6	8182.0
22554	29	29	0	Missouri	721214	Recreational and vacation camps (except campgrounds)	72	58.0	510.2	14324.4
22555	29	29	0	Missouri	721310	Rooming and boarding houses	72	53.6	227.0	4326.8
22556	29	29	0	Missouri	722310	Food service contractors	72	630.6	13235.0	243957.4
22557	29	29	0	Missouri	722320	Caterers	72	192.8	2560.2	40185.8
22558	29	29	0	Missouri	722330	Mobile food services	72	61.6	190.4	3568.6
22559	29	29	0	Missouri	722410	Drinking places (alcoholic beverages)	72	669.6	5672.8	81346.6
22560	29	29	0	Missouri	722511	Full-service restaurants	72	4552.8	101658.8	1568051.4
22561	29	29	0	Missouri	722513	Limited-service restaurants	72	4114.6	81033.0	1016345.0
22562	29	29	0	Missouri	722514	Cafeterias, grill buffets, and buffets	72	160.2	3078.6	41891.4
22563	29	29	0	Missouri	722515	Snack and nonalcoholic beverage bars	72	791.4	9177.0	130317.8
22564	29	29	0	Missouri	811111	General automotive repair	81	1724.4	7744.6	273883.8
22565	29	29	0	Missouri	811112	Automotive exhaust system repair	81	60.4	174.4	4902.6
22566	29	29	0	Missouri	811113	Automotive transmission repair	81	112.4	428.8	15514.4
22567	29	29	0	Missouri	811118	Other automotive mechanical and electrical repair and maintenance	81	61.0	185.6	5681.0
22568	29	29	0	Missouri	811121	Automotive body, paint, and interior repair and maintenance	81	819.6	5680.4	279857.2
22569	29	29	0	Missouri	811122	Automotive glass replacement shops	81	144.8	587.8	18581.2
22570	29	29	0	Missouri	811191	Automotive oil change and lubrication shops	81	227.6	616.2	34303.6
22571	29	29	0	Missouri	811192	Car washes	81	326.6	2596.6	43706.8
22572	29	29	0	Missouri	811198	All other automotive repair and maintenance	81	45.6	289.8	10890.6
22573	29	29	0	Missouri	811211	Consumer electronics repair and maintenance	81	37.6	165.4	4943.4
22574	29	29	0	Missouri	811212	Computer and office machine repair and maintenance	81	84.8	591.8	26379.2
22575	29	29	0	Missouri	811213	Communication equipment repair and maintenance	81	33.8	189.4	8131.6
22576	29	29	0	Missouri	811219	Other electronic and precision equipment repair and maintenance	81	66.2	1017.0	51758.6
22577	29	29	0	Missouri	811310	Commercial and industrial machinery and equipment (except automotive and electronic) repair and maintenance	81	456.8	3048.6	139148.4
22578	29	29	0	Missouri	811411	Home and garden equipment repair and maintenance	81	47.0	63.0	2633.4
22579	29	29	0	Missouri	811412	Appliance repair and maintenance	81	78.6	376.4	15001.0
22580	29	29	0	Missouri	811420	Reupholstery and furniture repair	81	75.2	222.0	6422.0
22581	29	29	0	Missouri	811430	Footwear and leather goods repair	81	21.0	36.2	1074.2
22582	29	29	0	Missouri	811490	Other personal and household goods repair and maintenance	81	178.0	519.6	15346.0
22583	29	29	0	Missouri	812111	Barber shops	81	74.6	431.2	9776.6
22584	29	29	0	Missouri	812112	Beauty salons	81	1309.6	7347.8	144966.8
22585	29	29	0	Missouri	812113	Nail salons	81	163.4	499.0	11662.0
22586	29	29	0	Missouri	812191	Diet and weight reducing centers	81	54.2	207.2	8409.4
22587	29	29	0	Missouri	812199	Other personal care services	81	383.2	2302.8	34062.6
22588	29	29	0	Missouri	812210	Funeral homes and funeral services	81	430.8	2821.4	84086.2
22589	29	29	0	Missouri	812220	Cemeteries and crematories	81	133.0	616.0	20557.8
22590	29	29	0	Missouri	812310	Coin-operated laundries and drycleaners	81	162.4	676.8	11976.2
22591	29	29	0	Missouri	812320	Drycleaning and laundry services (except coin-operated)	81	289.4	2150.0	37645.2
22592	29	29	0	Missouri	812331	Linen supply	81	18.6	777.4	24984.2
22593	29	29	0	Missouri	812332	Industrial launderers	81	38.2	1587.8	65226.8
22594	29	29	0	Missouri	812910	Pet care (except veterinary) services	81	338.4	1980.4	34663.0
22595	29	29	0	Missouri	812921	Photofinishing laboratories (except one-hour)	81	7.6	253.8	9181.6
22596	29	29	0	Missouri	812922	One-hour photofinishing	81	1.0	0.0	0.0
22597	29	29	0	Missouri	812930	Parking lots and garages	81	191.6	2100.2	35372.2
22598	29	29	0	Missouri	812990	All other personal services	81	237.4	622.4	13921.6
22599	29	29	0	Missouri	813110	Religious organizations	81	4694.2	42216.8	815853.6
22600	29	29	0	Missouri	813211	Grantmaking foundations	81	191.6	1185.2	67003.2
22601	29	29	0	Missouri	813212	Voluntary health organizations	81	90.6	807.8	33407.6
22602	29	29	0	Missouri	813219	Other grantmaking and giving services	81	84.8	612.0	28312.2
22603	29	29	0	Missouri	813311	Human rights organizations	81	46.6	232.2	12176.4
22604	29	29	0	Missouri	813312	Environment, conservation and wildlife organizations	81	99.6	1139.4	31802.4
22605	29	29	0	Missouri	813319	Other social advocacy organizations	81	112.8	697.4	31529.6
22606	29	29	0	Missouri	813410	Civic and social organizations	81	550.6	4651.8	95814.8
22607	29	29	0	Missouri	813910	Business associations	81	368.8	2223.2	142614.2
22608	29	29	0	Missouri	813920	Professional organizations	81	112.0	848.8	49627.6
22609	29	29	0	Missouri	813930	Labor unions and similar labor organizations	81	358.6	3347.2	89080.6
22610	29	29	0	Missouri	813940	Political organizations	81	47.2	104.2	6442.6
22611	29	29	0	Missouri	813990	Other similar organizations (except business, professional, labor, and political organizations)	81	227.6	1515.0	40742.2
