	id	state	COUNTY	GEO_TTL	relevant_naics	NAICS2012_TTL	NAICS_Sector	estab	emp	payann
435825	54	54	999	West Virginia -- Statewide	2111	Oil and gas extraction	21	5.2	401.6	44079.6
435826	54	54	999	West Virginia -- Statewide	2131	Support activities for mining	21	22.8	513.0	38049.0
435827	54	54	999	West Virginia -- Statewide	2212	Natural gas distribution	22	1.0	0.0	0.0
435828	54	54	999	West Virginia -- Statewide	2362	Nonresidential building construction	23	1.3333333333333333	0.0	0.0
435829	54	54	999	West Virginia -- Statewide	2371	Utility system construction	23	1.8	0.0	0.0
435830	54	54	999	West Virginia -- Statewide	2373	Highway, street, and bridge construction	23	1.6666666666666667	0.0	0.0
435831	54	54	999	West Virginia -- Statewide	4232	Furniture and home furnishing merchant wholesalers	42	1.4	0.0	0.0
435832	54	54	999	West Virginia -- Statewide	4233	Lumber and other construction materials merchant wholesalers	42	1.2	0.0	0.0
435833	54	54	999	West Virginia -- Statewide	4234	Professional and commercial equipment and supplies merchant wholesalers	42	17.6	104.4	15109.2
435834	54	54	999	West Virginia -- Statewide	4236	Household appliances and electrical and electronic goods merchant wholesalers	42	6.8	9.0	1215.6
435835	54	54	999	West Virginia -- Statewide	4237	Hardware, plumbing and heating equipment and supplies merchant wholesalers	42	1.0	0.0	0.0
435836	54	54	999	West Virginia -- Statewide	4238	Machinery, equipment, and supplies merchant wholesalers	42	8.2	13.0	1657.4
435837	54	54	999	West Virginia -- Statewide	4239	Miscellaneous durable goods merchant wholesalers	42	2.0	0.0	0.0
435838	54	54	999	West Virginia -- Statewide	4241	Paper and paper product merchant wholesalers	42	2.0	1.2	159.2
435839	54	54	999	West Virginia -- Statewide	4242	Drugs and druggists' sundries merchant wholesalers	42	8.6	110.4	14097.8
435840	54	54	999	West Virginia -- Statewide	4243	Apparel, piece goods, and notions merchant wholesalers	42	1.0	0.0	0.0
435841	54	54	999	West Virginia -- Statewide	4244	Grocery and related product merchant wholesalers	42	3.6	24.6	778.8
435842	54	54	999	West Virginia -- Statewide	4246	Chemical and allied products merchant wholesalers	42	5.0	39.8	3168.2
435843	54	54	999	West Virginia -- Statewide	4247	Petroleum and petroleum products merchant wholesalers	42	1.6	0.0	0.0
435844	54	54	999	West Virginia -- Statewide	4249	Miscellaneous nondurable goods merchant wholesalers	42	1.0	0.0	0.0
435845	54	54	999	West Virginia -- Statewide	4251	Wholesale electronic markets and agents and brokers	42	2.6	0.0	589.2
435846	54	54	999	West Virginia -- Statewide	4461	Health and personal care stores	44	1.0	0.0	0.0
435847	54	54	999	West Virginia -- Statewide	4541	Electronic shopping and mail-order houses	45	1.0	0.0	0.0
435848	54	54	999	West Virginia -- Statewide	4842	Specialized freight trucking	48	1.0	0.0	0.0
435849	54	54	999	West Virginia -- Statewide	4854	School and employee bus transportation	48	1.0	0.0	0.0
435850	54	54	999	West Virginia -- Statewide	5111	Newspaper, periodical, book, and directory publishers	51	1.4	2.4	196.6
435851	54	54	999	West Virginia -- Statewide	5112	Software publishers	51	6.0	16.0	1232.8
435852	54	54	999	West Virginia -- Statewide	5121	Motion picture and video industries	51	1.0	0.0	0.0
435853	54	54	999	West Virginia -- Statewide	5171	Wired telecommunications carriers	51	4.2	3.0	562.4
435854	54	54	999	West Virginia -- Statewide	5172	Wireless telecommunications carriers (except satellite)	51	2.25	2.5	196.0
435855	54	54	999	West Virginia -- Statewide	5179	Other telecommunications	51	1.2	0.0	0.0
435856	54	54	999	West Virginia -- Statewide	5182	Data processing, hosting, and related services	51	1.3333333333333333	0.0	0.0
435857	54	54	999	West Virginia -- Statewide	5191	Other information services	51	1.0	0.0	0.0
435858	54	54	999	West Virginia -- Statewide	5221	Depository credit intermediation	52	4.4	10.6	912.0
435859	54	54	999	West Virginia -- Statewide	5222	Nondepository credit intermediation	52	3.4	42.2	2741.8
435860	54	54	999	West Virginia -- Statewide	5223	Activities related to credit intermediation	52	3.4	14.0	942.4
435861	54	54	999	West Virginia -- Statewide	5231	Securities and commodity contracts intermediation and brokerage	52	1.4	0.0	0.0
435862	54	54	999	West Virginia -- Statewide	5239	Other financial investment activities	52	1.0	0.0	0.0
435863	54	54	999	West Virginia -- Statewide	5241	Insurance carriers	52	27.4	363.4	25925.0
435864	54	54	999	West Virginia -- Statewide	5242	Agencies, brokerages, and other insurance related activities	52	9.6	16.6	1465.4
435865	54	54	999	West Virginia -- Statewide	5312	Offices of real estate agents and brokers	53	1.0	0.0	0.0
435866	54	54	999	West Virginia -- Statewide	5313	Activities related to real estate	53	1.0	0.0	0.0
435867	54	54	999	West Virginia -- Statewide	5324	Commercial and industrial machinery and equipment rental and leasing	53	1.0	0.0	0.0
435868	54	54	999	West Virginia -- Statewide	5331	Lessors of nonfinancial intangible assets (except copyrighted works)	53	1.0	0.0	0.0
435869	54	54	999	West Virginia -- Statewide	5412	Accounting, tax preparation, bookkeeping, and payroll services	54	3.2	2.8	117.4
435870	54	54	999	West Virginia -- Statewide	5413	Architectural, engineering, and related services	54	5.6	59.6	4781.8
435871	54	54	999	West Virginia -- Statewide	5415	Computer systems design and related services	54	19.6	107.2	10102.2
435872	54	54	999	West Virginia -- Statewide	5416	Management, scientific, and technical consulting services	54	4.6	745.0	30063.8
435873	54	54	999	West Virginia -- Statewide	5417	Scientific research and development services	54	4.6	11.4	1321.0
435874	54	54	999	West Virginia -- Statewide	5418	Advertising, public relations, and related services	54	2.5	2.0	48.0
435875	54	54	999	West Virginia -- Statewide	5419	Other professional, scientific, and technical services	54	2.0	0.0	0.0
435876	54	54	999	West Virginia -- Statewide	5511	Management of companies and enterprises	55	4.2	6.8	1667.4
435877	54	54	999	West Virginia -- Statewide	5611	Office administrative services	56	1.0	0.0	0.0
435878	54	54	999	West Virginia -- Statewide	5612	Facilities support services	56	1.0	0.0	0.0
435879	54	54	999	West Virginia -- Statewide	5613	Employment services	56	18.0	1575.6	55443.6
435880	54	54	999	West Virginia -- Statewide	5614	Business support services	56	5.4	53.2	2766.0
435881	54	54	999	West Virginia -- Statewide	5615	Travel arrangement and reservation services	56	3.0	0.0	0.0
435882	54	54	999	West Virginia -- Statewide	5616	Investigation and security services	56	2.0	0.0	0.0
435883	54	54	999	West Virginia -- Statewide	5617	Services to buildings and dwellings	56	1.0	0.0	0.0
435884	54	54	999	West Virginia -- Statewide	5619	Other support services	56	1.0	0.0	0.0
435885	54	54	999	West Virginia -- Statewide	5622	Waste treatment and disposal	56	1.0	0.0	0.0
435886	54	54	999	West Virginia -- Statewide	6113	Colleges, universities, and professional schools	61	2.25	0.0	0.0
435887	54	54	999	West Virginia -- Statewide	6116	Other schools and instruction	61	1.0	0.0	0.0
435888	54	54	999	West Virginia -- Statewide	6117	Educational support services	61	1.25	0.0	0.0
435889	54	54	999	West Virginia -- Statewide	6211	Offices of physicians	62	1.0	0.0	0.0
435890	54	54	999	West Virginia -- Statewide	6213	Offices of other health practitioners	62	4.0	24.8	1580.0
435891	54	54	999	West Virginia -- Statewide	6215	Medical and diagnostic laboratories	62	1.0	0.0	0.0
435892	54	54	999	West Virginia -- Statewide	6216	Home health care services	62	1.8	0.0	0.0
435893	54	54	999	West Virginia -- Statewide	6219	Other ambulatory health care services	62	1.2	0.0	0.0
435894	54	54	999	West Virginia -- Statewide	8112	Electronic and precision equipment repair and maintenance	81	1.4	0.0	0.0
435895	54	54	999	West Virginia -- Statewide	8113	Commercial and industrial machinery and equipment (except automotive and electronic) repair and maintenance	81	1.0	0.0	0.0
435896	54	54	999	West Virginia -- Statewide	8129	Other personal services	81	1.0	0.0	0.0
435897	54	54	999	West Virginia -- Statewide	8132	Grantmaking and giving services	81	1.0	0.0	0.0
435898	54	54	999	West Virginia -- Statewide	8133	Social advocacy organizations	81	1.2	0.0	0.0
